Date,Id,Tweet,Username,Location,likeCount,replyCount,retweetCount,quoteCount,userDescription,userFollowers,hashtags,Cleaned_Tweet,Tweet_tokenized,Tweet_removed_stop_word,Tweet_stemmed,Tweet_lemmatized,sentiment,Country
2022-03-13 16:21:30+00:00,1503043585263996941,"My mom, 82 years old and fresh off beating cancer last year, told my aunt that she'd be going to help at the Ukraine border right now if it weren't for my dad's health issues. She's gone to Chechnya in the past to help with their mental health system, so this is consistent.",didic,Israel,19,2,0,0,"Publisher, Nova Press (on hiatus). Writer. Editor. Translator. Blogger. Speaker. Geek. Asexual. Enby. Tired. Tweets in English, some @s  in Hebrew. he/they.",8941,,my mom 82 years old and fresh off beating cancer last year told my aunt that shed be going to help at the ukraine border right now if it werent for my dads health issues shes gone to chechnya in the past to help with their mental health system so this is consistent,"['my', 'mom', '82', 'years', 'old', 'and', 'fresh', 'off', 'beating', 'cancer', 'last', 'year', 'told', 'my', 'aunt', 'that', 'shed', 'be', 'going', 'to', 'help', 'at', 'the', 'ukraine', 'border', 'right', 'now', 'if', 'it', 'werent', 'for', 'my', 'dads', 'health', 'issues', 'shes', 'gone', 'to', 'chechnya', 'in', 'the', 'past', 'to', 'help', 'with', 'their', 'mental', 'health', 'system', 'so', 'this', 'is', 'consistent']","['mom', '82', 'years', 'old', 'fresh', 'beating', 'cancer', 'last', 'year', 'told', 'aunt', 'shed', 'going', 'help', 'ukraine', 'border', 'right', 'werent', 'dads', 'health', 'issues', 'shes', 'gone', 'chechnya', 'past', 'help', 'mental', 'health', 'system', 'consistent']","['mom', '82', 'year', 'old', 'fresh', 'beat', 'cancer', 'last', 'year', 'told', 'aunt', 'shed', 'go', 'help', 'ukrain', 'border', 'right', 'werent', 'dad', 'health', 'issu', 'she', 'gone', 'chechnya', 'past', 'help', 'mental', 'health', 'system', 'consist']","['mom', '82', 'years', 'old', 'fresh', 'beating', 'cancer', 'last', 'year', 'told', 'aunt', 'shed', 'going', 'help', 'ukraine', 'border', 'right', 'werent', 'dads', 'health', 'issues', 'shes', 'gone', 'chechnya', 'past', 'help', 'mental', 'health', 'system', 'consistent']",5,Israel
2022-03-06 21:50:03+00:00,1500589551500288006,@Purple_Zayne @disillusionist9 @Daphi2312 @Nirimetus @tiffyb_thegreat @theogskrylla Im very sad cz i thought ur stream was on monday happiest birthday zayne may ur year be filled with blessings joy and good health,Nakad_Carla,Lebanon beirut,6,0,0,0,Dog lover 🐾❤ Romance reader ❤ Nemr abou Nassar❤ - Proud supporter of various twitch streamers 📺-  🚨- Nakad = Naked whoever knows knows😉,601,,im very sad cz i thought ur stream was on monday happiest birthday zayne may ur year be filled with blessings joy and good health,"['im', 'very', 'sad', 'cz', 'i', 'thought', 'ur', 'stream', 'was', 'on', 'monday', 'happiest', 'birthday', 'zayne', 'may', 'ur', 'year', 'be', 'filled', 'with', 'blessings', 'joy', 'and', 'good', 'health']","['im', 'sad', 'cz', 'thought', 'ur', 'stream', 'monday', 'happiest', 'birthday', 'zayne', 'may', 'ur', 'year', 'filled', 'blessings', 'joy', 'good', 'health']","['im', 'sad', 'cz', 'thought', 'ur', 'stream', 'monday', 'happiest', 'birthday', 'zayn', 'may', 'ur', 'year', 'fill', 'bless', 'joy', 'good', 'health']","['im', 'sad', 'cz', 'thought', 'ur', 'stream', 'monday', 'happiest', 'birthday', 'zayne', 'may', 'ur', 'year', 'filled', 'blessings', 'joy', 'good', 'health']",1,Israel
2022-02-22 04:45:36+00:00,1495983084801511426,"Be glad when you have a bad day, the experience will do you some good. A period of suffering can be your best teacher if you let it, better yet, a blessing!

#perspective #mentalhealth #health #wellness #Mindset #mindsetiseverything #Wisdom #Blessings",bernaywd,Lebanon,2,0,1,0,Certified FDN-P - #IBS #IBD #Histamine #MoldIllness #Autoimmune - Founder of YWD Natural Beauty Products & Supplements,25,"['perspective', 'mentalhealth', 'health', 'wellness', 'Mindset', 'mindsetiseverything', 'Wisdom', 'Blessings']",be glad when you have a bad day the experience will do you some good a period of suffering can be your best teacher if you let it better yet a blessing perspective mentalhealth health wellness mindset mindsetiseverything wisdom blessings,"['be', 'glad', 'when', 'you', 'have', 'a', 'bad', 'day', 'the', 'experience', 'will', 'do', 'you', 'some', 'good', 'a', 'period', 'of', 'suffering', 'can', 'be', 'your', 'best', 'teacher', 'if', 'you', 'let', 'it', 'better', 'yet', 'a', 'blessing', 'perspective', 'mentalhealth', 'health', 'wellness', 'mindset', 'mindsetiseverything', 'wisdom', 'blessings']","['glad', 'bad', 'day', 'experience', 'good', 'period', 'suffering', 'best', 'teacher', 'let', 'better', 'yet', 'blessing', 'perspective', 'mentalhealth', 'health', 'wellness', 'mindset', 'mindsetiseverything', 'wisdom', 'blessings']","['glad', 'bad', 'day', 'experi', 'good', 'period', 'suffer', 'best', 'teacher', 'let', 'better', 'yet', 'bless', 'perspect', 'mentalhealth', 'health', 'well', 'mindset', 'mindsetiseveryth', 'wisdom', 'bless']","['glad', 'bad', 'day', 'experience', 'good', 'period', 'suffering', 'best', 'teacher', 'let', 'better', 'yet', 'blessing', 'perspective', 'mentalhealth', 'health', 'wellness', 'mindset', 'mindsetiseverything', 'wisdom', 'blessings']",4,Israel
2022-02-21 15:34:37+00:00,1495784026958934026,"@KryssLeelfc Greetings and appreciation for your classy and beautiful person, how are you, I wish you all happiness, health and wellness",HassanE51945604,"Egypt, PA",1,1,0,0,اللهم إنك عفو كريم حليم تحب العفو فاعفو عنا ياكريم,1098,,greetings and appreciation for your classy and beautiful person how are you i wish you all happiness health and wellness,"['greetings', 'and', 'appreciation', 'for', 'your', 'classy', 'and', 'beautiful', 'person', 'how', 'are', 'you', 'i', 'wish', 'you', 'all', 'happiness', 'health', 'and', 'wellness']","['greetings', 'appreciation', 'classy', 'beautiful', 'person', 'wish', 'happiness', 'health', 'wellness']","['greet', 'appreci', 'classi', 'beauti', 'person', 'wish', 'happi', 'health', 'well']","['greetings', 'appreciation', 'classy', 'beautiful', 'person', 'wish', 'happiness', 'health', 'wellness']",5,Israel
2022-02-16 11:48:25+00:00,1493915162646089728,"I found that when I have an intense day at the lab, I take a short break outside in the sun (with coffee, of course). It helps lower my stress levels ☕😊. 

What do you do for your mental health in academia? #AcademicTwitter #AcademicChatter
@PhD_Genie
@PhDVoice 
@Tel_Aviv_Uni https://t.co/QVA508KY58",estherina_t,,20,1,6,2,"Neuroscience PhD candidate @TelAvivUni, @of_sagol. Researcher, proud nurse, social activist, innovator, teacher, nature lover, addicted to music &  books",384,"['AcademicTwitter', 'AcademicChatter']",i found that when i have an intense day at the lab i take a short break outside in the sun with coffee of course it helps lower my stress levels what do you do for your mental health in academia academictwitter academicchatter,"['i', 'found', 'that', 'when', 'i', 'have', 'an', 'intense', 'day', 'at', 'the', 'lab', 'i', 'take', 'a', 'short', 'break', 'outside', 'in', 'the', 'sun', 'with', 'coffee', 'of', 'course', 'it', 'helps', 'lower', 'my', 'stress', 'levels', 'what', 'do', 'you', 'do', 'for', 'your', 'mental', 'health', 'in', 'academia', 'academictwitter', 'academicchatter']","['found', 'intense', 'day', 'lab', 'take', 'short', 'break', 'outside', 'sun', 'coffee', 'course', 'helps', 'lower', 'stress', 'levels', 'mental', 'health', 'academia', 'academictwitter', 'academicchatter']","['found', 'intens', 'day', 'lab', 'take', 'short', 'break', 'outsid', 'sun', 'coffe', 'cours', 'help', 'lower', 'stress', 'level', 'mental', 'health', 'academia', 'academictwitt', 'academicchatt']","['found', 'intense', 'day', 'lab', 'take', 'short', 'break', 'outside', 'sun', 'coffee', 'course', 'helps', 'lower', 'stress', 'levels', 'mental', 'health', 'academia', 'academictwitter', 'academicchatter']",4,Israel
2022-02-16 08:27:32+00:00,1493864611615064065,"Most of my clients are surprised at how full &amp; satisfied they feel during my program, all while losing stubborn weight + achieving their health goals💯

Guess what? That’s how it should be!

#feedyourbody #health #food #wellness #diet #functionalmedicine #weightlossjourney",bernaywd,Lebanon,0,0,1,0,Certified FDN-P - #IBS #IBD #Histamine #MoldIllness #Autoimmune - Founder of YWD Natural Beauty Products & Supplements,25,"['feedyourbody', 'health', 'food', 'wellness', 'diet', 'functionalmedicine', 'weightlossjourney']",most of my clients are surprised at how full amp satisfied they feel during my program all while losing stubborn weight achieving their health goals guess what thats how it should be feedyourbody health food wellness diet functionalmedicine weightlossjourney,"['most', 'of', 'my', 'clients', 'are', 'surprised', 'at', 'how', 'full', 'amp', 'satisfied', 'they', 'feel', 'during', 'my', 'program', 'all', 'while', 'losing', 'stubborn', 'weight', 'achieving', 'their', 'health', 'goals', 'guess', 'what', 'thats', 'how', 'it', 'should', 'be', 'feedyourbody', 'health', 'food', 'wellness', 'diet', 'functionalmedicine', 'weightlossjourney']","['clients', 'surprised', 'full', 'amp', 'satisfied', 'feel', 'program', 'losing', 'stubborn', 'weight', 'achieving', 'health', 'goals', 'guess', 'thats', 'feedyourbody', 'health', 'food', 'wellness', 'diet', 'functionalmedicine', 'weightlossjourney']","['client', 'surpris', 'full', 'amp', 'satisfi', 'feel', 'program', 'lose', 'stubborn', 'weight', 'achiev', 'health', 'goal', 'guess', 'that', 'feedyourbodi', 'health', 'food', 'well', 'diet', 'functionalmedicin', 'weightlossjourney']","['clients', 'surprised', 'full', 'amp', 'satisfied', 'feel', 'program', 'losing', 'stubborn', 'weight', 'achieving', 'health', 'goals', 'guess', 'thats', 'feedyourbody', 'health', 'food', 'wellness', 'diet', 'functionalmedicine', 'weightlossjourney']",4,Israel
2022-02-09 09:22:00+00:00,1491341601171701763,"And a reminder of some great orgs to donate to if you want to help-
General support: https://t.co/ZJbflg9JcB &amp; https://t.co/wHarCSQuPl
Basic needs (food, fuel): Syrian Eyes https://t.co/NYOcIxnNH0
Kids: @INARAorg 
Education: @Jusoor_ngo 
Mobile health: EMA https://t.co/9zULJOFrcH",Leila_MA,Iraq,8,0,6,0,"Middle East Correspondent @PBS @Newshour @Channel4News. Catch me on @BBCFooc. Ex-@Economist, Iranian-Scot. Mother of hounds, proud daughter of immigrants.",21249,,and a reminder of some great orgs to donate to if you want to help general support amp basic needs food fuel syrian eyes kids education mobile health ema,"['and', 'a', 'reminder', 'of', 'some', 'great', 'orgs', 'to', 'donate', 'to', 'if', 'you', 'want', 'to', 'help', 'general', 'support', 'amp', 'basic', 'needs', 'food', 'fuel', 'syrian', 'eyes', 'kids', 'education', 'mobile', 'health', 'ema']","['reminder', 'great', 'orgs', 'donate', 'want', 'help', 'general', 'support', 'amp', 'basic', 'needs', 'food', 'fuel', 'syrian', 'eyes', 'kids', 'education', 'mobile', 'health', 'ema']","['remind', 'great', 'org', 'donat', 'want', 'help', 'gener', 'support', 'amp', 'basic', 'need', 'food', 'fuel', 'syrian', 'eye', 'kid', 'educ', 'mobil', 'health', 'ema']","['reminder', 'great', 'orgs', 'donate', 'want', 'help', 'general', 'support', 'amp', 'basic', 'needs', 'food', 'fuel', 'syrian', 'eyes', 'kids', 'education', 'mobile', 'health', 'ema']",5,Israel
2022-02-07 16:42:30+00:00,1490727680353918976,"Orgs to donate to help #Syria'n refugees in #Lebanon-
General assistance: https://t.co/ZJbflg9JcB &amp; https://t.co/wHarCSQuPl
Basic needs (eg food, fuel): Syrian Eyes https://t.co/NYOcIxnNH0
Kids: @INARAorg 
Education: @Jusoor_ngo 
Mobile health: EMA appeal https://t.co/9zULJOFrcH",Leila_MA,Iraq,14,0,13,1,"Middle East Correspondent @PBS @Newshour @Channel4News. Catch me on @BBCFooc. Ex-@Economist, Iranian-Scot. Mother of hounds, proud daughter of immigrants.",21249,"['Syria', 'Lebanon']",orgs to donate to help syrian refugees in lebanon general assistance amp basic needs eg food fuel syrian eyes kids education mobile health ema appeal,"['orgs', 'to', 'donate', 'to', 'help', 'syrian', 'refugees', 'in', 'lebanon', 'general', 'assistance', 'amp', 'basic', 'needs', 'eg', 'food', 'fuel', 'syrian', 'eyes', 'kids', 'education', 'mobile', 'health', 'ema', 'appeal']","['orgs', 'donate', 'help', 'syrian', 'refugees', 'lebanon', 'general', 'assistance', 'amp', 'basic', 'needs', 'eg', 'food', 'fuel', 'syrian', 'eyes', 'kids', 'education', 'mobile', 'health', 'ema', 'appeal']","['org', 'donat', 'help', 'syrian', 'refuge', 'lebanon', 'gener', 'assist', 'amp', 'basic', 'need', 'eg', 'food', 'fuel', 'syrian', 'eye', 'kid', 'educ', 'mobil', 'health', 'ema', 'appeal']","['orgs', 'donate', 'help', 'syrian', 'refugees', 'lebanon', 'general', 'assistance', 'amp', 'basic', 'needs', 'eg', 'food', 'fuel', 'syrian', 'eyes', 'kids', 'education', 'mobile', 'health', 'ema', 'appeal']",4,Israel
2022-02-07 15:27:46+00:00,1490708873736601605,"Nutrition = Digestion.

If your body isn’t breaking down &amp; using nutrients properly, eating the best foods still won’t truly nourish or heal you.

#nutrition #health #digestion #absorption #truthbomb #guthealth #wellness #nutrients #HealthyFood",bernaywd,Lebanon,4,0,2,0,Certified FDN-P - #IBS #IBD #Histamine #MoldIllness #Autoimmune - Founder of YWD Natural Beauty Products & Supplements,25,"['nutrition', 'health', 'digestion', 'absorption', 'truthbomb', 'guthealth', 'wellness', 'nutrients', 'HealthyFood']",nutrition digestion if your body isnt breaking down amp using nutrients properly eating the best foods still wont truly nourish or heal you nutrition health digestion absorption truthbomb guthealth wellness nutrients healthyfood,"['nutrition', 'digestion', 'if', 'your', 'body', 'isnt', 'breaking', 'down', 'amp', 'using', 'nutrients', 'properly', 'eating', 'the', 'best', 'foods', 'still', 'wont', 'truly', 'nourish', 'or', 'heal', 'you', 'nutrition', 'health', 'digestion', 'absorption', 'truthbomb', 'guthealth', 'wellness', 'nutrients', 'healthyfood']","['nutrition', 'digestion', 'body', 'isnt', 'breaking', 'amp', 'using', 'nutrients', 'properly', 'eating', 'best', 'foods', 'still', 'wont', 'truly', 'nourish', 'heal', 'nutrition', 'health', 'digestion', 'absorption', 'truthbomb', 'guthealth', 'wellness', 'nutrients', 'healthyfood']","['nutrit', 'digest', 'bodi', 'isnt', 'break', 'amp', 'use', 'nutrient', 'properli', 'eat', 'best', 'food', 'still', 'wont', 'truli', 'nourish', 'heal', 'nutrit', 'health', 'digest', 'absorpt', 'truthbomb', 'guthealth', 'well', 'nutrient', 'healthyfood']","['nutrition', 'digestion', 'body', 'isnt', 'breaking', 'amp', 'using', 'nutrients', 'properly', 'eating', 'best', 'foods', 'still', 'wont', 'truly', 'nourish', 'heal', 'nutrition', 'health', 'digestion', 'absorption', 'truthbomb', 'guthealth', 'wellness', 'nutrients', 'healthyfood']",4,Israel
2022-01-29 19:57:16+00:00,1487515207895330825,"@hpPz5QHq7dV3hPj Thank you very much. I wish you a happy evening, health and peace to you and your beautiful family https://t.co/p2ixZyoclu",HassanE51945604,"Egypt, PA",1,0,0,0,اللهم إنك عفو كريم حليم تحب العفو فاعفو عنا ياكريم,1098,,thank you very much i wish you a happy evening health and peace to you and your beautiful family,"['thank', 'you', 'very', 'much', 'i', 'wish', 'you', 'a', 'happy', 'evening', 'health', 'and', 'peace', 'to', 'you', 'and', 'your', 'beautiful', 'family']","['thank', 'much', 'wish', 'happy', 'evening', 'health', 'peace', 'beautiful', 'family']","['thank', 'much', 'wish', 'happi', 'even', 'health', 'peac', 'beauti', 'famili']","['thank', 'much', 'wish', 'happy', 'evening', 'health', 'peace', 'beautiful', 'family']",5,Israel
2022-01-29 19:56:32+00:00,1487515022880350209,"@hpPz5QHq7dV3hPj Thank you very much. I wish you a happy evening, health and peace to you and your beautiful family https://t.co/cnHz512o00",HassanE51945604,"Egypt, PA",1,1,0,0,اللهم إنك عفو كريم حليم تحب العفو فاعفو عنا ياكريم,1098,,thank you very much i wish you a happy evening health and peace to you and your beautiful family,"['thank', 'you', 'very', 'much', 'i', 'wish', 'you', 'a', 'happy', 'evening', 'health', 'and', 'peace', 'to', 'you', 'and', 'your', 'beautiful', 'family']","['thank', 'much', 'wish', 'happy', 'evening', 'health', 'peace', 'beautiful', 'family']","['thank', 'much', 'wish', 'happi', 'even', 'health', 'peac', 'beauti', 'famili']","['thank', 'much', 'wish', 'happy', 'evening', 'health', 'peace', 'beautiful', 'family']",5,Israel
2022-01-21 07:42:24+00:00,1484431168510570496,"@pepitaCurtis @Mygzters_trends Happy birthday 🎂🎉🎈 Pipeta
More blessings birthdays to come  stay good health,stay safe and God bless.",JhemmarieVictor,Lebanon 🇱🇧,2,0,1,0,Chubby,156,,happy birthday pipeta more blessings birthdays to come stay good healthstay safe and god bless,"['happy', 'birthday', 'pipeta', 'more', 'blessings', 'birthdays', 'to', 'come', 'stay', 'good', 'healthstay', 'safe', 'and', 'god', 'bless']","['happy', 'birthday', 'pipeta', 'blessings', 'birthdays', 'come', 'stay', 'good', 'healthstay', 'safe', 'god', 'bless']","['happi', 'birthday', 'pipeta', 'bless', 'birthday', 'come', 'stay', 'good', 'healthstay', 'safe', 'god', 'bless']","['happy', 'birthday', 'pipeta', 'blessings', 'birthdays', 'come', 'stay', 'good', 'healthstay', 'safe', 'god', 'bless']",5,Israel
2022-06-06 18:52:12+00:00,1533884478954905600,"The future leftists want is one where everyone gets the same opportunity to not just live, but to thrive. Everyone fed and educated. Everyone gets accessible and affirming healthcare. Everyone lives in safe and accessible housing and communities. That’s it. That’s the agenda.",FemiYahtzee,"Alexandria, Egypt",13,2,0,0,Hype 𓁦𓊹𓍛 (she/ella)~ historian by commitment | bioethicist by training | augur by nature | protean by profession. The mask goes over your nose AND mouth.,1152,,the future leftists want is one where everyone gets the same opportunity to not just live but to thrive everyone fed and educated everyone gets accessible and affirming healthcare everyone lives in safe and accessible housing and communities thats it thats the agenda,"['the', 'future', 'leftists', 'want', 'is', 'one', 'where', 'everyone', 'gets', 'the', 'same', 'opportunity', 'to', 'not', 'just', 'live', 'but', 'to', 'thrive', 'everyone', 'fed', 'and', 'educated', 'everyone', 'gets', 'accessible', 'and', 'affirming', 'healthcare', 'everyone', 'lives', 'in', 'safe', 'and', 'accessible', 'housing', 'and', 'communities', 'thats', 'it', 'thats', 'the', 'agenda']","['future', 'leftists', 'want', 'one', 'everyone', 'gets', 'opportunity', 'live', 'thrive', 'everyone', 'fed', 'educated', 'everyone', 'gets', 'accessible', 'affirming', 'healthcare', 'everyone', 'lives', 'safe', 'accessible', 'housing', 'communities', 'thats', 'thats', 'agenda']","['futur', 'leftist', 'want', 'one', 'everyon', 'get', 'opportun', 'live', 'thrive', 'everyon', 'fed', 'educ', 'everyon', 'get', 'access', 'affirm', 'healthcar', 'everyon', 'live', 'safe', 'access', 'hous', 'commun', 'that', 'that', 'agenda']","['future', 'leftists', 'want', 'one', 'everyone', 'gets', 'opportunity', 'live', 'thrive', 'everyone', 'fed', 'educated', 'everyone', 'gets', 'accessible', 'affirming', 'healthcare', 'everyone', 'lives', 'safe', 'accessible', 'housing', 'communities', 'thats', 'thats', 'agenda']",5,Israel
2022-06-06 10:40:52+00:00,1533760830579277826,"Bahrain-based VC fund @AlwahaFund has partnered with Israel's @LionBirdVC to launch the $85 million LionBird III fund, to help regional startups access the US healthcare market.

 #healthcare #startups #mena 
https://t.co/ysTDWrVTeQ",WamdaME,Middle East,0,0,0,0,"Inspiring, empowering, and connecting entrepreneurs in the Middle East and North Africa.",2200181,"['healthcare', 'startups', 'mena']",bahrainbased vc fund has partnered with israels to launch the 85 million lionbird iii fund to help regional startups access the us healthcare market healthcare startups mena,"['bahrainbased', 'vc', 'fund', 'has', 'partnered', 'with', 'israels', 'to', 'launch', 'the', '85', 'million', 'lionbird', 'iii', 'fund', 'to', 'help', 'regional', 'startups', 'access', 'the', 'us', 'healthcare', 'market', 'healthcare', 'startups', 'mena']","['bahrainbased', 'vc', 'fund', 'partnered', 'israels', 'launch', '85', 'million', 'lionbird', 'iii', 'fund', 'help', 'regional', 'startups', 'access', 'us', 'healthcare', 'market', 'healthcare', 'startups', 'mena']","['bahrainbas', 'vc', 'fund', 'partner', 'israel', 'launch', '85', 'million', 'lionbird', 'iii', 'fund', 'help', 'region', 'startup', 'access', 'us', 'healthcar', 'market', 'healthcar', 'startup', 'mena']","['bahrainbased', 'vc', 'fund', 'partnered', 'israels', 'launch', '85', 'million', 'lionbird', 'iii', 'fund', 'help', 'regional', 'startups', 'access', 'us', 'healthcare', 'market', 'healthcare', 'startups', 'mena']",5,Israel
2022-06-06 07:00:00+00:00,1533705247885074433,"Our proposed acquisition of @Cerner will help us transform #healthcare delivery.

@gulfbusiness explores. https://t.co/ieoXII3MHw",Oracle_ME,Middle East,4,0,0,0,"Stay connected with all things #Oracle: products, services, training, news, events, promotions, and more happening in the Middle East.",11681,['healthcare'],our proposed acquisition of will help us transform healthcare delivery explores,"['our', 'proposed', 'acquisition', 'of', 'will', 'help', 'us', 'transform', 'healthcare', 'delivery', 'explores']","['proposed', 'acquisition', 'help', 'us', 'transform', 'healthcare', 'delivery', 'explores']","['propos', 'acquisit', 'help', 'us', 'transform', 'healthcar', 'deliveri', 'explor']","['proposed', 'acquisition', 'help', 'us', 'transform', 'healthcare', 'delivery', 'explores']",5,Israel
2022-06-05 10:26:49+00:00,1533394908173705216,"A #GREAT day at the #UK Healthcare Mission to Jordan. Fantastic presentations from UK companies showcasing to their #Jordanian counterparts in #ammanjo this morning!🇬🇧🇯🇴
@tradegovukMEAP @UKinJordan https://t.co/1JA8S8yYqS",tradegovukJOR,"Amman, Jordan",0,0,0,0,"Updates from Dept. Int. Trade Jordan - We help UK-based companies export & grow overseas, and international companies establish & expand in the UK.",2609,"['GREAT', 'UK', 'Jordanian', 'ammanjo']",a great day at the uk healthcare mission to jordan fantastic presentations from uk companies showcasing to their jordanian counterparts in ammanjo this morning,"['a', 'great', 'day', 'at', 'the', 'uk', 'healthcare', 'mission', 'to', 'jordan', 'fantastic', 'presentations', 'from', 'uk', 'companies', 'showcasing', 'to', 'their', 'jordanian', 'counterparts', 'in', 'ammanjo', 'this', 'morning']","['great', 'day', 'uk', 'healthcare', 'mission', 'jordan', 'fantastic', 'presentations', 'uk', 'companies', 'showcasing', 'jordanian', 'counterparts', 'ammanjo', 'morning']","['great', 'day', 'uk', 'healthcar', 'mission', 'jordan', 'fantast', 'present', 'uk', 'compani', 'showcas', 'jordanian', 'counterpart', 'ammanjo', 'morn']","['great', 'day', 'uk', 'healthcare', 'mission', 'jordan', 'fantastic', 'presentations', 'uk', 'companies', 'showcasing', 'jordanian', 'counterparts', 'ammanjo', 'morning']",5,Israel
2022-06-04 18:38:43+00:00,1533156310396674048,"@whywouldyou_uk @IreneMinkema @TouchMyFalafels @WeinsteinDr @JonathanWeissb3 @IMDibe @AnastasiaKLynch @asegovia9 @ronenshefer729 @yes_we_cat @cool_grandad @issam_najdawi @BgoerckeRobert @japNakFikir @emmettimanu @PattataM @now_1984is @LehiRed @h7n33n @reallhere @Desuetudine @KesBilly @Buckeye_ricky @markovfaneghi1 @gomiriam63 @vannifrediani @robinsonmsr10 @corjoy @daggerhaft @DavidPick33 @6TK9Cn1RB4A49B1 @miss_gran_dia @MechanicznaC @IILeahll @MehrMiriam @MrSamArrow @ScottAlan107 @moderatedew @WeBuyBritish @ashvir2012 @garybkatz @Carl0s_Vela @Tax_Dodge_Hodge @Rudolf__Dassler @searchfeast @FLastrade @sadcjp @TheElementGuy @RyuGwansunSTAN @RikkAngel Seriously get professional help for whatever irrational obsessive hatred you’re carrying for Jews. 

Everyone deserves quality mental healthcare. Seek it. https://t.co/1uziZz7Xpp",Maccabi226km,"Tel Aviv, Israel",3,0,1,0,Ironman 2x226km 2x113km. Degree: Broadcast Journalism. אם אשכחך ירושלים תשכח ימיני,904,,seriously get professional help for whatever irrational obsessive hatred youre carrying for jews everyone deserves quality mental healthcare seek it,"['seriously', 'get', 'professional', 'help', 'for', 'whatever', 'irrational', 'obsessive', 'hatred', 'youre', 'carrying', 'for', 'jews', 'everyone', 'deserves', 'quality', 'mental', 'healthcare', 'seek', 'it']","['seriously', 'get', 'professional', 'help', 'whatever', 'irrational', 'obsessive', 'hatred', 'youre', 'carrying', 'jews', 'everyone', 'deserves', 'quality', 'mental', 'healthcare', 'seek']","['serious', 'get', 'profession', 'help', 'whatev', 'irrat', 'obsess', 'hatr', 'your', 'carri', 'jew', 'everyon', 'deserv', 'qualiti', 'mental', 'healthcar', 'seek']","['seriously', 'get', 'professional', 'help', 'whatever', 'irrational', 'obsessive', 'hatred', 'youre', 'carrying', 'jews', 'everyone', 'deserves', 'quality', 'mental', 'healthcare', 'seek']",1,Israel
