Date,Id,Tweet,Username,Location,likeCount,replyCount,retweetCount,quoteCount,userDescription,userFollowers,hashtags,Cleaned_Tweet,Tweet_tokenized,Tweet_removed_stop_word,Tweet_stemmed,Tweet_lemmatized,sentiment,Country
2020-08-10 13:39:54+00:00,1292817955223482371,"War consequences on own people. Hunger, eviction, healthcare and social crisis only because Trump and Republicans didn't know what to do! After W2 USA helped Europe and Japan to recover but today no one can't help to USA because USA have crisis plan Heroes Act which is last tool",swanhauser,"Pardubice, Česká republika",1,1,1,0,"Jsem intelektuální a umělecky založená, baví mne číst beletrii, ale také si rada zahraji na PSku. I'm intellectual and Media working women.",69,,war consequences on own people hunger eviction healthcare and social crisis only because trump and republicans didnt know what to do after w2 usa helped europe and japan to recover but today no one cant help to usa because usa have crisis plan heroes act which is last tool,"['war', 'consequences', 'on', 'own', 'people', 'hunger', 'eviction', 'healthcare', 'and', 'social', 'crisis', 'only', 'because', 'trump', 'and', 'republicans', 'didnt', 'know', 'what', 'to', 'do', 'after', 'w2', 'usa', 'helped', 'europe', 'and', 'japan', 'to', 'recover', 'but', 'today', 'no', 'one', 'cant', 'help', 'to', 'usa', 'because', 'usa', 'have', 'crisis', 'plan', 'heroes', 'act', 'which', 'is', 'last', 'tool']","['war', 'consequences', 'people', 'hunger', 'eviction', 'healthcare', 'social', 'crisis', 'trump', 'republicans', 'didnt', 'know', 'w2', 'usa', 'helped', 'europe', 'japan', 'recover', 'today', 'one', 'cant', 'help', 'usa', 'usa', 'crisis', 'plan', 'heroes', 'act', 'last', 'tool']","['war', 'consequ', 'peopl', 'hunger', 'evict', 'healthcar', 'social', 'crisi', 'trump', 'republican', 'didnt', 'know', 'w2', 'usa', 'help', 'europ', 'japan', 'recov', 'today', 'one', 'cant', 'help', 'usa', 'usa', 'crisi', 'plan', 'hero', 'act', 'last', 'tool']","['war', 'consequences', 'people', 'hunger', 'eviction', 'healthcare', 'social', 'crisis', 'trump', 'republicans', 'didnt', 'know', 'w2', 'usa', 'helped', 'europe', 'japan', 'recover', 'today', 'one', 'cant', 'help', 'usa', 'usa', 'crisis', 'plan', 'heroes', 'act', 'last', 'tool']",1,Czech Republic
2020-07-07 09:49:24+00:00,1280438758488240131,"Alight. I can't post ""diet pills"" or ""rapid weight loss"" in a (legitimate healthcare) system I'm building. Cheers Andrew, pointed me in the right direction. https://t.co/IM0Dps9bUP",regularsteven,Melbourne,1,2,0,0,"Web development, photography, consulting, marketing. Digital. 📍MELBOURNE Australia",1435,,alight i cant post diet pills or rapid weight loss in a legitimate healthcare system im building cheers andrew pointed me in the right direction,"['alight', 'i', 'cant', 'post', 'diet', 'pills', 'or', 'rapid', 'weight', 'loss', 'in', 'a', 'legitimate', 'healthcare', 'system', 'im', 'building', 'cheers', 'andrew', 'pointed', 'me', 'in', 'the', 'right', 'direction']","['alight', 'cant', 'post', 'diet', 'pills', 'rapid', 'weight', 'loss', 'legitimate', 'healthcare', 'system', 'im', 'building', 'cheers', 'andrew', 'pointed', 'right', 'direction']","['alight', 'cant', 'post', 'diet', 'pill', 'rapid', 'weight', 'loss', 'legitim', 'healthcar', 'system', 'im', 'build', 'cheer', 'andrew', 'point', 'right', 'direct']","['alight', 'cant', 'post', 'diet', 'pills', 'rapid', 'weight', 'loss', 'legitimate', 'healthcare', 'system', 'im', 'building', 'cheers', 'andrew', 'pointed', 'right', 'direction']",1,Czech Republic
2020-03-26 20:46:13+00:00,1243278103591424006,"These are tough times. Sending a massive 👏 to healthcare workers in 🇬🇧, 🇨🇿 and everywhere - and sharing this lovely video from @KensingtonRoyal https://t.co/dcfrBTKn2S",LucyAHughes,"Prague, Czech Republic",7,0,0,0,Zástupkyně britského velvyslance v České republice / Deputy British Ambassador to the Czech Republic @UKinCR,927,,these are tough times sending a massive to healthcare workers in and everywhere and sharing this lovely video from,"['these', 'are', 'tough', 'times', 'sending', 'a', 'massive', 'to', 'healthcare', 'workers', 'in', 'and', 'everywhere', 'and', 'sharing', 'this', 'lovely', 'video', 'from']","['tough', 'times', 'sending', 'massive', 'healthcare', 'workers', 'everywhere', 'sharing', 'lovely', 'video']","['tough', 'time', 'send', 'massiv', 'healthcar', 'worker', 'everywher', 'share', 'love', 'video']","['tough', 'times', 'sending', 'massive', 'healthcare', 'workers', 'everywhere', 'sharing', 'lovely', 'video']",5,Czech Republic
2022-03-26 11:50:27+00:00,1507686413885710339,"#Czechia helps to evacuate those in need of #medical and psychological help. 

Thank you @vnitro for getting engaged and transporting the #Ukrainian citizens to the #Czech hospitals!

Via @stojimeza_ua @UKRinCZE @strakovka https://t.co/KwQQiF19T2",Pavel_Havlicek_,"Prague, Czechia",31,0,10,0,@AMO_cz #Research Fellow. @MapInfluenceEU #Russia Research Coordinator. @EU_Russia_CSF Board Member. @VisegradInsight Fellow. @cepa & @gmfus Alumni. Views mine.,1984,"['Czechia', 'medical', 'Ukrainian', 'Czech']",czechia helps to evacuate those in need of medical and psychological help thank you for getting engaged and transporting the ukrainian citizens to the czech hospitals via,"['czechia', 'helps', 'to', 'evacuate', 'those', 'in', 'need', 'of', 'medical', 'and', 'psychological', 'help', 'thank', 'you', 'for', 'getting', 'engaged', 'and', 'transporting', 'the', 'ukrainian', 'citizens', 'to', 'the', 'czech', 'hospitals', 'via']","['czechia', 'helps', 'evacuate', 'need', 'medical', 'psychological', 'help', 'thank', 'getting', 'engaged', 'transporting', 'ukrainian', 'citizens', 'czech', 'hospitals', 'via']","['czechia', 'help', 'evacu', 'need', 'medic', 'psycholog', 'help', 'thank', 'get', 'engag', 'transport', 'ukrainian', 'citizen', 'czech', 'hospit', 'via']","['czechia', 'helps', 'evacuate', 'need', 'medical', 'psychological', 'help', 'thank', 'getting', 'engaged', 'transporting', 'ukrainian', 'citizens', 'czech', 'hospitals', 'via']",5,Czech Republic
2021-12-03 07:16:48+00:00,1466667721295233028,Increasing reports of attacks on Cz doctors/nurses treating Covid patients or involved in vaccination effort. Eleven cars parked inside Kladno hospital had their tyres slashed on Wed night. https://t.co/zdXAdpYYpu,BBCRobC,Prague,31,7,6,3,BBC Prague correspondent. All views my own not BBC's. rob.cameron@bbc.co.uk YouTube tinyurl.com/598jdn5b 🇬🇧🇨🇿🇪🇺🍺,6571,,increasing reports of attacks on cz doctorsnurses treating covid patients or involved in vaccination effort eleven cars parked inside kladno hospital had their tyres slashed on wed night,"['increasing', 'reports', 'of', 'attacks', 'on', 'cz', 'doctorsnurses', 'treating', 'covid', 'patients', 'or', 'involved', 'in', 'vaccination', 'effort', 'eleven', 'cars', 'parked', 'inside', 'kladno', 'hospital', 'had', 'their', 'tyres', 'slashed', 'on', 'wed', 'night']","['increasing', 'reports', 'attacks', 'cz', 'doctorsnurses', 'treating', 'covid', 'patients', 'involved', 'vaccination', 'effort', 'eleven', 'cars', 'parked', 'inside', 'kladno', 'hospital', 'tyres', 'slashed', 'wed', 'night']","['increas', 'report', 'attack', 'cz', 'doctorsnurs', 'treat', 'covid', 'patient', 'involv', 'vaccin', 'effort', 'eleven', 'car', 'park', 'insid', 'kladno', 'hospit', 'tyre', 'slash', 'wed', 'night']","['increasing', 'reports', 'attacks', 'cz', 'doctorsnurses', 'treating', 'covid', 'patients', 'involved', 'vaccination', 'effort', 'eleven', 'cars', 'parked', 'inside', 'kladno', 'hospital', 'tyres', 'slashed', 'wed', 'night']",1,Czech Republic
2020-11-23 17:01:36+00:00,1330919441169854466,My grandma died today early morning because of Covid. Thank you to the doctors in hospital in Litomysl for the care of her and that we could say last goodbye yesterday❤️,StepanRehak,Mladá Boleslav,15,11,0,0,"ENYAQ iV & ENYAQ COUPÉ iV 
E-mobility
ŠKODA AUTO Spokesperson",1958,,my grandma died today early morning because of covid thank you to the doctors in hospital in litomysl for the care of her and that we could say last goodbye yesterday,"['my', 'grandma', 'died', 'today', 'early', 'morning', 'because', 'of', 'covid', 'thank', 'you', 'to', 'the', 'doctors', 'in', 'hospital', 'in', 'litomysl', 'for', 'the', 'care', 'of', 'her', 'and', 'that', 'we', 'could', 'say', 'last', 'goodbye', 'yesterday']","['grandma', 'died', 'today', 'early', 'morning', 'covid', 'thank', 'doctors', 'hospital', 'litomysl', 'care', 'could', 'say', 'last', 'goodbye', 'yesterday']","['grandma', 'die', 'today', 'earli', 'morn', 'covid', 'thank', 'doctor', 'hospit', 'litomysl', 'care', 'could', 'say', 'last', 'goodby', 'yesterday']","['grandma', 'died', 'today', 'early', 'morning', 'covid', 'thank', 'doctors', 'hospital', 'litomysl', 'care', 'could', 'say', 'last', 'goodbye', 'yesterday']",1,Czech Republic
2022-06-02 21:07:30+00:00,1532468974583152643,Maybe if @elonmusk helps? https://t.co/IdjvX1Gpzy,KastorPolluxCZ,Hlavní město Praha,0,0,0,0,"Táta, #SKS, @49ers, @Ravens, NFL, Kastor a Pollux, Musk, Tesla (Nikola), SpaceX, Love.",80,,maybe if helps,"['maybe', 'if', 'helps']","['maybe', 'helps']","['mayb', 'help']","['maybe', 'helps']",3,Czech Republic
2022-06-02 14:02:42+00:00,1532362071228223489,"In addition to Smartlook being GDPR , CCPA, and HIPPA compliant, you can now easily mask or completely exclude elements you don't want to record.

The new UI makes the process simple and you won't even need your developer's help. 
https://t.co/FyhLN86fFN https://t.co/YOdYrV5F3R",getSmartlook,"Brno, Czech Republic",1,0,0,0,Smartlook is a qualitative analytics solution for websites and mobile apps that helps you understand users' actions. Get your free trial at smartlook.com,792,,in addition to smartlook being gdpr ccpa and hippa compliant you can now easily mask or completely exclude elements you dont want to record the new ui makes the process simple and you wont even need your developers help,"['in', 'addition', 'to', 'smartlook', 'being', 'gdpr', 'ccpa', 'and', 'hippa', 'compliant', 'you', 'can', 'now', 'easily', 'mask', 'or', 'completely', 'exclude', 'elements', 'you', 'dont', 'want', 'to', 'record', 'the', 'new', 'ui', 'makes', 'the', 'process', 'simple', 'and', 'you', 'wont', 'even', 'need', 'your', 'developers', 'help']","['addition', 'smartlook', 'gdpr', 'ccpa', 'hippa', 'compliant', 'easily', 'mask', 'completely', 'exclude', 'elements', 'dont', 'want', 'record', 'new', 'ui', 'makes', 'process', 'simple', 'wont', 'even', 'need', 'developers', 'help']","['addit', 'smartlook', 'gdpr', 'ccpa', 'hippa', 'compliant', 'easili', 'mask', 'complet', 'exclud', 'element', 'dont', 'want', 'record', 'new', 'ui', 'make', 'process', 'simpl', 'wont', 'even', 'need', 'develop', 'help']","['addition', 'smartlook', 'gdpr', 'ccpa', 'hippa', 'compliant', 'easily', 'mask', 'completely', 'exclude', 'elements', 'dont', 'want', 'record', 'new', 'ui', 'makes', 'process', 'simple', 'wont', 'even', 'need', 'developers', 'help']",5,Czech Republic
2022-06-01 23:26:15+00:00,1532141506852790272,@phike9391 @ShelKel2 @MikeKow26359960 @newsmax @elonmusk I do work and have helped startups become very successful. I also know I have a life outside of work and the onus is on me to balance life/work in a way that means successful outcomes can still be realised. Elon is partly successful because he exploits people. Go ask his workers.,jamesbarnettcz,prague,0,1,0,0,"boxing + weightlifting
carnivore/keto + omad
blockchain/crypto investor
hard work. dedication! 🥊 🙏",342,,i do work and have helped startups become very successful i also know i have a life outside of work and the onus is on me to balance lifework in a way that means successful outcomes can still be realised elon is partly successful because he exploits people go ask his workers,"['i', 'do', 'work', 'and', 'have', 'helped', 'startups', 'become', 'very', 'successful', 'i', 'also', 'know', 'i', 'have', 'a', 'life', 'outside', 'of', 'work', 'and', 'the', 'onus', 'is', 'on', 'me', 'to', 'balance', 'lifework', 'in', 'a', 'way', 'that', 'means', 'successful', 'outcomes', 'can', 'still', 'be', 'realised', 'elon', 'is', 'partly', 'successful', 'because', 'he', 'exploits', 'people', 'go', 'ask', 'his', 'workers']","['work', 'helped', 'startups', 'become', 'successful', 'also', 'know', 'life', 'outside', 'work', 'onus', 'balance', 'lifework', 'way', 'means', 'successful', 'outcomes', 'still', 'realised', 'elon', 'partly', 'successful', 'exploits', 'people', 'go', 'ask', 'workers']","['work', 'help', 'startup', 'becom', 'success', 'also', 'know', 'life', 'outsid', 'work', 'onu', 'balanc', 'lifework', 'way', 'mean', 'success', 'outcom', 'still', 'realis', 'elon', 'partli', 'success', 'exploit', 'peopl', 'go', 'ask', 'worker']","['work', 'helped', 'startups', 'become', 'successful', 'also', 'know', 'life', 'outside', 'work', 'onus', 'balance', 'lifework', 'way', 'means', 'successful', 'outcomes', 'still', 'realised', 'elon', 'partly', 'successful', 'exploits', 'people', 'go', 'ask', 'workers']",4,Czech Republic
2022-05-22 15:00:34+00:00,1528390366914826243,Single biggest square footage manufacturing plant under one roof in the United States? Giga Texas. @elonmusk @tesla https://t.co/4zxQvx8FrM,spotted_model,"Prague, Czech Republic",14,0,1,0,"OG Tesla supporter who really owns Teslas and $TSLA. Tweets include humor, satire, short rants, love, pics of Teslas, and EVs from all over.",7835,,single biggest square footage manufacturing plant under one roof in the united states giga texas,"['single', 'biggest', 'square', 'footage', 'manufacturing', 'plant', 'under', 'one', 'roof', 'in', 'the', 'united', 'states', 'giga', 'texas']","['single', 'biggest', 'square', 'footage', 'manufacturing', 'plant', 'one', 'roof', 'united', 'states', 'giga', 'texas']","['singl', 'biggest', 'squar', 'footag', 'manufactur', 'plant', 'one', 'roof', 'unit', 'state', 'giga', 'texa']","['single', 'biggest', 'square', 'footage', 'manufacturing', 'plant', 'one', 'roof', 'united', 'states', 'giga', 'texas']",5,Czech Republic
2022-02-21 07:50:36+00:00,1495667255597801472,"Just got a message on a certain chat app:
'Are you an anti-masker? Every time I see you at the shops, you're without a mask.'
'Nope. I'm pro-face.'
'I don't like wearing one either, but I wear it for other people.' 
'You actually think you're helping people?'
And he blocked me 😂",cult_covid,,9,0,0,0,"Now that the pandemic's over, on to the war!",939,,just got a message on a certain chat app are you an antimasker every time i see you at the shops youre without a mask nope im proface i dont like wearing one either but i wear it for other people you actually think youre helping people and he blocked me,"['just', 'got', 'a', 'message', 'on', 'a', 'certain', 'chat', 'app', 'are', 'you', 'an', 'antimasker', 'every', 'time', 'i', 'see', 'you', 'at', 'the', 'shops', 'youre', 'without', 'a', 'mask', 'nope', 'im', 'proface', 'i', 'dont', 'like', 'wearing', 'one', 'either', 'but', 'i', 'wear', 'it', 'for', 'other', 'people', 'you', 'actually', 'think', 'youre', 'helping', 'people', 'and', 'he', 'blocked', 'me']","['got', 'message', 'certain', 'chat', 'app', 'antimasker', 'every', 'time', 'see', 'shops', 'youre', 'without', 'mask', 'nope', 'im', 'proface', 'dont', 'like', 'wearing', 'one', 'either', 'wear', 'people', 'actually', 'think', 'youre', 'helping', 'people', 'blocked']","['got', 'messag', 'certain', 'chat', 'app', 'antimask', 'everi', 'time', 'see', 'shop', 'your', 'without', 'mask', 'nope', 'im', 'profac', 'dont', 'like', 'wear', 'one', 'either', 'wear', 'peopl', 'actual', 'think', 'your', 'help', 'peopl', 'block']","['got', 'message', 'certain', 'chat', 'app', 'antimasker', 'every', 'time', 'see', 'shops', 'youre', 'without', 'mask', 'nope', 'im', 'proface', 'dont', 'like', 'wearing', 'one', 'either', 'wear', 'people', 'actually', 'think', 'youre', 'helping', 'people', 'blocked']",1,Czech Republic
2021-03-28 13:15:19+00:00,1376160979076145157,"@RationalEtienne @elonmusk @Kristennetten @Tesla @SpaceX @MikySkoda @bremondr @Paralelni_polis @mayemusk @kimbal I agree the technicalities are complex, BUT the message of endorsing a cryptocurrency that exists outside the traditional banking system and showing people ‘yeah, it’s possible to do things differently and I’m putting my business on the line as support’ is symbolic+important",sarapolak_cz,"Prague, Czech Republic",6,2,0,0,Archaeologist in AI 🤖 Decentralisation & cloud civilisations research👩‍💻  Meme fan 🤙 Czech & Oxford gal 🇨🇿 #Forbes30under30,7653,,i agree the technicalities are complex but the message of endorsing a cryptocurrency that exists outside the traditional banking system and showing people yeah its possible to do things differently and im putting my business on the line as support is symbolicimportant,"['i', 'agree', 'the', 'technicalities', 'are', 'complex', 'but', 'the', 'message', 'of', 'endorsing', 'a', 'cryptocurrency', 'that', 'exists', 'outside', 'the', 'traditional', 'banking', 'system', 'and', 'showing', 'people', 'yeah', 'its', 'possible', 'to', 'do', 'things', 'differently', 'and', 'im', 'putting', 'my', 'business', 'on', 'the', 'line', 'as', 'support', 'is', 'symbolicimportant']","['agree', 'technicalities', 'complex', 'message', 'endorsing', 'cryptocurrency', 'exists', 'outside', 'traditional', 'banking', 'system', 'showing', 'people', 'yeah', 'possible', 'things', 'differently', 'im', 'putting', 'business', 'line', 'support', 'symbolicimportant']","['agre', 'technic', 'complex', 'messag', 'endors', 'cryptocurr', 'exist', 'outsid', 'tradit', 'bank', 'system', 'show', 'peopl', 'yeah', 'possibl', 'thing', 'differ', 'im', 'put', 'busi', 'line', 'support', 'symbolicimport']","['agree', 'technicalities', 'complex', 'message', 'endorsing', 'cryptocurrency', 'exists', 'outside', 'traditional', 'banking', 'system', 'showing', 'people', 'yeah', 'possible', 'things', 'differently', 'im', 'putting', 'business', 'line', 'support', 'symbolicimportant']",3,Czech Republic
2021-02-25 21:35:41+00:00,1365052874896646150,@elonmusk @skorusARK I love how Elon is literally just trying to help and the market is still hell bent over who sells more and competing rather than focusing on solving problems at hand,sarapolak_cz,"Prague, Czech Republic",9,1,0,0,Archaeologist in AI 🤖 Decentralisation & cloud civilisations research👩‍💻  Meme fan 🤙 Czech & Oxford gal 🇨🇿 #Forbes30under30,7653,,i love how elon is literally just trying to help and the market is still hell bent over who sells more and competing rather than focusing on solving problems at hand,"['i', 'love', 'how', 'elon', 'is', 'literally', 'just', 'trying', 'to', 'help', 'and', 'the', 'market', 'is', 'still', 'hell', 'bent', 'over', 'who', 'sells', 'more', 'and', 'competing', 'rather', 'than', 'focusing', 'on', 'solving', 'problems', 'at', 'hand']","['love', 'elon', 'literally', 'trying', 'help', 'market', 'still', 'hell', 'bent', 'sells', 'competing', 'rather', 'focusing', 'solving', 'problems', 'hand']","['love', 'elon', 'liter', 'tri', 'help', 'market', 'still', 'hell', 'bent', 'sell', 'compet', 'rather', 'focus', 'solv', 'problem', 'hand']","['love', 'elon', 'literally', 'trying', 'help', 'market', 'still', 'hell', 'bent', 'sells', 'competing', 'rather', 'focusing', 'solving', 'problems', 'hand']",5,Czech Republic
2020-10-23 08:58:52+00:00,1319563932386942976,"Czech Health Minister who closed down the restaurants, said don’t drink alcohol but water, forced masks on us, early 8pm closing.. he was caught at Prague’s Vyšehrad castle restaurant, indoors, without a mask, 10pm to midnight, having a nice dinner meal, drinking wine with others https://t.co/e7I2dTEeaZ",goldseek,"Prague, Czech Republic",147,13,56,8,In Gold There Is Truth | President of GoldSeek.com @GoldSeekcom ⚒ SilverSeek.com @SilverSeekcom ⚒ Inflation feeds the #GoldSqueeze #SilverSqueeze,40262,,czech health minister who closed down the restaurants said dont drink alcohol but water forced masks on us early 8pm closing he was caught at pragues vyehrad castle restaurant indoors without a mask 10pm to midnight having a nice dinner meal drinking wine with others,"['czech', 'health', 'minister', 'who', 'closed', 'down', 'the', 'restaurants', 'said', 'dont', 'drink', 'alcohol', 'but', 'water', 'forced', 'masks', 'on', 'us', 'early', '8pm', 'closing', 'he', 'was', 'caught', 'at', 'pragues', 'vyehrad', 'castle', 'restaurant', 'indoors', 'without', 'a', 'mask', '10pm', 'to', 'midnight', 'having', 'a', 'nice', 'dinner', 'meal', 'drinking', 'wine', 'with', 'others']","['czech', 'health', 'minister', 'closed', 'restaurants', 'said', 'dont', 'drink', 'alcohol', 'water', 'forced', 'masks', 'us', 'early', '8pm', 'closing', 'caught', 'pragues', 'vyehrad', 'castle', 'restaurant', 'indoors', 'without', 'mask', '10pm', 'midnight', 'nice', 'dinner', 'meal', 'drinking', 'wine', 'others']","['czech', 'health', 'minist', 'close', 'restaur', 'said', 'dont', 'drink', 'alcohol', 'water', 'forc', 'mask', 'us', 'earli', '8pm', 'close', 'caught', 'pragu', 'vyehrad', 'castl', 'restaur', 'indoor', 'without', 'mask', '10pm', 'midnight', 'nice', 'dinner', 'meal', 'drink', 'wine', 'other']","['czech', 'health', 'minister', 'closed', 'restaurants', 'said', 'dont', 'drink', 'alcohol', 'water', 'forced', 'masks', 'us', 'early', '8pm', 'closing', 'caught', 'pragues', 'vyehrad', 'castle', 'restaurant', 'indoors', 'without', 'mask', '10pm', 'midnight', 'nice', 'dinner', 'meal', 'drinking', 'wine', 'others']",1,Czech Republic
2020-06-29 01:39:10+00:00,1277416287602380800,I would like see that everyone at USA will be using masks. Really we wearing mask since February till 27.6. and our numbers are low and didn't grow.Please wear mask. Trump is stupid and Narcistic sociopath. He never care how many people suffer and dies. Be strong #EndTheNightmare https://t.co/fj8okWLdv2,swanhauser,"Pardubice, Česká republika",34,1,17,0,"Jsem intelektuální a umělecky založená, baví mne číst beletrii, ale také si rada zahraji na PSku. I'm intellectual and Media working women.",69,['EndTheNightmare'],i would like see that everyone at usa will be using masks really we wearing mask since february till 276 and our numbers are low and didnt growplease wear mask trump is stupid and narcistic sociopath he never care how many people suffer and dies be strong endthenightmare,"['i', 'would', 'like', 'see', 'that', 'everyone', 'at', 'usa', 'will', 'be', 'using', 'masks', 'really', 'we', 'wearing', 'mask', 'since', 'february', 'till', '276', 'and', 'our', 'numbers', 'are', 'low', 'and', 'didnt', 'growplease', 'wear', 'mask', 'trump', 'is', 'stupid', 'and', 'narcistic', 'sociopath', 'he', 'never', 'care', 'how', 'many', 'people', 'suffer', 'and', 'dies', 'be', 'strong', 'endthenightmare']","['would', 'like', 'see', 'everyone', 'usa', 'using', 'masks', 'really', 'wearing', 'mask', 'since', 'february', 'till', '276', 'numbers', 'low', 'didnt', 'growplease', 'wear', 'mask', 'trump', 'stupid', 'narcistic', 'sociopath', 'never', 'care', 'many', 'people', 'suffer', 'dies', 'strong', 'endthenightmare']","['would', 'like', 'see', 'everyon', 'usa', 'use', 'mask', 'realli', 'wear', 'mask', 'sinc', 'februari', 'till', '276', 'number', 'low', 'didnt', 'growpleas', 'wear', 'mask', 'trump', 'stupid', 'narcist', 'sociopath', 'never', 'care', 'mani', 'peopl', 'suffer', 'die', 'strong', 'endthenightmar']","['would', 'like', 'see', 'everyone', 'usa', 'using', 'masks', 'really', 'wearing', 'mask', 'since', 'february', 'till', '276', 'numbers', 'low', 'didnt', 'growplease', 'wear', 'mask', 'trump', 'stupid', 'narcistic', 'sociopath', 'never', 'care', 'many', 'people', 'suffer', 'dies', 'strong', 'endthenightmare']",1,Czech Republic
2020-04-23 09:19:12+00:00,1253252072197292032,"Slowly and carefully climbing up - sky’s the limit. Round ten. Take care, all of you and thank you for the face mask Oli. #biologicaltreatment #roundten #breastcancer #quarantine… https://t.co/NCx7lRBRKy",MrsLindaPosp,CR,0,0,0,0,"ELT,Mahara ePortfolio,Moodle,Badges&iPads in edu. 'The person who says something is impossible should not interrupt the person who is doing it.' Chinese proverb",670,"['biologicaltreatment', 'roundten', 'breastcancer', 'quarantine']",slowly and carefully climbing up skys the limit round ten take care all of you and thank you for the face mask oli biologicaltreatment roundten breastcancer quarantine,"['slowly', 'and', 'carefully', 'climbing', 'up', 'skys', 'the', 'limit', 'round', 'ten', 'take', 'care', 'all', 'of', 'you', 'and', 'thank', 'you', 'for', 'the', 'face', 'mask', 'oli', 'biologicaltreatment', 'roundten', 'breastcancer', 'quarantine']","['slowly', 'carefully', 'climbing', 'skys', 'limit', 'round', 'ten', 'take', 'care', 'thank', 'face', 'mask', 'oli', 'biologicaltreatment', 'roundten', 'breastcancer', 'quarantine']","['slowli', 'care', 'climb', 'ski', 'limit', 'round', 'ten', 'take', 'care', 'thank', 'face', 'mask', 'oli', 'biologicaltreat', 'roundten', 'breastcanc', 'quarantin']","['slowly', 'carefully', 'climbing', 'skys', 'limit', 'round', 'ten', 'take', 'care', 'thank', 'face', 'mask', 'oli', 'biologicaltreatment', 'roundten', 'breastcancer', 'quarantine']",5,Czech Republic
