Date,Id,Tweet,Username,Location,likeCount,replyCount,retweetCount,quoteCount,userDescription,userFollowers,hashtags,Cleaned_Tweet,Tweet_tokenized,Tweet_removed_stop_word,Tweet_stemmed,Tweet_lemmatized,sentiment,Country
2022-04-26 01:29:56+00:00,1518764279574544384,"@MsCStepp @KinderChat123 First, getting the groups settled and listening in order so raising their hand to speak and listen is a must Second golden safety routines and rules taking care of ourselves and our materials is key, along with modeling respect and being consistent with what we ask from them.",Monitejeda65,"Santiago, Metropolitana de Santiago",0,0,0,0,Early Childhood Educator.I love children and learning how they learn better. Nature is my favorite and place to seek peace and new ideas 🌳💚,537,,first getting the groups settled and listening in order so raising their hand to speak and listen is a must second golden safety routines and rules taking care of ourselves and our materials is key along with modeling respect and being consistent with what we ask from them,"['first', 'getting', 'the', 'groups', 'settled', 'and', 'listening', 'in', 'order', 'so', 'raising', 'their', 'hand', 'to', 'speak', 'and', 'listen', 'is', 'a', 'must', 'second', 'golden', 'safety', 'routines', 'and', 'rules', 'taking', 'care', 'of', 'ourselves', 'and', 'our', 'materials', 'is', 'key', 'along', 'with', 'modeling', 'respect', 'and', 'being', 'consistent', 'with', 'what', 'we', 'ask', 'from', 'them']","['first', 'getting', 'groups', 'settled', 'listening', 'order', 'raising', 'hand', 'speak', 'listen', 'must', 'second', 'golden', 'safety', 'routines', 'rules', 'taking', 'care', 'materials', 'key', 'along', 'modeling', 'respect', 'consistent', 'ask']","['first', 'get', 'group', 'settl', 'listen', 'order', 'rais', 'hand', 'speak', 'listen', 'must', 'second', 'golden', 'safeti', 'routin', 'rule', 'take', 'care', 'materi', 'key', 'along', 'model', 'respect', 'consist', 'ask']","['first', 'getting', 'groups', 'settled', 'listening', 'order', 'raising', 'hand', 'speak', 'listen', 'must', 'second', 'golden', 'safety', 'routines', 'rules', 'taking', 'care', 'materials', 'key', 'along', 'modeling', 'respect', 'consistent', 'ask']",5,Chile
2022-05-31 09:12:59+00:00,1531564384803205120,"Chile Government Encourages The 4th Shot Of Vaccine.

KAZINFORM – SANTIAGO According to Xinhua, Chile’s government on Thursday invited workers from all industries to take a fourth shot at COVID-19 and encouraged companies to make...

Continue reading...

https://t.co/hBfEn4oHSy",medrivaCL,Santiago,0,0,0,0,"@BNNBreaking 🇨🇱 Edition. Your most trusted coronavirus media newsroom bringing you breaking news, data modeling & research. 📧 tips@bnn.network",360,,chile government encourages the 4th shot of vaccine kazinform santiago according to xinhua chiles government on thursday invited workers from all industries to take a fourth shot at covid19 and encouraged companies to make continue reading,"['chile', 'government', 'encourages', 'the', '4th', 'shot', 'of', 'vaccine', 'kazinform', 'santiago', 'according', 'to', 'xinhua', 'chiles', 'government', 'on', 'thursday', 'invited', 'workers', 'from', 'all', 'industries', 'to', 'take', 'a', 'fourth', 'shot', 'at', 'covid19', 'and', 'encouraged', 'companies', 'to', 'make', 'continue', 'reading']","['chile', 'government', 'encourages', '4th', 'shot', 'vaccine', 'kazinform', 'santiago', 'according', 'xinhua', 'chiles', 'government', 'thursday', 'invited', 'workers', 'industries', 'take', 'fourth', 'shot', 'covid19', 'encouraged', 'companies', 'make', 'continue', 'reading']","['chile', 'govern', 'encourag', '4th', 'shot', 'vaccin', 'kazinform', 'santiago', 'accord', 'xinhua', 'chile', 'govern', 'thursday', 'invit', 'worker', 'industri', 'take', 'fourth', 'shot', 'covid19', 'encourag', 'compani', 'make', 'continu', 'read']","['chile', 'government', 'encourages', '4th', 'shot', 'vaccine', 'kazinform', 'santiago', 'according', 'xinhua', 'chiles', 'government', 'thursday', 'invited', 'workers', 'industries', 'take', 'fourth', 'shot', 'covid19', 'encouraged', 'companies', 'make', 'continue', 'reading']",1,Chile
