Date,Id,Tweet,Username,Location,likeCount,replyCount,retweetCount,quoteCount,userDescription,userFollowers,hashtags,Cleaned_Tweet,Tweet_tokenized,Tweet_removed_stop_word,Tweet_stemmed,Tweet_lemmatized,sentiment,Country
2022-02-02 23:04:45+00:00,1489011940517101568,Health Experts Warn Of Thousands Of Joe Rogan-Style Uncensored Conversations Increasingly Happening Between Everyday People https://t.co/Y6MxH11l5g via @TheBabylonBee,jasonmashak,Great Moravia,0,0,0,0,"Dad to daughters, Bohunk, Epicurean Stoic, MarComms, rusty musician/poet, author of Salty as a Lip, layman media analyst. RT/Like ≠ endorse",2400,,health experts warn of thousands of joe roganstyle uncensored conversations increasingly happening between everyday people via,"['health', 'experts', 'warn', 'of', 'thousands', 'of', 'joe', 'roganstyle', 'uncensored', 'conversations', 'increasingly', 'happening', 'between', 'everyday', 'people', 'via']","['health', 'experts', 'warn', 'thousands', 'joe', 'roganstyle', 'uncensored', 'conversations', 'increasingly', 'happening', 'everyday', 'people', 'via']","['health', 'expert', 'warn', 'thousand', 'joe', 'roganstyl', 'uncensor', 'convers', 'increasingli', 'happen', 'everyday', 'peopl', 'via']","['health', 'experts', 'warn', 'thousands', 'joe', 'roganstyle', 'uncensored', 'conversations', 'increasingly', 'happening', 'everyday', 'people', 'via']",5,Czech Republic
2022-01-02 11:59:06+00:00,1477610398752858115,less than 6k on housing. less than 2k on health insurance. more than 10k on balling.,quasimatt,nyc (brooklyn (williamsburg)),38,0,0,0,the quasiverse is a niche underground internet-native surrealist subcultural space.,2945,,less than 6k on housing less than 2k on health insurance more than 10k on balling,"['less', 'than', '6k', 'on', 'housing', 'less', 'than', '2k', 'on', 'health', 'insurance', 'more', 'than', '10k', 'on', 'balling']","['less', '6k', 'housing', 'less', '2k', 'health', 'insurance', '10k', 'balling']","['less', '6k', 'hous', 'less', '2k', 'health', 'insur', '10k', 'ball']","['less', '6k', 'housing', 'less', '2k', 'health', 'insurance', '10k', 'balling']",1,Czech Republic
2021-12-30 20:19:31+00:00,1476649169490219010,"Great excerpt from @Andrew_Bonello explaining why these reforms are not normalising cannabis:

“On the contrary, we have seen a strong civil society debate giving due space to the role of harm reduction as an important tool to promote public health, and a more dignified approach”",KowalskiKatya,"London, United Kingdom",3,0,0,0,Head of Operations @VoltefaceHub // Psychology Graduate @UniofBath // Tweeting about drug policy // Czech-British-American // Email: katya@volteface.me,1379,,great excerpt from explaining why these reforms are not normalising cannabis on the contrary we have seen a strong civil society debate giving due space to the role of harm reduction as an important tool to promote public health and a more dignified approach,"['great', 'excerpt', 'from', 'explaining', 'why', 'these', 'reforms', 'are', 'not', 'normalising', 'cannabis', 'on', 'the', 'contrary', 'we', 'have', 'seen', 'a', 'strong', 'civil', 'society', 'debate', 'giving', 'due', 'space', 'to', 'the', 'role', 'of', 'harm', 'reduction', 'as', 'an', 'important', 'tool', 'to', 'promote', 'public', 'health', 'and', 'a', 'more', 'dignified', 'approach']","['great', 'excerpt', 'explaining', 'reforms', 'normalising', 'cannabis', 'contrary', 'seen', 'strong', 'civil', 'society', 'debate', 'giving', 'due', 'space', 'role', 'harm', 'reduction', 'important', 'tool', 'promote', 'public', 'health', 'dignified', 'approach']","['great', 'excerpt', 'explain', 'reform', 'normalis', 'cannabi', 'contrari', 'seen', 'strong', 'civil', 'societi', 'debat', 'give', 'due', 'space', 'role', 'harm', 'reduct', 'import', 'tool', 'promot', 'public', 'health', 'dignifi', 'approach']","['great', 'excerpt', 'explaining', 'reforms', 'normalising', 'cannabis', 'contrary', 'seen', 'strong', 'civil', 'society', 'debate', 'giving', 'due', 'space', 'role', 'harm', 'reduction', 'important', 'tool', 'promote', 'public', 'health', 'dignified', 'approach']",5,Czech Republic
2021-11-07 10:05:34+00:00,1457288106860756997,"@StateFarm ""Prevea Health remains deeply committed to protecting its patients, staff, providers and communities amidst the COVID-19 pandemic. This includes encouraging and helping all eligible populations to become vaccinated against COVID-19.” What about you?",markbakerprague,Prague,0,0,0,0,Prague-based writer and travel journalist. Author of “Čas proměn” (Time of Changes). More about me on my blog:,4540,,prevea health remains deeply committed to protecting its patients staff providers and communities amidst the covid19 pandemic this includes encouraging and helping all eligible populations to become vaccinated against covid19 what about you,"['prevea', 'health', 'remains', 'deeply', 'committed', 'to', 'protecting', 'its', 'patients', 'staff', 'providers', 'and', 'communities', 'amidst', 'the', 'covid19', 'pandemic', 'this', 'includes', 'encouraging', 'and', 'helping', 'all', 'eligible', 'populations', 'to', 'become', 'vaccinated', 'against', 'covid19', 'what', 'about', 'you']","['prevea', 'health', 'remains', 'deeply', 'committed', 'protecting', 'patients', 'staff', 'providers', 'communities', 'amidst', 'covid19', 'pandemic', 'includes', 'encouraging', 'helping', 'eligible', 'populations', 'become', 'vaccinated', 'covid19']","['prevea', 'health', 'remain', 'deepli', 'commit', 'protect', 'patient', 'staff', 'provid', 'commun', 'amidst', 'covid19', 'pandem', 'includ', 'encourag', 'help', 'elig', 'popul', 'becom', 'vaccin', 'covid19']","['prevea', 'health', 'remains', 'deeply', 'committed', 'protecting', 'patients', 'staff', 'providers', 'communities', 'amidst', 'covid19', 'pandemic', 'includes', 'encouraging', 'helping', 'eligible', 'populations', 'become', 'vaccinated', 'covid19']",5,Czech Republic
2021-08-23 07:30:30+00:00,1429707605287505923,"@travelfish I think the pandemic has helped to shift the discussion around tourism to the include the effects -- and not just health — that travel can have on the destination itself. There’s clearly a long way to go yet, but this is a positive development.",markbakerprague,Prague,0,1,0,0,Prague-based writer and travel journalist. Author of “Čas proměn” (Time of Changes). More about me on my blog:,4540,,i think the pandemic has helped to shift the discussion around tourism to the include the effects and not just health that travel can have on the destination itself theres clearly a long way to go yet but this is a positive development,"['i', 'think', 'the', 'pandemic', 'has', 'helped', 'to', 'shift', 'the', 'discussion', 'around', 'tourism', 'to', 'the', 'include', 'the', 'effects', 'and', 'not', 'just', 'health', 'that', 'travel', 'can', 'have', 'on', 'the', 'destination', 'itself', 'theres', 'clearly', 'a', 'long', 'way', 'to', 'go', 'yet', 'but', 'this', 'is', 'a', 'positive', 'development']","['think', 'pandemic', 'helped', 'shift', 'discussion', 'around', 'tourism', 'include', 'effects', 'health', 'travel', 'destination', 'theres', 'clearly', 'long', 'way', 'go', 'yet', 'positive', 'development']","['think', 'pandem', 'help', 'shift', 'discuss', 'around', 'tourism', 'includ', 'effect', 'health', 'travel', 'destin', 'there', 'clearli', 'long', 'way', 'go', 'yet', 'posit', 'develop']","['think', 'pandemic', 'helped', 'shift', 'discussion', 'around', 'tourism', 'include', 'effects', 'health', 'travel', 'destination', 'theres', 'clearly', 'long', 'way', 'go', 'yet', 'positive', 'development']",4,Czech Republic
2021-08-13 09:47:14+00:00,1426118134923157507,"How can your inner voice help you to understand your health issues and guide you towards healing?

That is what I talk about in this week's Heart Connection Podcast 💖

https://t.co/Xyw32pOGVa https://t.co/3BKsQhuuAW",Pavlina_Jir,"Prague, Czech Republic",1,0,0,0,"✨Body, Mind & Soul Therapy | Helping women to heal from chronic health issues, including eczema & autoimmune disease.
💖 The Heart Connection Podcast",8,,how can your inner voice help you to understand your health issues and guide you towards healing that is what i talk about in this weeks heart connection podcast,"['how', 'can', 'your', 'inner', 'voice', 'help', 'you', 'to', 'understand', 'your', 'health', 'issues', 'and', 'guide', 'you', 'towards', 'healing', 'that', 'is', 'what', 'i', 'talk', 'about', 'in', 'this', 'weeks', 'heart', 'connection', 'podcast']","['inner', 'voice', 'help', 'understand', 'health', 'issues', 'guide', 'towards', 'healing', 'talk', 'weeks', 'heart', 'connection', 'podcast']","['inner', 'voic', 'help', 'understand', 'health', 'issu', 'guid', 'toward', 'heal', 'talk', 'week', 'heart', 'connect', 'podcast']","['inner', 'voice', 'help', 'understand', 'health', 'issues', 'guide', 'towards', 'healing', 'talk', 'weeks', 'heart', 'connection', 'podcast']",5,Czech Republic
2021-06-12 08:44:22+00:00,1403634269289910272,@LaurenWitzkeDE seek out a professional mental health professional. Or a cult deprogammer. You are an embarrassing to Delaware. https://t.co/0zKxpd3Z7j,Cabanaboiscoot,"Praha, Česká republika",1,0,0,0,"Teacher , Actor, currently the King of Student Films for FAMU, and have gone full OCD for #ourflagmeansdeath.",325,,seek out a professional mental health professional or a cult deprogammer you are an embarrassing to delaware,"['seek', 'out', 'a', 'professional', 'mental', 'health', 'professional', 'or', 'a', 'cult', 'deprogammer', 'you', 'are', 'an', 'embarrassing', 'to', 'delaware']","['seek', 'professional', 'mental', 'health', 'professional', 'cult', 'deprogammer', 'embarrassing', 'delaware']","['seek', 'profession', 'mental', 'health', 'profession', 'cult', 'deprogamm', 'embarrass', 'delawar']","['seek', 'professional', 'mental', 'health', 'professional', 'cult', 'deprogammer', 'embarrassing', 'delaware']",1,Czech Republic
2020-12-10 07:25:23+00:00,1336935024722120704,"Test-and-trace policies are the single most effective public health measure to reduce R,but are found to be most effective when the level of infections is low.From an initial R of 1.5,a lockdown would be expected to reduce R to just over 1.0, but also reduce mobility by up to 40% https://t.co/gW3T1X6b9C",HelenaHorska,,4,0,1,0,"hlavní ekonomka, přednášející, šťastná matka.
Tweety vyjadřují osobní postoj a mají jen informativní charakter. Nelze je ztotožňovat s názory Raiffeisenbank",17792,,testandtrace policies are the single most effective public health measure to reduce rbut are found to be most effective when the level of infections is lowfrom an initial r of 15a lockdown would be expected to reduce r to just over 10 but also reduce mobility by up to 40,"['testandtrace', 'policies', 'are', 'the', 'single', 'most', 'effective', 'public', 'health', 'measure', 'to', 'reduce', 'rbut', 'are', 'found', 'to', 'be', 'most', 'effective', 'when', 'the', 'level', 'of', 'infections', 'is', 'lowfrom', 'an', 'initial', 'r', 'of', '15a', 'lockdown', 'would', 'be', 'expected', 'to', 'reduce', 'r', 'to', 'just', 'over', '10', 'but', 'also', 'reduce', 'mobility', 'by', 'up', 'to', '40']","['testandtrace', 'policies', 'single', 'effective', 'public', 'health', 'measure', 'reduce', 'rbut', 'found', 'effective', 'level', 'infections', 'lowfrom', 'initial', 'r', '15a', 'lockdown', 'would', 'expected', 'reduce', 'r', '10', 'also', 'reduce', 'mobility', '40']","['testandtrac', 'polici', 'singl', 'effect', 'public', 'health', 'measur', 'reduc', 'rbut', 'found', 'effect', 'level', 'infect', 'lowfrom', 'initi', 'r', '15a', 'lockdown', 'would', 'expect', 'reduc', 'r', '10', 'also', 'reduc', 'mobil', '40']","['testandtrace', 'policies', 'single', 'effective', 'public', 'health', 'measure', 'reduce', 'rbut', 'found', 'effective', 'level', 'infections', 'lowfrom', 'initial', 'r', '15a', 'lockdown', 'would', 'expected', 'reduce', 'r', '10', 'also', 'reduce', 'mobility', '40']",4,Czech Republic
2020-11-12 15:19:35+00:00,1326907501875499015,"@PokerCookieM @statnews Excellent point. This is why it frustrates me so much to see people act selfishly. If everyone did their part, you wouldn’t be spending sleepless nights parsing out health versus learning....hoping you’re doing the best you can for your child.",ellenbraaten,"Boston, MA",1,1,0,1,Associate Professor @HarvardMed | Writer | Child Psychologist @mghfc | Visiting Professor-Charles University Prague | Views my own,5431,,excellent point this is why it frustrates me so much to see people act selfishly if everyone did their part you wouldnt be spending sleepless nights parsing out health versus learninghoping youre doing the best you can for your child,"['excellent', 'point', 'this', 'is', 'why', 'it', 'frustrates', 'me', 'so', 'much', 'to', 'see', 'people', 'act', 'selfishly', 'if', 'everyone', 'did', 'their', 'part', 'you', 'wouldnt', 'be', 'spending', 'sleepless', 'nights', 'parsing', 'out', 'health', 'versus', 'learninghoping', 'youre', 'doing', 'the', 'best', 'you', 'can', 'for', 'your', 'child']","['excellent', 'point', 'frustrates', 'much', 'see', 'people', 'act', 'selfishly', 'everyone', 'part', 'wouldnt', 'spending', 'sleepless', 'nights', 'parsing', 'health', 'versus', 'learninghoping', 'youre', 'best', 'child']","['excel', 'point', 'frustrat', 'much', 'see', 'peopl', 'act', 'selfishli', 'everyon', 'part', 'wouldnt', 'spend', 'sleepless', 'night', 'pars', 'health', 'versu', 'learninghop', 'your', 'best', 'child']","['excellent', 'point', 'frustrates', 'much', 'see', 'people', 'act', 'selfishly', 'everyone', 'part', 'wouldnt', 'spending', 'sleepless', 'nights', 'parsing', 'health', 'versus', 'learninghoping', 'youre', 'best', 'child']",5,Czech Republic
2020-10-27 17:09:22+00:00,1321136923096846339,"Besides mitigating effects of mental health issues or illness, exercise can help other ways:  

Better memory - especially as we age it can actually mitigate memory loss!
Better sleep patterns 
Better energy
More resilient to other stressors
Immune boosting 
Better self esteem",empotter10,"Winnipeg, Manitoba (sometimes)",0,1,0,0,6’5 Pro Hooper from Canada. Utah Alum #goutes MENTAL HEALTH IS JUST AS IMPORTANT AS PHYSICAL HEALTH ❤️#ripsarah👼🏾,1398,,besides mitigating effects of mental health issues or illness exercise can help other ways better memory especially as we age it can actually mitigate memory loss better sleep patterns better energy more resilient to other stressors immune boosting better self esteem,"['besides', 'mitigating', 'effects', 'of', 'mental', 'health', 'issues', 'or', 'illness', 'exercise', 'can', 'help', 'other', 'ways', 'better', 'memory', 'especially', 'as', 'we', 'age', 'it', 'can', 'actually', 'mitigate', 'memory', 'loss', 'better', 'sleep', 'patterns', 'better', 'energy', 'more', 'resilient', 'to', 'other', 'stressors', 'immune', 'boosting', 'better', 'self', 'esteem']","['besides', 'mitigating', 'effects', 'mental', 'health', 'issues', 'illness', 'exercise', 'help', 'ways', 'better', 'memory', 'especially', 'age', 'actually', 'mitigate', 'memory', 'loss', 'better', 'sleep', 'patterns', 'better', 'energy', 'resilient', 'stressors', 'immune', 'boosting', 'better', 'self', 'esteem']","['besid', 'mitig', 'effect', 'mental', 'health', 'issu', 'ill', 'exercis', 'help', 'way', 'better', 'memori', 'especi', 'age', 'actual', 'mitig', 'memori', 'loss', 'better', 'sleep', 'pattern', 'better', 'energi', 'resili', 'stressor', 'immun', 'boost', 'better', 'self', 'esteem']","['besides', 'mitigating', 'effects', 'mental', 'health', 'issues', 'illness', 'exercise', 'help', 'ways', 'better', 'memory', 'especially', 'age', 'actually', 'mitigate', 'memory', 'loss', 'better', 'sleep', 'patterns', 'better', 'energy', 'resilient', 'stressors', 'immune', 'boosting', 'better', 'self', 'esteem']",3,Czech Republic
2020-10-06 06:15:03+00:00,1313362111641387008,Hi @AppleSupport I have the strange problem that distance and steps collected on the watch (7.0.1) stopped showing up in Health on the phone (14.0.1). Restart didn’t work. Watch is listed as source. Any suggestions are highly appreciated. Thanks.,bluedog_at,Mostly somewhere in Austria.,0,1,0,0,Geek working at the University of Vienna as Systems Administrator. Not only surrounded by hardware and random code but helpful dogs.,54,,hi i have the strange problem that distance and steps collected on the watch 701 stopped showing up in health on the phone 1401 restart didnt work watch is listed as source any suggestions are highly appreciated thanks,"['hi', 'i', 'have', 'the', 'strange', 'problem', 'that', 'distance', 'and', 'steps', 'collected', 'on', 'the', 'watch', '701', 'stopped', 'showing', 'up', 'in', 'health', 'on', 'the', 'phone', '1401', 'restart', 'didnt', 'work', 'watch', 'is', 'listed', 'as', 'source', 'any', 'suggestions', 'are', 'highly', 'appreciated', 'thanks']","['hi', 'strange', 'problem', 'distance', 'steps', 'collected', 'watch', '701', 'stopped', 'showing', 'health', 'phone', '1401', 'restart', 'didnt', 'work', 'watch', 'listed', 'source', 'suggestions', 'highly', 'appreciated', 'thanks']","['hi', 'strang', 'problem', 'distanc', 'step', 'collect', 'watch', '701', 'stop', 'show', 'health', 'phone', '1401', 'restart', 'didnt', 'work', 'watch', 'list', 'sourc', 'suggest', 'highli', 'appreci', 'thank']","['hi', 'strange', 'problem', 'distance', 'steps', 'collected', 'watch', '701', 'stopped', 'showing', 'health', 'phone', '1401', 'restart', 'didnt', 'work', 'watch', 'listed', 'source', 'suggestions', 'highly', 'appreciated', 'thanks']",1,Czech Republic
2020-09-11 18:31:44+00:00,1304487809630298117,"There isn’t one way to handle mental health. What works for one may not work for another. Speaking out about mental health can be a HUGE help, especially from someone with Dak’s platform. Depression makes you feel alone. Sharing your struggle does NOT MAKE YOU WEAK.",empotter10,"Winnipeg, Manitoba (sometimes)",10,1,4,0,6’5 Pro Hooper from Canada. Utah Alum #goutes MENTAL HEALTH IS JUST AS IMPORTANT AS PHYSICAL HEALTH ❤️#ripsarah👼🏾,1398,,there isnt one way to handle mental health what works for one may not work for another speaking out about mental health can be a huge help especially from someone with daks platform depression makes you feel alone sharing your struggle does not make you weak,"['there', 'isnt', 'one', 'way', 'to', 'handle', 'mental', 'health', 'what', 'works', 'for', 'one', 'may', 'not', 'work', 'for', 'another', 'speaking', 'out', 'about', 'mental', 'health', 'can', 'be', 'a', 'huge', 'help', 'especially', 'from', 'someone', 'with', 'daks', 'platform', 'depression', 'makes', 'you', 'feel', 'alone', 'sharing', 'your', 'struggle', 'does', 'not', 'make', 'you', 'weak']","['isnt', 'one', 'way', 'handle', 'mental', 'health', 'works', 'one', 'may', 'work', 'another', 'speaking', 'mental', 'health', 'huge', 'help', 'especially', 'someone', 'daks', 'platform', 'depression', 'makes', 'feel', 'alone', 'sharing', 'struggle', 'make', 'weak']","['isnt', 'one', 'way', 'handl', 'mental', 'health', 'work', 'one', 'may', 'work', 'anoth', 'speak', 'mental', 'health', 'huge', 'help', 'especi', 'someon', 'dak', 'platform', 'depress', 'make', 'feel', 'alon', 'share', 'struggl', 'make', 'weak']","['isnt', 'one', 'way', 'handle', 'mental', 'health', 'works', 'one', 'may', 'work', 'another', 'speaking', 'mental', 'health', 'huge', 'help', 'especially', 'someone', 'daks', 'platform', 'depression', 'makes', 'feel', 'alone', 'sharing', 'struggle', 'make', 'weak']",1,Czech Republic
2020-09-11 18:30:25+00:00,1304487476170555406,"I mean this in the nicest way possible, skip bayless STFU, and thank you @ShannonSharpe for standing up for mental health 🙏🏼 https://t.co/381eRrLBER",empotter10,"Winnipeg, Manitoba (sometimes)",5,0,0,0,6’5 Pro Hooper from Canada. Utah Alum #goutes MENTAL HEALTH IS JUST AS IMPORTANT AS PHYSICAL HEALTH ❤️#ripsarah👼🏾,1398,,i mean this in the nicest way possible skip bayless stfu and thank you for standing up for mental health,"['i', 'mean', 'this', 'in', 'the', 'nicest', 'way', 'possible', 'skip', 'bayless', 'stfu', 'and', 'thank', 'you', 'for', 'standing', 'up', 'for', 'mental', 'health']","['mean', 'nicest', 'way', 'possible', 'skip', 'bayless', 'stfu', 'thank', 'standing', 'mental', 'health']","['mean', 'nicest', 'way', 'possibl', 'skip', 'bayless', 'stfu', 'thank', 'stand', 'mental', 'health']","['mean', 'nicest', 'way', 'possible', 'skip', 'bayless', 'stfu', 'thank', 'standing', 'mental', 'health']",5,Czech Republic
2020-08-05 16:13:04+00:00,1291044562409082880,"I am such a hypocrite when it comes to mental health, I'll be the first one to rush people into therapy but the moment somebody tells me to consider getting help I'm like https://t.co/ERW99EaJif",YeahNatStyles,"Berlin, Germany",2,1,1,0,Sometimes I worry I wouldn't be such a feminist if I had bigger tits.,109,,i am such a hypocrite when it comes to mental health ill be the first one to rush people into therapy but the moment somebody tells me to consider getting help im like,"['i', 'am', 'such', 'a', 'hypocrite', 'when', 'it', 'comes', 'to', 'mental', 'health', 'ill', 'be', 'the', 'first', 'one', 'to', 'rush', 'people', 'into', 'therapy', 'but', 'the', 'moment', 'somebody', 'tells', 'me', 'to', 'consider', 'getting', 'help', 'im', 'like']","['hypocrite', 'comes', 'mental', 'health', 'ill', 'first', 'one', 'rush', 'people', 'therapy', 'moment', 'somebody', 'tells', 'consider', 'getting', 'help', 'im', 'like']","['hypocrit', 'come', 'mental', 'health', 'ill', 'first', 'one', 'rush', 'peopl', 'therapi', 'moment', 'somebodi', 'tell', 'consid', 'get', 'help', 'im', 'like']","['hypocrite', 'comes', 'mental', 'health', 'ill', 'first', 'one', 'rush', 'people', 'therapy', 'moment', 'somebody', 'tells', 'consider', 'getting', 'help', 'im', 'like']",1,Czech Republic
2020-07-22 06:26:59+00:00,1285823638340546560,"With almost daily appearance of new epicenters of covid infection all over in Czech Republic, handling of the crises over the last few weeks by the Czech Government and especially by @adamvojtechano, the Minister of Health is starting to look increasingly more incompetent.",ddbogdanovic,"Prague, Czech Republic",2,2,1,0,Prague based. Opera | Theater | Classical Music,606,,with almost daily appearance of new epicenters of covid infection all over in czech republic handling of the crises over the last few weeks by the czech government and especially by the minister of health is starting to look increasingly more incompetent,"['with', 'almost', 'daily', 'appearance', 'of', 'new', 'epicenters', 'of', 'covid', 'infection', 'all', 'over', 'in', 'czech', 'republic', 'handling', 'of', 'the', 'crises', 'over', 'the', 'last', 'few', 'weeks', 'by', 'the', 'czech', 'government', 'and', 'especially', 'by', 'the', 'minister', 'of', 'health', 'is', 'starting', 'to', 'look', 'increasingly', 'more', 'incompetent']","['almost', 'daily', 'appearance', 'new', 'epicenters', 'covid', 'infection', 'czech', 'republic', 'handling', 'crises', 'last', 'weeks', 'czech', 'government', 'especially', 'minister', 'health', 'starting', 'look', 'increasingly', 'incompetent']","['almost', 'daili', 'appear', 'new', 'epicent', 'covid', 'infect', 'czech', 'republ', 'handl', 'crise', 'last', 'week', 'czech', 'govern', 'especi', 'minist', 'health', 'start', 'look', 'increasingli', 'incompet']","['almost', 'daily', 'appearance', 'new', 'epicenters', 'covid', 'infection', 'czech', 'republic', 'handling', 'crises', 'last', 'weeks', 'czech', 'government', 'especially', 'minister', 'health', 'starting', 'look', 'increasingly', 'incompetent']",2,Czech Republic
2020-07-18 15:36:29+00:00,1284512373684998144,Now imagine if you deploy automation using AI tools somewhere like the health sector... https://t.co/tmHh7syGcm,sarapolak_cz,"Prague, Czech Republic",9,0,0,0,Archaeologist in AI 🤖 Decentralisation & cloud civilisations research👩‍💻  Meme fan 🤙 Czech & Oxford gal 🇨🇿 #Forbes30under30,7653,,now imagine if you deploy automation using ai tools somewhere like the health sector,"['now', 'imagine', 'if', 'you', 'deploy', 'automation', 'using', 'ai', 'tools', 'somewhere', 'like', 'the', 'health', 'sector']","['imagine', 'deploy', 'automation', 'using', 'ai', 'tools', 'somewhere', 'like', 'health', 'sector']","['imagin', 'deploy', 'autom', 'use', 'ai', 'tool', 'somewher', 'like', 'health', 'sector']","['imagine', 'deploy', 'automation', 'using', 'ai', 'tools', 'somewhere', 'like', 'health', 'sector']",3,Czech Republic
