Date,Id,Tweet,Username,Location,likeCount,replyCount,retweetCount,quoteCount,userDescription,userFollowers,hashtags,Cleaned_Tweet,Tweet_tokenized,Tweet_removed_stop_word,Tweet_stemmed,Tweet_lemmatized,sentiment,Country
2022-06-03 23:25:35+00:00,1532866115948400641,"Shameka needs help keeping a roof over her babies head and feeding her!

Please help these two avoid homelessness and stay safe and healthy. #mutualaid #mutualaidrequest #BlackLivesMatter https://t.co/sDZQTL7CuE",LilithInJenin,Jenin,18,4,33,1,🇵🇸,1277,"['mutualaid', 'mutualaidrequest', 'BlackLivesMatter']",shameka needs help keeping a roof over her babies head and feeding her please help these two avoid homelessness and stay safe and healthy mutualaid mutualaidrequest blacklivesmatter,"['shameka', 'needs', 'help', 'keeping', 'a', 'roof', 'over', 'her', 'babies', 'head', 'and', 'feeding', 'her', 'please', 'help', 'these', 'two', 'avoid', 'homelessness', 'and', 'stay', 'safe', 'and', 'healthy', 'mutualaid', 'mutualaidrequest', 'blacklivesmatter']","['shameka', 'needs', 'help', 'keeping', 'roof', 'babies', 'head', 'feeding', 'please', 'help', 'two', 'avoid', 'homelessness', 'stay', 'safe', 'healthy', 'mutualaid', 'mutualaidrequest', 'blacklivesmatter']","['shameka', 'need', 'help', 'keep', 'roof', 'babi', 'head', 'feed', 'pleas', 'help', 'two', 'avoid', 'homeless', 'stay', 'safe', 'healthi', 'mutualaid', 'mutualaidrequest', 'blacklivesmatt']","['shameka', 'needs', 'help', 'keeping', 'roof', 'babies', 'head', 'feeding', 'please', 'help', 'two', 'avoid', 'homelessness', 'stay', 'safe', 'healthy', 'mutualaid', 'mutualaidrequest', 'blacklivesmatter']",5,Israel
2022-06-03 17:44:47+00:00,1532780349020839936,"We found this poor puppy in the ground when passing through Dahdouh street. The store owners in the area told u the puppy had been there for two days. We brought him to the vet where he received treatment and he is now safe with us.

🆘️🙏🐕🐈https://t.co/lExgU0d4yb

#Sulala https://t.co/mqwRc82GqV",SulalaSociety,Gaza strip ,14,1,5,0,"Many areas of Palestine are in need of financial support in order to help animals on the streets.“Sulala
https://2/sulala-for-animals-care/",1557,['Sulala'],we found this poor puppy in the ground when passing through dahdouh street the store owners in the area told u the puppy had been there for two days we brought him to the vet where he received treatment and he is now safe with us sulala,"['we', 'found', 'this', 'poor', 'puppy', 'in', 'the', 'ground', 'when', 'passing', 'through', 'dahdouh', 'street', 'the', 'store', 'owners', 'in', 'the', 'area', 'told', 'u', 'the', 'puppy', 'had', 'been', 'there', 'for', 'two', 'days', 'we', 'brought', 'him', 'to', 'the', 'vet', 'where', 'he', 'received', 'treatment', 'and', 'he', 'is', 'now', 'safe', 'with', 'us', 'sulala']","['found', 'poor', 'puppy', 'ground', 'passing', 'dahdouh', 'street', 'store', 'owners', 'area', 'told', 'u', 'puppy', 'two', 'days', 'brought', 'vet', 'received', 'treatment', 'safe', 'us', 'sulala']","['found', 'poor', 'puppi', 'ground', 'pass', 'dahdouh', 'street', 'store', 'owner', 'area', 'told', 'u', 'puppi', 'two', 'day', 'brought', 'vet', 'receiv', 'treatment', 'safe', 'us', 'sulala']","['found', 'poor', 'puppy', 'ground', 'passing', 'dahdouh', 'street', 'store', 'owners', 'area', 'told', 'u', 'puppy', 'two', 'days', 'brought', 'vet', 'received', 'treatment', 'safe', 'us', 'sulala']",1,Israel
2022-06-03 05:20:58+00:00,1532593161565925376,"Acts of Service: When people take initiative to ease some of my responsibilities and burdens, it helps them feel taken care of, safe, and loved in return. #mylovelanguage",addistgeb,Zion,1,0,0,0,At the moment I am dedicated to ending #TigrayGenocide but also standing in solidarity with dissenters worldwide. |✌🏾& ❤💛 | #BLM #IStandWithTigray,2591,['mylovelanguage'],acts of service when people take initiative to ease some of my responsibilities and burdens it helps them feel taken care of safe and loved in return mylovelanguage,"['acts', 'of', 'service', 'when', 'people', 'take', 'initiative', 'to', 'ease', 'some', 'of', 'my', 'responsibilities', 'and', 'burdens', 'it', 'helps', 'them', 'feel', 'taken', 'care', 'of', 'safe', 'and', 'loved', 'in', 'return', 'mylovelanguage']","['acts', 'service', 'people', 'take', 'initiative', 'ease', 'responsibilities', 'burdens', 'helps', 'feel', 'taken', 'care', 'safe', 'loved', 'return', 'mylovelanguage']","['act', 'servic', 'peopl', 'take', 'initi', 'eas', 'respons', 'burden', 'help', 'feel', 'taken', 'care', 'safe', 'love', 'return', 'mylovelanguag']","['acts', 'service', 'people', 'take', 'initiative', 'ease', 'responsibilities', 'burdens', 'helps', 'feel', 'taken', 'care', 'safe', 'loved', 'return', 'mylovelanguage']",5,Israel
2022-05-30 16:57:01+00:00,1531318778457473028,"In the US today, we remember and honor all the brave men and women who served,  making the ultimate sacrifice for our freedom. And to those who serve still, Thank You!

Wishing everyone a safe and happy Memorial Day!

#MemorialDay #veterans #MemorialDay2022 https://t.co/8GJ9QH0wE8",ClassiqTech,"Tel-Aviv, Israel ",1,0,0,0,"Quantum Algorithm Design Software.

Revolutionizing #quantumcomputing with a quick & efficient way to build complex #quantum circuits.",829,"['MemorialDay', 'veterans', 'MemorialDay2022']",in the us today we remember and honor all the brave men and women who served making the ultimate sacrifice for our freedom and to those who serve still thank you wishing everyone a safe and happy memorial day memorialday veterans memorialday2022,"['in', 'the', 'us', 'today', 'we', 'remember', 'and', 'honor', 'all', 'the', 'brave', 'men', 'and', 'women', 'who', 'served', 'making', 'the', 'ultimate', 'sacrifice', 'for', 'our', 'freedom', 'and', 'to', 'those', 'who', 'serve', 'still', 'thank', 'you', 'wishing', 'everyone', 'a', 'safe', 'and', 'happy', 'memorial', 'day', 'memorialday', 'veterans', 'memorialday2022']","['us', 'today', 'remember', 'honor', 'brave', 'men', 'women', 'served', 'making', 'ultimate', 'sacrifice', 'freedom', 'serve', 'still', 'thank', 'wishing', 'everyone', 'safe', 'happy', 'memorial', 'day', 'memorialday', 'veterans', 'memorialday2022']","['us', 'today', 'rememb', 'honor', 'brave', 'men', 'women', 'serv', 'make', 'ultim', 'sacrific', 'freedom', 'serv', 'still', 'thank', 'wish', 'everyon', 'safe', 'happi', 'memori', 'day', 'memorialday', 'veteran', 'memorialday2022']","['us', 'today', 'remember', 'honor', 'brave', 'men', 'women', 'served', 'making', 'ultimate', 'sacrifice', 'freedom', 'serve', 'still', 'thank', 'wishing', 'everyone', 'safe', 'happy', 'memorial', 'day', 'memorialday', 'veterans', 'memorialday2022']",5,Israel
2022-05-23 21:47:30+00:00,1528855165368946688,"🚨💉BREAKING: ""No need for widespread public #vaccination to combat #MonkeyPox, safe sex will help control the outbreak."": WHO officials https://t.co/o23YngQpdz",terror_alarm,Our website in 20 languages:,18,3,10,3,"🇮🇱 ""Not state-affiliated media""  @Terror_Alarm: Counter-Terrorism and Military News from ירושלים - ישראל. #IDF #Breaking #News #NWO. Signal: +972559997626",32542,"['vaccination', 'MonkeyPox']",breaking no need for widespread public vaccination to combat monkeypox safe sex will help control the outbreak who officials,"['breaking', 'no', 'need', 'for', 'widespread', 'public', 'vaccination', 'to', 'combat', 'monkeypox', 'safe', 'sex', 'will', 'help', 'control', 'the', 'outbreak', 'who', 'officials']","['breaking', 'need', 'widespread', 'public', 'vaccination', 'combat', 'monkeypox', 'safe', 'sex', 'help', 'control', 'outbreak', 'officials']","['break', 'need', 'widespread', 'public', 'vaccin', 'combat', 'monkeypox', 'safe', 'sex', 'help', 'control', 'outbreak', 'offici']","['breaking', 'need', 'widespread', 'public', 'vaccination', 'combat', 'monkeypox', 'safe', 'sex', 'help', 'control', 'outbreak', 'officials']",5,Israel
2022-04-19 08:55:40+00:00,1516339738436898819,"@WdwlArtlab @ASTRO_Staff Thank you for being yourself and next to the members loving them and leading them to what makes them successful and being a very important part in their lives and ours. We love you so much. Please stay safe, warm, happy, healthy, soft and kind because you are ASTRO's LEADER",JoumanaKaram13,Lebanon,3,0,1,0,"this acc is about Astro and spreading Love all arround the world bcz Astro are Love, Happiness, Pure Hearts...

youtu.be/DrvDLXjd0YM",20,,thank you for being yourself and next to the members loving them and leading them to what makes them successful and being a very important part in their lives and ours we love you so much please stay safe warm happy healthy soft and kind because you are astros leader,"['thank', 'you', 'for', 'being', 'yourself', 'and', 'next', 'to', 'the', 'members', 'loving', 'them', 'and', 'leading', 'them', 'to', 'what', 'makes', 'them', 'successful', 'and', 'being', 'a', 'very', 'important', 'part', 'in', 'their', 'lives', 'and', 'ours', 'we', 'love', 'you', 'so', 'much', 'please', 'stay', 'safe', 'warm', 'happy', 'healthy', 'soft', 'and', 'kind', 'because', 'you', 'are', 'astros', 'leader']","['thank', 'next', 'members', 'loving', 'leading', 'makes', 'successful', 'important', 'part', 'lives', 'love', 'much', 'please', 'stay', 'safe', 'warm', 'happy', 'healthy', 'soft', 'kind', 'astros', 'leader']","['thank', 'next', 'member', 'love', 'lead', 'make', 'success', 'import', 'part', 'live', 'love', 'much', 'pleas', 'stay', 'safe', 'warm', 'happi', 'healthi', 'soft', 'kind', 'astro', 'leader']","['thank', 'next', 'members', 'loving', 'leading', 'makes', 'successful', 'important', 'part', 'lives', 'love', 'much', 'please', 'stay', 'safe', 'warm', 'happy', 'healthy', 'soft', 'kind', 'astros', 'leader']",5,Israel
2022-03-02 13:29:11+00:00,1499013953040564224,"#Breaking : Meral Akşener, leader of the Turkish opposition İYİ party: “Who can say with certainty that #Turkey is safe in the current state of #Russia? Who can say for sure that in Putin's head, Kars, Erzurum and Ardahan are not the missing parts of Russia? + https://t.co/07lRKIWGXk",yeghig,"Lebanon, Beirut",28,6,3,8,Regional analyst & researcher. PPIA graduate @AUB_lebanon. Associate Fellow @IFI_AUB co @ArmenianWeekly #MiddleEast #Caucasus #Geopolitics #EnergySecurity,4415,"['Breaking', 'Turkey', 'Russia']",breaking meral akener leader of the turkish opposition iyi party who can say with certainty that turkey is safe in the current state of russia who can say for sure that in putins head kars erzurum and ardahan are not the missing parts of russia,"['breaking', 'meral', 'akener', 'leader', 'of', 'the', 'turkish', 'opposition', 'iyi', 'party', 'who', 'can', 'say', 'with', 'certainty', 'that', 'turkey', 'is', 'safe', 'in', 'the', 'current', 'state', 'of', 'russia', 'who', 'can', 'say', 'for', 'sure', 'that', 'in', 'putins', 'head', 'kars', 'erzurum', 'and', 'ardahan', 'are', 'not', 'the', 'missing', 'parts', 'of', 'russia']","['breaking', 'meral', 'akener', 'leader', 'turkish', 'opposition', 'iyi', 'party', 'say', 'certainty', 'turkey', 'safe', 'current', 'state', 'russia', 'say', 'sure', 'putins', 'head', 'kars', 'erzurum', 'ardahan', 'missing', 'parts', 'russia']","['break', 'meral', 'aken', 'leader', 'turkish', 'opposit', 'iyi', 'parti', 'say', 'certainti', 'turkey', 'safe', 'current', 'state', 'russia', 'say', 'sure', 'putin', 'head', 'kar', 'erzurum', 'ardahan', 'miss', 'part', 'russia']","['breaking', 'meral', 'akener', 'leader', 'turkish', 'opposition', 'iyi', 'party', 'say', 'certainty', 'turkey', 'safe', 'current', 'state', 'russia', 'say', 'sure', 'putins', 'head', 'kars', 'erzurum', 'ardahan', 'missing', 'parts', 'russia']",1,Israel
2022-02-21 16:43:26+00:00,1495801349098848268,"@KryssLeelfc Praise be to God anyway, I hope you take care of yourself and be safe, two happy with God's blessing",HassanE51945604,"Egypt, PA",1,0,0,0,اللهم إنك عفو كريم حليم تحب العفو فاعفو عنا ياكريم,1098,,praise be to god anyway i hope you take care of yourself and be safe two happy with gods blessing,"['praise', 'be', 'to', 'god', 'anyway', 'i', 'hope', 'you', 'take', 'care', 'of', 'yourself', 'and', 'be', 'safe', 'two', 'happy', 'with', 'gods', 'blessing']","['praise', 'god', 'anyway', 'hope', 'take', 'care', 'safe', 'two', 'happy', 'gods', 'blessing']","['prais', 'god', 'anyway', 'hope', 'take', 'care', 'safe', 'two', 'happi', 'god', 'bless']","['praise', 'god', 'anyway', 'hope', 'take', 'care', 'safe', 'two', 'happy', 'gods', 'blessing']",5,Israel
2022-01-25 14:37:23+00:00,1485985154103484423,I hope they r discussing energy security and who is going to guarantee the secure flow of gas from Egypt and safe network for electricity from Jordan! And guarantees that Syria will not politicize this energy issue against Lebanon etc etc… https://t.co/54lTem6uLS,LauryHaytayan,Lebanon & virtually everywhere,8,1,0,0,Oil & Gas policy expert with special interest in geopolitics of oil in MENA. Host of Energy Espresso Podcast,10898,,i hope they r discussing energy security and who is going to guarantee the secure flow of gas from egypt and safe network for electricity from jordan and guarantees that syria will not politicize this energy issue against lebanon etc etc,"['i', 'hope', 'they', 'r', 'discussing', 'energy', 'security', 'and', 'who', 'is', 'going', 'to', 'guarantee', 'the', 'secure', 'flow', 'of', 'gas', 'from', 'egypt', 'and', 'safe', 'network', 'for', 'electricity', 'from', 'jordan', 'and', 'guarantees', 'that', 'syria', 'will', 'not', 'politicize', 'this', 'energy', 'issue', 'against', 'lebanon', 'etc', 'etc']","['hope', 'r', 'discussing', 'energy', 'security', 'going', 'guarantee', 'secure', 'flow', 'gas', 'egypt', 'safe', 'network', 'electricity', 'jordan', 'guarantees', 'syria', 'politicize', 'energy', 'issue', 'lebanon', 'etc', 'etc']","['hope', 'r', 'discuss', 'energi', 'secur', 'go', 'guarante', 'secur', 'flow', 'ga', 'egypt', 'safe', 'network', 'electr', 'jordan', 'guarante', 'syria', 'politic', 'energi', 'issu', 'lebanon', 'etc', 'etc']","['hope', 'r', 'discussing', 'energy', 'security', 'going', 'guarantee', 'secure', 'flow', 'gas', 'egypt', 'safe', 'network', 'electricity', 'jordan', 'guarantees', 'syria', 'politicize', 'energy', 'issue', 'lebanon', 'etc', 'etc']",4,Israel
2022-01-21 07:42:24+00:00,1484431168510570496,"@pepitaCurtis @Mygzters_trends Happy birthday 🎂🎉🎈 Pipeta
More blessings birthdays to come  stay good health,stay safe and God bless.",JhemmarieVictor,Lebanon 🇱🇧,2,0,1,0,Chubby,156,,happy birthday pipeta more blessings birthdays to come stay good healthstay safe and god bless,"['happy', 'birthday', 'pipeta', 'more', 'blessings', 'birthdays', 'to', 'come', 'stay', 'good', 'healthstay', 'safe', 'and', 'god', 'bless']","['happy', 'birthday', 'pipeta', 'blessings', 'birthdays', 'come', 'stay', 'good', 'healthstay', 'safe', 'god', 'bless']","['happi', 'birthday', 'pipeta', 'bless', 'birthday', 'come', 'stay', 'good', 'healthstay', 'safe', 'god', 'bless']","['happy', 'birthday', 'pipeta', 'blessings', 'birthdays', 'come', 'stay', 'good', 'healthstay', 'safe', 'god', 'bless']",5,Israel
2021-12-16 11:19:23+00:00,1471439808530731008,@lizBeth_Hineni @csilvi72 @Gianlui91580067 @EvaDuranRamos @zeque66 @olgabeatriztorr @reilluminati @silvance5555 @LenGrunstein @Mieke35735862 @james_anderssen @AlanZionist @Elliott150644 @19Myriam91 @YaelSed1 @cakito2 @DSDloveyou @Smalou1 @xandraax @Ruthtgn69 @Intersymbol Hello dearest Beth sorry for the delay in response thank you for your blessings May God Bless You and Keep you safe healthy and happy 🇮🇱 🇮🇱 🙌.,Wp7xtPXs0EaLPTn,Israel.,2,0,1,0,Humble man.Jerusalem 🇮🇱🇺🇸🇮🇱 -Trump.,3339,,hello dearest beth sorry for the delay in response thank you for your blessings may god bless you and keep you safe healthy and happy,"['hello', 'dearest', 'beth', 'sorry', 'for', 'the', 'delay', 'in', 'response', 'thank', 'you', 'for', 'your', 'blessings', 'may', 'god', 'bless', 'you', 'and', 'keep', 'you', 'safe', 'healthy', 'and', 'happy']","['hello', 'dearest', 'beth', 'sorry', 'delay', 'response', 'thank', 'blessings', 'may', 'god', 'bless', 'keep', 'safe', 'healthy', 'happy']","['hello', 'dearest', 'beth', 'sorri', 'delay', 'respons', 'thank', 'bless', 'may', 'god', 'bless', 'keep', 'safe', 'healthi', 'happi']","['hello', 'dearest', 'beth', 'sorry', 'delay', 'response', 'thank', 'blessings', 'may', 'god', 'bless', 'keep', 'safe', 'healthy', 'happy']",5,Israel
2021-11-25 17:21:07+00:00,1463920697311436807,"This afternoon our youngest, Hillel - just shy of 10yo - received his COVID-19 vaccine. It is safe and effective, and as both a concerned father and a medical professional I encourage you to inoculate your children wherever the vaccine is available. https://t.co/gY2lfym6hB",EpshtainItay,,10,1,0,0,Senior Humanitarian Law and Policy Consultant; Special Advisor @NRC_Norway @NRC_Geneva @AIDAoPt. All views my own.,1720,,this afternoon our youngest hillel just shy of 10yo received his covid19 vaccine it is safe and effective and as both a concerned father and a medical professional i encourage you to inoculate your children wherever the vaccine is available,"['this', 'afternoon', 'our', 'youngest', 'hillel', 'just', 'shy', 'of', '10yo', 'received', 'his', 'covid19', 'vaccine', 'it', 'is', 'safe', 'and', 'effective', 'and', 'as', 'both', 'a', 'concerned', 'father', 'and', 'a', 'medical', 'professional', 'i', 'encourage', 'you', 'to', 'inoculate', 'your', 'children', 'wherever', 'the', 'vaccine', 'is', 'available']","['afternoon', 'youngest', 'hillel', 'shy', '10yo', 'received', 'covid19', 'vaccine', 'safe', 'effective', 'concerned', 'father', 'medical', 'professional', 'encourage', 'inoculate', 'children', 'wherever', 'vaccine', 'available']","['afternoon', 'youngest', 'hillel', 'shi', '10yo', 'receiv', 'covid19', 'vaccin', 'safe', 'effect', 'concern', 'father', 'medic', 'profession', 'encourag', 'inocul', 'children', 'wherev', 'vaccin', 'avail']","['afternoon', 'youngest', 'hillel', 'shy', '10yo', 'received', 'covid19', 'vaccine', 'safe', 'effective', 'concerned', 'father', 'medical', 'professional', 'encourage', 'inoculate', 'children', 'wherever', 'vaccine', 'available']",5,Israel
2021-10-16 10:42:11+00:00,1449324787113811972,"World Anaethesia day October 16, thanks to all the heroines and heroes , when Cardiac surgeons discuss CABG I am always surprised at the lack of mention of who makes difficult cases safe, the Anaethetists, thank you. https://t.co/b0QjQvJzbY",Hragy,egypt,4,0,0,0,"Cardiologist, National Heart Institute, Egypt رجاء عدم التواصل بشأن شؤون طبية خاصة علي تويتر",49140,,world anaethesia day october 16 thanks to all the heroines and heroes when cardiac surgeons discuss cabg i am always surprised at the lack of mention of who makes difficult cases safe the anaethetists thank you,"['world', 'anaethesia', 'day', 'october', '16', 'thanks', 'to', 'all', 'the', 'heroines', 'and', 'heroes', 'when', 'cardiac', 'surgeons', 'discuss', 'cabg', 'i', 'am', 'always', 'surprised', 'at', 'the', 'lack', 'of', 'mention', 'of', 'who', 'makes', 'difficult', 'cases', 'safe', 'the', 'anaethetists', 'thank', 'you']","['world', 'anaethesia', 'day', 'october', '16', 'thanks', 'heroines', 'heroes', 'cardiac', 'surgeons', 'discuss', 'cabg', 'always', 'surprised', 'lack', 'mention', 'makes', 'difficult', 'cases', 'safe', 'anaethetists', 'thank']","['world', 'anaethesia', 'day', 'octob', '16', 'thank', 'heroin', 'hero', 'cardiac', 'surgeon', 'discuss', 'cabg', 'alway', 'surpris', 'lack', 'mention', 'make', 'difficult', 'case', 'safe', 'anaethetist', 'thank']","['world', 'anaethesia', 'day', 'october', '16', 'thanks', 'heroines', 'heroes', 'cardiac', 'surgeons', 'discuss', 'cabg', 'always', 'surprised', 'lack', 'mention', 'makes', 'difficult', 'cases', 'safe', 'anaethetists', 'thank']",5,Israel
2021-05-29 07:11:40+00:00,1398537510918164480,@SirajSd10 Thank You Sai Raj🤗 Take Care and Stay Safe Dear Friend,JosephDagher10,Lebanon  🇱🇧🇱🇧🇱🇧❤️,0,0,0,0,"💜❤️🇱🇧❤️ 
✝️✝️♥️Jesus Christ is my Savior .... 💟Family .... 💚Nature .... 💗Art ....  ❌🚫Block Porno",10249,,thank you sai raj take care and stay safe dear friend,"['thank', 'you', 'sai', 'raj', 'take', 'care', 'and', 'stay', 'safe', 'dear', 'friend']","['thank', 'sai', 'raj', 'take', 'care', 'stay', 'safe', 'dear', 'friend']","['thank', 'sai', 'raj', 'take', 'care', 'stay', 'safe', 'dear', 'friend']","['thank', 'sai', 'raj', 'take', 'care', 'stay', 'safe', 'dear', 'friend']",5,Israel
2021-05-13 22:15:03+00:00,1392966648408285196,"@roadtoserfdumb @jiyuukashi @jonniefletch @IDF Again, Explainme pls the so called “ethnic cleansing” while their numbers grow, their workers work here in israel safe, their citizens get the shots of COVID19 that their government didn’t got bc the $ from Iran went to rockets. If someone wants to wipe someone is hamas 2 jews",Akaitzberg,"Cali, colombia",1,1,0,0,"Médico, Colombosraelí. Fan #1 de los videojuegos. Judío, humano y amante de una buena historia. 🇮🇱🇨🇴",237,,again explainme pls the so called ethnic cleansing while their numbers grow their workers work here in israel safe their citizens get the shots of covid19 that their government didnt got bc the from iran went to rockets if someone wants to wipe someone is hamas 2 jews,"['again', 'explainme', 'pls', 'the', 'so', 'called', 'ethnic', 'cleansing', 'while', 'their', 'numbers', 'grow', 'their', 'workers', 'work', 'here', 'in', 'israel', 'safe', 'their', 'citizens', 'get', 'the', 'shots', 'of', 'covid19', 'that', 'their', 'government', 'didnt', 'got', 'bc', 'the', 'from', 'iran', 'went', 'to', 'rockets', 'if', 'someone', 'wants', 'to', 'wipe', 'someone', 'is', 'hamas', '2', 'jews']","['explainme', 'pls', 'called', 'ethnic', 'cleansing', 'numbers', 'grow', 'workers', 'work', 'israel', 'safe', 'citizens', 'get', 'shots', 'covid19', 'government', 'didnt', 'got', 'bc', 'iran', 'went', 'rockets', 'someone', 'wants', 'wipe', 'someone', 'hamas', '2', 'jews']","['explainm', 'pl', 'call', 'ethnic', 'cleans', 'number', 'grow', 'worker', 'work', 'israel', 'safe', 'citizen', 'get', 'shot', 'covid19', 'govern', 'didnt', 'got', 'bc', 'iran', 'went', 'rocket', 'someon', 'want', 'wipe', 'someon', 'hama', '2', 'jew']","['explainme', 'pls', 'called', 'ethnic', 'cleansing', 'numbers', 'grow', 'workers', 'work', 'israel', 'safe', 'citizens', 'get', 'shots', 'covid19', 'government', 'didnt', 'got', 'bc', 'iran', 'went', 'rockets', 'someone', 'wants', 'wipe', 'someone', 'hamas', '2', 'jews']",1,Israel
2021-05-13 21:49:19+00:00,1392960173103271938,"@CaptainTrips17 @SoundsYeshivish @goodspiritunltd @IDF @IntlCrimCourt Explain a little please the so called “ethnic cleansing” while their numbers grow, their workers work here in israel safe, their citizens get the shots of COVID19 that their government didn’t got bc the $ from Iran went to rockets. If someone wants to wipe someone is hamas 2 jews",Akaitzberg,"Cali, colombia",2,0,0,0,"Médico, Colombosraelí. Fan #1 de los videojuegos. Judío, humano y amante de una buena historia. 🇮🇱🇨🇴",237,,explain a little please the so called ethnic cleansing while their numbers grow their workers work here in israel safe their citizens get the shots of covid19 that their government didnt got bc the from iran went to rockets if someone wants to wipe someone is hamas 2 jews,"['explain', 'a', 'little', 'please', 'the', 'so', 'called', 'ethnic', 'cleansing', 'while', 'their', 'numbers', 'grow', 'their', 'workers', 'work', 'here', 'in', 'israel', 'safe', 'their', 'citizens', 'get', 'the', 'shots', 'of', 'covid19', 'that', 'their', 'government', 'didnt', 'got', 'bc', 'the', 'from', 'iran', 'went', 'to', 'rockets', 'if', 'someone', 'wants', 'to', 'wipe', 'someone', 'is', 'hamas', '2', 'jews']","['explain', 'little', 'please', 'called', 'ethnic', 'cleansing', 'numbers', 'grow', 'workers', 'work', 'israel', 'safe', 'citizens', 'get', 'shots', 'covid19', 'government', 'didnt', 'got', 'bc', 'iran', 'went', 'rockets', 'someone', 'wants', 'wipe', 'someone', 'hamas', '2', 'jews']","['explain', 'littl', 'pleas', 'call', 'ethnic', 'cleans', 'number', 'grow', 'worker', 'work', 'israel', 'safe', 'citizen', 'get', 'shot', 'covid19', 'govern', 'didnt', 'got', 'bc', 'iran', 'went', 'rocket', 'someon', 'want', 'wipe', 'someon', 'hama', '2', 'jew']","['explain', 'little', 'please', 'called', 'ethnic', 'cleansing', 'numbers', 'grow', 'workers', 'work', 'israel', 'safe', 'citizens', 'get', 'shots', 'covid19', 'government', 'didnt', 'got', 'bc', 'iran', 'went', 'rockets', 'someone', 'wants', 'wipe', 'someone', 'hamas', '2', 'jews']",1,Israel
