Date,Id,Tweet,Username,Location,likeCount,replyCount,retweetCount,quoteCount,userDescription,userFollowers,hashtags,Cleaned_Tweet,Tweet_tokenized,Tweet_removed_stop_word,Tweet_stemmed,Tweet_lemmatized,sentiment,Country
2022-06-04 21:26:41+00:00,1533198578797379584,@SLOinCZE @MZZRS @SloveniaInfo Thank you very much for being part of this event 🙏 We appreciate it and looking forward next year 🙂,Praha6,Praha 6,1,0,0,0,Oficiální Twitter MČ Praha 6. #Praha6 #Dejvice #Bubenec #Brevnov #Stresovice #Petriny #Liboc #Ruzyne #Vokovice #Hanspaulka #kulatak,1458,,thank you very much for being part of this event we appreciate it and looking forward next year,"['thank', 'you', 'very', 'much', 'for', 'being', 'part', 'of', 'this', 'event', 'we', 'appreciate', 'it', 'and', 'looking', 'forward', 'next', 'year']","['thank', 'much', 'part', 'event', 'appreciate', 'looking', 'forward', 'next', 'year']","['thank', 'much', 'part', 'event', 'appreci', 'look', 'forward', 'next', 'year']","['thank', 'much', 'part', 'event', 'appreciate', 'looking', 'forward', 'next', 'year']",5,Czech Republic
2022-06-04 12:14:51+00:00,1533059708030177280,"@Dm_me_your_dogs @Dm_me_your_dogs Hello, care to elaborate more on your thoughts? 🙂 We'd appreciate some detailed feedback 🍅",vigorthegame,"Brno, Czech Republic",0,2,0,0,"Outlive the apocalypse, Vigor is a free-to-play looter shooter in post-war Norway. Developed by @bohemiainteract
  
#VigorGame 🍅📻",26596,,hello care to elaborate more on your thoughts wed appreciate some detailed feedback,"['hello', 'care', 'to', 'elaborate', 'more', 'on', 'your', 'thoughts', 'wed', 'appreciate', 'some', 'detailed', 'feedback']","['hello', 'care', 'elaborate', 'thoughts', 'wed', 'appreciate', 'detailed', 'feedback']","['hello', 'care', 'elabor', 'thought', 'wed', 'appreci', 'detail', 'feedback']","['hello', 'care', 'elaborate', 'thoughts', 'wed', 'appreciate', 'detailed', 'feedback']",3,Czech Republic
2022-06-02 08:24:19+00:00,1532276916945838080,"Appreciate @AmarjeetSohiYEG's comments on releasing people from prison when they have nowhere to go. If the system is about rehabilitation, that must include assistance for reintegration into society - finding housing, employment, supports to avoid relapse. #RealTalkRJ",aggieloveseggs,"Brno, Czech Republic",6,1,0,0,Polish-Canadian awkwardly navigating life in the Czech Republic. Irrationally enamoured with Canadian Tire. she/her,2476,['RealTalkRJ'],appreciate comments on releasing people from prison when they have nowhere to go if the system is about rehabilitation that must include assistance for reintegration into society finding housing employment supports to avoid relapse realtalkrj,"['appreciate', 'comments', 'on', 'releasing', 'people', 'from', 'prison', 'when', 'they', 'have', 'nowhere', 'to', 'go', 'if', 'the', 'system', 'is', 'about', 'rehabilitation', 'that', 'must', 'include', 'assistance', 'for', 'reintegration', 'into', 'society', 'finding', 'housing', 'employment', 'supports', 'to', 'avoid', 'relapse', 'realtalkrj']","['appreciate', 'comments', 'releasing', 'people', 'prison', 'nowhere', 'go', 'system', 'rehabilitation', 'must', 'include', 'assistance', 'reintegration', 'society', 'finding', 'housing', 'employment', 'supports', 'avoid', 'relapse', 'realtalkrj']","['appreci', 'comment', 'releas', 'peopl', 'prison', 'nowher', 'go', 'system', 'rehabilit', 'must', 'includ', 'assist', 'reintegr', 'societi', 'find', 'hous', 'employ', 'support', 'avoid', 'relaps', 'realtalkrj']","['appreciate', 'comments', 'releasing', 'people', 'prison', 'nowhere', 'go', 'system', 'rehabilitation', 'must', 'include', 'assistance', 'reintegration', 'society', 'finding', 'housing', 'employment', 'supports', 'avoid', 'relapse', 'realtalkrj']",3,Czech Republic
2022-06-01 13:39:59+00:00,1531993965205020675,"That's a wrap on day 2 of the Advanced Materials and Recyclable Wind Turbine Blade Forum ……..Many thanks to all the attendees who have joined us, we really appreciate your active and attentive participation.

#recyclableblade #recyclablematerials #windturbine #windenergy #wind https://t.co/xgp1lSRvDG",leadvent,Prague,2,0,0,0,Leadvent Group is one of the world's leading #business to business #event management company based in #Europe,293,"['recyclableblade', 'recyclablematerials', 'windturbine', 'windenergy', 'wind']",thats a wrap on day 2 of the advanced materials and recyclable wind turbine blade forum many thanks to all the attendees who have joined us we really appreciate your active and attentive participation recyclableblade recyclablematerials windturbine windenergy wind,"['thats', 'a', 'wrap', 'on', 'day', '2', 'of', 'the', 'advanced', 'materials', 'and', 'recyclable', 'wind', 'turbine', 'blade', 'forum', 'many', 'thanks', 'to', 'all', 'the', 'attendees', 'who', 'have', 'joined', 'us', 'we', 'really', 'appreciate', 'your', 'active', 'and', 'attentive', 'participation', 'recyclableblade', 'recyclablematerials', 'windturbine', 'windenergy', 'wind']","['thats', 'wrap', 'day', '2', 'advanced', 'materials', 'recyclable', 'wind', 'turbine', 'blade', 'forum', 'many', 'thanks', 'attendees', 'joined', 'us', 'really', 'appreciate', 'active', 'attentive', 'participation', 'recyclableblade', 'recyclablematerials', 'windturbine', 'windenergy', 'wind']","['that', 'wrap', 'day', '2', 'advanc', 'materi', 'recycl', 'wind', 'turbin', 'blade', 'forum', 'mani', 'thank', 'attende', 'join', 'us', 'realli', 'appreci', 'activ', 'attent', 'particip', 'recyclableblad', 'recyclablemateri', 'windturbin', 'windenergi', 'wind']","['thats', 'wrap', 'day', '2', 'advanced', 'materials', 'recyclable', 'wind', 'turbine', 'blade', 'forum', 'many', 'thanks', 'attendees', 'joined', 'us', 'really', 'appreciate', 'active', 'attentive', 'participation', 'recyclableblade', 'recyclablematerials', 'windturbine', 'windenergy', 'wind']",5,Czech Republic
2022-05-31 21:27:47+00:00,1531749303776989185,"@PaulMoonPhotos @jlindsayfilm @ziotakes @bernabephoto @Intodaysnight @TS446photo Thank you for the tag Paul. 
Appreciate you. https://t.co/6lpZKU4og6",Vik_Vii7,Prague/Kathmandu,2,0,0,0,"Photographer • Dreamer • Moments from life • Nft's •
$WhaleCurated artist • Exhibiting artist",1818,,thank you for the tag paul appreciate you,"['thank', 'you', 'for', 'the', 'tag', 'paul', 'appreciate', 'you']","['thank', 'tag', 'paul', 'appreciate']","['thank', 'tag', 'paul', 'appreci']","['thank', 'tag', 'paul', 'appreciate']",5,Czech Republic
2022-04-08 14:28:22+00:00,1512437196556587014,This is appreciate post for @NanaVisitor  because i finish listening Gates McFadden Investigates: Who do you think you are? Where Nana share her story and i am blown away how she stay the amazing person that she is after what been through 💗 https://t.co/5Bah1Ah5tN,eli_in_cosplay,Česká republika,3,0,0,0,"Stargate Fan Trekkie 
part of the Trek tok crew on TikTok 
23 years old",158,,this is appreciate post for because i finish listening gates mcfadden investigates who do you think you are where nana share her story and i am blown away how she stay the amazing person that she is after what been through,"['this', 'is', 'appreciate', 'post', 'for', 'because', 'i', 'finish', 'listening', 'gates', 'mcfadden', 'investigates', 'who', 'do', 'you', 'think', 'you', 'are', 'where', 'nana', 'share', 'her', 'story', 'and', 'i', 'am', 'blown', 'away', 'how', 'she', 'stay', 'the', 'amazing', 'person', 'that', 'she', 'is', 'after', 'what', 'been', 'through']","['appreciate', 'post', 'finish', 'listening', 'gates', 'mcfadden', 'investigates', 'think', 'nana', 'share', 'story', 'blown', 'away', 'stay', 'amazing', 'person']","['appreci', 'post', 'finish', 'listen', 'gate', 'mcfadden', 'investig', 'think', 'nana', 'share', 'stori', 'blown', 'away', 'stay', 'amaz', 'person']","['appreciate', 'post', 'finish', 'listening', 'gates', 'mcfadden', 'investigates', 'think', 'nana', 'share', 'story', 'blown', 'away', 'stay', 'amazing', 'person']",4,Czech Republic
2022-02-11 08:05:44+00:00,1492047183616557093,@BlessCreatics Really appreciate the feedback 🙏 I'm targeting passionate expat business owners who want to stand out in a global market,_anna_kyriacou_,"Malaga, Spain",0,0,0,0,"Multinational Freelance Creator 🇿🇦🇬🇷🇨🇾🌍 Designer by profession 🎨 Artist at heart💚
Life is an adventure_dance_love_laugh_create👾
View my work below ⬇️",215,,really appreciate the feedback im targeting passionate expat business owners who want to stand out in a global market,"['really', 'appreciate', 'the', 'feedback', 'im', 'targeting', 'passionate', 'expat', 'business', 'owners', 'who', 'want', 'to', 'stand', 'out', 'in', 'a', 'global', 'market']","['really', 'appreciate', 'feedback', 'im', 'targeting', 'passionate', 'expat', 'business', 'owners', 'want', 'stand', 'global', 'market']","['realli', 'appreci', 'feedback', 'im', 'target', 'passion', 'expat', 'busi', 'owner', 'want', 'stand', 'global', 'market']","['really', 'appreciate', 'feedback', 'im', 'targeting', 'passionate', 'expat', 'business', 'owners', 'want', 'stand', 'global', 'market']",5,Czech Republic
2021-06-16 06:58:29+00:00,1405057172417941504,"‘Hold on to the now, the here’ #JamesJoyce this 2nd #Bloomsday we  appreciate each &amp; every front line worker fr making it possible for us to live safely again #COVID19 @NBurgessDFAT @JCGalway @eugenedownes @dfatirl @NLIreland @Buckledcranium @IrlEmbPrague https://t.co/K7eerYAeX9",CManahanIRL,Czech Republic,3,0,0,1,"Ambassador #CzechRepublic fmr Amb to #Denmark & #Iceland #foreign policy, #energy #green growth, #business #culture #creative #digital industries",2093,"['JamesJoyce', 'Bloomsday', 'COVID19']",hold on to the now the here jamesjoyce this 2nd bloomsday we appreciate each amp every front line worker fr making it possible for us to live safely again covid19,"['hold', 'on', 'to', 'the', 'now', 'the', 'here', 'jamesjoyce', 'this', '2nd', 'bloomsday', 'we', 'appreciate', 'each', 'amp', 'every', 'front', 'line', 'worker', 'fr', 'making', 'it', 'possible', 'for', 'us', 'to', 'live', 'safely', 'again', 'covid19']","['hold', 'jamesjoyce', '2nd', 'bloomsday', 'appreciate', 'amp', 'every', 'front', 'line', 'worker', 'fr', 'making', 'possible', 'us', 'live', 'safely', 'covid19']","['hold', 'jamesjoyc', '2nd', 'bloomsday', 'appreci', 'amp', 'everi', 'front', 'line', 'worker', 'fr', 'make', 'possibl', 'us', 'live', 'safe', 'covid19']","['hold', 'jamesjoyce', '2nd', 'bloomsday', 'appreciate', 'amp', 'every', 'front', 'line', 'worker', 'fr', 'making', 'possible', 'us', 'live', 'safely', 'covid19']",5,Czech Republic
2020-12-10 19:22:59+00:00,1337115613525905411,"I made a short dance film this semester whilst doing my MA at @TrinityLaban and it’s been one hell of a ride! I would appreciate any feedback or comments! Starring my beautiful friend Kristyna Kocianova❤️ give it a watch! #screendance #dance #shortfilm 
https://t.co/MgPd2AJgL9",iamcoolandtall,"London, England",2,2,0,0,🇨🇿🇬🇧 | she/her | Performer | Creator |     represented by @NGPersonalmng | Photographer @PavlinaPictures,422,"['screendance', 'dance', 'shortfilm']",i made a short dance film this semester whilst doing my ma at and its been one hell of a ride i would appreciate any feedback or comments starring my beautiful friend kristyna kocianova give it a watch screendance dance shortfilm,"['i', 'made', 'a', 'short', 'dance', 'film', 'this', 'semester', 'whilst', 'doing', 'my', 'ma', 'at', 'and', 'its', 'been', 'one', 'hell', 'of', 'a', 'ride', 'i', 'would', 'appreciate', 'any', 'feedback', 'or', 'comments', 'starring', 'my', 'beautiful', 'friend', 'kristyna', 'kocianova', 'give', 'it', 'a', 'watch', 'screendance', 'dance', 'shortfilm']","['made', 'short', 'dance', 'film', 'semester', 'whilst', 'one', 'hell', 'ride', 'would', 'appreciate', 'feedback', 'comments', 'starring', 'beautiful', 'friend', 'kristyna', 'kocianova', 'give', 'watch', 'screendance', 'dance', 'shortfilm']","['made', 'short', 'danc', 'film', 'semest', 'whilst', 'one', 'hell', 'ride', 'would', 'appreci', 'feedback', 'comment', 'star', 'beauti', 'friend', 'kristyna', 'kocianova', 'give', 'watch', 'screendanc', 'danc', 'shortfilm']","['made', 'short', 'dance', 'film', 'semester', 'whilst', 'one', 'hell', 'ride', 'would', 'appreciate', 'feedback', 'comments', 'starring', 'beautiful', 'friend', 'kristyna', 'kocianova', 'give', 'watch', 'screendance', 'dance', 'shortfilm']",4,Czech Republic
2020-07-10 23:27:34+00:00,1281731821491847168,"4 years on this Twitter account. Although my time here dates a little longer, I appreciate the people I found here and care I was given. 
#MojeVýročíNaTwitteru #MyTwitterAnniversary https://t.co/8gG0uIwGlL",General_Macek,"Praha, Česká republika",0,0,0,0,"A czech man who does not approve anything that is coming from the left. A czech patriot, Sabaton fan and lover of history. #PreserveHistory",249,"['MojeVýročíNaTwitteru', 'MyTwitterAnniversary']",4 years on this twitter account although my time here dates a little longer i appreciate the people i found here and care i was given mojevronatwitteru mytwitteranniversary,"['4', 'years', 'on', 'this', 'twitter', 'account', 'although', 'my', 'time', 'here', 'dates', 'a', 'little', 'longer', 'i', 'appreciate', 'the', 'people', 'i', 'found', 'here', 'and', 'care', 'i', 'was', 'given', 'mojevronatwitteru', 'mytwitteranniversary']","['4', 'years', 'twitter', 'account', 'although', 'time', 'dates', 'little', 'longer', 'appreciate', 'people', 'found', 'care', 'given', 'mojevronatwitteru', 'mytwitteranniversary']","['4', 'year', 'twitter', 'account', 'although', 'time', 'date', 'littl', 'longer', 'appreci', 'peopl', 'found', 'care', 'given', 'mojevronatwitteru', 'mytwitteranniversari']","['4', 'years', 'twitter', 'account', 'although', 'time', 'dates', 'little', 'longer', 'appreciate', 'people', 'found', 'care', 'given', 'mojevronatwitteru', 'mytwitteranniversary']",4,Czech Republic
2019-12-24 18:21:31+00:00,1209539618590351360,"@devonzuegel I think I stopped reading paper books about a decade ago... Still, I appreciate well designed instances of those.",webknjaz,"Brno, Czech Republic",0,0,0,0,"@RedHat @ansible-core Engineer.

🐍 #Python enthusiast.
Inspired by open source.
🍒🥧 @CherryPy maintainer.
💘💍 @bluebirrrrd.
🗣️ 🇺🇦🇺🇸
🙏 #StandWithUkraine",1794,,i think i stopped reading paper books about a decade ago still i appreciate well designed instances of those,"['i', 'think', 'i', 'stopped', 'reading', 'paper', 'books', 'about', 'a', 'decade', 'ago', 'still', 'i', 'appreciate', 'well', 'designed', 'instances', 'of', 'those']","['think', 'stopped', 'reading', 'paper', 'books', 'decade', 'ago', 'still', 'appreciate', 'well', 'designed', 'instances']","['think', 'stop', 'read', 'paper', 'book', 'decad', 'ago', 'still', 'appreci', 'well', 'design', 'instanc']","['think', 'stopped', 'reading', 'paper', 'books', 'decade', 'ago', 'still', 'appreciate', 'well', 'designed', 'instances']",4,Czech Republic
2019-12-18 19:44:30+00:00,1207386172101668866,"Thanks @TMakrides for being a great ambassador for @BC_EHS &amp; Paramedicine as a profession. 

Mate, you are also a great Australian 🇦🇺 and we appreciate your insights! 

#bcehsCPP https://t.co/AR797ByDpU",AckerJoe,Australia,15,0,1,0,Paramedic | Chief Executive @AmbulanceTas I Adjunct Senior Lecturer @CharlesSturtUni I Adjunct Professor @UBC I Views are my own,2913,['bcehsCPP'],thanks for being a great ambassador for amp paramedicine as a profession mate you are also a great australian and we appreciate your insights bcehscpp,"['thanks', 'for', 'being', 'a', 'great', 'ambassador', 'for', 'amp', 'paramedicine', 'as', 'a', 'profession', 'mate', 'you', 'are', 'also', 'a', 'great', 'australian', 'and', 'we', 'appreciate', 'your', 'insights', 'bcehscpp']","['thanks', 'great', 'ambassador', 'amp', 'paramedicine', 'profession', 'mate', 'also', 'great', 'australian', 'appreciate', 'insights', 'bcehscpp']","['thank', 'great', 'ambassador', 'amp', 'paramedicin', 'profess', 'mate', 'also', 'great', 'australian', 'appreci', 'insight', 'bcehscpp']","['thanks', 'great', 'ambassador', 'amp', 'paramedicine', 'profession', 'mate', 'also', 'great', 'australian', 'appreciate', 'insights', 'bcehscpp']",5,Czech Republic
2020-06-26 12:34:16+00:00,1276493985549373440,"I’m told the sirens and loud voices being projected throughout Prague today do *not* mean the city is being bombed. Instead Prague is paying tribute to Milada Horáková, a Czech feminist and anti-fascist who was murdered in 1950 by the communist regime after a show trial. https://t.co/2iQBDa91rg",BenoitDLewis,"Prague, Czech Republic",5,0,1,1,Human. Husband. Half-🇫🇷 Person. Writer: @NYTmag. Fellow: @NewAmerica. Professor: @EmersonCollege. Fan: @NU_Sports,5061,,im told the sirens and loud voices being projected throughout prague today do not mean the city is being bombed instead prague is paying tribute to milada horkov a czech feminist and antifascist who was murdered in 1950 by the communist regime after a show trial,"['im', 'told', 'the', 'sirens', 'and', 'loud', 'voices', 'being', 'projected', 'throughout', 'prague', 'today', 'do', 'not', 'mean', 'the', 'city', 'is', 'being', 'bombed', 'instead', 'prague', 'is', 'paying', 'tribute', 'to', 'milada', 'horkov', 'a', 'czech', 'feminist', 'and', 'antifascist', 'who', 'was', 'murdered', 'in', '1950', 'by', 'the', 'communist', 'regime', 'after', 'a', 'show', 'trial']","['im', 'told', 'sirens', 'loud', 'voices', 'projected', 'throughout', 'prague', 'today', 'mean', 'city', 'bombed', 'instead', 'prague', 'paying', 'tribute', 'milada', 'horkov', 'czech', 'feminist', 'antifascist', 'murdered', '1950', 'communist', 'regime', 'show', 'trial']","['im', 'told', 'siren', 'loud', 'voic', 'project', 'throughout', 'pragu', 'today', 'mean', 'citi', 'bomb', 'instead', 'pragu', 'pay', 'tribut', 'milada', 'horkov', 'czech', 'feminist', 'antifascist', 'murder', '1950', 'communist', 'regim', 'show', 'trial']","['im', 'told', 'sirens', 'loud', 'voices', 'projected', 'throughout', 'prague', 'today', 'mean', 'city', 'bombed', 'instead', 'prague', 'paying', 'tribute', 'milada', 'horkov', 'czech', 'feminist', 'antifascist', 'murdered', '1950', 'communist', 'regime', 'show', 'trial']",1,Czech Republic
2020-01-22 20:49:11+00:00,1220086025063714816,"@mrTeigen @showipintbri Tony is a tribute to perseverance, a tireless positive soul with dreams only surpassed by his kindness and enthusiasm. I cannot be prouder of him. I'll make sure his ribs are treated with care 😁",davidsamuelps,Potatoland - Czech Republic,4,0,0,0,"#CCDEWannabe #CiscoVIP #CiscoChampion Tireless, persistent, stubborn, sarcastic. Geek, networker, sick learner, ardent teacher, hug machine. Gross but effective",5720,,tony is a tribute to perseverance a tireless positive soul with dreams only surpassed by his kindness and enthusiasm i cannot be prouder of him ill make sure his ribs are treated with care,"['tony', 'is', 'a', 'tribute', 'to', 'perseverance', 'a', 'tireless', 'positive', 'soul', 'with', 'dreams', 'only', 'surpassed', 'by', 'his', 'kindness', 'and', 'enthusiasm', 'i', 'cannot', 'be', 'prouder', 'of', 'him', 'ill', 'make', 'sure', 'his', 'ribs', 'are', 'treated', 'with', 'care']","['tony', 'tribute', 'perseverance', 'tireless', 'positive', 'soul', 'dreams', 'surpassed', 'kindness', 'enthusiasm', 'cannot', 'prouder', 'ill', 'make', 'sure', 'ribs', 'treated', 'care']","['toni', 'tribut', 'persever', 'tireless', 'posit', 'soul', 'dream', 'surpass', 'kind', 'enthusiasm', 'cannot', 'prouder', 'ill', 'make', 'sure', 'rib', 'treat', 'care']","['tony', 'tribute', 'perseverance', 'tireless', 'positive', 'soul', 'dreams', 'surpassed', 'kindness', 'enthusiasm', 'cannot', 'prouder', 'ill', 'make', 'sure', 'ribs', 'treated', 'care']",3,Czech Republic
2019-12-06 13:28:34+00:00,1202942911693959168,"#gearofwar tribute made in #procreateapp ..it was fun drawing this one! I changed a little bit my custom brushes, do you look that? Do you like this game? ...some news coming! Stay Tuned guys!!! @ Libcice Nad… https://t.co/t2GpixovOw",marcoturini,Praga,0,0,0,0,Artist #MarvelComics | DC #comics | Star comics and many more | PULP FACTORY AWARD (Best Cover #Artist) | @QuantumEraNFT creator,1488,"['gearofwar', 'procreateapp']",gearofwar tribute made in procreateapp it was fun drawing this one i changed a little bit my custom brushes do you look that do you like this game some news coming stay tuned guys libcice nad,"['gearofwar', 'tribute', 'made', 'in', 'procreateapp', 'it', 'was', 'fun', 'drawing', 'this', 'one', 'i', 'changed', 'a', 'little', 'bit', 'my', 'custom', 'brushes', 'do', 'you', 'look', 'that', 'do', 'you', 'like', 'this', 'game', 'some', 'news', 'coming', 'stay', 'tuned', 'guys', 'libcice', 'nad']","['gearofwar', 'tribute', 'made', 'procreateapp', 'fun', 'drawing', 'one', 'changed', 'little', 'bit', 'custom', 'brushes', 'look', 'like', 'game', 'news', 'coming', 'stay', 'tuned', 'guys', 'libcice', 'nad']","['gearofwar', 'tribut', 'made', 'procreateapp', 'fun', 'draw', 'one', 'chang', 'littl', 'bit', 'custom', 'brush', 'look', 'like', 'game', 'news', 'come', 'stay', 'tune', 'guy', 'libcic', 'nad']","['gearofwar', 'tribute', 'made', 'procreateapp', 'fun', 'drawing', 'one', 'changed', 'little', 'bit', 'custom', 'brushes', 'look', 'like', 'game', 'news', 'coming', 'stay', 'tuned', 'guys', 'libcice', 'nad']",4,Czech Republic
2022-06-02 11:11:16+00:00,1532318928684425217,"@adamdavidson Misogyny and a great PR campaign has won, I haven't seen a single article on Depp not being portrayed as a poor little thing hurt by an ugly vicious witch. Someone had to pay for youtube showing me nothing else but Heard being wrong despite me actively trying to avoid this trial.",AnnStage,Prague,4,0,0,0,still figuring out if I need a twitter acc,62,,misogyny and a great pr campaign has won i havent seen a single article on depp not being portrayed as a poor little thing hurt by an ugly vicious witch someone had to pay for youtube showing me nothing else but heard being wrong despite me actively trying to avoid this trial,"['misogyny', 'and', 'a', 'great', 'pr', 'campaign', 'has', 'won', 'i', 'havent', 'seen', 'a', 'single', 'article', 'on', 'depp', 'not', 'being', 'portrayed', 'as', 'a', 'poor', 'little', 'thing', 'hurt', 'by', 'an', 'ugly', 'vicious', 'witch', 'someone', 'had', 'to', 'pay', 'for', 'youtube', 'showing', 'me', 'nothing', 'else', 'but', 'heard', 'being', 'wrong', 'despite', 'me', 'actively', 'trying', 'to', 'avoid', 'this', 'trial']","['misogyny', 'great', 'pr', 'campaign', 'havent', 'seen', 'single', 'article', 'depp', 'portrayed', 'poor', 'little', 'thing', 'hurt', 'ugly', 'vicious', 'witch', 'someone', 'pay', 'youtube', 'showing', 'nothing', 'else', 'heard', 'wrong', 'despite', 'actively', 'trying', 'avoid', 'trial']","['misogyni', 'great', 'pr', 'campaign', 'havent', 'seen', 'singl', 'articl', 'depp', 'portray', 'poor', 'littl', 'thing', 'hurt', 'ugli', 'viciou', 'witch', 'someon', 'pay', 'youtub', 'show', 'noth', 'els', 'heard', 'wrong', 'despit', 'activ', 'tri', 'avoid', 'trial']","['misogyny', 'great', 'pr', 'campaign', 'havent', 'seen', 'single', 'article', 'depp', 'portrayed', 'poor', 'little', 'thing', 'hurt', 'ugly', 'vicious', 'witch', 'someone', 'pay', 'youtube', 'showing', 'nothing', 'else', 'heard', 'wrong', 'despite', 'actively', 'trying', 'avoid', 'trial']",1,Czech Republic
2022-06-02 16:16:52+00:00,1532395836897906689,"“In a post-COVID world, all people want is to feel heard. When hiring, companies and organizations can stand out by using Vette’s instant human engagement product to bring back the human-to-human touch at scale. https://t.co/n9DZg0wzoA",theoakslab,Prague,3,1,0,0,A startup technology partner that empowers innovators to improve life and the world. Founders partner with us to build their products and scale their teams.,2071,,in a postcovid world all people want is to feel heard when hiring companies and organizations can stand out by using vettes instant human engagement product to bring back the humantohuman touch at scale,"['in', 'a', 'postcovid', 'world', 'all', 'people', 'want', 'is', 'to', 'feel', 'heard', 'when', 'hiring', 'companies', 'and', 'organizations', 'can', 'stand', 'out', 'by', 'using', 'vettes', 'instant', 'human', 'engagement', 'product', 'to', 'bring', 'back', 'the', 'humantohuman', 'touch', 'at', 'scale']","['postcovid', 'world', 'people', 'want', 'feel', 'heard', 'hiring', 'companies', 'organizations', 'stand', 'using', 'vettes', 'instant', 'human', 'engagement', 'product', 'bring', 'back', 'humantohuman', 'touch', 'scale']","['postcovid', 'world', 'peopl', 'want', 'feel', 'heard', 'hire', 'compani', 'organ', 'stand', 'use', 'vett', 'instant', 'human', 'engag', 'product', 'bring', 'back', 'humantohuman', 'touch', 'scale']","['postcovid', 'world', 'people', 'want', 'feel', 'heard', 'hiring', 'companies', 'organizations', 'stand', 'using', 'vettes', 'instant', 'human', 'engagement', 'product', 'bring', 'back', 'humantohuman', 'touch', 'scale']",5,Czech Republic
2022-03-27 12:43:20+00:00,1508062110978293762,"@Alphalogical__ @videotech_ @RockstarGames I don't care about single player games. 

New content during covid, casino and Cayo.",OH_Man_Blue,Praha ,0,1,0,1,"Czechiscouser, Evertonian, Dyslexic AF, sorry if I make no sense..
#GTAO aficionado in my 40s.
Pro Human",395,,i dont care about single player games new content during covid casino and cayo,"['i', 'dont', 'care', 'about', 'single', 'player', 'games', 'new', 'content', 'during', 'covid', 'casino', 'and', 'cayo']","['dont', 'care', 'single', 'player', 'games', 'new', 'content', 'covid', 'casino', 'cayo']","['dont', 'care', 'singl', 'player', 'game', 'new', 'content', 'covid', 'casino', 'cayo']","['dont', 'care', 'single', 'player', 'games', 'new', 'content', 'covid', 'casino', 'cayo']",3,Czech Republic
