Date,Id,Tweet,Username,Location,likeCount,replyCount,retweetCount,quoteCount,userDescription,userFollowers,hashtags,Cleaned_Tweet,Tweet_tokenized,Tweet_removed_stop_word,Tweet_stemmed,Tweet_lemmatized,sentiment,Country
2022-06-04 10:06:43+00:00,1533027460597653505,"@MrsHichilema Shabbat Shalom first lady and Mr President HH. Yahweh grant you divine health and long good life
You are a precious gift to mum Mutinta, the whole family, our nation Zambia,Africa and the nations. The lord grant you success as you lead us. And so shall it be!",TherabbiHaggai,"Lusaka, Zambia",2,0,0,0,"Living for a purpose, fulfilling a divine assignment. Loving Yahweh and loving people. Yahweh's mission is my mission.",11,,shabbat shalom first lady and mr president hh yahweh grant you divine health and long good life you are a precious gift to mum mutinta the whole family our nation zambiaafrica and the nations the lord grant you success as you lead us and so shall it be,"['shabbat', 'shalom', 'first', 'lady', 'and', 'mr', 'president', 'hh', 'yahweh', 'grant', 'you', 'divine', 'health', 'and', 'long', 'good', 'life', 'you', 'are', 'a', 'precious', 'gift', 'to', 'mum', 'mutinta', 'the', 'whole', 'family', 'our', 'nation', 'zambiaafrica', 'and', 'the', 'nations', 'the', 'lord', 'grant', 'you', 'success', 'as', 'you', 'lead', 'us', 'and', 'so', 'shall', 'it', 'be']","['shabbat', 'shalom', 'first', 'lady', 'mr', 'president', 'hh', 'yahweh', 'grant', 'divine', 'health', 'long', 'good', 'life', 'precious', 'gift', 'mum', 'mutinta', 'whole', 'family', 'nation', 'zambiaafrica', 'nations', 'lord', 'grant', 'success', 'lead', 'us', 'shall']","['shabbat', 'shalom', 'first', 'ladi', 'mr', 'presid', 'hh', 'yahweh', 'grant', 'divin', 'health', 'long', 'good', 'life', 'preciou', 'gift', 'mum', 'mutinta', 'whole', 'famili', 'nation', 'zambiaafrica', 'nation', 'lord', 'grant', 'success', 'lead', 'us', 'shall']","['shabbat', 'shalom', 'first', 'lady', 'mr', 'president', 'hh', 'yahweh', 'grant', 'divine', 'health', 'long', 'good', 'life', 'precious', 'gift', 'mum', 'mutinta', 'whole', 'family', 'nation', 'zambiaafrica', 'nations', 'lord', 'grant', 'success', 'lead', 'us', 'shall']",5,Zambia
2022-06-02 07:56:50+00:00,1532269998336528384,"I have never had a cool &amp; understandng boss like this man! 

May God continue keeping him in good health &amp; always meet his needs🙏🏽.
Few are like him, always tells me to push harder, discover new opportunities, do what is right he supports me like I'm his young bro. Leave granted!",uncle_moze,Zambia,4,0,0,0,An Administrator | AChelsea Fan | Family | Work | A lil of Mosi | Money |,9564,,i have never had a cool amp understandng boss like this man may god continue keeping him in good health amp always meet his needs few are like him always tells me to push harder discover new opportunities do what is right he supports me like im his young bro leave granted,"['i', 'have', 'never', 'had', 'a', 'cool', 'amp', 'understandng', 'boss', 'like', 'this', 'man', 'may', 'god', 'continue', 'keeping', 'him', 'in', 'good', 'health', 'amp', 'always', 'meet', 'his', 'needs', 'few', 'are', 'like', 'him', 'always', 'tells', 'me', 'to', 'push', 'harder', 'discover', 'new', 'opportunities', 'do', 'what', 'is', 'right', 'he', 'supports', 'me', 'like', 'im', 'his', 'young', 'bro', 'leave', 'granted']","['never', 'cool', 'amp', 'understandng', 'boss', 'like', 'man', 'may', 'god', 'continue', 'keeping', 'good', 'health', 'amp', 'always', 'meet', 'needs', 'like', 'always', 'tells', 'push', 'harder', 'discover', 'new', 'opportunities', 'right', 'supports', 'like', 'im', 'young', 'bro', 'leave', 'granted']","['never', 'cool', 'amp', 'understandng', 'boss', 'like', 'man', 'may', 'god', 'continu', 'keep', 'good', 'health', 'amp', 'alway', 'meet', 'need', 'like', 'alway', 'tell', 'push', 'harder', 'discov', 'new', 'opportun', 'right', 'support', 'like', 'im', 'young', 'bro', 'leav', 'grant']","['never', 'cool', 'amp', 'understandng', 'boss', 'like', 'man', 'may', 'god', 'continue', 'keeping', 'good', 'health', 'amp', 'always', 'meet', 'needs', 'like', 'always', 'tells', 'push', 'harder', 'discover', 'new', 'opportunities', 'right', 'supports', 'like', 'im', 'young', 'bro', 'leave', 'granted']",5,Zambia
2022-05-29 15:04:00+00:00,1530927945891684353,"A day with the Youth of Samaritan Trust was a success we had a great time raising mental health awareness, health talks,play and giving out donations. Thank you all who gave towards the cause.
#MentalHealthAwarenessMonth #youths #YANA #TOCK https://t.co/eRkcOx6QwB",karenbisalomu,,5,0,2,0,"A non-profit mental health youth organization in Malawi, that raises awareness on mental health, depression,suicide and stigma in the youth.",173,"['MentalHealthAwarenessMonth', 'youths', 'YANA', 'TOCK']",a day with the youth of samaritan trust was a success we had a great time raising mental health awareness health talksplay and giving out donations thank you all who gave towards the cause mentalhealthawarenessmonth youths yana tock,"['a', 'day', 'with', 'the', 'youth', 'of', 'samaritan', 'trust', 'was', 'a', 'success', 'we', 'had', 'a', 'great', 'time', 'raising', 'mental', 'health', 'awareness', 'health', 'talksplay', 'and', 'giving', 'out', 'donations', 'thank', 'you', 'all', 'who', 'gave', 'towards', 'the', 'cause', 'mentalhealthawarenessmonth', 'youths', 'yana', 'tock']","['day', 'youth', 'samaritan', 'trust', 'success', 'great', 'time', 'raising', 'mental', 'health', 'awareness', 'health', 'talksplay', 'giving', 'donations', 'thank', 'gave', 'towards', 'cause', 'mentalhealthawarenessmonth', 'youths', 'yana', 'tock']","['day', 'youth', 'samaritan', 'trust', 'success', 'great', 'time', 'rais', 'mental', 'health', 'awar', 'health', 'talksplay', 'give', 'donat', 'thank', 'gave', 'toward', 'caus', 'mentalhealthawarenessmonth', 'youth', 'yana', 'tock']","['day', 'youth', 'samaritan', 'trust', 'success', 'great', 'time', 'raising', 'mental', 'health', 'awareness', 'health', 'talksplay', 'giving', 'donations', 'thank', 'gave', 'towards', 'cause', 'mentalhealthawarenessmonth', 'youths', 'yana', 'tock']",5,Zambia
2022-05-26 16:49:22+00:00,1529867297963245568,"On Menstrual health day me, @RKazingatchire and some colleagues have volunteered with the Osadandaula workshop to each girls how to sew reusable sanitary pads. Your donations will be higly appreciated🤗. https://t.co/W1H3ngCoAN",JayneDammah,Above,3,1,5,0,Maverick City Music Fanatic💜🌻,528,,on menstrual health day me and some colleagues have volunteered with the osadandaula workshop to each girls how to sew reusable sanitary pads your donations will be higly appreciated,"['on', 'menstrual', 'health', 'day', 'me', 'and', 'some', 'colleagues', 'have', 'volunteered', 'with', 'the', 'osadandaula', 'workshop', 'to', 'each', 'girls', 'how', 'to', 'sew', 'reusable', 'sanitary', 'pads', 'your', 'donations', 'will', 'be', 'higly', 'appreciated']","['menstrual', 'health', 'day', 'colleagues', 'volunteered', 'osadandaula', 'workshop', 'girls', 'sew', 'reusable', 'sanitary', 'pads', 'donations', 'higly', 'appreciated']","['menstrual', 'health', 'day', 'colleagu', 'volunt', 'osadandaula', 'workshop', 'girl', 'sew', 'reusabl', 'sanitari', 'pad', 'donat', 'higli', 'appreci']","['menstrual', 'health', 'day', 'colleagues', 'volunteered', 'osadandaula', 'workshop', 'girls', 'sew', 'reusable', 'sanitary', 'pads', 'donations', 'higly', 'appreciated']",4,Zambia
2022-05-25 17:35:52+00:00,1529516614240149504,"Children struggle to access quality health care and nutrition. And many lack access to quality education. With more than 65% of childrens in the second grade being unable to read due lack of food
Donate to feed the hungry CHILDREN'S ORPHANS.💚🇿🇲

https://t.co/UeIZKXQi1t #Charity",MOSESCharityOr1,"Lusaka, Zambia🇿🇲",1,0,1,0,restoring hope in the communities,747,['Charity'],children struggle to access quality health care and nutrition and many lack access to quality education with more than 65 of childrens in the second grade being unable to read due lack of food donate to feed the hungry childrens orphans charity,"['children', 'struggle', 'to', 'access', 'quality', 'health', 'care', 'and', 'nutrition', 'and', 'many', 'lack', 'access', 'to', 'quality', 'education', 'with', 'more', 'than', '65', 'of', 'childrens', 'in', 'the', 'second', 'grade', 'being', 'unable', 'to', 'read', 'due', 'lack', 'of', 'food', 'donate', 'to', 'feed', 'the', 'hungry', 'childrens', 'orphans', 'charity']","['children', 'struggle', 'access', 'quality', 'health', 'care', 'nutrition', 'many', 'lack', 'access', 'quality', 'education', '65', 'childrens', 'second', 'grade', 'unable', 'read', 'due', 'lack', 'food', 'donate', 'feed', 'hungry', 'childrens', 'orphans', 'charity']","['children', 'struggl', 'access', 'qualiti', 'health', 'care', 'nutrit', 'mani', 'lack', 'access', 'qualiti', 'educ', '65', 'children', 'second', 'grade', 'unabl', 'read', 'due', 'lack', 'food', 'donat', 'feed', 'hungri', 'children', 'orphan', 'chariti']","['children', 'struggle', 'access', 'quality', 'health', 'care', 'nutrition', 'many', 'lack', 'access', 'quality', 'education', '65', 'childrens', 'second', 'grade', 'unable', 'read', 'due', 'lack', 'food', 'donate', 'feed', 'hungry', 'childrens', 'orphans', 'charity']",2,Zambia
2022-05-23 08:03:38+00:00,1528647829496991744,"We had a great time at mpemba with the kids, together with Touch and Care for kids we gave donations,mental and other health talks like sanitation and reproductive health,games ,food,spirtual talks and interactions. Thank you all who gave.

#MentalHealthMatters #Children #charity https://t.co/Kk6U3oacFQ",karenbisalomu,,4,0,1,0,"A non-profit mental health youth organization in Malawi, that raises awareness on mental health, depression,suicide and stigma in the youth.",173,"['MentalHealthMatters', 'Children', 'charity']",we had a great time at mpemba with the kids together with touch and care for kids we gave donationsmental and other health talks like sanitation and reproductive healthgames foodspirtual talks and interactions thank you all who gave mentalhealthmatters children charity,"['we', 'had', 'a', 'great', 'time', 'at', 'mpemba', 'with', 'the', 'kids', 'together', 'with', 'touch', 'and', 'care', 'for', 'kids', 'we', 'gave', 'donationsmental', 'and', 'other', 'health', 'talks', 'like', 'sanitation', 'and', 'reproductive', 'healthgames', 'foodspirtual', 'talks', 'and', 'interactions', 'thank', 'you', 'all', 'who', 'gave', 'mentalhealthmatters', 'children', 'charity']","['great', 'time', 'mpemba', 'kids', 'together', 'touch', 'care', 'kids', 'gave', 'donationsmental', 'health', 'talks', 'like', 'sanitation', 'reproductive', 'healthgames', 'foodspirtual', 'talks', 'interactions', 'thank', 'gave', 'mentalhealthmatters', 'children', 'charity']","['great', 'time', 'mpemba', 'kid', 'togeth', 'touch', 'care', 'kid', 'gave', 'donationsment', 'health', 'talk', 'like', 'sanit', 'reproduct', 'healthgam', 'foodspirtu', 'talk', 'interact', 'thank', 'gave', 'mentalhealthmatt', 'children', 'chariti']","['great', 'time', 'mpemba', 'kids', 'together', 'touch', 'care', 'kids', 'gave', 'donationsmental', 'health', 'talks', 'like', 'sanitation', 'reproductive', 'healthgames', 'foodspirtual', 'talks', 'interactions', 'thank', 'gave', 'mentalhealthmatters', 'children', 'charity']",5,Zambia
2022-04-23 13:03:41+00:00,1517851706423492608,"The International Drug Company (IDC) has donated over 900 X 12 cases of IV fluids (1000mls) to the Ministry of Health. 

MOH PS - Administration, Dr. George Magwende received the donation on behalf of the government of Zambia at ZAMMSA central warehouse in Lusaka today... https://t.co/yYNM5htXg7",StoresZambia,,1,0,0,0,,22,,the international drug company idc has donated over 900 x 12 cases of iv fluids 1000mls to the ministry of health moh ps administration dr george magwende received the donation on behalf of the government of zambia at zammsa central warehouse in lusaka today,"['the', 'international', 'drug', 'company', 'idc', 'has', 'donated', 'over', '900', 'x', '12', 'cases', 'of', 'iv', 'fluids', '1000mls', 'to', 'the', 'ministry', 'of', 'health', 'moh', 'ps', 'administration', 'dr', 'george', 'magwende', 'received', 'the', 'donation', 'on', 'behalf', 'of', 'the', 'government', 'of', 'zambia', 'at', 'zammsa', 'central', 'warehouse', 'in', 'lusaka', 'today']","['international', 'drug', 'company', 'idc', 'donated', '900', 'x', '12', 'cases', 'iv', 'fluids', '1000mls', 'ministry', 'health', 'moh', 'ps', 'administration', 'dr', 'george', 'magwende', 'received', 'donation', 'behalf', 'government', 'zambia', 'zammsa', 'central', 'warehouse', 'lusaka', 'today']","['intern', 'drug', 'compani', 'idc', 'donat', '900', 'x', '12', 'case', 'iv', 'fluid', '1000ml', 'ministri', 'health', 'moh', 'ps', 'administr', 'dr', 'georg', 'magwend', 'receiv', 'donat', 'behalf', 'govern', 'zambia', 'zammsa', 'central', 'warehous', 'lusaka', 'today']","['international', 'drug', 'company', 'idc', 'donated', '900', 'x', '12', 'cases', 'iv', 'fluids', '1000mls', 'ministry', 'health', 'moh', 'ps', 'administration', 'dr', 'george', 'magwende', 'received', 'donation', 'behalf', 'government', 'zambia', 'zammsa', 'central', 'warehouse', 'lusaka', 'today']",1,Zambia
2022-04-11 18:15:32+00:00,1513581531809333257,"For those organization or individual willing to  partner with us can connect with us on
mosescharity2021@gmail.com
+260977124244.

 Together we can provide better health Rocket cookstoves in the communities.
🍀🌿🌱🇿🇲 https://t.co/Qd2DUvm8S2",MOSESCharityOr1,"Lusaka, Zambia🇿🇲",0,0,0,0,restoring hope in the communities,747,,for those organization or individual willing to partner with us can connect with us on mosescharity2021 260977124244 together we can provide better health rocket cookstoves in the communities,"['for', 'those', 'organization', 'or', 'individual', 'willing', 'to', 'partner', 'with', 'us', 'can', 'connect', 'with', 'us', 'on', 'mosescharity2021', '260977124244', 'together', 'we', 'can', 'provide', 'better', 'health', 'rocket', 'cookstoves', 'in', 'the', 'communities']","['organization', 'individual', 'willing', 'partner', 'us', 'connect', 'us', 'mosescharity2021', '260977124244', 'together', 'provide', 'better', 'health', 'rocket', 'cookstoves', 'communities']","['organ', 'individu', 'will', 'partner', 'us', 'connect', 'us', 'mosescharity2021', '260977124244', 'togeth', 'provid', 'better', 'health', 'rocket', 'cookstov', 'commun']","['organization', 'individual', 'willing', 'partner', 'us', 'connect', 'us', 'mosescharity2021', '260977124244', 'together', 'provide', 'better', 'health', 'rocket', 'cookstoves', 'communities']",4,Zambia
2022-04-10 12:39:13+00:00,1513134503752986624,Happy birthday Mom May Allah grants u a good health and  happiness .#mymombirthday❤️  #MrUntouchable💪🏽👍🏻🙏🙌🏻🙏 @ Lord Herry View https://t.co/1Qa43DQTeM,LordHerry,Lordherryview,0,0,0,0,"Loyalty is a two way street. If I am asking it from you, you are getting it from me.#MrUntouchable",2910,"['mymombirthday', 'MrUntouchable']",happy birthday mom may allah grants u a good health and happiness mymombirthday mruntouchable lord herry view,"['happy', 'birthday', 'mom', 'may', 'allah', 'grants', 'u', 'a', 'good', 'health', 'and', 'happiness', 'mymombirthday', 'mruntouchable', 'lord', 'herry', 'view']","['happy', 'birthday', 'mom', 'may', 'allah', 'grants', 'u', 'good', 'health', 'happiness', 'mymombirthday', 'mruntouchable', 'lord', 'herry', 'view']","['happi', 'birthday', 'mom', 'may', 'allah', 'grant', 'u', 'good', 'health', 'happi', 'mymombirthday', 'mruntouch', 'lord', 'herri', 'view']","['happy', 'birthday', 'mom', 'may', 'allah', 'grants', 'u', 'good', 'health', 'happiness', 'mymombirthday', 'mruntouchable', 'lord', 'herry', 'view']",5,Zambia
2022-03-24 19:24:37+00:00,1507075933559209993,YA ALLAH! Don't make this coming Ramadan our last one. Please grant us the opportunity to witness many more Ramadan in good health.,YpheJ,Tanzania,1,0,0,0,"Real Madrid🇪🇦 & Simba Sc 🇹🇿 & Manchester city🏴󠁧󠁢󠁥󠁮󠁧󠁿 fan//idealistic 

wealth is not what we have but what we are☘️
//Food scientist and technologist",127,,ya allah dont make this coming ramadan our last one please grant us the opportunity to witness many more ramadan in good health,"['ya', 'allah', 'dont', 'make', 'this', 'coming', 'ramadan', 'our', 'last', 'one', 'please', 'grant', 'us', 'the', 'opportunity', 'to', 'witness', 'many', 'more', 'ramadan', 'in', 'good', 'health']","['ya', 'allah', 'dont', 'make', 'coming', 'ramadan', 'last', 'one', 'please', 'grant', 'us', 'opportunity', 'witness', 'many', 'ramadan', 'good', 'health']","['ya', 'allah', 'dont', 'make', 'come', 'ramadan', 'last', 'one', 'pleas', 'grant', 'us', 'opportun', 'wit', 'mani', 'ramadan', 'good', 'health']","['ya', 'allah', 'dont', 'make', 'coming', 'ramadan', 'last', 'one', 'please', 'grant', 'us', 'opportunity', 'witness', 'many', 'ramadan', 'good', 'health']",5,Zambia
2022-02-21 11:45:10+00:00,1495726284382560259,Lunch time salt donation obviously my Lunch was much better than yours 😂😂 @ Lifestyle Health &amp; Fitness Gym https://t.co/xUg5e3zy7g,KafulaMwiche,Lusaka,1,0,0,0,"Zambian, Husband, Father, Lawyer, Philanthropist, avid runner, Spinning Instructor reflecting the Glory and Image of the Most High.",2333,,lunch time salt donation obviously my lunch was much better than yours lifestyle health amp fitness gym,"['lunch', 'time', 'salt', 'donation', 'obviously', 'my', 'lunch', 'was', 'much', 'better', 'than', 'yours', 'lifestyle', 'health', 'amp', 'fitness', 'gym']","['lunch', 'time', 'salt', 'donation', 'obviously', 'lunch', 'much', 'better', 'lifestyle', 'health', 'amp', 'fitness', 'gym']","['lunch', 'time', 'salt', 'donat', 'obvious', 'lunch', 'much', 'better', 'lifestyl', 'health', 'amp', 'fit', 'gym']","['lunch', 'time', 'salt', 'donation', 'obviously', 'lunch', 'much', 'better', 'lifestyle', 'health', 'amp', 'fitness', 'gym']",5,Zambia
2021-11-29 19:53:23+00:00,1465408570497933312,"We are calling for your participation in Zambia on emergency as the minister of health announce a lock down we seek your engagement in masks and hands sanitizers. For more information contact us on mosescharity2021@gmail.com
+260977124244 https://t.co/2sExsZyxgi",MOSESCharityOr1,"Lusaka, Zambia🇿🇲",3,0,0,0,restoring hope in the communities,747,,we are calling for your participation in zambia on emergency as the minister of health announce a lock down we seek your engagement in masks and hands sanitizers for more information contact us on mosescharity2021 260977124244,"['we', 'are', 'calling', 'for', 'your', 'participation', 'in', 'zambia', 'on', 'emergency', 'as', 'the', 'minister', 'of', 'health', 'announce', 'a', 'lock', 'down', 'we', 'seek', 'your', 'engagement', 'in', 'masks', 'and', 'hands', 'sanitizers', 'for', 'more', 'information', 'contact', 'us', 'on', 'mosescharity2021', '260977124244']","['calling', 'participation', 'zambia', 'emergency', 'minister', 'health', 'announce', 'lock', 'seek', 'engagement', 'masks', 'hands', 'sanitizers', 'information', 'contact', 'us', 'mosescharity2021', '260977124244']","['call', 'particip', 'zambia', 'emerg', 'minist', 'health', 'announc', 'lock', 'seek', 'engag', 'mask', 'hand', 'sanit', 'inform', 'contact', 'us', 'mosescharity2021', '260977124244']","['calling', 'participation', 'zambia', 'emergency', 'minister', 'health', 'announce', 'lock', 'seek', 'engagement', 'masks', 'hands', 'sanitizers', 'information', 'contact', 'us', 'mosescharity2021', '260977124244']",1,Zambia
2021-11-17 11:09:00+00:00,1460927951059492866,"@MalawiPage We don't really have an option but to receive these donations. Until we are independent enough to finance our own health then perhaps we can do away with these strange donor behavior. But besides that, there is a huge mess at CMST. Funds mismanagement and procurement issues",MalawianMidwife,"Lilongwe, Malawi.",0,1,0,0,"#HellomynameisDan ▪️Midwife▪️  Maternal Health Activist ▪️Vice President @MalawiMidwives▪️ Founder at  @imcaimalawi ▪️imcaimw.org 
RTs not endorsements",6321,,we dont really have an option but to receive these donations until we are independent enough to finance our own health then perhaps we can do away with these strange donor behavior but besides that there is a huge mess at cmst funds mismanagement and procurement issues,"['we', 'dont', 'really', 'have', 'an', 'option', 'but', 'to', 'receive', 'these', 'donations', 'until', 'we', 'are', 'independent', 'enough', 'to', 'finance', 'our', 'own', 'health', 'then', 'perhaps', 'we', 'can', 'do', 'away', 'with', 'these', 'strange', 'donor', 'behavior', 'but', 'besides', 'that', 'there', 'is', 'a', 'huge', 'mess', 'at', 'cmst', 'funds', 'mismanagement', 'and', 'procurement', 'issues']","['dont', 'really', 'option', 'receive', 'donations', 'independent', 'enough', 'finance', 'health', 'perhaps', 'away', 'strange', 'donor', 'behavior', 'besides', 'huge', 'mess', 'cmst', 'funds', 'mismanagement', 'procurement', 'issues']","['dont', 'realli', 'option', 'receiv', 'donat', 'independ', 'enough', 'financ', 'health', 'perhap', 'away', 'strang', 'donor', 'behavior', 'besid', 'huge', 'mess', 'cmst', 'fund', 'mismanag', 'procur', 'issu']","['dont', 'really', 'option', 'receive', 'donations', 'independent', 'enough', 'finance', 'health', 'perhaps', 'away', 'strange', 'donor', 'behavior', 'besides', 'huge', 'mess', 'cmst', 'funds', 'mismanagement', 'procurement', 'issues']",2,Zambia
2021-11-15 12:01:19+00:00,1460216338467766276,"@HHichilema @iatf2021 @CyrilRamaphosa @OlusegunObasnjo @AfCFTA Mr. President, truth be told, you are a KEY VALUE DRIVER. You use your time so wisely. I pray that Hid continues to grant you wisdom and good health on your tour of duty.",JomoMatululu,,3,0,0,0,,3,,mr president truth be told you are a key value driver you use your time so wisely i pray that hid continues to grant you wisdom and good health on your tour of duty,"['mr', 'president', 'truth', 'be', 'told', 'you', 'are', 'a', 'key', 'value', 'driver', 'you', 'use', 'your', 'time', 'so', 'wisely', 'i', 'pray', 'that', 'hid', 'continues', 'to', 'grant', 'you', 'wisdom', 'and', 'good', 'health', 'on', 'your', 'tour', 'of', 'duty']","['mr', 'president', 'truth', 'told', 'key', 'value', 'driver', 'use', 'time', 'wisely', 'pray', 'hid', 'continues', 'grant', 'wisdom', 'good', 'health', 'tour', 'duty']","['mr', 'presid', 'truth', 'told', 'key', 'valu', 'driver', 'use', 'time', 'wise', 'pray', 'hid', 'continu', 'grant', 'wisdom', 'good', 'health', 'tour', 'duti']","['mr', 'president', 'truth', 'told', 'key', 'value', 'driver', 'use', 'time', 'wisely', 'pray', 'hid', 'continues', 'grant', 'wisdom', 'good', 'health', 'tour', 'duty']",5,Zambia
2021-11-13 08:24:26+00:00,1459436982925410306,Never take good health for granted.,aquila_fpoz_,Heaven-RHS of His Throne,147,0,36,1,"Son of God, Creative ,Optimist and FPOZ| Co- founder @UBUNTUGOVERNAN1 | Passionate about Climate and Fiscal Justice| own opinions",17206,,never take good health for granted,"['never', 'take', 'good', 'health', 'for', 'granted']","['never', 'take', 'good', 'health', 'granted']","['never', 'take', 'good', 'health', 'grant']","['never', 'take', 'good', 'health', 'granted']",1,Zambia
2021-11-04 05:28:13+00:00,1456131144232013825,"Don't take your sexual health for granted. Seek health advice if you are having challenges dealing with your sexuallity.
Your voice matters speak up 🗣️. https://t.co/jeJ8JuImwD",voice_zambia,"Copperbelt, Zambia",1,0,0,0,"A youth led non profitable, non governmental Organization.
Founded in the year 2019 ,by Lucky Kalunga youth advocate based in the copperbelt province of Zambia",33,,dont take your sexual health for granted seek health advice if you are having challenges dealing with your sexuallity your voice matters speak up,"['dont', 'take', 'your', 'sexual', 'health', 'for', 'granted', 'seek', 'health', 'advice', 'if', 'you', 'are', 'having', 'challenges', 'dealing', 'with', 'your', 'sexuallity', 'your', 'voice', 'matters', 'speak', 'up']","['dont', 'take', 'sexual', 'health', 'granted', 'seek', 'health', 'advice', 'challenges', 'dealing', 'sexuallity', 'voice', 'matters', 'speak']","['dont', 'take', 'sexual', 'health', 'grant', 'seek', 'health', 'advic', 'challeng', 'deal', 'sexual', 'voic', 'matter', 'speak']","['dont', 'take', 'sexual', 'health', 'granted', 'seek', 'health', 'advice', 'challenges', 'dealing', 'sexuallity', 'voice', 'matters', 'speak']",1,Zambia
