Date,Id,Tweet,Username,Location,likeCount,replyCount,retweetCount,quoteCount,userDescription,userFollowers,hashtags,Cleaned_Tweet,Tweet_tokenized,Tweet_removed_stop_word,Tweet_stemmed,Tweet_lemmatized,sentiment,Country
2022-06-14 17:41:00+00:00,1536765662537953282,"Thank you for being a lifesaver to many! Donating blood is a noble act!
Let us thank voluntary blood donors worldwide for their selfless contribution to society.

#worldblooddonorday #blooddonor #blooddonation #blooddrive
#exploreregisterednurse #exprn https://t.co/6qPU0D86Wu",ExploreNurse,"Michigan, USA",0,0,0,0,"•Providing Care, Dedication, and Expertise in Healthcare Staffing
•Traveling Healthcare Professionals.",0,"['worldblooddonorday', 'blooddonor', 'blooddonation', 'blooddrive', 'exploreregisterednurse', 'exprn']",thank you for being a lifesaver to many donating blood is a noble act let us thank voluntary blood donors worldwide for their selfless contribution to society worldblooddonorday blooddonor blooddonation blooddrive exploreregisterednurse exprn,"['thank', 'you', 'for', 'being', 'a', 'lifesaver', 'to', 'many', 'donating', 'blood', 'is', 'a', 'noble', 'act', 'let', 'us', 'thank', 'voluntary', 'blood', 'donors', 'worldwide', 'for', 'their', 'selfless', 'contribution', 'to', 'society', 'worldblooddonorday', 'blooddonor', 'blooddonation', 'blooddrive', 'exploreregisterednurse', 'exprn']","['thank', 'lifesaver', 'many', 'donating', 'blood', 'noble', 'act', 'let', 'us', 'thank', 'voluntary', 'blood', 'donors', 'worldwide', 'selfless', 'contribution', 'society', 'worldblooddonorday', 'blooddonor', 'blooddonation', 'blooddrive', 'exploreregisterednurse', 'exprn']","['thank', 'lifesav', 'mani', 'donat', 'blood', 'nobl', 'act', 'let', 'us', 'thank', 'voluntari', 'blood', 'donor', 'worldwid', 'selfless', 'contribut', 'societi', 'worldblooddonorday', 'blooddonor', 'blooddon', 'blooddriv', 'exploreregisterednurs', 'exprn']","['thank', 'lifesaver', 'many', 'donating', 'blood', 'noble', 'act', 'let', 'us', 'thank', 'voluntary', 'blood', 'donors', 'worldwide', 'selfless', 'contribution', 'society', 'worldblooddonorday', 'blooddonor', 'blooddonation', 'blooddrive', 'exploreregisterednurse', 'exprn']",5,Canada
2022-06-22 10:10:48+00:00,1539551469443088386,"""The median salary for a train driver is £59,000, compared with £31,000 for a nurse and £21,000 for a care worker."" -Grant Shapps

First, train drivers aren't (currently) on strike. The average salary for railroad workers who are is £36,800.",cjlemire,New England,2,1,0,0,Kinky ex-Brit. Associate member of Romancelandia. Red Sox fan. Remoaner. He/him,1861,,the median salary for a train driver is 59000 compared with 31000 for a nurse and 21000 for a care worker grant shapps first train drivers arent currently on strike the average salary for railroad workers who are is 36800,"['the', 'median', 'salary', 'for', 'a', 'train', 'driver', 'is', '59000', 'compared', 'with', '31000', 'for', 'a', 'nurse', 'and', '21000', 'for', 'a', 'care', 'worker', 'grant', 'shapps', 'first', 'train', 'drivers', 'arent', 'currently', 'on', 'strike', 'the', 'average', 'salary', 'for', 'railroad', 'workers', 'who', 'are', 'is', '36800']","['median', 'salary', 'train', 'driver', '59000', 'compared', '31000', 'nurse', '21000', 'care', 'worker', 'grant', 'shapps', 'first', 'train', 'drivers', 'arent', 'currently', 'strike', 'average', 'salary', 'railroad', 'workers', '36800']","['median', 'salari', 'train', 'driver', '59000', 'compar', '31000', 'nurs', '21000', 'care', 'worker', 'grant', 'shapp', 'first', 'train', 'driver', 'arent', 'current', 'strike', 'averag', 'salari', 'railroad', 'worker', '36800']","['median', 'salary', 'train', 'driver', '59000', 'compared', '31000', 'nurse', '21000', 'care', 'worker', 'grant', 'shapps', 'first', 'train', 'drivers', 'arent', 'currently', 'strike', 'average', 'salary', 'railroad', 'workers', '36800']",1,Canada
2022-06-20 07:32:03+00:00,1538786744379838464,"Nurse cycling 3,200 miles to every children’s hospice in UK for charity https://t.co/R2NcpvybxP",UNALocal115,"Calgary, Alberta",0,0,0,0,"United Nurses of Alberta Local 115 represents RNs & RPNs @ Foothills Medical Centre, U of C, GWHC, Dialysis (Fanning, NW & SCDC), Urgent Care & Mental Health",1112,,nurse cycling 3200 miles to every childrens hospice in uk for charity,"['nurse', 'cycling', '3200', 'miles', 'to', 'every', 'childrens', 'hospice', 'in', 'uk', 'for', 'charity']","['nurse', 'cycling', '3200', 'miles', 'every', 'childrens', 'hospice', 'uk', 'charity']","['nurs', 'cycl', '3200', 'mile', 'everi', 'children', 'hospic', 'uk', 'chariti']","['nurse', 'cycling', '3200', 'miles', 'every', 'childrens', 'hospice', 'uk', 'charity']",5,Canada
2022-06-19 14:35:31+00:00,1538530923410497537,Where I work RN’s are now being granted double time to pick up shifts. Meanwhile the very competent excellent RPN’s are not granted this. @CUPEOntario better start negotiating better pay for their RPN’s or they are going to walk. That means less dues for you. You have nurses,Calderon08,Hamilton Ont CANADA,5,1,0,0,"Nurse COVID-19 unit/Acute Medicine,  work with horses. . Pro Choice!. Ford has got to go! Embrace Science! blocked by Warren Kinsella & Rempel",871,,where i work rns are now being granted double time to pick up shifts meanwhile the very competent excellent rpns are not granted this better start negotiating better pay for their rpns or they are going to walk that means less dues for you you have nurses,"['where', 'i', 'work', 'rns', 'are', 'now', 'being', 'granted', 'double', 'time', 'to', 'pick', 'up', 'shifts', 'meanwhile', 'the', 'very', 'competent', 'excellent', 'rpns', 'are', 'not', 'granted', 'this', 'better', 'start', 'negotiating', 'better', 'pay', 'for', 'their', 'rpns', 'or', 'they', 'are', 'going', 'to', 'walk', 'that', 'means', 'less', 'dues', 'for', 'you', 'you', 'have', 'nurses']","['work', 'rns', 'granted', 'double', 'time', 'pick', 'shifts', 'meanwhile', 'competent', 'excellent', 'rpns', 'granted', 'better', 'start', 'negotiating', 'better', 'pay', 'rpns', 'going', 'walk', 'means', 'less', 'dues', 'nurses']","['work', 'rn', 'grant', 'doubl', 'time', 'pick', 'shift', 'meanwhil', 'compet', 'excel', 'rpn', 'grant', 'better', 'start', 'negoti', 'better', 'pay', 'rpn', 'go', 'walk', 'mean', 'less', 'due', 'nurs']","['work', 'rns', 'granted', 'double', 'time', 'pick', 'shifts', 'meanwhile', 'competent', 'excellent', 'rpns', 'granted', 'better', 'start', 'negotiating', 'better', 'pay', 'rpns', 'going', 'walk', 'means', 'less', 'dues', 'nurses']",2,Canada
2022-06-16 17:57:57+00:00,1537494704484405255,"Easy - @PanMass all day long!!  All monies go directly to the charity.   All donations go directly to cancer care, cancer drugs, hospitals, nurses, doctors.   It's the best place to send your money!  And yes, full disclosure...this year will be my 17th year riding as a fundraiser https://t.co/CscOfOJFMd",Wildhog681,New England,6,1,1,0,"Mtn Hiker, Mtn Biker, 4,000 footers of NH, 52 with a view, Taylor Guitar, Daily Fitness!  #PMC    Can't we all just get along?  It's OK to disagree!!",413,,easy all day long all monies go directly to the charity all donations go directly to cancer care cancer drugs hospitals nurses doctors its the best place to send your money and yes full disclosurethis year will be my 17th year riding as a fundraiser,"['easy', 'all', 'day', 'long', 'all', 'monies', 'go', 'directly', 'to', 'the', 'charity', 'all', 'donations', 'go', 'directly', 'to', 'cancer', 'care', 'cancer', 'drugs', 'hospitals', 'nurses', 'doctors', 'its', 'the', 'best', 'place', 'to', 'send', 'your', 'money', 'and', 'yes', 'full', 'disclosurethis', 'year', 'will', 'be', 'my', '17th', 'year', 'riding', 'as', 'a', 'fundraiser']","['easy', 'day', 'long', 'monies', 'go', 'directly', 'charity', 'donations', 'go', 'directly', 'cancer', 'care', 'cancer', 'drugs', 'hospitals', 'nurses', 'doctors', 'best', 'place', 'send', 'money', 'yes', 'full', 'disclosurethis', 'year', '17th', 'year', 'riding', 'fundraiser']","['easi', 'day', 'long', 'moni', 'go', 'directli', 'chariti', 'donat', 'go', 'directli', 'cancer', 'care', 'cancer', 'drug', 'hospit', 'nurs', 'doctor', 'best', 'place', 'send', 'money', 'ye', 'full', 'disclosurethi', 'year', '17th', 'year', 'ride', 'fundrais']","['easy', 'day', 'long', 'monies', 'go', 'directly', 'charity', 'donations', 'go', 'directly', 'cancer', 'care', 'cancer', 'drugs', 'hospitals', 'nurses', 'doctors', 'best', 'place', 'send', 'money', 'yes', 'full', 'disclosurethis', 'year', '17th', 'year', 'riding', 'fundraiser']",5,Canada
2022-06-15 15:34:20+00:00,1537096173345030144,"@Nurse_Braylee I like open country vibes, granted humidity and heat are bad here in Michigan today. Have fun sexiness https://t.co/o2AX63J2RJ",daveclark75,"Michigan, USA",1,0,0,0,"18+ females only, No males. I am straight. my only account, report any others. love taking photos and wish was able to pleasure multiple females.",924,,i like open country vibes granted humidity and heat are bad here in michigan today have fun sexiness,"['i', 'like', 'open', 'country', 'vibes', 'granted', 'humidity', 'and', 'heat', 'are', 'bad', 'here', 'in', 'michigan', 'today', 'have', 'fun', 'sexiness']","['like', 'open', 'country', 'vibes', 'granted', 'humidity', 'heat', 'bad', 'michigan', 'today', 'fun', 'sexiness']","['like', 'open', 'countri', 'vibe', 'grant', 'humid', 'heat', 'bad', 'michigan', 'today', 'fun', 'sexi']","['like', 'open', 'country', 'vibes', 'granted', 'humidity', 'heat', 'bad', 'michigan', 'today', 'fun', 'sexiness']",4,Canada
2022-06-14 17:41:00+00:00,1536765662537953282,"Thank you for being a lifesaver to many! Donating blood is a noble act!
Let us thank voluntary blood donors worldwide for their selfless contribution to society.

#worldblooddonorday #blooddonor #blooddonation #blooddrive
#exploreregisterednurse #exprn https://t.co/6qPU0D86Wu",ExploreNurse,"Michigan, USA",0,0,0,0,"•Providing Care, Dedication, and Expertise in Healthcare Staffing
•Traveling Healthcare Professionals.",0,"['worldblooddonorday', 'blooddonor', 'blooddonation', 'blooddrive', 'exploreregisterednurse', 'exprn']",thank you for being a lifesaver to many donating blood is a noble act let us thank voluntary blood donors worldwide for their selfless contribution to society worldblooddonorday blooddonor blooddonation blooddrive exploreregisterednurse exprn,"['thank', 'you', 'for', 'being', 'a', 'lifesaver', 'to', 'many', 'donating', 'blood', 'is', 'a', 'noble', 'act', 'let', 'us', 'thank', 'voluntary', 'blood', 'donors', 'worldwide', 'for', 'their', 'selfless', 'contribution', 'to', 'society', 'worldblooddonorday', 'blooddonor', 'blooddonation', 'blooddrive', 'exploreregisterednurse', 'exprn']","['thank', 'lifesaver', 'many', 'donating', 'blood', 'noble', 'act', 'let', 'us', 'thank', 'voluntary', 'blood', 'donors', 'worldwide', 'selfless', 'contribution', 'society', 'worldblooddonorday', 'blooddonor', 'blooddonation', 'blooddrive', 'exploreregisterednurse', 'exprn']","['thank', 'lifesav', 'mani', 'donat', 'blood', 'nobl', 'act', 'let', 'us', 'thank', 'voluntari', 'blood', 'donor', 'worldwid', 'selfless', 'contribut', 'societi', 'worldblooddonorday', 'blooddonor', 'blooddon', 'blooddriv', 'exploreregisterednurs', 'exprn']","['thank', 'lifesaver', 'many', 'donating', 'blood', 'noble', 'act', 'let', 'us', 'thank', 'voluntary', 'blood', 'donors', 'worldwide', 'selfless', 'contribution', 'society', 'worldblooddonorday', 'blooddonor', 'blooddonation', 'blooddrive', 'exploreregisterednurse', 'exprn']",5,Canada
2022-06-05 17:53:30+00:00,1533507318167371777,"#Canada #health On June 3, 2022, Federal Health Minister Jean - Yves Duclos discussed the urgent need for blood and plasma donations in Canada with CanadasLifeline's Dr. Postl and Dr. Sher

👉https://t.co/pniXqeR0Nn https://t.co/2rgfkI0UmM",NewsCanada24,Winnipeg,0,0,0,0,"News from Canada every day. Les nouvelles du Canada tous les jours.
English - French . Anglais - Français.
Contact : +1 431 373 11 45
email : news24canada@gmail",4,"['Canada', 'health']",canada health on june 3 2022 federal health minister jean yves duclos discussed the urgent need for blood and plasma donations in canada with canadaslifelines dr postl and dr sher,"['canada', 'health', 'on', 'june', '3', '2022', 'federal', 'health', 'minister', 'jean', 'yves', 'duclos', 'discussed', 'the', 'urgent', 'need', 'for', 'blood', 'and', 'plasma', 'donations', 'in', 'canada', 'with', 'canadaslifelines', 'dr', 'postl', 'and', 'dr', 'sher']","['canada', 'health', 'june', '3', '2022', 'federal', 'health', 'minister', 'jean', 'yves', 'duclos', 'discussed', 'urgent', 'need', 'blood', 'plasma', 'donations', 'canada', 'canadaslifelines', 'dr', 'postl', 'dr', 'sher']","['canada', 'health', 'june', '3', '2022', 'feder', 'health', 'minist', 'jean', 'yve', 'duclo', 'discuss', 'urgent', 'need', 'blood', 'plasma', 'donat', 'canada', 'canadaslifelin', 'dr', 'postl', 'dr', 'sher']","['canada', 'health', 'june', '3', '2022', 'federal', 'health', 'minister', 'jean', 'yves', 'duclos', 'discussed', 'urgent', 'need', 'blood', 'plasma', 'donations', 'canada', 'canadaslifelines', 'dr', 'postl', 'dr', 'sher']",1,Canada
2022-05-31 03:40:36+00:00,1531480740894064642,"Despite the fact that the #abortionpill, mifepristone, became available in Canada at the beginning of 2017, this has not necessarily translated into better access to abortion for migrant worker - via @healthing_ca

#healthing #health #healthnews  https://t.co/aSWGIxOSNN",edmontonjournal,"Edmonton, Alberta, Canada",0,0,0,0,Headlines on all subjects from the Edmonton Journal. A list of our journalists: twitter.com/edmontonjourna…,186434,"['abortionpill', 'healthing', 'health', 'healthnews']",despite the fact that the abortionpill mifepristone became available in canada at the beginning of 2017 this has not necessarily translated into better access to abortion for migrant worker via healthing health healthnews,"['despite', 'the', 'fact', 'that', 'the', 'abortionpill', 'mifepristone', 'became', 'available', 'in', 'canada', 'at', 'the', 'beginning', 'of', '2017', 'this', 'has', 'not', 'necessarily', 'translated', 'into', 'better', 'access', 'to', 'abortion', 'for', 'migrant', 'worker', 'via', 'healthing', 'health', 'healthnews']","['despite', 'fact', 'abortionpill', 'mifepristone', 'became', 'available', 'canada', 'beginning', '2017', 'necessarily', 'translated', 'better', 'access', 'abortion', 'migrant', 'worker', 'via', 'healthing', 'health', 'healthnews']","['despit', 'fact', 'abortionpil', 'mifepriston', 'becam', 'avail', 'canada', 'begin', '2017', 'necessarili', 'translat', 'better', 'access', 'abort', 'migrant', 'worker', 'via', 'health', 'health', 'healthnew']","['despite', 'fact', 'abortionpill', 'mifepristone', 'became', 'available', 'canada', 'beginning', '2017', 'necessarily', 'translated', 'better', 'access', 'abortion', 'migrant', 'worker', 'via', 'healthing', 'health', 'healthnews']",2,Canada
2022-05-30 16:31:22+00:00,1531312321213120513,"Despite the fact that the #abortionpill, mifepristone, became available in Canada at the beginning of 2017, this has not necessarily translated into better access to abortion for migrant worker - via @healthing_ca

#healthing #health #healthnews  https://t.co/JV1G3ESWDG",TheStarPhoenix,"Saskatoon, Saskatchewan",0,0,0,0,Saskatoon's best online source for breaking news,67749,"['abortionpill', 'healthing', 'health', 'healthnews']",despite the fact that the abortionpill mifepristone became available in canada at the beginning of 2017 this has not necessarily translated into better access to abortion for migrant worker via healthing health healthnews,"['despite', 'the', 'fact', 'that', 'the', 'abortionpill', 'mifepristone', 'became', 'available', 'in', 'canada', 'at', 'the', 'beginning', 'of', '2017', 'this', 'has', 'not', 'necessarily', 'translated', 'into', 'better', 'access', 'to', 'abortion', 'for', 'migrant', 'worker', 'via', 'healthing', 'health', 'healthnews']","['despite', 'fact', 'abortionpill', 'mifepristone', 'became', 'available', 'canada', 'beginning', '2017', 'necessarily', 'translated', 'better', 'access', 'abortion', 'migrant', 'worker', 'via', 'healthing', 'health', 'healthnews']","['despit', 'fact', 'abortionpil', 'mifepriston', 'becam', 'avail', 'canada', 'begin', '2017', 'necessarili', 'translat', 'better', 'access', 'abort', 'migrant', 'worker', 'via', 'health', 'health', 'healthnew']","['despite', 'fact', 'abortionpill', 'mifepristone', 'became', 'available', 'canada', 'beginning', '2017', 'necessarily', 'translated', 'better', 'access', 'abortion', 'migrant', 'worker', 'via', 'healthing', 'health', 'healthnews']",2,Canada
2022-05-30 16:31:20+00:00,1531312313176842240,"Despite the fact that the #abortionpill, mifepristone, became available in Canada at the beginning of 2017, this has not necessarily translated into better access to abortion for migrant worker - via @healthing_ca

#healthing #health #healthnews  https://t.co/yauhILJlif",calgaryherald,"Calgary, Alberta",0,0,0,0,"Latest local, national, world, business & sports news. Tweet us with questions, suggestions or tips! @HeraldHeadlines for headlines only.",206476,"['abortionpill', 'healthing', 'health', 'healthnews']",despite the fact that the abortionpill mifepristone became available in canada at the beginning of 2017 this has not necessarily translated into better access to abortion for migrant worker via healthing health healthnews,"['despite', 'the', 'fact', 'that', 'the', 'abortionpill', 'mifepristone', 'became', 'available', 'in', 'canada', 'at', 'the', 'beginning', 'of', '2017', 'this', 'has', 'not', 'necessarily', 'translated', 'into', 'better', 'access', 'to', 'abortion', 'for', 'migrant', 'worker', 'via', 'healthing', 'health', 'healthnews']","['despite', 'fact', 'abortionpill', 'mifepristone', 'became', 'available', 'canada', 'beginning', '2017', 'necessarily', 'translated', 'better', 'access', 'abortion', 'migrant', 'worker', 'via', 'healthing', 'health', 'healthnews']","['despit', 'fact', 'abortionpil', 'mifepriston', 'becam', 'avail', 'canada', 'begin', '2017', 'necessarili', 'translat', 'better', 'access', 'abort', 'migrant', 'worker', 'via', 'health', 'health', 'healthnew']","['despite', 'fact', 'abortionpill', 'mifepristone', 'became', 'available', 'canada', 'beginning', '2017', 'necessarily', 'translated', 'better', 'access', 'abortion', 'migrant', 'worker', 'via', 'healthing', 'health', 'healthnews']",2,Canada
2022-05-30 16:29:46+00:00,1531311918681624577,"Despite the fact that the #abortionpill, mifepristone, became available in Canada at the beginning of 2017, this has not necessarily translated into better access to abortion for migrant worker - via @healthing_ca

#healthing #health #healthnews  https://t.co/vhoJi5T4se",winnipegsun,"Winnipeg, Manitoba",0,1,0,0,"For the best in news, sports, and entertainment, check out winnipegsun.com.",65195,"['abortionpill', 'healthing', 'health', 'healthnews']",despite the fact that the abortionpill mifepristone became available in canada at the beginning of 2017 this has not necessarily translated into better access to abortion for migrant worker via healthing health healthnews,"['despite', 'the', 'fact', 'that', 'the', 'abortionpill', 'mifepristone', 'became', 'available', 'in', 'canada', 'at', 'the', 'beginning', 'of', '2017', 'this', 'has', 'not', 'necessarily', 'translated', 'into', 'better', 'access', 'to', 'abortion', 'for', 'migrant', 'worker', 'via', 'healthing', 'health', 'healthnews']","['despite', 'fact', 'abortionpill', 'mifepristone', 'became', 'available', 'canada', 'beginning', '2017', 'necessarily', 'translated', 'better', 'access', 'abortion', 'migrant', 'worker', 'via', 'healthing', 'health', 'healthnews']","['despit', 'fact', 'abortionpil', 'mifepriston', 'becam', 'avail', 'canada', 'begin', '2017', 'necessarili', 'translat', 'better', 'access', 'abort', 'migrant', 'worker', 'via', 'health', 'health', 'healthnew']","['despite', 'fact', 'abortionpill', 'mifepristone', 'became', 'available', 'canada', 'beginning', '2017', 'necessarily', 'translated', 'better', 'access', 'abortion', 'migrant', 'worker', 'via', 'healthing', 'health', 'healthnews']",2,Canada
2022-05-30 16:23:55+00:00,1531310448645226496,"Despite the fact that the #abortionpill, mifepristone, became available in Canada at the beginning of 2017, this has not necessarily translated into better access to abortion for migrant worker - via @healthing_ca

#healthing #health #healthnews  https://t.co/i5IxiOT9tW",Edmontonsun,"Edmonton, Alberta, Canada",0,0,0,0,"For 40 years we've kept a dedication to quality that offers our readers must-read content every day. The best coverage in Edmonton, Alberta, Canada & more.",84415,"['abortionpill', 'healthing', 'health', 'healthnews']",despite the fact that the abortionpill mifepristone became available in canada at the beginning of 2017 this has not necessarily translated into better access to abortion for migrant worker via healthing health healthnews,"['despite', 'the', 'fact', 'that', 'the', 'abortionpill', 'mifepristone', 'became', 'available', 'in', 'canada', 'at', 'the', 'beginning', 'of', '2017', 'this', 'has', 'not', 'necessarily', 'translated', 'into', 'better', 'access', 'to', 'abortion', 'for', 'migrant', 'worker', 'via', 'healthing', 'health', 'healthnews']","['despite', 'fact', 'abortionpill', 'mifepristone', 'became', 'available', 'canada', 'beginning', '2017', 'necessarily', 'translated', 'better', 'access', 'abortion', 'migrant', 'worker', 'via', 'healthing', 'health', 'healthnews']","['despit', 'fact', 'abortionpil', 'mifepriston', 'becam', 'avail', 'canada', 'begin', '2017', 'necessarili', 'translat', 'better', 'access', 'abort', 'migrant', 'worker', 'via', 'health', 'health', 'healthnew']","['despite', 'fact', 'abortionpill', 'mifepristone', 'became', 'available', 'canada', 'beginning', '2017', 'necessarily', 'translated', 'better', 'access', 'abortion', 'migrant', 'worker', 'via', 'healthing', 'health', 'healthnews']",2,Canada
2022-05-30 16:16:33+00:00,1531308591482908673,"Despite the fact that the #abortionpill, mifepristone, became available in Canada at the beginning of 2017, this has not necessarily translated into better access to abortion for migrant worker - via @healthing_ca

#healthing #health #healthnews  https://t.co/BTVLCqeLx3",leaderpost,"Regina, Saskatchewan",3,0,0,0,The Regina Leader-Post is home to news you need to know about #yqr and beyond.,70734,"['abortionpill', 'healthing', 'health', 'healthnews']",despite the fact that the abortionpill mifepristone became available in canada at the beginning of 2017 this has not necessarily translated into better access to abortion for migrant worker via healthing health healthnews,"['despite', 'the', 'fact', 'that', 'the', 'abortionpill', 'mifepristone', 'became', 'available', 'in', 'canada', 'at', 'the', 'beginning', 'of', '2017', 'this', 'has', 'not', 'necessarily', 'translated', 'into', 'better', 'access', 'to', 'abortion', 'for', 'migrant', 'worker', 'via', 'healthing', 'health', 'healthnews']","['despite', 'fact', 'abortionpill', 'mifepristone', 'became', 'available', 'canada', 'beginning', '2017', 'necessarily', 'translated', 'better', 'access', 'abortion', 'migrant', 'worker', 'via', 'healthing', 'health', 'healthnews']","['despit', 'fact', 'abortionpil', 'mifepriston', 'becam', 'avail', 'canada', 'begin', '2017', 'necessarili', 'translat', 'better', 'access', 'abort', 'migrant', 'worker', 'via', 'health', 'health', 'healthnew']","['despite', 'fact', 'abortionpill', 'mifepristone', 'became', 'available', 'canada', 'beginning', '2017', 'necessarily', 'translated', 'better', 'access', 'abortion', 'migrant', 'worker', 'via', 'healthing', 'health', 'healthnews']",2,Canada
2022-06-01 19:46:54+00:00,1532086303017213952,"We've got TWO *shocking* options for you if you buy before Midnight, June 2:

🚗 2022 Tesla Model 3
⚡️ 2022 Ford F-150 Electric

&gt;&gt; https://t.co/UNHZ5lInjY

#summerdream #trihospital #trihospitaldream #winnipeg #ywg #manitoba #win #healthcare #childhealth #fundraising https://t.co/2JkSqC5Ias",trihospitaldr,"Winnipeg, Manitoba",0,0,0,0,"6 Grand Prize choices! Choose your dream home, or $1.25 million cash (tax-free!) 😍",524,"['summerdream', 'trihospital', 'trihospitaldream', 'winnipeg', 'ywg', 'manitoba', 'win', 'healthcare', 'childhealth', 'fundraising']",weve got two shocking options for you if you buy before midnight june 2 2022 tesla model 3 2022 ford f150 electric gtgt summerdream trihospital trihospitaldream winnipeg ywg manitoba win healthcare childhealth fundraising,"['weve', 'got', 'two', 'shocking', 'options', 'for', 'you', 'if', 'you', 'buy', 'before', 'midnight', 'june', '2', '2022', 'tesla', 'model', '3', '2022', 'ford', 'f150', 'electric', 'gtgt', 'summerdream', 'trihospital', 'trihospitaldream', 'winnipeg', 'ywg', 'manitoba', 'win', 'healthcare', 'childhealth', 'fundraising']","['weve', 'got', 'two', 'shocking', 'options', 'buy', 'midnight', 'june', '2', '2022', 'tesla', 'model', '3', '2022', 'ford', 'f150', 'electric', 'gtgt', 'summerdream', 'trihospital', 'trihospitaldream', 'winnipeg', 'ywg', 'manitoba', 'win', 'healthcare', 'childhealth', 'fundraising']","['weve', 'got', 'two', 'shock', 'option', 'buy', 'midnight', 'june', '2', '2022', 'tesla', 'model', '3', '2022', 'ford', 'f150', 'electr', 'gtgt', 'summerdream', 'trihospit', 'trihospitaldream', 'winnipeg', 'ywg', 'manitoba', 'win', 'healthcar', 'childhealth', 'fundrais']","['weve', 'got', 'two', 'shocking', 'options', 'buy', 'midnight', 'june', '2', '2022', 'tesla', 'model', '3', '2022', 'ford', 'f150', 'electric', 'gtgt', 'summerdream', 'trihospital', 'trihospitaldream', 'winnipeg', 'ywg', 'manitoba', 'win', 'healthcare', 'childhealth', 'fundraising']",1,Canada
