Date,Id,Tweet,Username,Location,likeCount,replyCount,retweetCount,quoteCount,userDescription,userFollowers,hashtags,Cleaned_Tweet,Tweet_tokenized,Tweet_removed_stop_word,Tweet_stemmed,Tweet_lemmatized,sentiment,Country
2020-03-06 11:29:03+00:00,1235890128477917185,"Almighty. We pray for everyone across the globe, for safety as well as comfort amidst uncertainty and crisis. We ask for Your guidance and direction. We are completely reliant on You, especially during these challenging times. May we never take good health for granted. Aameen!",siddiksardar,Malawi,1,0,0,0,,208,,almighty we pray for everyone across the globe for safety as well as comfort amidst uncertainty and crisis we ask for your guidance and direction we are completely reliant on you especially during these challenging times may we never take good health for granted aameen,"['almighty', 'we', 'pray', 'for', 'everyone', 'across', 'the', 'globe', 'for', 'safety', 'as', 'well', 'as', 'comfort', 'amidst', 'uncertainty', 'and', 'crisis', 'we', 'ask', 'for', 'your', 'guidance', 'and', 'direction', 'we', 'are', 'completely', 'reliant', 'on', 'you', 'especially', 'during', 'these', 'challenging', 'times', 'may', 'we', 'never', 'take', 'good', 'health', 'for', 'granted', 'aameen']","['almighty', 'pray', 'everyone', 'across', 'globe', 'safety', 'well', 'comfort', 'amidst', 'uncertainty', 'crisis', 'ask', 'guidance', 'direction', 'completely', 'reliant', 'especially', 'challenging', 'times', 'may', 'never', 'take', 'good', 'health', 'granted', 'aameen']","['almighti', 'pray', 'everyon', 'across', 'globe', 'safeti', 'well', 'comfort', 'amidst', 'uncertainti', 'crisi', 'ask', 'guidanc', 'direct', 'complet', 'reliant', 'especi', 'challeng', 'time', 'may', 'never', 'take', 'good', 'health', 'grant', 'aameen']","['almighty', 'pray', 'everyone', 'across', 'globe', 'safety', 'well', 'comfort', 'amidst', 'uncertainty', 'crisis', 'ask', 'guidance', 'direction', 'completely', 'reliant', 'especially', 'challenging', 'times', 'may', 'never', 'take', 'good', 'health', 'granted', 'aameen']",5,Zambia
2020-02-28 08:51:54+00:00,1233313867788378112,Happy birthday @Big_sEGO may God grant you many more amazing yearz! Health and wealth mogherl! 🥳🥳,Jerry_Tsunke,South Africa,0,0,0,0,"Love all💕 Trust a few 😒, do wrong to none🙏🏾||Future #FPL winner||Serving L’s on FIFA since ‘99||Gooner||KC✌🏾|Husband & Father of 3❤️",1129,,happy birthday may god grant you many more amazing yearz health and wealth mogherl,"['happy', 'birthday', 'may', 'god', 'grant', 'you', 'many', 'more', 'amazing', 'yearz', 'health', 'and', 'wealth', 'mogherl']","['happy', 'birthday', 'may', 'god', 'grant', 'many', 'amazing', 'yearz', 'health', 'wealth', 'mogherl']","['happi', 'birthday', 'may', 'god', 'grant', 'mani', 'amaz', 'yearz', 'health', 'wealth', 'mogherl']","['happy', 'birthday', 'may', 'god', 'grant', 'many', 'amazing', 'yearz', 'health', 'wealth', 'mogherl']",5,Zambia
2020-02-22 16:27:16+00:00,1231254138803171328,We really take good health for granted.,benjimumena,Africa ,0,0,0,0,Entrepreneur.,1102,,we really take good health for granted,"['we', 'really', 'take', 'good', 'health', 'for', 'granted']","['really', 'take', 'good', 'health', 'granted']","['realli', 'take', 'good', 'health', 'grant']","['really', 'take', 'good', 'health', 'granted']",5,Zambia
2019-12-26 09:39:22+00:00,1210132987427393536,"@moise_chi @kobbyblay Mental health is an area we’ve taken for granted and yet it is at the heart of productivity, from any perspective. I liken it to #EQ emotional intelligence.  @6s_EQ",DevelpmtAnalyst,"Lusaka, Zambia",2,1,0,0,"A Deep, Systems guy | Organic Farmer | Promotes Children’s literacy | Food Business owner | Change Agent | I am Me",1397,['EQ'],mental health is an area weve taken for granted and yet it is at the heart of productivity from any perspective i liken it to eq emotional intelligence,"['mental', 'health', 'is', 'an', 'area', 'weve', 'taken', 'for', 'granted', 'and', 'yet', 'it', 'is', 'at', 'the', 'heart', 'of', 'productivity', 'from', 'any', 'perspective', 'i', 'liken', 'it', 'to', 'eq', 'emotional', 'intelligence']","['mental', 'health', 'area', 'weve', 'taken', 'granted', 'yet', 'heart', 'productivity', 'perspective', 'liken', 'eq', 'emotional', 'intelligence']","['mental', 'health', 'area', 'weve', 'taken', 'grant', 'yet', 'heart', 'product', 'perspect', 'liken', 'eq', 'emot', 'intellig']","['mental', 'health', 'area', 'weve', 'taken', 'granted', 'yet', 'heart', 'productivity', 'perspective', 'liken', 'eq', 'emotional', 'intelligence']",4,Zambia
2019-12-24 22:05:10+00:00,1209595902144503809,"Indian Government handover donation of drugs valued at $2million 
“Today is the epitome of the out comes of that state visit (by HE) a donation of drugs worth $2million , this is a key investment in HE President Edgar C Lungu ‘s agenda for UHC. “ Health Minister @ChitaluChilufy3 https://t.co/HYbn2P0LNe",mohzambia,"Lusaka, Zambia",6,1,2,1,The Ministry aims to address and share ideas with the public on various topics in the health field and related services,14236,,indian government handover donation of drugs valued at 2million today is the epitome of the out comes of that state visit by he a donation of drugs worth 2million this is a key investment in he president edgar c lungu s agenda for uhc health minister,"['indian', 'government', 'handover', 'donation', 'of', 'drugs', 'valued', 'at', '2million', 'today', 'is', 'the', 'epitome', 'of', 'the', 'out', 'comes', 'of', 'that', 'state', 'visit', 'by', 'he', 'a', 'donation', 'of', 'drugs', 'worth', '2million', 'this', 'is', 'a', 'key', 'investment', 'in', 'he', 'president', 'edgar', 'c', 'lungu', 's', 'agenda', 'for', 'uhc', 'health', 'minister']","['indian', 'government', 'handover', 'donation', 'drugs', 'valued', '2million', 'today', 'epitome', 'comes', 'state', 'visit', 'donation', 'drugs', 'worth', '2million', 'key', 'investment', 'president', 'edgar', 'c', 'lungu', 'agenda', 'uhc', 'health', 'minister']","['indian', 'govern', 'handov', 'donat', 'drug', 'valu', '2million', 'today', 'epitom', 'come', 'state', 'visit', 'donat', 'drug', 'worth', '2million', 'key', 'invest', 'presid', 'edgar', 'c', 'lungu', 'agenda', 'uhc', 'health', 'minist']","['indian', 'government', 'handover', 'donation', 'drugs', 'valued', '2million', 'today', 'epitome', 'comes', 'state', 'visit', 'donation', 'drugs', 'worth', '2million', 'key', 'investment', 'president', 'edgar', 'c', 'lungu', 'agenda', 'uhc', 'health', 'minister']",5,Zambia
2019-12-19 18:49:07+00:00,1207734622634811399,"Tune into SunFm breakfast show tomorrow 8am as I give more insight on my charity drives.  And do feel free to share what you feel needs to done especially about menstrual health🙏🏾❤️

Pls RT https://t.co/AKfR2NLL3t",Tee1o1,Zambia,28,1,15,0,Jeremiah 29:11 •|• Boy Mom💙•|• FOUNDER @Gogirlzambia @Interiorcoutur @zambianEatery•|• The future belongs to those who believe in the beauty of their dreams📍,24425,,tune into sunfm breakfast show tomorrow 8am as i give more insight on my charity drives and do feel free to share what you feel needs to done especially about menstrual health pls rt,"['tune', 'into', 'sunfm', 'breakfast', 'show', 'tomorrow', '8am', 'as', 'i', 'give', 'more', 'insight', 'on', 'my', 'charity', 'drives', 'and', 'do', 'feel', 'free', 'to', 'share', 'what', 'you', 'feel', 'needs', 'to', 'done', 'especially', 'about', 'menstrual', 'health', 'pls', 'rt']","['tune', 'sunfm', 'breakfast', 'show', 'tomorrow', '8am', 'give', 'insight', 'charity', 'drives', 'feel', 'free', 'share', 'feel', 'needs', 'done', 'especially', 'menstrual', 'health', 'pls', 'rt']","['tune', 'sunfm', 'breakfast', 'show', 'tomorrow', '8am', 'give', 'insight', 'chariti', 'drive', 'feel', 'free', 'share', 'feel', 'need', 'done', 'especi', 'menstrual', 'health', 'pl', 'rt']","['tune', 'sunfm', 'breakfast', 'show', 'tomorrow', '8am', 'give', 'insight', 'charity', 'drives', 'feel', 'free', 'share', 'feel', 'needs', 'done', 'especially', 'menstrual', 'health', 'pls', 'rt']",5,Zambia
2021-11-29 19:53:23+00:00,1465408570497933312,"We are calling for your participation in Zambia on emergency as the minister of health announce a lock down we seek your engagement in masks and hands sanitizers. For more information contact us on mosescharity2021@gmail.com
+260977124244 https://t.co/2sExsZyxgi",MOSESCharityOr1,"Lusaka, Zambia🇿🇲",3,0,0,0,restoring hope in the communities,747,,we are calling for your participation in zambia on emergency as the minister of health announce a lock down we seek your engagement in masks and hands sanitizers for more information contact us on mosescharity2021 260977124244,"['we', 'are', 'calling', 'for', 'your', 'participation', 'in', 'zambia', 'on', 'emergency', 'as', 'the', 'minister', 'of', 'health', 'announce', 'a', 'lock', 'down', 'we', 'seek', 'your', 'engagement', 'in', 'masks', 'and', 'hands', 'sanitizers', 'for', 'more', 'information', 'contact', 'us', 'on', 'mosescharity2021', '260977124244']","['calling', 'participation', 'zambia', 'emergency', 'minister', 'health', 'announce', 'lock', 'seek', 'engagement', 'masks', 'hands', 'sanitizers', 'information', 'contact', 'us', 'mosescharity2021', '260977124244']","['call', 'particip', 'zambia', 'emerg', 'minist', 'health', 'announc', 'lock', 'seek', 'engag', 'mask', 'hand', 'sanit', 'inform', 'contact', 'us', 'mosescharity2021', '260977124244']","['calling', 'participation', 'zambia', 'emergency', 'minister', 'health', 'announce', 'lock', 'seek', 'engagement', 'masks', 'hands', 'sanitizers', 'information', 'contact', 'us', 'mosescharity2021', '260977124244']",1,Zambia
2021-09-25 06:05:59+00:00,1441645134068785152,"@chanock7 @NovemberQueen_ USAid had been a wonderful partner to Zambia, walk into hospitals and see a number of critical care medical equipment present been a donation from USAID",simudumo,"Kafue,zambia",4,2,0,0,"Heart of a slave, blood of the king! Work hard in silence and let success make noise for you",165,,usaid had been a wonderful partner to zambia walk into hospitals and see a number of critical care medical equipment present been a donation from usaid,"['usaid', 'had', 'been', 'a', 'wonderful', 'partner', 'to', 'zambia', 'walk', 'into', 'hospitals', 'and', 'see', 'a', 'number', 'of', 'critical', 'care', 'medical', 'equipment', 'present', 'been', 'a', 'donation', 'from', 'usaid']","['usaid', 'wonderful', 'partner', 'zambia', 'walk', 'hospitals', 'see', 'number', 'critical', 'care', 'medical', 'equipment', 'present', 'donation', 'usaid']","['usaid', 'wonder', 'partner', 'zambia', 'walk', 'hospit', 'see', 'number', 'critic', 'care', 'medic', 'equip', 'present', 'donat', 'usaid']","['usaid', 'wonderful', 'partner', 'zambia', 'walk', 'hospitals', 'see', 'number', 'critical', 'care', 'medical', 'equipment', 'present', 'donation', 'usaid']",5,Zambia
2021-09-24 17:44:56+00:00,1441458646240698369,"@Mwebantu It's interesting how U.S. funds the purchase of drugs to support big Pharmaceutical Companies, which drive their economies. Can someone name a major school, major hospital, major road, major bridge funded by U.S. aid? U.S. donations do not really move me, it comes with conditions",jeregk1,"Lusaka, Zambia",3,1,0,0,EYE CARE PERSONNEL,42,,its interesting how us funds the purchase of drugs to support big pharmaceutical companies which drive their economies can someone name a major school major hospital major road major bridge funded by us aid us donations do not really move me it comes with conditions,"['its', 'interesting', 'how', 'us', 'funds', 'the', 'purchase', 'of', 'drugs', 'to', 'support', 'big', 'pharmaceutical', 'companies', 'which', 'drive', 'their', 'economies', 'can', 'someone', 'name', 'a', 'major', 'school', 'major', 'hospital', 'major', 'road', 'major', 'bridge', 'funded', 'by', 'us', 'aid', 'us', 'donations', 'do', 'not', 'really', 'move', 'me', 'it', 'comes', 'with', 'conditions']","['interesting', 'us', 'funds', 'purchase', 'drugs', 'support', 'big', 'pharmaceutical', 'companies', 'drive', 'economies', 'someone', 'name', 'major', 'school', 'major', 'hospital', 'major', 'road', 'major', 'bridge', 'funded', 'us', 'aid', 'us', 'donations', 'really', 'move', 'comes', 'conditions']","['interest', 'us', 'fund', 'purchas', 'drug', 'support', 'big', 'pharmaceut', 'compani', 'drive', 'economi', 'someon', 'name', 'major', 'school', 'major', 'hospit', 'major', 'road', 'major', 'bridg', 'fund', 'us', 'aid', 'us', 'donat', 'realli', 'move', 'come', 'condit']","['interesting', 'us', 'funds', 'purchase', 'drugs', 'support', 'big', 'pharmaceutical', 'companies', 'drive', 'economies', 'someone', 'name', 'major', 'school', 'major', 'hospital', 'major', 'road', 'major', 'bridge', 'funded', 'us', 'aid', 'us', 'donations', 'really', 'move', 'comes', 'conditions']",3,Zambia
2020-08-01 13:05:59+00:00,1289547929032646658,"Beautiful day today. We went to KCH to show solidarity with the COVID-19 Frontline Health workers ..With love from the local charity, MyAngeMyPride! @ Kamuzu Central Hospital https://t.co/7QhCV23JDV",WaazilenZileni,Malawi,1,0,0,0,Male,346,,beautiful day today we went to kch to show solidarity with the covid19 frontline health workers with love from the local charity myangemypride kamuzu central hospital,"['beautiful', 'day', 'today', 'we', 'went', 'to', 'kch', 'to', 'show', 'solidarity', 'with', 'the', 'covid19', 'frontline', 'health', 'workers', 'with', 'love', 'from', 'the', 'local', 'charity', 'myangemypride', 'kamuzu', 'central', 'hospital']","['beautiful', 'day', 'today', 'went', 'kch', 'show', 'solidarity', 'covid19', 'frontline', 'health', 'workers', 'love', 'local', 'charity', 'myangemypride', 'kamuzu', 'central', 'hospital']","['beauti', 'day', 'today', 'went', 'kch', 'show', 'solidar', 'covid19', 'frontlin', 'health', 'worker', 'love', 'local', 'chariti', 'myangemyprid', 'kamuzu', 'central', 'hospit']","['beautiful', 'day', 'today', 'went', 'kch', 'show', 'solidarity', 'covid19', 'frontline', 'health', 'workers', 'love', 'local', 'charity', 'myangemypride', 'kamuzu', 'central', 'hospital']",5,Zambia
2020-04-17 16:54:07+00:00,1251192227688218625,A people centered lockdown is necessary. Doesn't mean the injunction granted means we should let loose. Staying home is the best way. The only hope is that they will consider the vulnerable akayambaso z lockdown. Vulnerable not just food wise but our health workers safety too,rubis_rare,"Dedza, Malawi",6,2,0,2,"#SportsforDevelopment
#ChildProtection #GESI #GenderPractitioner #Humanitarian #DRR #Naturelover #COYG
perfect imperfection.
personal thoughts
#GODFIRST",10126,,a people centered lockdown is necessary doesnt mean the injunction granted means we should let loose staying home is the best way the only hope is that they will consider the vulnerable akayambaso z lockdown vulnerable not just food wise but our health workers safety too,"['a', 'people', 'centered', 'lockdown', 'is', 'necessary', 'doesnt', 'mean', 'the', 'injunction', 'granted', 'means', 'we', 'should', 'let', 'loose', 'staying', 'home', 'is', 'the', 'best', 'way', 'the', 'only', 'hope', 'is', 'that', 'they', 'will', 'consider', 'the', 'vulnerable', 'akayambaso', 'z', 'lockdown', 'vulnerable', 'not', 'just', 'food', 'wise', 'but', 'our', 'health', 'workers', 'safety', 'too']","['people', 'centered', 'lockdown', 'necessary', 'doesnt', 'mean', 'injunction', 'granted', 'means', 'let', 'loose', 'staying', 'home', 'best', 'way', 'hope', 'consider', 'vulnerable', 'akayambaso', 'z', 'lockdown', 'vulnerable', 'food', 'wise', 'health', 'workers', 'safety']","['peopl', 'center', 'lockdown', 'necessari', 'doesnt', 'mean', 'injunct', 'grant', 'mean', 'let', 'loos', 'stay', 'home', 'best', 'way', 'hope', 'consid', 'vulner', 'akayambaso', 'z', 'lockdown', 'vulner', 'food', 'wise', 'health', 'worker', 'safeti']","['people', 'centered', 'lockdown', 'necessary', 'doesnt', 'mean', 'injunction', 'granted', 'means', 'let', 'loose', 'staying', 'home', 'best', 'way', 'hope', 'consider', 'vulnerable', 'akayambaso', 'z', 'lockdown', 'vulnerable', 'food', 'wise', 'health', 'workers', 'safety']",3,Zambia
2022-06-01 13:04:43+00:00,1531985094092677121,"60 @ 60 @ Money @ 15:00 hours
•The US Dollar is buying at K17.10 and selling at K17.43.
•Minister of Commerce calls for measures that will help seal the trade gap between Zambia and Israel.
•Immigration Department removes 190 illegal immigrants and relocates 95 refugees. https://t.co/vtQFkyLZvR",moneyfmzambia,"Lusaka, Zambia",0,0,0,0,"BOZ Governor award winner, business & personal finance radio station. Focus on business and money-related topics, wider social topics such as health and more.",5186,,60 60 money 1500 hours the us dollar is buying at k1710 and selling at k1743 minister of commerce calls for measures that will help seal the trade gap between zambia and israel immigration department removes 190 illegal immigrants and relocates 95 refugees,"['60', '60', 'money', '1500', 'hours', 'the', 'us', 'dollar', 'is', 'buying', 'at', 'k1710', 'and', 'selling', 'at', 'k1743', 'minister', 'of', 'commerce', 'calls', 'for', 'measures', 'that', 'will', 'help', 'seal', 'the', 'trade', 'gap', 'between', 'zambia', 'and', 'israel', 'immigration', 'department', 'removes', '190', 'illegal', 'immigrants', 'and', 'relocates', '95', 'refugees']","['60', '60', 'money', '1500', 'hours', 'us', 'dollar', 'buying', 'k1710', 'selling', 'k1743', 'minister', 'commerce', 'calls', 'measures', 'help', 'seal', 'trade', 'gap', 'zambia', 'israel', 'immigration', 'department', 'removes', '190', 'illegal', 'immigrants', 'relocates', '95', 'refugees']","['60', '60', 'money', '1500', 'hour', 'us', 'dollar', 'buy', 'k1710', 'sell', 'k1743', 'minist', 'commerc', 'call', 'measur', 'help', 'seal', 'trade', 'gap', 'zambia', 'israel', 'immigr', 'depart', 'remov', '190', 'illeg', 'immigr', 'reloc', '95', 'refuge']","['60', '60', 'money', '1500', 'hours', 'us', 'dollar', 'buying', 'k1710', 'selling', 'k1743', 'minister', 'commerce', 'calls', 'measures', 'help', 'seal', 'trade', 'gap', 'zambia', 'israel', 'immigration', 'department', 'removes', '190', 'illegal', 'immigrants', 'relocates', '95', 'refugees']",1,Zambia
2020-07-31 17:34:18+00:00,1289253065476861953,This life thing is funny you just never know what will come of it one moment you living happy and healthy the next you fighting for your life don’t take anything for granted stay safe live responsibly most of all put  God first in everything you do.,ayococo811,"Lusaka, Zambia",2,0,0,0,"I love pictures,clothes , makeup ,shoes and bags / life of an OREO / HOOD MONALISA / Mental health advocate / 𝐵𝑒𝓂𝒷𝒶 -𝓈𝒽𝑜𝓃𝒶 𝑔𝒾𝓇𝓁 / I’m 4’11 / MRS M",3270,,this life thing is funny you just never know what will come of it one moment you living happy and healthy the next you fighting for your life dont take anything for granted stay safe live responsibly most of all put god first in everything you do,"['this', 'life', 'thing', 'is', 'funny', 'you', 'just', 'never', 'know', 'what', 'will', 'come', 'of', 'it', 'one', 'moment', 'you', 'living', 'happy', 'and', 'healthy', 'the', 'next', 'you', 'fighting', 'for', 'your', 'life', 'dont', 'take', 'anything', 'for', 'granted', 'stay', 'safe', 'live', 'responsibly', 'most', 'of', 'all', 'put', 'god', 'first', 'in', 'everything', 'you', 'do']","['life', 'thing', 'funny', 'never', 'know', 'come', 'one', 'moment', 'living', 'happy', 'healthy', 'next', 'fighting', 'life', 'dont', 'take', 'anything', 'granted', 'stay', 'safe', 'live', 'responsibly', 'put', 'god', 'first', 'everything']","['life', 'thing', 'funni', 'never', 'know', 'come', 'one', 'moment', 'live', 'happi', 'healthi', 'next', 'fight', 'life', 'dont', 'take', 'anyth', 'grant', 'stay', 'safe', 'live', 'respons', 'put', 'god', 'first', 'everyth']","['life', 'thing', 'funny', 'never', 'know', 'come', 'one', 'moment', 'living', 'happy', 'healthy', 'next', 'fighting', 'life', 'dont', 'take', 'anything', 'granted', 'stay', 'safe', 'live', 'responsibly', 'put', 'god', 'first', 'everything']",5,Zambia
2020-04-22 16:21:07+00:00,1252995860922880000,".@PrimeMinisterGR: I know you are committed to keeping all kids in #Greece healthy &amp; safe through #COVID19. Hundreds of migrant kids are locked up for no reason. You can save their childhoods. #FreeTheKids, put them in child-friendly housing now! https://t.co/Vslkt5fC1b",mkombwayage,"Dar es Salaam, Tanzania",1,0,0,0,"Chairperson  @UN Chapter IFM . Follow@yunatz @UNVTanzania @c_mwamanga
Volunteerism for Peace and Developments .
HUMANITARIAN ( NO WEAPON 🚫)",41,"['Greece', 'COVID19', 'FreeTheKids']",i know you are committed to keeping all kids in greece healthy amp safe through covid19 hundreds of migrant kids are locked up for no reason you can save their childhoods freethekids put them in childfriendly housing now,"['i', 'know', 'you', 'are', 'committed', 'to', 'keeping', 'all', 'kids', 'in', 'greece', 'healthy', 'amp', 'safe', 'through', 'covid19', 'hundreds', 'of', 'migrant', 'kids', 'are', 'locked', 'up', 'for', 'no', 'reason', 'you', 'can', 'save', 'their', 'childhoods', 'freethekids', 'put', 'them', 'in', 'childfriendly', 'housing', 'now']","['know', 'committed', 'keeping', 'kids', 'greece', 'healthy', 'amp', 'safe', 'covid19', 'hundreds', 'migrant', 'kids', 'locked', 'reason', 'save', 'childhoods', 'freethekids', 'put', 'childfriendly', 'housing']","['know', 'commit', 'keep', 'kid', 'greec', 'healthi', 'amp', 'safe', 'covid19', 'hundr', 'migrant', 'kid', 'lock', 'reason', 'save', 'childhood', 'freethekid', 'put', 'childfriendli', 'hous']","['know', 'committed', 'keeping', 'kids', 'greece', 'healthy', 'amp', 'safe', 'covid19', 'hundreds', 'migrant', 'kids', 'locked', 'reason', 'save', 'childhoods', 'freethekids', 'put', 'childfriendly', 'housing']",5,Zambia
2020-04-18 11:53:02+00:00,1251478844822958081,It’s safe to say that no risk assessment was carried out during the decision making process. GRN knew people would rush to ATMs once they received their grant. Why weren’t social distancing measures put into place at ATMs? https://t.co/SSp1Wk3Qtf,MwahafarN,"Windhoek, Namibia ",1,0,0,0,NamTwitter News Anchor,3126,,its safe to say that no risk assessment was carried out during the decision making process grn knew people would rush to atms once they received their grant why werent social distancing measures put into place at atms,"['its', 'safe', 'to', 'say', 'that', 'no', 'risk', 'assessment', 'was', 'carried', 'out', 'during', 'the', 'decision', 'making', 'process', 'grn', 'knew', 'people', 'would', 'rush', 'to', 'atms', 'once', 'they', 'received', 'their', 'grant', 'why', 'werent', 'social', 'distancing', 'measures', 'put', 'into', 'place', 'at', 'atms']","['safe', 'say', 'risk', 'assessment', 'carried', 'decision', 'making', 'process', 'grn', 'knew', 'people', 'would', 'rush', 'atms', 'received', 'grant', 'werent', 'social', 'distancing', 'measures', 'put', 'place', 'atms']","['safe', 'say', 'risk', 'assess', 'carri', 'decis', 'make', 'process', 'grn', 'knew', 'peopl', 'would', 'rush', 'atm', 'receiv', 'grant', 'werent', 'social', 'distanc', 'measur', 'put', 'place', 'atm']","['safe', 'say', 'risk', 'assessment', 'carried', 'decision', 'making', 'process', 'grn', 'knew', 'people', 'would', 'rush', 'atms', 'received', 'grant', 'werent', 'social', 'distancing', 'measures', 'put', 'place', 'atms']",4,Zambia
2020-03-06 11:29:03+00:00,1235890128477917185,"Almighty. We pray for everyone across the globe, for safety as well as comfort amidst uncertainty and crisis. We ask for Your guidance and direction. We are completely reliant on You, especially during these challenging times. May we never take good health for granted. Aameen!",siddiksardar,Malawi,1,0,0,0,,208,,almighty we pray for everyone across the globe for safety as well as comfort amidst uncertainty and crisis we ask for your guidance and direction we are completely reliant on you especially during these challenging times may we never take good health for granted aameen,"['almighty', 'we', 'pray', 'for', 'everyone', 'across', 'the', 'globe', 'for', 'safety', 'as', 'well', 'as', 'comfort', 'amidst', 'uncertainty', 'and', 'crisis', 'we', 'ask', 'for', 'your', 'guidance', 'and', 'direction', 'we', 'are', 'completely', 'reliant', 'on', 'you', 'especially', 'during', 'these', 'challenging', 'times', 'may', 'we', 'never', 'take', 'good', 'health', 'for', 'granted', 'aameen']","['almighty', 'pray', 'everyone', 'across', 'globe', 'safety', 'well', 'comfort', 'amidst', 'uncertainty', 'crisis', 'ask', 'guidance', 'direction', 'completely', 'reliant', 'especially', 'challenging', 'times', 'may', 'never', 'take', 'good', 'health', 'granted', 'aameen']","['almighti', 'pray', 'everyon', 'across', 'globe', 'safeti', 'well', 'comfort', 'amidst', 'uncertainti', 'crisi', 'ask', 'guidanc', 'direct', 'complet', 'reliant', 'especi', 'challeng', 'time', 'may', 'never', 'take', 'good', 'health', 'grant', 'aameen']","['almighty', 'pray', 'everyone', 'across', 'globe', 'safety', 'well', 'comfort', 'amidst', 'uncertainty', 'crisis', 'ask', 'guidance', 'direction', 'completely', 'reliant', 'especially', 'challenging', 'times', 'may', 'never', 'take', 'good', 'health', 'granted', 'aameen']",5,Zambia
