Date,Id,Tweet,Username,Location,likeCount,replyCount,retweetCount,quoteCount,userDescription,userFollowers,hashtags,Cleaned_Tweet,Tweet_tokenized,Tweet_removed_stop_word,Tweet_stemmed,Tweet_lemmatized,sentiment,Country
2021-12-07 18:27:05+00:00,1468285953621979137,"Your donations &amp; this $50 000 donation from @Synergycu brings the total to $179 000 for The Health Foundation. #YLL 
https://t.co/lbaOeBWNk5 https://t.co/Kn6tQItsfa",Priceyfm,,19,0,6,0,"Luv the Riders, Habs, Blue Jays and Clowns that eat children.",1225,['YLL'],your donations amp this 50 000 donation from brings the total to 179 000 for the health foundation yll,"['your', 'donations', 'amp', 'this', '50', '000', 'donation', 'from', 'brings', 'the', 'total', 'to', '179', '000', 'for', 'the', 'health', 'foundation', 'yll']","['donations', 'amp', '50', '000', 'donation', 'brings', 'total', '179', '000', 'health', 'foundation', 'yll']","['donat', 'amp', '50', '000', 'donat', 'bring', 'total', '179', '000', 'health', 'foundat', 'yll']","['donations', 'amp', '50', '000', 'donation', 'brings', 'total', '179', '000', 'health', 'foundation', 'yll']",5,Canada
2021-12-05 05:36:48+00:00,1467367328597827584,Shut this shithole down! Fine them for their flagrant disregard for public health and safety rules.. and for goodness sake people..stop supporting this business 🤷‍♀️💉 https://t.co/RZlzgIPjXc,sunsetlover65,"Winnipeg, Manitoba",0,0,0,0,…mom.. wife.. nurse.. dog lover.. #lakelife,428,,shut this shithole down fine them for their flagrant disregard for public health and safety rules and for goodness sake peoplestop supporting this business,"['shut', 'this', 'shithole', 'down', 'fine', 'them', 'for', 'their', 'flagrant', 'disregard', 'for', 'public', 'health', 'and', 'safety', 'rules', 'and', 'for', 'goodness', 'sake', 'peoplestop', 'supporting', 'this', 'business']","['shut', 'shithole', 'fine', 'flagrant', 'disregard', 'public', 'health', 'safety', 'rules', 'goodness', 'sake', 'peoplestop', 'supporting', 'business']","['shut', 'shithol', 'fine', 'flagrant', 'disregard', 'public', 'health', 'safeti', 'rule', 'good', 'sake', 'peoplestop', 'support', 'busi']","['shut', 'shithole', 'fine', 'flagrant', 'disregard', 'public', 'health', 'safety', 'rules', 'goodness', 'sake', 'peoplestop', 'supporting', 'business']",5,Canada
2021-11-28 05:10:29+00:00,1464823991466557441,Also wanted to share this video of one of the indigenous programs that the #Movember foundation supports in Churchill. All donations go to help fund programs like this one helping indigenous men’s mental health. https://t.co/IBOQi1eRZB https://t.co/0H3Q5epHvM,BigPapiPegCity,"Winnipeg, MB",1,0,1,0,"I speak out against racism, bigotry and social injustice. Strong supporter of addictions treatment and recovery. Please support the Bruce Oake Recovery Centre.",1903,['Movember'],also wanted to share this video of one of the indigenous programs that the movember foundation supports in churchill all donations go to help fund programs like this one helping indigenous mens mental health,"['also', 'wanted', 'to', 'share', 'this', 'video', 'of', 'one', 'of', 'the', 'indigenous', 'programs', 'that', 'the', 'movember', 'foundation', 'supports', 'in', 'churchill', 'all', 'donations', 'go', 'to', 'help', 'fund', 'programs', 'like', 'this', 'one', 'helping', 'indigenous', 'mens', 'mental', 'health']","['also', 'wanted', 'share', 'video', 'one', 'indigenous', 'programs', 'movember', 'foundation', 'supports', 'churchill', 'donations', 'go', 'help', 'fund', 'programs', 'like', 'one', 'helping', 'indigenous', 'mens', 'mental', 'health']","['also', 'want', 'share', 'video', 'one', 'indigen', 'program', 'movemb', 'foundat', 'support', 'churchil', 'donat', 'go', 'help', 'fund', 'program', 'like', 'one', 'help', 'indigen', 'men', 'mental', 'health']","['also', 'wanted', 'share', 'video', 'one', 'indigenous', 'programs', 'movember', 'foundation', 'supports', 'churchill', 'donations', 'go', 'help', 'fund', 'programs', 'like', 'one', 'helping', 'indigenous', 'mens', 'mental', 'health']",1,Canada
2021-11-23 19:57:18+00:00,1463235228978143237,McMan will use donations from Giving Tuesday to ensure access to much needed mental health and wellness services. @GivingTuesdayCa,McManCalgary,"Calgary, Alberta",0,0,0,0,"McMan Youth, Family and Community Services of Calgary & Area delivers more than 20 programs that evoke positive changes and improve the quality of our community",1735,,mcman will use donations from giving tuesday to ensure access to much needed mental health and wellness services,"['mcman', 'will', 'use', 'donations', 'from', 'giving', 'tuesday', 'to', 'ensure', 'access', 'to', 'much', 'needed', 'mental', 'health', 'and', 'wellness', 'services']","['mcman', 'use', 'donations', 'giving', 'tuesday', 'ensure', 'access', 'much', 'needed', 'mental', 'health', 'wellness', 'services']","['mcman', 'use', 'donat', 'give', 'tuesday', 'ensur', 'access', 'much', 'need', 'mental', 'health', 'well', 'servic']","['mcman', 'use', 'donations', 'giving', 'tuesday', 'ensure', 'access', 'much', 'needed', 'mental', 'health', 'wellness', 'services']",5,Canada
2021-11-22 15:47:05+00:00,1462809869749215232,Hey a North Dakota Department of Agriculture.  You Soil Health Cover Crop Grant Program make no sense. Rec. Post harvest seeded in Sept. But has to be done in August? https://t.co/J64kMIxTqD,Pness03,"Sharon, ND    aka Beaver Creek",8,0,0,0,"Sharon, ND
Owner operator of Ness Farms.
snapchat: pness03
TikTok: @nessfarms03
Insta: pete.ness.16",4493,,hey a north dakota department of agriculture you soil health cover crop grant program make no sense rec post harvest seeded in sept but has to be done in august,"['hey', 'a', 'north', 'dakota', 'department', 'of', 'agriculture', 'you', 'soil', 'health', 'cover', 'crop', 'grant', 'program', 'make', 'no', 'sense', 'rec', 'post', 'harvest', 'seeded', 'in', 'sept', 'but', 'has', 'to', 'be', 'done', 'in', 'august']","['hey', 'north', 'dakota', 'department', 'agriculture', 'soil', 'health', 'cover', 'crop', 'grant', 'program', 'make', 'sense', 'rec', 'post', 'harvest', 'seeded', 'sept', 'done', 'august']","['hey', 'north', 'dakota', 'depart', 'agricultur', 'soil', 'health', 'cover', 'crop', 'grant', 'program', 'make', 'sens', 'rec', 'post', 'harvest', 'seed', 'sept', 'done', 'august']","['hey', 'north', 'dakota', 'department', 'agriculture', 'soil', 'health', 'cover', 'crop', 'grant', 'program', 'make', 'sense', 'rec', 'post', 'harvest', 'seeded', 'sept', 'done', 'august']",3,Canada
2021-11-18 22:47:31+00:00,1461466123623223299,"I have officially eclipsed my goal of $1500 with the awesome donation from @JoeDPea Thank you so much for your support! Remind me to give you a big hug when I see you next! Help me change the face of men’s health. Click on the link and donate today!    

https://t.co/Lft3LcKwvP https://t.co/H6rL3knocA",BigPapiPegCity,"Winnipeg, MB",8,1,0,0,"I speak out against racism, bigotry and social injustice. Strong supporter of addictions treatment and recovery. Please support the Bruce Oake Recovery Centre.",1903,,i have officially eclipsed my goal of 1500 with the awesome donation from thank you so much for your support remind me to give you a big hug when i see you next help me change the face of mens health click on the link and donate today,"['i', 'have', 'officially', 'eclipsed', 'my', 'goal', 'of', '1500', 'with', 'the', 'awesome', 'donation', 'from', 'thank', 'you', 'so', 'much', 'for', 'your', 'support', 'remind', 'me', 'to', 'give', 'you', 'a', 'big', 'hug', 'when', 'i', 'see', 'you', 'next', 'help', 'me', 'change', 'the', 'face', 'of', 'mens', 'health', 'click', 'on', 'the', 'link', 'and', 'donate', 'today']","['officially', 'eclipsed', 'goal', '1500', 'awesome', 'donation', 'thank', 'much', 'support', 'remind', 'give', 'big', 'hug', 'see', 'next', 'help', 'change', 'face', 'mens', 'health', 'click', 'link', 'donate', 'today']","['offici', 'eclips', 'goal', '1500', 'awesom', 'donat', 'thank', 'much', 'support', 'remind', 'give', 'big', 'hug', 'see', 'next', 'help', 'chang', 'face', 'men', 'health', 'click', 'link', 'donat', 'today']","['officially', 'eclipsed', 'goal', '1500', 'awesome', 'donation', 'thank', 'much', 'support', 'remind', 'give', 'big', 'hug', 'see', 'next', 'help', 'change', 'face', 'mens', 'health', 'click', 'link', 'donate', 'today']",5,Canada
2021-11-16 15:54:56+00:00,1460637517422772225,"If you’ve been considering training or development for your employees, now is the time!Retrain Manitoba offers grants to employers to train their employees, &amp; @InstituteLinks is eligible to provide training. We offer mental health, leadership training &amp; more. #training #manitoba https://t.co/8Hlu2dVhLZ",RpnMpn,"Brandon, Manitoba",3,0,1,0,"Founder & CEO LINKS Institute |Registered psychiatric nurse, PhD in Nursing student 🇦🇺",217,"['training', 'manitoba']",if youve been considering training or development for your employees now is the timeretrain manitoba offers grants to employers to train their employees amp is eligible to provide training we offer mental health leadership training amp more training manitoba,"['if', 'youve', 'been', 'considering', 'training', 'or', 'development', 'for', 'your', 'employees', 'now', 'is', 'the', 'timeretrain', 'manitoba', 'offers', 'grants', 'to', 'employers', 'to', 'train', 'their', 'employees', 'amp', 'is', 'eligible', 'to', 'provide', 'training', 'we', 'offer', 'mental', 'health', 'leadership', 'training', 'amp', 'more', 'training', 'manitoba']","['youve', 'considering', 'training', 'development', 'employees', 'timeretrain', 'manitoba', 'offers', 'grants', 'employers', 'train', 'employees', 'amp', 'eligible', 'provide', 'training', 'offer', 'mental', 'health', 'leadership', 'training', 'amp', 'training', 'manitoba']","['youv', 'consid', 'train', 'develop', 'employe', 'timeretrain', 'manitoba', 'offer', 'grant', 'employ', 'train', 'employe', 'amp', 'elig', 'provid', 'train', 'offer', 'mental', 'health', 'leadership', 'train', 'amp', 'train', 'manitoba']","['youve', 'considering', 'training', 'development', 'employees', 'timeretrain', 'manitoba', 'offers', 'grants', 'employers', 'train', 'employees', 'amp', 'eligible', 'provide', 'training', 'offer', 'mental', 'health', 'leadership', 'training', 'amp', 'training', 'manitoba']",4,Canada
2021-11-15 21:54:14+00:00,1460365552069791745,Help me change the face of men’s health this #Movember by making a donation to my moustache: https://t.co/3WggZ8d9OG @MovemberCA,RScottMckenzie,"Winnipeg, Manitoba",2,0,0,0,,136,['Movember'],help me change the face of mens health this movember by making a donation to my moustache,"['help', 'me', 'change', 'the', 'face', 'of', 'mens', 'health', 'this', 'movember', 'by', 'making', 'a', 'donation', 'to', 'my', 'moustache']","['help', 'change', 'face', 'mens', 'health', 'movember', 'making', 'donation', 'moustache']","['help', 'chang', 'face', 'men', 'health', 'movemb', 'make', 'donat', 'moustach']","['help', 'change', 'face', 'mens', 'health', 'movember', 'making', 'donation', 'moustache']",5,Canada
2021-11-03 14:23:24+00:00,1455903443403431937,"Day 3 and Monis growing and I have done cycling and running each day. Please donate to help change the face of Men's Health, too many men are afraid of their health be it mental or physical and ignore it all for too long.

https://t.co/uX5ChMIHpY",Pauljigger,"Calgary, Alberta",0,0,0,0,"I tweet about video games, beer, and my workouts, Cycling, running and aspiring to be a tri-athlete. He/Him",284,,day 3 and monis growing and i have done cycling and running each day please donate to help change the face of mens health too many men are afraid of their health be it mental or physical and ignore it all for too long,"['day', '3', 'and', 'monis', 'growing', 'and', 'i', 'have', 'done', 'cycling', 'and', 'running', 'each', 'day', 'please', 'donate', 'to', 'help', 'change', 'the', 'face', 'of', 'mens', 'health', 'too', 'many', 'men', 'are', 'afraid', 'of', 'their', 'health', 'be', 'it', 'mental', 'or', 'physical', 'and', 'ignore', 'it', 'all', 'for', 'too', 'long']","['day', '3', 'monis', 'growing', 'done', 'cycling', 'running', 'day', 'please', 'donate', 'help', 'change', 'face', 'mens', 'health', 'many', 'men', 'afraid', 'health', 'mental', 'physical', 'ignore', 'long']","['day', '3', 'moni', 'grow', 'done', 'cycl', 'run', 'day', 'pleas', 'donat', 'help', 'chang', 'face', 'men', 'health', 'mani', 'men', 'afraid', 'health', 'mental', 'physic', 'ignor', 'long']","['day', '3', 'monis', 'growing', 'done', 'cycling', 'running', 'day', 'please', 'donate', 'help', 'change', 'face', 'mens', 'health', 'many', 'men', 'afraid', 'health', 'mental', 'physical', 'ignore', 'long']",5,Canada
2021-10-13 18:25:08+00:00,1448354131622649863,"@ninianpoetree Many people who have never had to deal with underlying conditions don’t seem to think it could just as easily happen to them or their loved ones. They take their good health for granted, as though they earned it. It is a denial of our human vulnerability.",LHCowie,"Winnipeg, Manitoba",0,0,0,0,"Winnipeg School Division Library Manager, lover of reading, teller of tales, leaper into life #WinnipegSDLibraries @WSD_Libraries",1260,,many people who have never had to deal with underlying conditions dont seem to think it could just as easily happen to them or their loved ones they take their good health for granted as though they earned it it is a denial of our human vulnerability,"['many', 'people', 'who', 'have', 'never', 'had', 'to', 'deal', 'with', 'underlying', 'conditions', 'dont', 'seem', 'to', 'think', 'it', 'could', 'just', 'as', 'easily', 'happen', 'to', 'them', 'or', 'their', 'loved', 'ones', 'they', 'take', 'their', 'good', 'health', 'for', 'granted', 'as', 'though', 'they', 'earned', 'it', 'it', 'is', 'a', 'denial', 'of', 'our', 'human', 'vulnerability']","['many', 'people', 'never', 'deal', 'underlying', 'conditions', 'dont', 'seem', 'think', 'could', 'easily', 'happen', 'loved', 'ones', 'take', 'good', 'health', 'granted', 'though', 'earned', 'denial', 'human', 'vulnerability']","['mani', 'peopl', 'never', 'deal', 'underli', 'condit', 'dont', 'seem', 'think', 'could', 'easili', 'happen', 'love', 'one', 'take', 'good', 'health', 'grant', 'though', 'earn', 'denial', 'human', 'vulner']","['many', 'people', 'never', 'deal', 'underlying', 'conditions', 'dont', 'seem', 'think', 'could', 'easily', 'happen', 'loved', 'ones', 'take', 'good', 'health', 'granted', 'though', 'earned', 'denial', 'human', 'vulnerability']",1,Canada
2021-10-10 21:26:28+00:00,1447312603072667651,"@HounddogZenith We are so very sorry to learn of Z's passing Over the 🌈 Bridge. 

We have made a donation in his name to @BTBSK9Rescue a Senior Dog Rescue close to our home. They rescue + help find homes for senior dogs, some with health issues.

Miss you Z. Much love, hugs to your Mom. https://t.co/hygUO9rI9X",kimgal66,Winnipeg Manitoba ,9,2,1,0,"LOVE to help RESCUE dogs fr kill Shelters. Mom to Jess,Toby+Gabe

Ret. due to illness + disabled,
Corp Rad☢Safety Coord/ChargeTech/RSO 
Nuclear Med Technologist",1200,,we are so very sorry to learn of zs passing over the bridge we have made a donation in his name to a senior dog rescue close to our home they rescue help find homes for senior dogs some with health issues miss you z much love hugs to your mom,"['we', 'are', 'so', 'very', 'sorry', 'to', 'learn', 'of', 'zs', 'passing', 'over', 'the', 'bridge', 'we', 'have', 'made', 'a', 'donation', 'in', 'his', 'name', 'to', 'a', 'senior', 'dog', 'rescue', 'close', 'to', 'our', 'home', 'they', 'rescue', 'help', 'find', 'homes', 'for', 'senior', 'dogs', 'some', 'with', 'health', 'issues', 'miss', 'you', 'z', 'much', 'love', 'hugs', 'to', 'your', 'mom']","['sorry', 'learn', 'zs', 'passing', 'bridge', 'made', 'donation', 'name', 'senior', 'dog', 'rescue', 'close', 'home', 'rescue', 'help', 'find', 'homes', 'senior', 'dogs', 'health', 'issues', 'miss', 'z', 'much', 'love', 'hugs', 'mom']","['sorri', 'learn', 'zs', 'pass', 'bridg', 'made', 'donat', 'name', 'senior', 'dog', 'rescu', 'close', 'home', 'rescu', 'help', 'find', 'home', 'senior', 'dog', 'health', 'issu', 'miss', 'z', 'much', 'love', 'hug', 'mom']","['sorry', 'learn', 'zs', 'passing', 'bridge', 'made', 'donation', 'name', 'senior', 'dog', 'rescue', 'close', 'home', 'rescue', 'help', 'find', 'homes', 'senior', 'dogs', 'health', 'issues', 'miss', 'z', 'much', 'love', 'hugs', 'mom']",5,Canada
2021-09-28 16:44:40+00:00,1442893029371645953,"Since Health Minister @MerrimanPaul’s last public sighting over a month ago:
➡️ 13,052 people contracted COVID
➡️ 181 more people are in hospital
➡️ Active case load, tripled
➡️ Surgeries, cancelled
➡️ Organ donations, suspended
Real leaders don’t hide during a crisis.
#skpoli https://t.co/cnBN4FhxLA",Sask_NDP,"Saskatchewan, Canada",74,5,29,8,Putting People First | Official Opposition #skpoli | Led by: @RyanMeili,12557,['skpoli'],since health minister last public sighting over a month ago 13052 people contracted covid 181 more people are in hospital active case load tripled surgeries cancelled organ donations suspended real leaders dont hide during a crisis skpoli,"['since', 'health', 'minister', 'last', 'public', 'sighting', 'over', 'a', 'month', 'ago', '13052', 'people', 'contracted', 'covid', '181', 'more', 'people', 'are', 'in', 'hospital', 'active', 'case', 'load', 'tripled', 'surgeries', 'cancelled', 'organ', 'donations', 'suspended', 'real', 'leaders', 'dont', 'hide', 'during', 'a', 'crisis', 'skpoli']","['since', 'health', 'minister', 'last', 'public', 'sighting', 'month', 'ago', '13052', 'people', 'contracted', 'covid', '181', 'people', 'hospital', 'active', 'case', 'load', 'tripled', 'surgeries', 'cancelled', 'organ', 'donations', 'suspended', 'real', 'leaders', 'dont', 'hide', 'crisis', 'skpoli']","['sinc', 'health', 'minist', 'last', 'public', 'sight', 'month', 'ago', '13052', 'peopl', 'contract', 'covid', '181', 'peopl', 'hospit', 'activ', 'case', 'load', 'tripl', 'surgeri', 'cancel', 'organ', 'donat', 'suspend', 'real', 'leader', 'dont', 'hide', 'crisi', 'skpoli']","['since', 'health', 'minister', 'last', 'public', 'sighting', 'month', 'ago', '13052', 'people', 'contracted', 'covid', '181', 'people', 'hospital', 'active', 'case', 'load', 'tripled', 'surgeries', 'cancelled', 'organ', 'donations', 'suspended', 'real', 'leaders', 'dont', 'hide', 'crisis', 'skpoli']",1,Canada
2021-09-24 06:38:38+00:00,1441290965038157826,"I'm just really horrible at Twitter, but I hope my situation about Mental Health And Pregnant Immigrant Voting Rights brings awareness how immigrants are targeted and prosecuted by their mental health in Canada by the permit 👩...@TheAndySpears @danabrams @GMA",KrazyKoolCherry,"Bowling Green, Kentucky",0,0,0,0,I,60,,im just really horrible at twitter but i hope my situation about mental health and pregnant immigrant voting rights brings awareness how immigrants are targeted and prosecuted by their mental health in canada by the permit,"['im', 'just', 'really', 'horrible', 'at', 'twitter', 'but', 'i', 'hope', 'my', 'situation', 'about', 'mental', 'health', 'and', 'pregnant', 'immigrant', 'voting', 'rights', 'brings', 'awareness', 'how', 'immigrants', 'are', 'targeted', 'and', 'prosecuted', 'by', 'their', 'mental', 'health', 'in', 'canada', 'by', 'the', 'permit']","['im', 'really', 'horrible', 'twitter', 'hope', 'situation', 'mental', 'health', 'pregnant', 'immigrant', 'voting', 'rights', 'brings', 'awareness', 'immigrants', 'targeted', 'prosecuted', 'mental', 'health', 'canada', 'permit']","['im', 'realli', 'horribl', 'twitter', 'hope', 'situat', 'mental', 'health', 'pregnant', 'immigr', 'vote', 'right', 'bring', 'awar', 'immigr', 'target', 'prosecut', 'mental', 'health', 'canada', 'permit']","['im', 'really', 'horrible', 'twitter', 'hope', 'situation', 'mental', 'health', 'pregnant', 'immigrant', 'voting', 'rights', 'brings', 'awareness', 'immigrants', 'targeted', 'prosecuted', 'mental', 'health', 'canada', 'permit']",1,Canada
2021-09-09 15:09:58+00:00,1435983827206291460,"Second year in a row!! 🍪😋
We're excited to announce UWR and our friends @CMHARegina, @fam_service were chosen as the @TimHortons Smile Cookie campaign charity partners in #yqr again this year! We will work together to increase access to mental health supports. 
😊🍪 Sept 13-19. https://t.co/QvAxCsQPl9",UnitedWayRegina,Regina,8,0,6,1,"Working with you to move people from poverty to possibility, build a strong community & help kids be all they can be. #ShowYourLocalLove 💫",2356,['yqr'],second year in a row were excited to announce uwr and our friends were chosen as the smile cookie campaign charity partners in yqr again this year we will work together to increase access to mental health supports sept 1319,"['second', 'year', 'in', 'a', 'row', 'were', 'excited', 'to', 'announce', 'uwr', 'and', 'our', 'friends', 'were', 'chosen', 'as', 'the', 'smile', 'cookie', 'campaign', 'charity', 'partners', 'in', 'yqr', 'again', 'this', 'year', 'we', 'will', 'work', 'together', 'to', 'increase', 'access', 'to', 'mental', 'health', 'supports', 'sept', '1319']","['second', 'year', 'row', 'excited', 'announce', 'uwr', 'friends', 'chosen', 'smile', 'cookie', 'campaign', 'charity', 'partners', 'yqr', 'year', 'work', 'together', 'increase', 'access', 'mental', 'health', 'supports', 'sept', '1319']","['second', 'year', 'row', 'excit', 'announc', 'uwr', 'friend', 'chosen', 'smile', 'cooki', 'campaign', 'chariti', 'partner', 'yqr', 'year', 'work', 'togeth', 'increas', 'access', 'mental', 'health', 'support', 'sept', '1319']","['second', 'year', 'row', 'excited', 'announce', 'uwr', 'friends', 'chosen', 'smile', 'cookie', 'campaign', 'charity', 'partners', 'yqr', 'year', 'work', 'together', 'increase', 'access', 'mental', 'health', 'supports', 'sept', '1319']",5,Canada
2021-09-07 02:05:50+00:00,1435061720532209665,"@SteveScho54 @TomPark1n @AnnieClaireBO This is a completely different program. This is opioid for severe addicts. The high cost drug program is still at health ministers discretion to a max of 6b.  So what about the charity lies that forced rhe resignation of Butts and Morneau.
Corruption, blackface, etc.",ruttigert,"Edmonton, Alberta",0,0,0,0,,48,,this is a completely different program this is opioid for severe addicts the high cost drug program is still at health ministers discretion to a max of 6b so what about the charity lies that forced rhe resignation of butts and morneau corruption blackface etc,"['this', 'is', 'a', 'completely', 'different', 'program', 'this', 'is', 'opioid', 'for', 'severe', 'addicts', 'the', 'high', 'cost', 'drug', 'program', 'is', 'still', 'at', 'health', 'ministers', 'discretion', 'to', 'a', 'max', 'of', '6b', 'so', 'what', 'about', 'the', 'charity', 'lies', 'that', 'forced', 'rhe', 'resignation', 'of', 'butts', 'and', 'morneau', 'corruption', 'blackface', 'etc']","['completely', 'different', 'program', 'opioid', 'severe', 'addicts', 'high', 'cost', 'drug', 'program', 'still', 'health', 'ministers', 'discretion', 'max', '6b', 'charity', 'lies', 'forced', 'rhe', 'resignation', 'butts', 'morneau', 'corruption', 'blackface', 'etc']","['complet', 'differ', 'program', 'opioid', 'sever', 'addict', 'high', 'cost', 'drug', 'program', 'still', 'health', 'minist', 'discret', 'max', '6b', 'chariti', 'lie', 'forc', 'rhe', 'resign', 'butt', 'morneau', 'corrupt', 'blackfac', 'etc']","['completely', 'different', 'program', 'opioid', 'severe', 'addicts', 'high', 'cost', 'drug', 'program', 'still', 'health', 'ministers', 'discretion', 'max', '6b', 'charity', 'lies', 'forced', 'rhe', 'resignation', 'butts', 'morneau', 'corruption', 'blackface', 'etc']",1,Canada
2021-09-02 19:44:18+00:00,1433516151485566989,"@MTPCA awarded a 3-year fed Navigator grant to provide outreach &amp; enrollment for the Health Insurance Marketplace &amp; Medicaid. Interested?
Find the full descriptions here:
Navigator Manager: https://t.co/wOvKW3X462
Navigator: https://t.co/eSKFU5tETB",pagenei,Montana,0,0,0,0,Dreamer. Proud mama. Cancer fighting government relations director. Mountain girl doing her part to improve her great community and state. Tweets are my own.,854,,awarded a 3year fed navigator grant to provide outreach amp enrollment for the health insurance marketplace amp medicaid interested find the full descriptions here navigator manager navigator,"['awarded', 'a', '3year', 'fed', 'navigator', 'grant', 'to', 'provide', 'outreach', 'amp', 'enrollment', 'for', 'the', 'health', 'insurance', 'marketplace', 'amp', 'medicaid', 'interested', 'find', 'the', 'full', 'descriptions', 'here', 'navigator', 'manager', 'navigator']","['awarded', '3year', 'fed', 'navigator', 'grant', 'provide', 'outreach', 'amp', 'enrollment', 'health', 'insurance', 'marketplace', 'amp', 'medicaid', 'interested', 'find', 'full', 'descriptions', 'navigator', 'manager', 'navigator']","['award', '3year', 'fed', 'navig', 'grant', 'provid', 'outreach', 'amp', 'enrol', 'health', 'insur', 'marketplac', 'amp', 'medicaid', 'interest', 'find', 'full', 'descript', 'navig', 'manag', 'navig']","['awarded', '3year', 'fed', 'navigator', 'grant', 'provide', 'outreach', 'amp', 'enrollment', 'health', 'insurance', 'marketplace', 'amp', 'medicaid', 'interested', 'find', 'full', 'descriptions', 'navigator', 'manager', 'navigator']",4,Canada
