Date,Id,Tweet,Username,Location,likeCount,replyCount,retweetCount,quoteCount,userDescription,userFollowers,hashtags,Cleaned_Tweet,Tweet_tokenized,Tweet_removed_stop_word,Tweet_stemmed,Tweet_lemmatized,sentiment,Country
2021-10-12 12:35:57+00:00,1.447903868206076e+18,"Strong commitment from @Europarl_EN for brain health &amp; research – this is @CristianSBusoi’s key message to #EuropeanBrainSummit participants. #EU4Health, @HorizonEU &amp; others should ensure support for researchers &amp; innovators. #BIDays https://t.co/hT9UkP1wEi",JensJot,Brussels & Aachen,2.0,1.0,1.0,0.0,"Research 🧬, rainbows 🏳️‍🌈, realness 🌹🇪🇺. Health research policy @Helmholtz_EU. Prev.: @fz_juelich, @YaleCellBio. 🇩🇪🇺🇸🇮🇹🇫🇷🇧🇷 My views. He/him.",1084.0,"['EuropeanBrainSummit', 'EU4Health', 'BIDays']",strong commitment from for brain health amp research this is key message to europeanbrainsummit participants eu4health amp others should ensure support for researchers amp innovators bidays,"['strong', 'commitment', 'from', 'for', 'brain', 'health', 'amp', 'research', 'this', 'is', 'key', 'message', 'to', 'europeanbrainsummit', 'participants', 'eu4health', 'amp', 'others', 'should', 'ensure', 'support', 'for', 'researchers', 'amp', 'innovators', 'bidays']","['strong', 'commitment', 'brain', 'health', 'amp', 'research', 'key', 'message', 'europeanbrainsummit', 'participants', 'eu4health', 'amp', 'others', 'ensure', 'support', 'researchers', 'amp', 'innovators', 'bidays']","['strong', 'commit', 'brain', 'health', 'amp', 'research', 'key', 'messag', 'europeanbrainsummit', 'particip', 'eu4health', 'amp', 'other', 'ensur', 'support', 'research', 'amp', 'innov', 'biday']","['strong', 'commitment', 'brain', 'health', 'amp', 'research', 'key', 'message', 'europeanbrainsummit', 'participants', 'eu4health', 'amp', 'others', 'ensure', 'support', 'researchers', 'amp', 'innovators', 'bidays']",5,Netherlands
2021-10-09 05:41:50+00:00,1.446712489547346e+18,"#Health teams reached 11,347 people during the same six-week period with direct #medical assistance, including 9,170 out-patient consultations, 1,357 reproductive health consultations, more than 820 #psychosocial counselling sessions and #COVID19 screening for 394,600 travelers https://t.co/vlBcRMUCW1",SAIBI2001,"Brussel, België",0.0,0.0,0.0,0.0,"#Migration and #Asylum Program in #Europe 
...more rights...more humanity...",1182.0,"['Health', 'medical', 'psychosocial', 'COVID19']",health teams reached 11347 people during the same sixweek period with direct medical assistance including 9170 outpatient consultations 1357 reproductive health consultations more than 820 psychosocial counselling sessions and covid19 screening for 394600 travelers,"['health', 'teams', 'reached', '11347', 'people', 'during', 'the', 'same', 'sixweek', 'period', 'with', 'direct', 'medical', 'assistance', 'including', '9170', 'outpatient', 'consultations', '1357', 'reproductive', 'health', 'consultations', 'more', 'than', '820', 'psychosocial', 'counselling', 'sessions', 'and', 'covid19', 'screening', 'for', '394600', 'travelers']","['health', 'teams', 'reached', '11347', 'people', 'sixweek', 'period', 'direct', 'medical', 'assistance', 'including', '9170', 'outpatient', 'consultations', '1357', 'reproductive', 'health', 'consultations', '820', 'psychosocial', 'counselling', 'sessions', 'covid19', 'screening', '394600', 'travelers']","['health', 'team', 'reach', '11347', 'peopl', 'sixweek', 'period', 'direct', 'medic', 'assist', 'includ', '9170', 'outpati', 'consult', '1357', 'reproduct', 'health', 'consult', '820', 'psychosoci', 'counsel', 'session', 'covid19', 'screen', '394600', 'travel']","['health', 'teams', 'reached', '11347', 'people', 'sixweek', 'period', 'direct', 'medical', 'assistance', 'including', '9170', 'outpatient', 'consultations', '1357', 'reproductive', 'health', 'consultations', '820', 'psychosocial', 'counselling', 'sessions', 'covid19', 'screening', '394600', 'travelers']",5,Netherlands
2021-10-08 17:15:32+00:00,1.4465246766253752e+18,"Health teams reached 11,347 people during the same six-week period with direct #medical assistance, including 9,170 out-patient consultations, 1,357 reproductive #health consultations, more than 820 #psychosocial counselling sessions and #COVID19 screening for 394,600 travelers",SAIBI2001,"Brussel, België",0.0,0.0,0.0,0.0,"#Migration and #Asylum Program in #Europe 
...more rights...more humanity...",1182.0,"['medical', 'health', 'psychosocial', 'COVID19']",health teams reached 11347 people during the same sixweek period with direct medical assistance including 9170 outpatient consultations 1357 reproductive health consultations more than 820 psychosocial counselling sessions and covid19 screening for 394600 travelers,"['health', 'teams', 'reached', '11347', 'people', 'during', 'the', 'same', 'sixweek', 'period', 'with', 'direct', 'medical', 'assistance', 'including', '9170', 'outpatient', 'consultations', '1357', 'reproductive', 'health', 'consultations', 'more', 'than', '820', 'psychosocial', 'counselling', 'sessions', 'and', 'covid19', 'screening', 'for', '394600', 'travelers']","['health', 'teams', 'reached', '11347', 'people', 'sixweek', 'period', 'direct', 'medical', 'assistance', 'including', '9170', 'outpatient', 'consultations', '1357', 'reproductive', 'health', 'consultations', '820', 'psychosocial', 'counselling', 'sessions', 'covid19', 'screening', '394600', 'travelers']","['health', 'team', 'reach', '11347', 'peopl', 'sixweek', 'period', 'direct', 'medic', 'assist', 'includ', '9170', 'outpati', 'consult', '1357', 'reproduct', 'health', 'consult', '820', 'psychosoci', 'counsel', 'session', 'covid19', 'screen', '394600', 'travel']","['health', 'teams', 'reached', '11347', 'people', 'sixweek', 'period', 'direct', 'medical', 'assistance', 'including', '9170', 'outpatient', 'consultations', '1357', 'reproductive', 'health', 'consultations', '820', 'psychosocial', 'counselling', 'sessions', 'covid19', 'screening', '394600', 'travelers']",5,Netherlands
2021-10-05 10:03:03+00:00,1.445328673977082e+18,"Body MOT today with Ancora Health. Can't wait for the results to learn in depth more about my body and how to improve performance 🤓

https://t.co/nA48GPa2m9

10% discount available if you DM https://t.co/ezgmRdxlvO",SMcCallin,"Maidenhead, South East",3.0,0.0,0.0,0.0,"🇬🇧 GB Hockey Player ~
🥇🥉 Double Olympic Medalist ~
🥇European Champion ~ 
@stxfh @opromouthguards ~
See website for discount codes ⬇️",8466.0,,body mot today with ancora health cant wait for the results to learn in depth more about my body and how to improve performance 10 discount available if you dm,"['body', 'mot', 'today', 'with', 'ancora', 'health', 'cant', 'wait', 'for', 'the', 'results', 'to', 'learn', 'in', 'depth', 'more', 'about', 'my', 'body', 'and', 'how', 'to', 'improve', 'performance', '10', 'discount', 'available', 'if', 'you', 'dm']","['body', 'mot', 'today', 'ancora', 'health', 'cant', 'wait', 'results', 'learn', 'depth', 'body', 'improve', 'performance', '10', 'discount', 'available', 'dm']","['bodi', 'mot', 'today', 'ancora', 'health', 'cant', 'wait', 'result', 'learn', 'depth', 'bodi', 'improv', 'perform', '10', 'discount', 'avail', 'dm']","['body', 'mot', 'today', 'ancora', 'health', 'cant', 'wait', 'results', 'learn', 'depth', 'body', 'improve', 'performance', '10', 'discount', 'available', 'dm']",5,Netherlands
2021-10-02 10:14:27+00:00,1.4442443814275113e+18,"Good morning Amsterdam!☀️🇳🇱 Just last week, The Netherlands lifted the mandatory quarantine for travelers from very high risk areas (including the US), as long as you have your Covid vaccine, a negative PCR test taken 48 hours before arrival, and the health declaration forms. https://t.co/vF4EUmhVVV",cheryltiu,Miami🇺🇸 + Manila🇵🇭,18.0,3.0,1.0,0.0,"Media + Events + Consultancy | World’s 50 Best Restaurants Tastehunter | Writer: Forbes, CNN Travel, Infatuation, Philippine Star | Co-Founder: Proclamation Gin",11218.0,,good morning amsterdam just last week the netherlands lifted the mandatory quarantine for travelers from very high risk areas including the us as long as you have your covid vaccine a negative pcr test taken 48 hours before arrival and the health declaration forms,"['good', 'morning', 'amsterdam', 'just', 'last', 'week', 'the', 'netherlands', 'lifted', 'the', 'mandatory', 'quarantine', 'for', 'travelers', 'from', 'very', 'high', 'risk', 'areas', 'including', 'the', 'us', 'as', 'long', 'as', 'you', 'have', 'your', 'covid', 'vaccine', 'a', 'negative', 'pcr', 'test', 'taken', '48', 'hours', 'before', 'arrival', 'and', 'the', 'health', 'declaration', 'forms']","['good', 'morning', 'amsterdam', 'last', 'week', 'netherlands', 'lifted', 'mandatory', 'quarantine', 'travelers', 'high', 'risk', 'areas', 'including', 'us', 'long', 'covid', 'vaccine', 'negative', 'pcr', 'test', 'taken', '48', 'hours', 'arrival', 'health', 'declaration', 'forms']","['good', 'morn', 'amsterdam', 'last', 'week', 'netherland', 'lift', 'mandatori', 'quarantin', 'travel', 'high', 'risk', 'area', 'includ', 'us', 'long', 'covid', 'vaccin', 'neg', 'pcr', 'test', 'taken', '48', 'hour', 'arriv', 'health', 'declar', 'form']","['good', 'morning', 'amsterdam', 'last', 'week', 'netherlands', 'lifted', 'mandatory', 'quarantine', 'travelers', 'high', 'risk', 'areas', 'including', 'us', 'long', 'covid', 'vaccine', 'negative', 'pcr', 'test', 'taken', '48', 'hours', 'arrival', 'health', 'declaration', 'forms']",1,Netherlands
2021-09-25 10:27:25+00:00,1.4417109293899612e+18,"With Canada’s border now open to qualified travellers, it was a pleasure to be back in Europe working with our partners once again in person. Nice to see travel coming back with enhanced health and safety precautions in place. #yeg #aviation #airports #tourism https://t.co/P13dkxQ7hx",awarchola,"Edmonton, AB",9.0,0.0,0.0,0.0,All things #yeg #travel #airports #music 🇨🇦,377.0,"['yeg', 'aviation', 'airports', 'tourism']",with canadas border now open to qualified travellers it was a pleasure to be back in europe working with our partners once again in person nice to see travel coming back with enhanced health and safety precautions in place yeg aviation airports tourism,"['with', 'canadas', 'border', 'now', 'open', 'to', 'qualified', 'travellers', 'it', 'was', 'a', 'pleasure', 'to', 'be', 'back', 'in', 'europe', 'working', 'with', 'our', 'partners', 'once', 'again', 'in', 'person', 'nice', 'to', 'see', 'travel', 'coming', 'back', 'with', 'enhanced', 'health', 'and', 'safety', 'precautions', 'in', 'place', 'yeg', 'aviation', 'airports', 'tourism']","['canadas', 'border', 'open', 'qualified', 'travellers', 'pleasure', 'back', 'europe', 'working', 'partners', 'person', 'nice', 'see', 'travel', 'coming', 'back', 'enhanced', 'health', 'safety', 'precautions', 'place', 'yeg', 'aviation', 'airports', 'tourism']","['canada', 'border', 'open', 'qualifi', 'travel', 'pleasur', 'back', 'europ', 'work', 'partner', 'person', 'nice', 'see', 'travel', 'come', 'back', 'enhanc', 'health', 'safeti', 'precaut', 'place', 'yeg', 'aviat', 'airport', 'tourism']","['canadas', 'border', 'open', 'qualified', 'travellers', 'pleasure', 'back', 'europe', 'working', 'partners', 'person', 'nice', 'see', 'travel', 'coming', 'back', 'enhanced', 'health', 'safety', 'precautions', 'place', 'yeg', 'aviation', 'airports', 'tourism']",5,Netherlands
2021-09-09 07:55:38+00:00,1.4358745246339643e+18,"♻️🇪🇺NEW arriving ✍🏻#CAP #EUFarm2Fork Basically choose to #consume #fresh #eco #local products. As well as rewarding your health, you will be helping to support many families who make a living from the countryside. 

Their effort deserves your choice 🙌💚🇪🇺 https://t.co/XyVBid04eX",cristinatavio,"Bruselas, Bélgica",1.0,1.0,0.0,0.0,"Expert in Public Policy & Funding. Ongoing Doctoral Student. Passionate connecting talent, innovating in social, green, blue & digital sustainability. 🇪🇺by💚",10045.0,"['CAP', 'EUFarm2Fork', 'consume', 'fresh', 'eco', 'local']",new arriving cap eufarm2fork basically choose to consume fresh eco local products as well as rewarding your health you will be helping to support many families who make a living from the countryside their effort deserves your choice,"['new', 'arriving', 'cap', 'eufarm2fork', 'basically', 'choose', 'to', 'consume', 'fresh', 'eco', 'local', 'products', 'as', 'well', 'as', 'rewarding', 'your', 'health', 'you', 'will', 'be', 'helping', 'to', 'support', 'many', 'families', 'who', 'make', 'a', 'living', 'from', 'the', 'countryside', 'their', 'effort', 'deserves', 'your', 'choice']","['new', 'arriving', 'cap', 'eufarm2fork', 'basically', 'choose', 'consume', 'fresh', 'eco', 'local', 'products', 'well', 'rewarding', 'health', 'helping', 'support', 'many', 'families', 'make', 'living', 'countryside', 'effort', 'deserves', 'choice']","['new', 'arriv', 'cap', 'eufarm2fork', 'basic', 'choos', 'consum', 'fresh', 'eco', 'local', 'product', 'well', 'reward', 'health', 'help', 'support', 'mani', 'famili', 'make', 'live', 'countrysid', 'effort', 'deserv', 'choic']","['new', 'arriving', 'cap', 'eufarm2fork', 'basically', 'choose', 'consume', 'fresh', 'eco', 'local', 'products', 'well', 'rewarding', 'health', 'helping', 'support', 'many', 'families', 'make', 'living', 'countryside', 'effort', 'deserves', 'choice']",5,Netherlands
2021-08-12 08:39:06+00:00,1.4257386027980636e+18,Today (UN declared) international youth day (12 August). On this day Dutch politicians are on holidays and for the next weeks too. Nevermind long waitinglists for youthcare and mental health facilities.This can wait for them. We need politicians who really care!!,dr_veerman,Nederland,1.0,0.0,0.0,0.0,Psychologist and expert of children's rights,1166.0,,today un declared international youth day 12 august on this day dutch politicians are on holidays and for the next weeks too nevermind long waitinglists for youthcare and mental health facilitiesthis can wait for them we need politicians who really care,"['today', 'un', 'declared', 'international', 'youth', 'day', '12', 'august', 'on', 'this', 'day', 'dutch', 'politicians', 'are', 'on', 'holidays', 'and', 'for', 'the', 'next', 'weeks', 'too', 'nevermind', 'long', 'waitinglists', 'for', 'youthcare', 'and', 'mental', 'health', 'facilitiesthis', 'can', 'wait', 'for', 'them', 'we', 'need', 'politicians', 'who', 'really', 'care']","['today', 'un', 'declared', 'international', 'youth', 'day', '12', 'august', 'day', 'dutch', 'politicians', 'holidays', 'next', 'weeks', 'nevermind', 'long', 'waitinglists', 'youthcare', 'mental', 'health', 'facilitiesthis', 'wait', 'need', 'politicians', 'really', 'care']","['today', 'un', 'declar', 'intern', 'youth', 'day', '12', 'august', 'day', 'dutch', 'politician', 'holiday', 'next', 'week', 'nevermind', 'long', 'waitinglist', 'youthcar', 'mental', 'health', 'facilitiesthi', 'wait', 'need', 'politician', 'realli', 'care']","['today', 'un', 'declared', 'international', 'youth', 'day', '12', 'august', 'day', 'dutch', 'politicians', 'holidays', 'next', 'weeks', 'nevermind', 'long', 'waitinglists', 'youthcare', 'mental', 'health', 'facilitiesthis', 'wait', 'need', 'politicians', 'really', 'care']",1,Netherlands
2021-08-05 17:35:13+00:00,1.4233368055298007e+18,"If anyone could please help us out! Health and tax bills came unexpected and my insurance didn't cover it all 😭
Have some food left but not enough until the 20th....when my allowance comes in again.
Any help/RTs are greatly appreciated! https://t.co/efekHk6F9C",PlaystationPixy,Netherlands,6.0,4.0,3.0,1.0,"She/her - I ♥ gaming, music, movies and TV series 😁
This is my adventures Tweet zone! 🇳🇱 🕊 🇺🇦
#ActuallyAutistic 💪🏻
🎮 PlaystationPixy on Twitch 🎮",4653.0,,if anyone could please help us out health and tax bills came unexpected and my insurance didnt cover it all have some food left but not enough until the 20thwhen my allowance comes in again any helprts are greatly appreciated,"['if', 'anyone', 'could', 'please', 'help', 'us', 'out', 'health', 'and', 'tax', 'bills', 'came', 'unexpected', 'and', 'my', 'insurance', 'didnt', 'cover', 'it', 'all', 'have', 'some', 'food', 'left', 'but', 'not', 'enough', 'until', 'the', '20thwhen', 'my', 'allowance', 'comes', 'in', 'again', 'any', 'helprts', 'are', 'greatly', 'appreciated']","['anyone', 'could', 'please', 'help', 'us', 'health', 'tax', 'bills', 'came', 'unexpected', 'insurance', 'didnt', 'cover', 'food', 'left', 'enough', '20thwhen', 'allowance', 'comes', 'helprts', 'greatly', 'appreciated']","['anyon', 'could', 'pleas', 'help', 'us', 'health', 'tax', 'bill', 'came', 'unexpect', 'insur', 'didnt', 'cover', 'food', 'left', 'enough', '20thwhen', 'allow', 'come', 'helprt', 'greatli', 'appreci']","['anyone', 'could', 'please', 'help', 'us', 'health', 'tax', 'bills', 'came', 'unexpected', 'insurance', 'didnt', 'cover', 'food', 'left', 'enough', '20thwhen', 'allowance', 'comes', 'helprts', 'greatly', 'appreciated']",2,Netherlands
2021-07-12 14:21:25+00:00,1.4145907272885084e+18,"Is there any course on designing cool public health related communication tools/ templates? Flyers, posters, videos? 
It’s important to pass a cool looking #OneHealth message as well! https://t.co/3WaRPi0Net",irt_interest,Belgique,0.0,0.0,0.0,0.0,🇫🇷🇬🇧 Co-constructing opportunities for One Health/ Global Health education 🐾🖐🍃 Insta: @ inte.res.t,397.0,['OneHealth'],is there any course on designing cool public health related communication tools templates flyers posters videos its important to pass a cool looking onehealth message as well,"['is', 'there', 'any', 'course', 'on', 'designing', 'cool', 'public', 'health', 'related', 'communication', 'tools', 'templates', 'flyers', 'posters', 'videos', 'its', 'important', 'to', 'pass', 'a', 'cool', 'looking', 'onehealth', 'message', 'as', 'well']","['course', 'designing', 'cool', 'public', 'health', 'related', 'communication', 'tools', 'templates', 'flyers', 'posters', 'videos', 'important', 'pass', 'cool', 'looking', 'onehealth', 'message', 'well']","['cours', 'design', 'cool', 'public', 'health', 'relat', 'commun', 'tool', 'templat', 'flyer', 'poster', 'video', 'import', 'pass', 'cool', 'look', 'onehealth', 'messag', 'well']","['course', 'designing', 'cool', 'public', 'health', 'related', 'communication', 'tools', 'templates', 'flyers', 'posters', 'videos', 'important', 'pass', 'cool', 'looking', 'onehealth', 'message', 'well']",4,Netherlands
2021-06-20 08:12:41+00:00,1.4065253988763156e+18,"@drDendere I guess it’s an act of balance. As they say here, it’s a capitalist country with a social heart. Health Insurance is approx €110 p.p but can rise depending on add ons like specialist dental or eye care. Kids just fall under parent fee. Travel cost - free 0-4 &amp; 4-12 yrs on trains",Kayceeremo,"Amsterdam, Netherlands",0.0,0.0,0.0,0.0,"Founder: Afriagromarketer |From #Chiwundura |#Media #AdTech |#nature, #brick & #mortar #Agripreneur |Travel Lover |Sports & fitness fan |V&O R mine 🇿🇼🇿🇦🇳🇱",526.0,,i guess its an act of balance as they say here its a capitalist country with a social heart health insurance is approx 110 pp but can rise depending on add ons like specialist dental or eye care kids just fall under parent fee travel cost free 04 amp 412 yrs on trains,"['i', 'guess', 'its', 'an', 'act', 'of', 'balance', 'as', 'they', 'say', 'here', 'its', 'a', 'capitalist', 'country', 'with', 'a', 'social', 'heart', 'health', 'insurance', 'is', 'approx', '110', 'pp', 'but', 'can', 'rise', 'depending', 'on', 'add', 'ons', 'like', 'specialist', 'dental', 'or', 'eye', 'care', 'kids', 'just', 'fall', 'under', 'parent', 'fee', 'travel', 'cost', 'free', '04', 'amp', '412', 'yrs', 'on', 'trains']","['guess', 'act', 'balance', 'say', 'capitalist', 'country', 'social', 'heart', 'health', 'insurance', 'approx', '110', 'pp', 'rise', 'depending', 'add', 'ons', 'like', 'specialist', 'dental', 'eye', 'care', 'kids', 'fall', 'parent', 'fee', 'travel', 'cost', 'free', '04', 'amp', '412', 'yrs', 'trains']","['guess', 'act', 'balanc', 'say', 'capitalist', 'countri', 'social', 'heart', 'health', 'insur', 'approx', '110', 'pp', 'rise', 'depend', 'add', 'on', 'like', 'specialist', 'dental', 'eye', 'care', 'kid', 'fall', 'parent', 'fee', 'travel', 'cost', 'free', '04', 'amp', '412', 'yr', 'train']","['guess', 'act', 'balance', 'say', 'capitalist', 'country', 'social', 'heart', 'health', 'insurance', 'approx', '110', 'pp', 'rise', 'depending', 'add', 'ons', 'like', 'specialist', 'dental', 'eye', 'care', 'kids', 'fall', 'parent', 'fee', 'travel', 'cost', 'free', '04', 'amp', '412', 'yrs', 'trains']",3,Netherlands
2021-06-13 11:01:32+00:00,1.404031176130564e+18,"When we planned we kept in mind that people don’t start riding because of travel time savings. They start riding for health, for enjoyment and/or to save costs. Attractive, quiet and safe surroundings are crucial; with as less stops as possible as wel. No rider likes to stop ;)",Sjoess,"Nijmegen, Nederland",15.0,0.0,3.0,1.0,Advisor cycling and mobility | sustainable mobility | Cycling | Royal HaskoningDHV | Spatial planning | Velo-city 2017 | Personal title,2347.0,,when we planned we kept in mind that people dont start riding because of travel time savings they start riding for health for enjoyment andor to save costs attractive quiet and safe surroundings are crucial with as less stops as possible as wel no rider likes to stop,"['when', 'we', 'planned', 'we', 'kept', 'in', 'mind', 'that', 'people', 'dont', 'start', 'riding', 'because', 'of', 'travel', 'time', 'savings', 'they', 'start', 'riding', 'for', 'health', 'for', 'enjoyment', 'andor', 'to', 'save', 'costs', 'attractive', 'quiet', 'and', 'safe', 'surroundings', 'are', 'crucial', 'with', 'as', 'less', 'stops', 'as', 'possible', 'as', 'wel', 'no', 'rider', 'likes', 'to', 'stop']","['planned', 'kept', 'mind', 'people', 'dont', 'start', 'riding', 'travel', 'time', 'savings', 'start', 'riding', 'health', 'enjoyment', 'andor', 'save', 'costs', 'attractive', 'quiet', 'safe', 'surroundings', 'crucial', 'less', 'stops', 'possible', 'wel', 'rider', 'likes', 'stop']","['plan', 'kept', 'mind', 'peopl', 'dont', 'start', 'ride', 'travel', 'time', 'save', 'start', 'ride', 'health', 'enjoy', 'andor', 'save', 'cost', 'attract', 'quiet', 'safe', 'surround', 'crucial', 'less', 'stop', 'possibl', 'wel', 'rider', 'like', 'stop']","['planned', 'kept', 'mind', 'people', 'dont', 'start', 'riding', 'travel', 'time', 'savings', 'start', 'riding', 'health', 'enjoyment', 'andor', 'save', 'costs', 'attractive', 'quiet', 'safe', 'surroundings', 'crucial', 'less', 'stops', 'possible', 'wel', 'rider', 'likes', 'stop']",4,Netherlands
2021-06-10 19:06:40+00:00,1.403066101051822e+18,"Aid is not the greatest solution to the current health problems in poor countries, but it can make a difference when fairly distributed. Unfortunately, the current global aid architecture rewards failure. I will explain why I think it does!",degujerene,"The Hague, The Netherlands",0.0,0.0,0.0,0.0,Global health myth-buster,110.0,,aid is not the greatest solution to the current health problems in poor countries but it can make a difference when fairly distributed unfortunately the current global aid architecture rewards failure i will explain why i think it does,"['aid', 'is', 'not', 'the', 'greatest', 'solution', 'to', 'the', 'current', 'health', 'problems', 'in', 'poor', 'countries', 'but', 'it', 'can', 'make', 'a', 'difference', 'when', 'fairly', 'distributed', 'unfortunately', 'the', 'current', 'global', 'aid', 'architecture', 'rewards', 'failure', 'i', 'will', 'explain', 'why', 'i', 'think', 'it', 'does']","['aid', 'greatest', 'solution', 'current', 'health', 'problems', 'poor', 'countries', 'make', 'difference', 'fairly', 'distributed', 'unfortunately', 'current', 'global', 'aid', 'architecture', 'rewards', 'failure', 'explain', 'think']","['aid', 'greatest', 'solut', 'current', 'health', 'problem', 'poor', 'countri', 'make', 'differ', 'fairli', 'distribut', 'unfortun', 'current', 'global', 'aid', 'architectur', 'reward', 'failur', 'explain', 'think']","['aid', 'greatest', 'solution', 'current', 'health', 'problems', 'poor', 'countries', 'make', 'difference', 'fairly', 'distributed', 'unfortunately', 'current', 'global', 'aid', 'architecture', 'rewards', 'failure', 'explain', 'think']",3,Netherlands
