Date,Id,Tweet,Username,Location,likeCount,replyCount,retweetCount,quoteCount,userDescription,userFollowers,hashtags,Cleaned_Tweet,Tweet_tokenized,Tweet_removed_stop_word,Tweet_stemmed,Tweet_lemmatized,sentiment,Country
2022-06-03 20:49:57+00:00,1.532826947541254e+18,"@srrappoccio Basic worker's rights - or is this yet another email?
I don't find it an easy discussion. CERN holidays are often not matching other countries' holidays. What is CERN's special place in this? Oh the other hand, a race to the bottom is on no-one's benefit...",StevenLowette,"Brussels, Belgium",3.0,0.0,0.0,0.0,Dark Matter explorer since over a decade. Research prof at VUB on the CMS and milliQan experiments at CERN.,1114.0,,basic workers rights or is this yet another email i dont find it an easy discussion cern holidays are often not matching other countries holidays what is cerns special place in this oh the other hand a race to the bottom is on noones benefit,"['basic', 'workers', 'rights', 'or', 'is', 'this', 'yet', 'another', 'email', 'i', 'dont', 'find', 'it', 'an', 'easy', 'discussion', 'cern', 'holidays', 'are', 'often', 'not', 'matching', 'other', 'countries', 'holidays', 'what', 'is', 'cerns', 'special', 'place', 'in', 'this', 'oh', 'the', 'other', 'hand', 'a', 'race', 'to', 'the', 'bottom', 'is', 'on', 'noones', 'benefit']","['basic', 'workers', 'rights', 'yet', 'another', 'email', 'dont', 'find', 'easy', 'discussion', 'cern', 'holidays', 'often', 'matching', 'countries', 'holidays', 'cerns', 'special', 'place', 'oh', 'hand', 'race', 'bottom', 'noones', 'benefit']","['basic', 'worker', 'right', 'yet', 'anoth', 'email', 'dont', 'find', 'easi', 'discuss', 'cern', 'holiday', 'often', 'match', 'countri', 'holiday', 'cern', 'special', 'place', 'oh', 'hand', 'race', 'bottom', 'noon', 'benefit']","['basic', 'workers', 'rights', 'yet', 'another', 'email', 'dont', 'find', 'easy', 'discussion', 'cern', 'holidays', 'often', 'matching', 'countries', 'holidays', 'cerns', 'special', 'place', 'oh', 'hand', 'race', 'bottom', 'noones', 'benefit']",3,Netherlands
2022-06-03 20:49:57+00:00,1.532826947541254e+18,"@srrappoccio Basic worker's rights - or is this yet another email?
I don't find it an easy discussion. CERN holidays are often not matching other countries' holidays. What is CERN's special place in this? Oh the other hand, a race to the bottom is on no-one's benefit...",StevenLowette,"Brussels, Belgium",3.0,0.0,0.0,0.0,Dark Matter explorer since over a decade. Research prof at VUB on the CMS and milliQan experiments at CERN.,1114.0,,basic workers rights or is this yet another email i dont find it an easy discussion cern holidays are often not matching other countries holidays what is cerns special place in this oh the other hand a race to the bottom is on noones benefit,"['basic', 'workers', 'rights', 'or', 'is', 'this', 'yet', 'another', 'email', 'i', 'dont', 'find', 'it', 'an', 'easy', 'discussion', 'cern', 'holidays', 'are', 'often', 'not', 'matching', 'other', 'countries', 'holidays', 'what', 'is', 'cerns', 'special', 'place', 'in', 'this', 'oh', 'the', 'other', 'hand', 'a', 'race', 'to', 'the', 'bottom', 'is', 'on', 'noones', 'benefit']","['basic', 'workers', 'rights', 'yet', 'another', 'email', 'dont', 'find', 'easy', 'discussion', 'cern', 'holidays', 'often', 'matching', 'countries', 'holidays', 'cerns', 'special', 'place', 'oh', 'hand', 'race', 'bottom', 'noones', 'benefit']","['basic', 'worker', 'right', 'yet', 'anoth', 'email', 'dont', 'find', 'easi', 'discuss', 'cern', 'holiday', 'often', 'match', 'countri', 'holiday', 'cern', 'special', 'place', 'oh', 'hand', 'race', 'bottom', 'noon', 'benefit']","['basic', 'workers', 'rights', 'yet', 'another', 'email', 'dont', 'find', 'easy', 'discussion', 'cern', 'holidays', 'often', 'matching', 'countries', 'holidays', 'cerns', 'special', 'place', 'oh', 'hand', 'race', 'bottom', 'noones', 'benefit']",3,Netherlands
2022-06-02 13:52:59+00:00,1.532359626011947e+18,"EFG partners with @HNatSummit 2022, the online global summit on natural #hydrogen. As a partner of the event, members of our National Associations and EurGeol title holders can benefit from a special discount of 30%! ➡️ https://t.co/MYpcvvu4mr https://t.co/cfKLwYxnst",EfgInfo,"Brussels, Belgium",2.0,0.0,1.0,0.0,EFG is the voice of #European Geologists. #NGO representing 27 national associations & 50.000 #geoscience #professionals. #EurGeol,2230.0,['hydrogen'],efg partners with 2022 the online global summit on natural hydrogen as a partner of the event members of our national associations and eurgeol title holders can benefit from a special discount of 30,"['efg', 'partners', 'with', '2022', 'the', 'online', 'global', 'summit', 'on', 'natural', 'hydrogen', 'as', 'a', 'partner', 'of', 'the', 'event', 'members', 'of', 'our', 'national', 'associations', 'and', 'eurgeol', 'title', 'holders', 'can', 'benefit', 'from', 'a', 'special', 'discount', 'of', '30']","['efg', 'partners', '2022', 'online', 'global', 'summit', 'natural', 'hydrogen', 'partner', 'event', 'members', 'national', 'associations', 'eurgeol', 'title', 'holders', 'benefit', 'special', 'discount', '30']","['efg', 'partner', '2022', 'onlin', 'global', 'summit', 'natur', 'hydrogen', 'partner', 'event', 'member', 'nation', 'associ', 'eurgeol', 'titl', 'holder', 'benefit', 'special', 'discount', '30']","['efg', 'partners', '2022', 'online', 'global', 'summit', 'natural', 'hydrogen', 'partner', 'event', 'members', 'national', 'associations', 'eurgeol', 'title', 'holders', 'benefit', 'special', 'discount', '30']",5,Netherlands
2022-06-02 12:43:34+00:00,1.532342158925103e+18,"""Nestlé's Income Accelerator Program is based on cash incentives that reward farmers not only for the quantity/quality of their cocoa but also for practices that benefit the environment &amp; local community. Our goal: help to close the living income gap for farmers."" - Darrell High https://t.co/3GWKqTwU7W",NestleEU,Brussels,0.0,1.0,0.0,0.0,News and information from the Nestlé Corporate Communications and ESG Engagement team for Europe. Tweets by Karel and Paolo.,6771.0,,nestls income accelerator program is based on cash incentives that reward farmers not only for the quantityquality of their cocoa but also for practices that benefit the environment amp local community our goal help to close the living income gap for farmers darrell high,"['nestls', 'income', 'accelerator', 'program', 'is', 'based', 'on', 'cash', 'incentives', 'that', 'reward', 'farmers', 'not', 'only', 'for', 'the', 'quantityquality', 'of', 'their', 'cocoa', 'but', 'also', 'for', 'practices', 'that', 'benefit', 'the', 'environment', 'amp', 'local', 'community', 'our', 'goal', 'help', 'to', 'close', 'the', 'living', 'income', 'gap', 'for', 'farmers', 'darrell', 'high']","['nestls', 'income', 'accelerator', 'program', 'based', 'cash', 'incentives', 'reward', 'farmers', 'quantityquality', 'cocoa', 'also', 'practices', 'benefit', 'environment', 'amp', 'local', 'community', 'goal', 'help', 'close', 'living', 'income', 'gap', 'farmers', 'darrell', 'high']","['nestl', 'incom', 'acceler', 'program', 'base', 'cash', 'incent', 'reward', 'farmer', 'quantityqu', 'cocoa', 'also', 'practic', 'benefit', 'environ', 'amp', 'local', 'commun', 'goal', 'help', 'close', 'live', 'incom', 'gap', 'farmer', 'darrel', 'high']","['nestls', 'income', 'accelerator', 'program', 'based', 'cash', 'incentives', 'reward', 'farmers', 'quantityquality', 'cocoa', 'also', 'practices', 'benefit', 'environment', 'amp', 'local', 'community', 'goal', 'help', 'close', 'living', 'income', 'gap', 'farmers', 'darrell', 'high']",4,Netherlands
2022-06-02 11:23:07+00:00,1.5323219133930575e+18,"Today in the #Stockholm50 event 'Action towards green and blue financing' with PACE Co-Chair @SvVeldhoven, leaders delivered a message of hope on funding green growth, with financing increasing, we need to ensure those worst impacted, benefit most. #GreenFinance https://t.co/GpcHYfVNbS",PACEcircular,"The Hague, Netherlands ",5.0,0.0,3.0,0.0,PACE is a global community of leaders working together to accelerate the transition to a #CircularEconomy. Created by @wef and now hosted by @WorldResources.,5884.0,"['Stockholm50', 'GreenFinance']",today in the stockholm50 event action towards green and blue financing with pace cochair leaders delivered a message of hope on funding green growth with financing increasing we need to ensure those worst impacted benefit most greenfinance,"['today', 'in', 'the', 'stockholm50', 'event', 'action', 'towards', 'green', 'and', 'blue', 'financing', 'with', 'pace', 'cochair', 'leaders', 'delivered', 'a', 'message', 'of', 'hope', 'on', 'funding', 'green', 'growth', 'with', 'financing', 'increasing', 'we', 'need', 'to', 'ensure', 'those', 'worst', 'impacted', 'benefit', 'most', 'greenfinance']","['today', 'stockholm50', 'event', 'action', 'towards', 'green', 'blue', 'financing', 'pace', 'cochair', 'leaders', 'delivered', 'message', 'hope', 'funding', 'green', 'growth', 'financing', 'increasing', 'need', 'ensure', 'worst', 'impacted', 'benefit', 'greenfinance']","['today', 'stockholm50', 'event', 'action', 'toward', 'green', 'blue', 'financ', 'pace', 'cochair', 'leader', 'deliv', 'messag', 'hope', 'fund', 'green', 'growth', 'financ', 'increas', 'need', 'ensur', 'worst', 'impact', 'benefit', 'greenfin']","['today', 'stockholm50', 'event', 'action', 'towards', 'green', 'blue', 'financing', 'pace', 'cochair', 'leaders', 'delivered', 'message', 'hope', 'funding', 'green', 'growth', 'financing', 'increasing', 'need', 'ensure', 'worst', 'impacted', 'benefit', 'greenfinance']",5,Netherlands
2022-06-02 07:16:08+00:00,1.5322597542774784e+18,"Thanks to an emergency mechanism triggered by the EU, Ukrainian refugees can legally live and work across the bloc. They are also entitled to the same benefits as Polish citizens: health insurance, free public education, a child allowance. https://t.co/jISw7vrPW8",aitorehm,"Brussels, Belgium",3.0,1.0,0.0,0.0,"Journalist covering cities at @POLITICOEurope. Formerly in Miami, Madrid, Lisbon, Rome; now in Brussels (but often elsewhere). 🔁≠👍 | 📧 ahernandez@politico.eu",10035.0,,thanks to an emergency mechanism triggered by the eu ukrainian refugees can legally live and work across the bloc they are also entitled to the same benefits as polish citizens health insurance free public education a child allowance,"['thanks', 'to', 'an', 'emergency', 'mechanism', 'triggered', 'by', 'the', 'eu', 'ukrainian', 'refugees', 'can', 'legally', 'live', 'and', 'work', 'across', 'the', 'bloc', 'they', 'are', 'also', 'entitled', 'to', 'the', 'same', 'benefits', 'as', 'polish', 'citizens', 'health', 'insurance', 'free', 'public', 'education', 'a', 'child', 'allowance']","['thanks', 'emergency', 'mechanism', 'triggered', 'eu', 'ukrainian', 'refugees', 'legally', 'live', 'work', 'across', 'bloc', 'also', 'entitled', 'benefits', 'polish', 'citizens', 'health', 'insurance', 'free', 'public', 'education', 'child', 'allowance']","['thank', 'emerg', 'mechan', 'trigger', 'eu', 'ukrainian', 'refuge', 'legal', 'live', 'work', 'across', 'bloc', 'also', 'entitl', 'benefit', 'polish', 'citizen', 'health', 'insur', 'free', 'public', 'educ', 'child', 'allow']","['thanks', 'emergency', 'mechanism', 'triggered', 'eu', 'ukrainian', 'refugees', 'legally', 'live', 'work', 'across', 'bloc', 'also', 'entitled', 'benefits', 'polish', 'citizens', 'health', 'insurance', 'free', 'public', 'education', 'child', 'allowance']",5,Netherlands
2022-05-30 14:52:25+00:00,1.5312874203055557e+18,"""... this assumption would ignore the well-documented nutritional benefits (of red meat)... if the current public health message is replaced by the message that any intake of red meat is harmful, this change will adversely affect iron deficiency anemia and maternal malnutrition.""",santonology,"Antwerp, Belgium",0.0,0.0,0.0,0.0,#ACMilan #LakeShow #RedSea,295.0,,this assumption would ignore the welldocumented nutritional benefits of red meat if the current public health message is replaced by the message that any intake of red meat is harmful this change will adversely affect iron deficiency anemia and maternal malnutrition,"['this', 'assumption', 'would', 'ignore', 'the', 'welldocumented', 'nutritional', 'benefits', 'of', 'red', 'meat', 'if', 'the', 'current', 'public', 'health', 'message', 'is', 'replaced', 'by', 'the', 'message', 'that', 'any', 'intake', 'of', 'red', 'meat', 'is', 'harmful', 'this', 'change', 'will', 'adversely', 'affect', 'iron', 'deficiency', 'anemia', 'and', 'maternal', 'malnutrition']","['assumption', 'would', 'ignore', 'welldocumented', 'nutritional', 'benefits', 'red', 'meat', 'current', 'public', 'health', 'message', 'replaced', 'message', 'intake', 'red', 'meat', 'harmful', 'change', 'adversely', 'affect', 'iron', 'deficiency', 'anemia', 'maternal', 'malnutrition']","['assumpt', 'would', 'ignor', 'welldocu', 'nutrit', 'benefit', 'red', 'meat', 'current', 'public', 'health', 'messag', 'replac', 'messag', 'intak', 'red', 'meat', 'harm', 'chang', 'advers', 'affect', 'iron', 'defici', 'anemia', 'matern', 'malnutrit']","['assumption', 'would', 'ignore', 'welldocumented', 'nutritional', 'benefits', 'red', 'meat', 'current', 'public', 'health', 'message', 'replaced', 'message', 'intake', 'red', 'meat', 'harmful', 'change', 'adversely', 'affect', 'iron', 'deficiency', 'anemia', 'maternal', 'malnutrition']",1,Netherlands
2022-05-29 06:54:37+00:00,1.5308047915254948e+18,"@AskRamiRustom @Evidentialism1 @mostlyreplies @BBrown24646528 @AlchemistNon (Just 'more' practical; looking at consequences etc)
Like when there's high costs and no return or any reward, people still care for their old dying parents, or sacrifice their lives in war for principle or people still to be born: no benefit when duty calls, but the right thing.",simonfrans,Wageningen,0.0,2.0,0.0,0.0,"echtgenoot & vader | 
ontwerper + ingenieur | 
recycling ♲ energie | 
geloof ✞ hoop | 
filosofie ~ politiek | 
taal } betekenis | 
leven = liefde",685.0,,just more practical looking at consequences etc like when theres high costs and no return or any reward people still care for their old dying parents or sacrifice their lives in war for principle or people still to be born no benefit when duty calls but the right thing,"['just', 'more', 'practical', 'looking', 'at', 'consequences', 'etc', 'like', 'when', 'theres', 'high', 'costs', 'and', 'no', 'return', 'or', 'any', 'reward', 'people', 'still', 'care', 'for', 'their', 'old', 'dying', 'parents', 'or', 'sacrifice', 'their', 'lives', 'in', 'war', 'for', 'principle', 'or', 'people', 'still', 'to', 'be', 'born', 'no', 'benefit', 'when', 'duty', 'calls', 'but', 'the', 'right', 'thing']","['practical', 'looking', 'consequences', 'etc', 'like', 'theres', 'high', 'costs', 'return', 'reward', 'people', 'still', 'care', 'old', 'dying', 'parents', 'sacrifice', 'lives', 'war', 'principle', 'people', 'still', 'born', 'benefit', 'duty', 'calls', 'right', 'thing']","['practic', 'look', 'consequ', 'etc', 'like', 'there', 'high', 'cost', 'return', 'reward', 'peopl', 'still', 'care', 'old', 'die', 'parent', 'sacrific', 'live', 'war', 'principl', 'peopl', 'still', 'born', 'benefit', 'duti', 'call', 'right', 'thing']","['practical', 'looking', 'consequences', 'etc', 'like', 'theres', 'high', 'costs', 'return', 'reward', 'people', 'still', 'care', 'old', 'dying', 'parents', 'sacrifice', 'lives', 'war', 'principle', 'people', 'still', 'born', 'benefit', 'duty', 'calls', 'right', 'thing']",4,Netherlands
2022-04-20 19:55:19+00:00,1.5168681316455014e+18,"@awjre @LeicsCountyBike Not to big up Labour too much, they are generally pretty hopeless at selling the benefits of active travel, climate mitigation and environmental/health policies, but still have done a damn sight more than those that hold the purse strings.",BlaiseKe11y,"Utrecht, Nederland",0.0,0.0,0.0,0.0,"AQ modelling, energy and R",103.0,,not to big up labour too much they are generally pretty hopeless at selling the benefits of active travel climate mitigation and environmentalhealth policies but still have done a damn sight more than those that hold the purse strings,"['not', 'to', 'big', 'up', 'labour', 'too', 'much', 'they', 'are', 'generally', 'pretty', 'hopeless', 'at', 'selling', 'the', 'benefits', 'of', 'active', 'travel', 'climate', 'mitigation', 'and', 'environmentalhealth', 'policies', 'but', 'still', 'have', 'done', 'a', 'damn', 'sight', 'more', 'than', 'those', 'that', 'hold', 'the', 'purse', 'strings']","['big', 'labour', 'much', 'generally', 'pretty', 'hopeless', 'selling', 'benefits', 'active', 'travel', 'climate', 'mitigation', 'environmentalhealth', 'policies', 'still', 'done', 'damn', 'sight', 'hold', 'purse', 'strings']","['big', 'labour', 'much', 'gener', 'pretti', 'hopeless', 'sell', 'benefit', 'activ', 'travel', 'climat', 'mitig', 'environmentalhealth', 'polici', 'still', 'done', 'damn', 'sight', 'hold', 'purs', 'string']","['big', 'labour', 'much', 'generally', 'pretty', 'hopeless', 'selling', 'benefits', 'active', 'travel', 'climate', 'mitigation', 'environmentalhealth', 'policies', 'still', 'done', 'damn', 'sight', 'hold', 'purse', 'strings']",3,Netherlands
2021-12-07 08:53:08+00:00,1.4681415157971558e+18,"@Antara_DasKumar @Leorkatz @bradpwyble @byronprecio @UAW5810 I also had benefits when I was a postdoc at Princeton. We actually got a very good health insurance, paid holidays and retirement benefits(ok that last one was not a huge amount but it was decent). The problem is that it’s not universal in the US and depends on where you work.",AleksBadura,"Amsterdam, The Netherlands",3.0,0.0,0.0,0.0,"Neuroscientist, Associate Professor at Erasmus MC, Show jumper at heart",617.0,,i also had benefits when i was a postdoc at princeton we actually got a very good health insurance paid holidays and retirement benefitsok that last one was not a huge amount but it was decent the problem is that its not universal in the us and depends on where you work,"['i', 'also', 'had', 'benefits', 'when', 'i', 'was', 'a', 'postdoc', 'at', 'princeton', 'we', 'actually', 'got', 'a', 'very', 'good', 'health', 'insurance', 'paid', 'holidays', 'and', 'retirement', 'benefitsok', 'that', 'last', 'one', 'was', 'not', 'a', 'huge', 'amount', 'but', 'it', 'was', 'decent', 'the', 'problem', 'is', 'that', 'its', 'not', 'universal', 'in', 'the', 'us', 'and', 'depends', 'on', 'where', 'you', 'work']","['also', 'benefits', 'postdoc', 'princeton', 'actually', 'got', 'good', 'health', 'insurance', 'paid', 'holidays', 'retirement', 'benefitsok', 'last', 'one', 'huge', 'amount', 'decent', 'problem', 'universal', 'us', 'depends', 'work']","['also', 'benefit', 'postdoc', 'princeton', 'actual', 'got', 'good', 'health', 'insur', 'paid', 'holiday', 'retir', 'benefitsok', 'last', 'one', 'huge', 'amount', 'decent', 'problem', 'univers', 'us', 'depend', 'work']","['also', 'benefits', 'postdoc', 'princeton', 'actually', 'got', 'good', 'health', 'insurance', 'paid', 'holidays', 'retirement', 'benefitsok', 'last', 'one', 'huge', 'amount', 'decent', 'problem', 'universal', 'us', 'depends', 'work']",3,Netherlands
2022-06-05 14:00:02+00:00,1.533448564038312e+18,"@willheim97 Vaclav Jurecka is a good striker. Going to Slavia as a free agent. Very high finishing probability with a small bonus of some passing game probability. Replacement value for Slovacko = €2,341,766. So undervalued player. RV for Slavia = €2,734,790. So nice catch for Slavia. https://t.co/he5bfcpyY1",JoostvanderLeij,"Amsterdam, NL",7.0,0.0,2.0,0.0,Philosopher applying Bayesian statistics to football (see: footballphilosophy.org - footballbehaviormanagement.com) Working for FC Twente. DM open for requests!,2610.0,,vaclav jurecka is a good striker going to slavia as a free agent very high finishing probability with a small bonus of some passing game probability replacement value for slovacko 2341766 so undervalued player rv for slavia 2734790 so nice catch for slavia,"['vaclav', 'jurecka', 'is', 'a', 'good', 'striker', 'going', 'to', 'slavia', 'as', 'a', 'free', 'agent', 'very', 'high', 'finishing', 'probability', 'with', 'a', 'small', 'bonus', 'of', 'some', 'passing', 'game', 'probability', 'replacement', 'value', 'for', 'slovacko', '2341766', 'so', 'undervalued', 'player', 'rv', 'for', 'slavia', '2734790', 'so', 'nice', 'catch', 'for', 'slavia']","['vaclav', 'jurecka', 'good', 'striker', 'going', 'slavia', 'free', 'agent', 'high', 'finishing', 'probability', 'small', 'bonus', 'passing', 'game', 'probability', 'replacement', 'value', 'slovacko', '2341766', 'undervalued', 'player', 'rv', 'slavia', '2734790', 'nice', 'catch', 'slavia']","['vaclav', 'jurecka', 'good', 'striker', 'go', 'slavia', 'free', 'agent', 'high', 'finish', 'probabl', 'small', 'bonu', 'pass', 'game', 'probabl', 'replac', 'valu', 'slovacko', '2341766', 'undervalu', 'player', 'rv', 'slavia', '2734790', 'nice', 'catch', 'slavia']","['vaclav', 'jurecka', 'good', 'striker', 'going', 'slavia', 'free', 'agent', 'high', 'finishing', 'probability', 'small', 'bonus', 'passing', 'game', 'probability', 'replacement', 'value', 'slovacko', '2341766', 'undervalued', 'player', 'rv', 'slavia', '2734790', 'nice', 'catch', 'slavia']",4,Netherlands
2022-06-05 12:56:40+00:00,1.533432615960707e+18,"DM request: Carlos Cuesta is a good CB. High defensive probability with decent passing game probability with a bonus of a little bit of finishing probability. Not too creative though. Replacement value for Genk = €3,803,106. https://t.co/xi0ty6leBv",JoostvanderLeij,"Amsterdam, NL",3.0,0.0,1.0,0.0,Philosopher applying Bayesian statistics to football (see: footballphilosophy.org - footballbehaviormanagement.com) Working for FC Twente. DM open for requests!,2610.0,,dm request carlos cuesta is a good cb high defensive probability with decent passing game probability with a bonus of a little bit of finishing probability not too creative though replacement value for genk 3803106,"['dm', 'request', 'carlos', 'cuesta', 'is', 'a', 'good', 'cb', 'high', 'defensive', 'probability', 'with', 'decent', 'passing', 'game', 'probability', 'with', 'a', 'bonus', 'of', 'a', 'little', 'bit', 'of', 'finishing', 'probability', 'not', 'too', 'creative', 'though', 'replacement', 'value', 'for', 'genk', '3803106']","['dm', 'request', 'carlos', 'cuesta', 'good', 'cb', 'high', 'defensive', 'probability', 'decent', 'passing', 'game', 'probability', 'bonus', 'little', 'bit', 'finishing', 'probability', 'creative', 'though', 'replacement', 'value', 'genk', '3803106']","['dm', 'request', 'carlo', 'cuesta', 'good', 'cb', 'high', 'defens', 'probabl', 'decent', 'pass', 'game', 'probabl', 'bonu', 'littl', 'bit', 'finish', 'probabl', 'creativ', 'though', 'replac', 'valu', 'genk', '3803106']","['dm', 'request', 'carlos', 'cuesta', 'good', 'cb', 'high', 'defensive', 'probability', 'decent', 'passing', 'game', 'probability', 'bonus', 'little', 'bit', 'finishing', 'probability', 'creative', 'though', 'replacement', 'value', 'genk', '3803106']",4,Netherlands
2022-06-05 08:01:50+00:00,1.5333584193646835e+18,"DM request: Gianluca Scamacca is an above par CF with decent finishing probability and a nice bonus of some passing game probability. Also a bit of creativity. But not an absolute killer. Replacement value for Sassuolo = €15,214,810. https://t.co/ACDGj0Zboe",JoostvanderLeij,"Amsterdam, NL",2.0,0.0,0.0,0.0,Philosopher applying Bayesian statistics to football (see: footballphilosophy.org - footballbehaviormanagement.com) Working for FC Twente. DM open for requests!,2610.0,,dm request gianluca scamacca is an above par cf with decent finishing probability and a nice bonus of some passing game probability also a bit of creativity but not an absolute killer replacement value for sassuolo 15214810,"['dm', 'request', 'gianluca', 'scamacca', 'is', 'an', 'above', 'par', 'cf', 'with', 'decent', 'finishing', 'probability', 'and', 'a', 'nice', 'bonus', 'of', 'some', 'passing', 'game', 'probability', 'also', 'a', 'bit', 'of', 'creativity', 'but', 'not', 'an', 'absolute', 'killer', 'replacement', 'value', 'for', 'sassuolo', '15214810']","['dm', 'request', 'gianluca', 'scamacca', 'par', 'cf', 'decent', 'finishing', 'probability', 'nice', 'bonus', 'passing', 'game', 'probability', 'also', 'bit', 'creativity', 'absolute', 'killer', 'replacement', 'value', 'sassuolo', '15214810']","['dm', 'request', 'gianluca', 'scamacca', 'par', 'cf', 'decent', 'finish', 'probabl', 'nice', 'bonu', 'pass', 'game', 'probabl', 'also', 'bit', 'creativ', 'absolut', 'killer', 'replac', 'valu', 'sassuolo', '15214810']","['dm', 'request', 'gianluca', 'scamacca', 'par', 'cf', 'decent', 'finishing', 'probability', 'nice', 'bonus', 'passing', 'game', 'probability', 'also', 'bit', 'creativity', 'absolute', 'killer', 'replacement', 'value', 'sassuolo', '15214810']",4,Netherlands
2022-06-04 21:51:58+00:00,1.5332049445133844e+18,@Aerospace_Lovr @SandraK02826308 @ineed__spacee @EveryDay_Cosmos @DavidBflower An added bonus in an already stunning photo.,PippaLeeuwen,Nederland,1.0,0.0,0.0,0.0,"A Brit living in Netherlands. Enjoying retirement. Mother & grandmother. Half Scottish. Anti Tory. Peace, Justice & Equality. #GTTO #ProEU. No DMs!",2276.0,,an added bonus in an already stunning photo,"['an', 'added', 'bonus', 'in', 'an', 'already', 'stunning', 'photo']","['added', 'bonus', 'already', 'stunning', 'photo']","['ad', 'bonu', 'alreadi', 'stun', 'photo']","['added', 'bonus', 'already', 'stunning', 'photo']",5,Netherlands
