Date,Id,Tweet,Username,Location,likeCount,replyCount,retweetCount,quoteCount,userDescription,userFollowers,hashtags,Cleaned_Tweet,Tweet_tokenized,Tweet_removed_stop_word,Tweet_stemmed,Tweet_lemmatized,sentiment,Country
2021-12-23 22:44:01+00:00,1474148820883853318,🇬🇾 The Guyana government on Tuesday announced a two-week tax-free bonus for all health care workers as it praised them for their service to the country during the coronavirus (COVID-19) pandemic. https://t.co/diLOhRy9ry https://t.co/a343SXyyv5,CNWNetwork,"Fort Lauderdale, FL",1,0,1,0,"#CNWNetwork 📰 The official Twitter account of Caribbean National Weekly, South Florida's most widely circulated #Caribbean-American newspaper.",1379,,the guyana government on tuesday announced a twoweek taxfree bonus for all health care workers as it praised them for their service to the country during the coronavirus covid19 pandemic,"['the', 'guyana', 'government', 'on', 'tuesday', 'announced', 'a', 'twoweek', 'taxfree', 'bonus', 'for', 'all', 'health', 'care', 'workers', 'as', 'it', 'praised', 'them', 'for', 'their', 'service', 'to', 'the', 'country', 'during', 'the', 'coronavirus', 'covid19', 'pandemic']","['guyana', 'government', 'tuesday', 'announced', 'twoweek', 'taxfree', 'bonus', 'health', 'care', 'workers', 'praised', 'service', 'country', 'coronavirus', 'covid19', 'pandemic']","['guyana', 'govern', 'tuesday', 'announc', 'twoweek', 'taxfre', 'bonu', 'health', 'care', 'worker', 'prais', 'servic', 'countri', 'coronaviru', 'covid19', 'pandem']","['guyana', 'government', 'tuesday', 'announced', 'twoweek', 'taxfree', 'bonus', 'health', 'care', 'workers', 'praised', 'service', 'country', 'coronavirus', 'covid19', 'pandemic']",5,Venezuela
2021-11-11 16:09:56+00:00,1458829352599183362,The scene at 10am in town on a Thursday outside of the local hardware store. Bonus Andrew cameo. #costaricathings https://t.co/g1TtdaNgpK,meowllyson,new jersey / costa rica,1,0,0,0,ohey,919,['costaricathings'],the scene at 10am in town on a thursday outside of the local hardware store bonus andrew cameo costaricathings,"['the', 'scene', 'at', '10am', 'in', 'town', 'on', 'a', 'thursday', 'outside', 'of', 'the', 'local', 'hardware', 'store', 'bonus', 'andrew', 'cameo', 'costaricathings']","['scene', '10am', 'town', 'thursday', 'outside', 'local', 'hardware', 'store', 'bonus', 'andrew', 'cameo', 'costaricathings']","['scene', '10am', 'town', 'thursday', 'outsid', 'local', 'hardwar', 'store', 'bonu', 'andrew', 'cameo', 'costaricath']","['scene', '10am', 'town', 'thursday', 'outside', 'local', 'hardware', 'store', 'bonus', 'andrew', 'cameo', 'costaricathings']",4,Venezuela
2021-11-04 18:34:25+00:00,1456328999777488899,"Curious how I got started in STR space?

Way way back in the day…1998 to be exact. Used my Blackstone signing bonus to buy my first real estate: a vacation rental house in the Hamptons. 

We lived in hospital housing (my ex was a MD student). 

👉1st home: incoming producing STR",imrichardfertig,"Jackson, WY",50,2,0,0,short term rental developer. boutique hotel owner. STR GP: stompcapital.com   educator: youtube.com/struniversity - grateful. father x3 🚀🙏,15355,,curious how i got started in str space way way back in the day1998 to be exact used my blackstone signing bonus to buy my first real estate a vacation rental house in the hamptons we lived in hospital housing my ex was a md student 1st home incoming producing str,"['curious', 'how', 'i', 'got', 'started', 'in', 'str', 'space', 'way', 'way', 'back', 'in', 'the', 'day1998', 'to', 'be', 'exact', 'used', 'my', 'blackstone', 'signing', 'bonus', 'to', 'buy', 'my', 'first', 'real', 'estate', 'a', 'vacation', 'rental', 'house', 'in', 'the', 'hamptons', 'we', 'lived', 'in', 'hospital', 'housing', 'my', 'ex', 'was', 'a', 'md', 'student', '1st', 'home', 'incoming', 'producing', 'str']","['curious', 'got', 'started', 'str', 'space', 'way', 'way', 'back', 'day1998', 'exact', 'used', 'blackstone', 'signing', 'bonus', 'buy', 'first', 'real', 'estate', 'vacation', 'rental', 'house', 'hamptons', 'lived', 'hospital', 'housing', 'ex', 'md', 'student', '1st', 'home', 'incoming', 'producing', 'str']","['curiou', 'got', 'start', 'str', 'space', 'way', 'way', 'back', 'day1998', 'exact', 'use', 'blackston', 'sign', 'bonu', 'buy', 'first', 'real', 'estat', 'vacat', 'rental', 'hous', 'hampton', 'live', 'hospit', 'hous', 'ex', 'md', 'student', '1st', 'home', 'incom', 'produc', 'str']","['curious', 'got', 'started', 'str', 'space', 'way', 'way', 'back', 'day1998', 'exact', 'used', 'blackstone', 'signing', 'bonus', 'buy', 'first', 'real', 'estate', 'vacation', 'rental', 'house', 'hamptons', 'lived', 'hospital', 'housing', 'ex', 'md', 'student', '1st', 'home', 'incoming', 'producing', 'str']",4,Venezuela
2021-11-01 01:10:39+00:00,1454979162544955398,"Deere &amp; Co. union workers would get wage increases of 10% the first year and 5% in the third and fifth years in a tentative contract reached between the farm-equipment maker and the United Auto Workers. They would also get a ratification bonus of $8,500. https://t.co/oOMWKhSn7E",IsmaelTobon,Colombia,0,0,0,0,Covering news and stories for @RTVCNoticias🇨🇴,1405,,deere amp co union workers would get wage increases of 10 the first year and 5 in the third and fifth years in a tentative contract reached between the farmequipment maker and the united auto workers they would also get a ratification bonus of 8500,"['deere', 'amp', 'co', 'union', 'workers', 'would', 'get', 'wage', 'increases', 'of', '10', 'the', 'first', 'year', 'and', '5', 'in', 'the', 'third', 'and', 'fifth', 'years', 'in', 'a', 'tentative', 'contract', 'reached', 'between', 'the', 'farmequipment', 'maker', 'and', 'the', 'united', 'auto', 'workers', 'they', 'would', 'also', 'get', 'a', 'ratification', 'bonus', 'of', '8500']","['deere', 'amp', 'co', 'union', 'workers', 'would', 'get', 'wage', 'increases', '10', 'first', 'year', '5', 'third', 'fifth', 'years', 'tentative', 'contract', 'reached', 'farmequipment', 'maker', 'united', 'auto', 'workers', 'would', 'also', 'get', 'ratification', 'bonus', '8500']","['deer', 'amp', 'co', 'union', 'worker', 'would', 'get', 'wage', 'increas', '10', 'first', 'year', '5', 'third', 'fifth', 'year', 'tent', 'contract', 'reach', 'farmequip', 'maker', 'unit', 'auto', 'worker', 'would', 'also', 'get', 'ratif', 'bonu', '8500']","['deere', 'amp', 'co', 'union', 'workers', 'would', 'get', 'wage', 'increases', '10', 'first', 'year', '5', 'third', 'fifth', 'years', 'tentative', 'contract', 'reached', 'farmequipment', 'maker', 'united', 'auto', 'workers', 'would', 'also', 'get', 'ratification', 'bonus', '8500']",1,Venezuela
2021-09-20 03:01:06+00:00,1439786668186288129,Hey I joined a network called EarnCashTo and earned $242.74 You get paid for testing out new free apps and posting on social media. Sign up with my link for an instant $25 signup bonus! https://t.co/9FgpcFZmAI,fmaitavzla,"Maturín, Venezuela",0,0,0,0,"➡️Consultor en Marketing Digital.📱
➡️Desarrollo y Diseño Web.💻⌨️
➡️Negocio Online.💵
➡️ Emprendedor.🧑‍🌾",924,,hey i joined a network called earncashto and earned 24274 you get paid for testing out new free apps and posting on social media sign up with my link for an instant 25 signup bonus,"['hey', 'i', 'joined', 'a', 'network', 'called', 'earncashto', 'and', 'earned', '24274', 'you', 'get', 'paid', 'for', 'testing', 'out', 'new', 'free', 'apps', 'and', 'posting', 'on', 'social', 'media', 'sign', 'up', 'with', 'my', 'link', 'for', 'an', 'instant', '25', 'signup', 'bonus']","['hey', 'joined', 'network', 'called', 'earncashto', 'earned', '24274', 'get', 'paid', 'testing', 'new', 'free', 'apps', 'posting', 'social', 'media', 'sign', 'link', 'instant', '25', 'signup', 'bonus']","['hey', 'join', 'network', 'call', 'earncashto', 'earn', '24274', 'get', 'paid', 'test', 'new', 'free', 'app', 'post', 'social', 'media', 'sign', 'link', 'instant', '25', 'signup', 'bonu']","['hey', 'joined', 'network', 'called', 'earncashto', 'earned', '24274', 'get', 'paid', 'testing', 'new', 'free', 'apps', 'posting', 'social', 'media', 'sign', 'link', 'instant', '25', 'signup', 'bonus']",1,Venezuela
2021-05-18 00:58:49+00:00,1394457411608621063,@BenjamminHeller I just read Apple’s actual announcement. Lossless isn’t the focus. Everyone is focusing on the lossless piece. Spatial Audio and Atmos are what Apple cares about. Lossless was just a bonus. https://t.co/0z3kx5VTeS,carlhancock,Costa Rica,2,1,0,0,CEO and Founder of @GravityForms. Live in #CostaRica. 🇺🇸🇨🇷,10113,,i just read apples actual announcement lossless isnt the focus everyone is focusing on the lossless piece spatial audio and atmos are what apple cares about lossless was just a bonus,"['i', 'just', 'read', 'apples', 'actual', 'announcement', 'lossless', 'isnt', 'the', 'focus', 'everyone', 'is', 'focusing', 'on', 'the', 'lossless', 'piece', 'spatial', 'audio', 'and', 'atmos', 'are', 'what', 'apple', 'cares', 'about', 'lossless', 'was', 'just', 'a', 'bonus']","['read', 'apples', 'actual', 'announcement', 'lossless', 'isnt', 'focus', 'everyone', 'focusing', 'lossless', 'piece', 'spatial', 'audio', 'atmos', 'apple', 'cares', 'lossless', 'bonus']","['read', 'appl', 'actual', 'announc', 'lossless', 'isnt', 'focu', 'everyon', 'focus', 'lossless', 'piec', 'spatial', 'audio', 'atmo', 'appl', 'care', 'lossless', 'bonu']","['read', 'apples', 'actual', 'announcement', 'lossless', 'isnt', 'focus', 'everyone', 'focusing', 'lossless', 'piece', 'spatial', 'audio', 'atmos', 'apple', 'cares', 'lossless', 'bonus']",1,Venezuela
2021-05-29 14:56:45+00:00,1398654550895116288,"Dear @klm why did you cancel our flight booking leaving Panama tonight?? The flight still exists. No compensation, no offer of accommodation, no contact other than a generic email. Unable to contact anyone by phone and your DM says check the website! What a joke #worstideaever",SarahOnAnIsland,Bahrain,1,1,1,0,Admirer of high heels. Crypto & NFT curious.,171,['worstideaever'],dear why did you cancel our flight booking leaving panama tonight the flight still exists no compensation no offer of accommodation no contact other than a generic email unable to contact anyone by phone and your dm says check the website what a joke worstideaever,"['dear', 'why', 'did', 'you', 'cancel', 'our', 'flight', 'booking', 'leaving', 'panama', 'tonight', 'the', 'flight', 'still', 'exists', 'no', 'compensation', 'no', 'offer', 'of', 'accommodation', 'no', 'contact', 'other', 'than', 'a', 'generic', 'email', 'unable', 'to', 'contact', 'anyone', 'by', 'phone', 'and', 'your', 'dm', 'says', 'check', 'the', 'website', 'what', 'a', 'joke', 'worstideaever']","['dear', 'cancel', 'flight', 'booking', 'leaving', 'panama', 'tonight', 'flight', 'still', 'exists', 'compensation', 'offer', 'accommodation', 'contact', 'generic', 'email', 'unable', 'contact', 'anyone', 'phone', 'dm', 'says', 'check', 'website', 'joke', 'worstideaever']","['dear', 'cancel', 'flight', 'book', 'leav', 'panama', 'tonight', 'flight', 'still', 'exist', 'compens', 'offer', 'accommod', 'contact', 'gener', 'email', 'unabl', 'contact', 'anyon', 'phone', 'dm', 'say', 'check', 'websit', 'joke', 'worstideaev']","['dear', 'cancel', 'flight', 'booking', 'leaving', 'panama', 'tonight', 'flight', 'still', 'exists', 'compensation', 'offer', 'accommodation', 'contact', 'generic', 'email', 'unable', 'contact', 'anyone', 'phone', 'dm', 'says', 'check', 'website', 'joke', 'worstideaever']",1,Venezuela
2020-12-06 14:40:21+00:00,1335594937446932480,@claraeuro Large state sector. Strikes to increase wages for public sector workers. Militant coal miners. Electrical black outs. Private sector salaries not enough to keep central heating going or afford holidays.,hutchdav,Bogota,0,0,0,0,South American banker.,93,,large state sector strikes to increase wages for public sector workers militant coal miners electrical black outs private sector salaries not enough to keep central heating going or afford holidays,"['large', 'state', 'sector', 'strikes', 'to', 'increase', 'wages', 'for', 'public', 'sector', 'workers', 'militant', 'coal', 'miners', 'electrical', 'black', 'outs', 'private', 'sector', 'salaries', 'not', 'enough', 'to', 'keep', 'central', 'heating', 'going', 'or', 'afford', 'holidays']","['large', 'state', 'sector', 'strikes', 'increase', 'wages', 'public', 'sector', 'workers', 'militant', 'coal', 'miners', 'electrical', 'black', 'outs', 'private', 'sector', 'salaries', 'enough', 'keep', 'central', 'heating', 'going', 'afford', 'holidays']","['larg', 'state', 'sector', 'strike', 'increas', 'wage', 'public', 'sector', 'worker', 'milit', 'coal', 'miner', 'electr', 'black', 'out', 'privat', 'sector', 'salari', 'enough', 'keep', 'central', 'heat', 'go', 'afford', 'holiday']","['large', 'state', 'sector', 'strikes', 'increase', 'wages', 'public', 'sector', 'workers', 'militant', 'coal', 'miners', 'electrical', 'black', 'outs', 'private', 'sector', 'salaries', 'enough', 'keep', 'central', 'heating', 'going', 'afford', 'holidays']",2,Venezuela
2022-06-19 17:34:30+00:00,1538575967374848000,@manmanatl Chiiiiiile! I work for the travel nurse agency. They slow like shit! Lol,ToneyRocks,Cali,1,1,0,0,The Toney Chronicles,390,,chiiiiiile i work for the travel nurse agency they slow like shit lol,"['chiiiiiile', 'i', 'work', 'for', 'the', 'travel', 'nurse', 'agency', 'they', 'slow', 'like', 'shit', 'lol']","['chiiiiiile', 'work', 'travel', 'nurse', 'agency', 'slow', 'like', 'shit', 'lol']","['chiiiiiil', 'work', 'travel', 'nurs', 'agenc', 'slow', 'like', 'shit', 'lol']","['chiiiiiile', 'work', 'travel', 'nurse', 'agency', 'slow', 'like', 'shit', 'lol']",2,Venezuela
2022-06-17 17:28:47+00:00,1537849753458860036,@PRider1980 @lizsalerno1 @PhilAmPatriot1 @JohnM53093509 @milamiarose HCQ and Ivermectin.  It was a video a nurse took of the doctor in a hospital ward saying that she knew it worked but would lose her license if she used it on any Covid patients.  Have you watched the whistle blower Nurse Erin video?,wakeupsheepnow,Central Florida,1,1,0,0,be open to things,133,,hcq and ivermectin it was a video a nurse took of the doctor in a hospital ward saying that she knew it worked but would lose her license if she used it on any covid patients have you watched the whistle blower nurse erin video,"['hcq', 'and', 'ivermectin', 'it', 'was', 'a', 'video', 'a', 'nurse', 'took', 'of', 'the', 'doctor', 'in', 'a', 'hospital', 'ward', 'saying', 'that', 'she', 'knew', 'it', 'worked', 'but', 'would', 'lose', 'her', 'license', 'if', 'she', 'used', 'it', 'on', 'any', 'covid', 'patients', 'have', 'you', 'watched', 'the', 'whistle', 'blower', 'nurse', 'erin', 'video']","['hcq', 'ivermectin', 'video', 'nurse', 'took', 'doctor', 'hospital', 'ward', 'saying', 'knew', 'worked', 'would', 'lose', 'license', 'used', 'covid', 'patients', 'watched', 'whistle', 'blower', 'nurse', 'erin', 'video']","['hcq', 'ivermectin', 'video', 'nurs', 'took', 'doctor', 'hospit', 'ward', 'say', 'knew', 'work', 'would', 'lose', 'licens', 'use', 'covid', 'patient', 'watch', 'whistl', 'blower', 'nurs', 'erin', 'video']","['hcq', 'ivermectin', 'video', 'nurse', 'took', 'doctor', 'hospital', 'ward', 'saying', 'knew', 'worked', 'would', 'lose', 'license', 'used', 'covid', 'patients', 'watched', 'whistle', 'blower', 'nurse', 'erin', 'video']",1,Venezuela
2022-06-19 17:34:30+00:00,1538575967374848000,@manmanatl Chiiiiiile! I work for the travel nurse agency. They slow like shit! Lol,ToneyRocks,Cali,1,1,0,0,The Toney Chronicles,390,,chiiiiiile i work for the travel nurse agency they slow like shit lol,"['chiiiiiile', 'i', 'work', 'for', 'the', 'travel', 'nurse', 'agency', 'they', 'slow', 'like', 'shit', 'lol']","['chiiiiiile', 'work', 'travel', 'nurse', 'agency', 'slow', 'like', 'shit', 'lol']","['chiiiiiil', 'work', 'travel', 'nurs', 'agenc', 'slow', 'like', 'shit', 'lol']","['chiiiiiile', 'work', 'travel', 'nurse', 'agency', 'slow', 'like', 'shit', 'lol']",2,Venezuela
2022-06-17 17:28:47+00:00,1537849753458860036,@PRider1980 @lizsalerno1 @PhilAmPatriot1 @JohnM53093509 @milamiarose HCQ and Ivermectin.  It was a video a nurse took of the doctor in a hospital ward saying that she knew it worked but would lose her license if she used it on any Covid patients.  Have you watched the whistle blower Nurse Erin video?,wakeupsheepnow,Central Florida,1,1,0,0,be open to things,133,,hcq and ivermectin it was a video a nurse took of the doctor in a hospital ward saying that she knew it worked but would lose her license if she used it on any covid patients have you watched the whistle blower nurse erin video,"['hcq', 'and', 'ivermectin', 'it', 'was', 'a', 'video', 'a', 'nurse', 'took', 'of', 'the', 'doctor', 'in', 'a', 'hospital', 'ward', 'saying', 'that', 'she', 'knew', 'it', 'worked', 'but', 'would', 'lose', 'her', 'license', 'if', 'she', 'used', 'it', 'on', 'any', 'covid', 'patients', 'have', 'you', 'watched', 'the', 'whistle', 'blower', 'nurse', 'erin', 'video']","['hcq', 'ivermectin', 'video', 'nurse', 'took', 'doctor', 'hospital', 'ward', 'saying', 'knew', 'worked', 'would', 'lose', 'license', 'used', 'covid', 'patients', 'watched', 'whistle', 'blower', 'nurse', 'erin', 'video']","['hcq', 'ivermectin', 'video', 'nurs', 'took', 'doctor', 'hospit', 'ward', 'say', 'knew', 'work', 'would', 'lose', 'licens', 'use', 'covid', 'patient', 'watch', 'whistl', 'blower', 'nurs', 'erin', 'video']","['hcq', 'ivermectin', 'video', 'nurse', 'took', 'doctor', 'hospital', 'ward', 'saying', 'knew', 'worked', 'would', 'lose', 'license', 'used', 'covid', 'patients', 'watched', 'whistle', 'blower', 'nurse', 'erin', 'video']",1,Venezuela
2020-11-15 18:32:29+00:00,1328043209252102146,"Society is having less sex as a result of poor diet. Cut out #caffeine #dairy and #sugar and you will:

💯 Look &amp; Feel better.
✅ Attract the opposite &amp; same sex.
❎ ADDED BONUS: You will have the sex drive you had when you were 16 years old.

#health #cooking #nutrition https://t.co/ki9aqHofXk",JediRich_com,"Las Vegas, NV",0,1,0,0,"Cannabis, art, music, nutrition, weight loss, photography and video production. YouTube: youtube.com/c/JediRichCrea…",1048,"['caffeine', 'dairy', 'sugar', 'health', 'cooking', 'nutrition']",society is having less sex as a result of poor diet cut out caffeine dairy and sugar and you will look amp feel better attract the opposite amp same sex added bonus you will have the sex drive you had when you were 16 years old health cooking nutrition,"['society', 'is', 'having', 'less', 'sex', 'as', 'a', 'result', 'of', 'poor', 'diet', 'cut', 'out', 'caffeine', 'dairy', 'and', 'sugar', 'and', 'you', 'will', 'look', 'amp', 'feel', 'better', 'attract', 'the', 'opposite', 'amp', 'same', 'sex', 'added', 'bonus', 'you', 'will', 'have', 'the', 'sex', 'drive', 'you', 'had', 'when', 'you', 'were', '16', 'years', 'old', 'health', 'cooking', 'nutrition']","['society', 'less', 'sex', 'result', 'poor', 'diet', 'cut', 'caffeine', 'dairy', 'sugar', 'look', 'amp', 'feel', 'better', 'attract', 'opposite', 'amp', 'sex', 'added', 'bonus', 'sex', 'drive', '16', 'years', 'old', 'health', 'cooking', 'nutrition']","['societi', 'less', 'sex', 'result', 'poor', 'diet', 'cut', 'caffein', 'dairi', 'sugar', 'look', 'amp', 'feel', 'better', 'attract', 'opposit', 'amp', 'sex', 'ad', 'bonu', 'sex', 'drive', '16', 'year', 'old', 'health', 'cook', 'nutrit']","['society', 'less', 'sex', 'result', 'poor', 'diet', 'cut', 'caffeine', 'dairy', 'sugar', 'look', 'amp', 'feel', 'better', 'attract', 'opposite', 'amp', 'sex', 'added', 'bonus', 'sex', 'drive', '16', 'years', 'old', 'health', 'cooking', 'nutrition']",2,Venezuela
2022-06-04 23:45:03+00:00,1533233402337533953,Initiating Telehealth Visits Through Text Messaging Benefits Patients https://t.co/xKT40e578T #telehealth #textmessaging #textmessages #mHealth #mobilehealth #healthcare #HealthTech #TelehealthStrategies https://t.co/k3Xle8cn0H,clinicoin,"Uvita, Costa Rica",1,0,1,0,Clinicoin is a #blockchain platform that pays you in #cryptocurrency to be healthy and connects you with people who help keep you that way.,7425,"['telehealth', 'textmessaging', 'textmessages', 'mHealth', 'mobilehealth', 'healthcare', 'HealthTech', 'TelehealthStrategies']",initiating telehealth visits through text messaging benefits patients telehealth textmessaging textmessages mhealth mobilehealth healthcare healthtech telehealthstrategies,"['initiating', 'telehealth', 'visits', 'through', 'text', 'messaging', 'benefits', 'patients', 'telehealth', 'textmessaging', 'textmessages', 'mhealth', 'mobilehealth', 'healthcare', 'healthtech', 'telehealthstrategies']","['initiating', 'telehealth', 'visits', 'text', 'messaging', 'benefits', 'patients', 'telehealth', 'textmessaging', 'textmessages', 'mhealth', 'mobilehealth', 'healthcare', 'healthtech', 'telehealthstrategies']","['initi', 'telehealth', 'visit', 'text', 'messag', 'benefit', 'patient', 'telehealth', 'textmessag', 'textmessag', 'mhealth', 'mobilehealth', 'healthcar', 'healthtech', 'telehealthstrategi']","['initiating', 'telehealth', 'visits', 'text', 'messaging', 'benefits', 'patients', 'telehealth', 'textmessaging', 'textmessages', 'mhealth', 'mobilehealth', 'healthcare', 'healthtech', 'telehealthstrategies']",4,Venezuela
2022-06-09 06:16:38+00:00,1534781498993168384,"Earned $10 CVS pharmacy and health rewards, idk how I got that much? But I got small pack of diapers with it and they were on sale so I paid .84 cents for them 😎 score! 💩",THeCannacouple,Cali,1,0,0,0,"I love Cannabis and dab daily! 
Boy Mom 😊
instagram.com/thecannacouple",559,,earned 10 cvs pharmacy and health rewards idk how i got that much but i got small pack of diapers with it and they were on sale so i paid 84 cents for them score,"['earned', '10', 'cvs', 'pharmacy', 'and', 'health', 'rewards', 'idk', 'how', 'i', 'got', 'that', 'much', 'but', 'i', 'got', 'small', 'pack', 'of', 'diapers', 'with', 'it', 'and', 'they', 'were', 'on', 'sale', 'so', 'i', 'paid', '84', 'cents', 'for', 'them', 'score']","['earned', '10', 'cvs', 'pharmacy', 'health', 'rewards', 'idk', 'got', 'much', 'got', 'small', 'pack', 'diapers', 'sale', 'paid', '84', 'cents', 'score']","['earn', '10', 'cv', 'pharmaci', 'health', 'reward', 'idk', 'got', 'much', 'got', 'small', 'pack', 'diaper', 'sale', 'paid', '84', 'cent', 'score']","['earned', '10', 'cvs', 'pharmacy', 'health', 'rewards', 'idk', 'got', 'much', 'got', 'small', 'pack', 'diapers', 'sale', 'paid', '84', 'cents', 'score']",1,Venezuela
2022-06-08 19:07:14+00:00,1534613037709148164,@JuliaHB1 Certificate Of Vaccine I.D - its a universal health security “pass” for the endless mRNA jabs planned in a biosecurity medical tyrannical state: Even the head of ECB told us “vaccines are the new economy”. All those who took the jabs to go on a weeks holiday are enablers,LiveAzores,Portugal,17,0,4,1,'It's the end of the world as we know it And I feel fine',1231,,certificate of vaccine id its a universal health security pass for the endless mrna jabs planned in a biosecurity medical tyrannical state even the head of ecb told us vaccines are the new economy all those who took the jabs to go on a weeks holiday are enablers,"['certificate', 'of', 'vaccine', 'id', 'its', 'a', 'universal', 'health', 'security', 'pass', 'for', 'the', 'endless', 'mrna', 'jabs', 'planned', 'in', 'a', 'biosecurity', 'medical', 'tyrannical', 'state', 'even', 'the', 'head', 'of', 'ecb', 'told', 'us', 'vaccines', 'are', 'the', 'new', 'economy', 'all', 'those', 'who', 'took', 'the', 'jabs', 'to', 'go', 'on', 'a', 'weeks', 'holiday', 'are', 'enablers']","['certificate', 'vaccine', 'id', 'universal', 'health', 'security', 'pass', 'endless', 'mrna', 'jabs', 'planned', 'biosecurity', 'medical', 'tyrannical', 'state', 'even', 'head', 'ecb', 'told', 'us', 'vaccines', 'new', 'economy', 'took', 'jabs', 'go', 'weeks', 'holiday', 'enablers']","['certif', 'vaccin', 'id', 'univers', 'health', 'secur', 'pass', 'endless', 'mrna', 'jab', 'plan', 'biosecur', 'medic', 'tyrann', 'state', 'even', 'head', 'ecb', 'told', 'us', 'vaccin', 'new', 'economi', 'took', 'jab', 'go', 'week', 'holiday', 'enabl']","['certificate', 'vaccine', 'id', 'universal', 'health', 'security', 'pass', 'endless', 'mrna', 'jabs', 'planned', 'biosecurity', 'medical', 'tyrannical', 'state', 'even', 'head', 'ecb', 'told', 'us', 'vaccines', 'new', 'economy', 'took', 'jabs', 'go', 'weeks', 'holiday', 'enablers']",5,Venezuela
