Date,Id,Tweet,Username,Location,likeCount,replyCount,retweetCount,quoteCount,userDescription,userFollowers,hashtags,Cleaned_Tweet,Tweet_tokenized,Tweet_removed_stop_word,Tweet_stemmed,Tweet_lemmatized,sentiment,Country
2020-04-25 14:39:00+00:00,1254057327306694656,"""Time is of the essence in detecting and treating malaria. Rapid diagnostic tests provide quick results and are simple to perform and interpret.""

Prompt treatment is one of the key messages from the World Health Organization campaign to #EndMalaria. #worldmalariaday2020🌍 https://t.co/mkSkapgkzo",cczambia_tweets,"Lusaka, Zambia",0,0,0,0,"🏢: Plot No 377A Bishops Road, CCZ Ecumenical Centre, Kabulonga Lusaka
📞: +260-211-267744/39
📠: +260-211-267744
📧: ccz.socialmedia@gmail.com",214,"['EndMalaria', 'worldmalariaday2020']",time is of the essence in detecting and treating malaria rapid diagnostic tests provide quick results and are simple to perform and interpret prompt treatment is one of the key messages from the world health organization campaign to endmalaria worldmalariaday2020,"['time', 'is', 'of', 'the', 'essence', 'in', 'detecting', 'and', 'treating', 'malaria', 'rapid', 'diagnostic', 'tests', 'provide', 'quick', 'results', 'and', 'are', 'simple', 'to', 'perform', 'and', 'interpret', 'prompt', 'treatment', 'is', 'one', 'of', 'the', 'key', 'messages', 'from', 'the', 'world', 'health', 'organization', 'campaign', 'to', 'endmalaria', 'worldmalariaday2020']","['time', 'essence', 'detecting', 'treating', 'malaria', 'rapid', 'diagnostic', 'tests', 'provide', 'quick', 'results', 'simple', 'perform', 'interpret', 'prompt', 'treatment', 'one', 'key', 'messages', 'world', 'health', 'organization', 'campaign', 'endmalaria', 'worldmalariaday2020']","['time', 'essenc', 'detect', 'treat', 'malaria', 'rapid', 'diagnost', 'test', 'provid', 'quick', 'result', 'simpl', 'perform', 'interpret', 'prompt', 'treatment', 'one', 'key', 'messag', 'world', 'health', 'organ', 'campaign', 'endmalaria', 'worldmalariaday2020']","['time', 'essence', 'detecting', 'treating', 'malaria', 'rapid', 'diagnostic', 'tests', 'provide', 'quick', 'results', 'simple', 'perform', 'interpret', 'prompt', 'treatment', 'one', 'key', 'messages', 'world', 'health', 'organization', 'campaign', 'endmalaria', 'worldmalariaday2020']",5,Zambia
2020-04-20 11:38:41+00:00,1252200010047008769,"Monthly risk allowance for health care workers revised from 1, 800 to 60,000 but the new rates will only apply during the covid-19 pandemic period. What will happen corona ikatha? Back to 1,800? 🤔

Uyu nde Pusi Pusi",FlyRic1,Africa                    ,2,1,4,4,Public Health Specialist - Arsenal Fan,2148,,monthly risk allowance for health care workers revised from 1 800 to 60000 but the new rates will only apply during the covid19 pandemic period what will happen corona ikatha back to 1800 uyu nde pusi pusi,"['monthly', 'risk', 'allowance', 'for', 'health', 'care', 'workers', 'revised', 'from', '1', '800', 'to', '60000', 'but', 'the', 'new', 'rates', 'will', 'only', 'apply', 'during', 'the', 'covid19', 'pandemic', 'period', 'what', 'will', 'happen', 'corona', 'ikatha', 'back', 'to', '1800', 'uyu', 'nde', 'pusi', 'pusi']","['monthly', 'risk', 'allowance', 'health', 'care', 'workers', 'revised', '1', '800', '60000', 'new', 'rates', 'apply', 'covid19', 'pandemic', 'period', 'happen', 'corona', 'ikatha', 'back', '1800', 'uyu', 'nde', 'pusi', 'pusi']","['monthli', 'risk', 'allow', 'health', 'care', 'worker', 'revis', '1', '800', '60000', 'new', 'rate', 'appli', 'covid19', 'pandem', 'period', 'happen', 'corona', 'ikatha', 'back', '1800', 'uyu', 'nde', 'pusi', 'pusi']","['monthly', 'risk', 'allowance', 'health', 'care', 'workers', 'revised', '1', '800', '60000', 'new', 'rates', 'apply', 'covid19', 'pandemic', 'period', 'happen', 'corona', 'ikatha', 'back', '1800', 'uyu', 'nde', 'pusi', 'pusi']",2,Zambia
2020-04-15 18:59:25+00:00,1250498982079533057,"Just like You work hard and pray to God for rewards, you also follow Health workers instructions and pray to God he protects you and others from this pandemic.
#StaySafeEveryone",SlimZeblues,Malawi,0,0,0,0,@ChelseaFc DIEHARD FAN,902,['StaySafeEveryone'],just like you work hard and pray to god for rewards you also follow health workers instructions and pray to god he protects you and others from this pandemic staysafeeveryone,"['just', 'like', 'you', 'work', 'hard', 'and', 'pray', 'to', 'god', 'for', 'rewards', 'you', 'also', 'follow', 'health', 'workers', 'instructions', 'and', 'pray', 'to', 'god', 'he', 'protects', 'you', 'and', 'others', 'from', 'this', 'pandemic', 'staysafeeveryone']","['like', 'work', 'hard', 'pray', 'god', 'rewards', 'also', 'follow', 'health', 'workers', 'instructions', 'pray', 'god', 'protects', 'others', 'pandemic', 'staysafeeveryone']","['like', 'work', 'hard', 'pray', 'god', 'reward', 'also', 'follow', 'health', 'worker', 'instruct', 'pray', 'god', 'protect', 'other', 'pandem', 'staysafeeveryon']","['like', 'work', 'hard', 'pray', 'god', 'rewards', 'also', 'follow', 'health', 'workers', 'instructions', 'pray', 'god', 'protects', 'others', 'pandemic', 'staysafeeveryone']",5,Zambia
2020-04-14 17:12:07+00:00,1250109590815023107,"Please note UK Travel Advice for #Zambia has today been updated to reflect the likelihood that *all* new arrivals by air will be taken initially to gov. health/isolation facilities, in addition to the existing mandatory requirement of 14 days quarantine: https://t.co/uiYmuzCdSO",nkwoolley,"Lusaka, Zambia Insta=nkwoolley",29,1,8,2,"British🇬🇧 High Commissioner to Zambia🇿🇲 & Special Rep to COMESA. 
Former UK Dep Ambassador to DR Congo🇨🇩, Rep Congo🇨🇬 and CAR🇨🇫. 
Father & Adventurer.",33394,['Zambia'],please note uk travel advice for zambia has today been updated to reflect the likelihood that all new arrivals by air will be taken initially to gov healthisolation facilities in addition to the existing mandatory requirement of 14 days quarantine,"['please', 'note', 'uk', 'travel', 'advice', 'for', 'zambia', 'has', 'today', 'been', 'updated', 'to', 'reflect', 'the', 'likelihood', 'that', 'all', 'new', 'arrivals', 'by', 'air', 'will', 'be', 'taken', 'initially', 'to', 'gov', 'healthisolation', 'facilities', 'in', 'addition', 'to', 'the', 'existing', 'mandatory', 'requirement', 'of', '14', 'days', 'quarantine']","['please', 'note', 'uk', 'travel', 'advice', 'zambia', 'today', 'updated', 'reflect', 'likelihood', 'new', 'arrivals', 'air', 'taken', 'initially', 'gov', 'healthisolation', 'facilities', 'addition', 'existing', 'mandatory', 'requirement', '14', 'days', 'quarantine']","['pleas', 'note', 'uk', 'travel', 'advic', 'zambia', 'today', 'updat', 'reflect', 'likelihood', 'new', 'arriv', 'air', 'taken', 'initi', 'gov', 'healthisol', 'facil', 'addit', 'exist', 'mandatori', 'requir', '14', 'day', 'quarantin']","['please', 'note', 'uk', 'travel', 'advice', 'zambia', 'today', 'updated', 'reflect', 'likelihood', 'new', 'arrivals', 'air', 'taken', 'initially', 'gov', 'healthisolation', 'facilities', 'addition', 'existing', 'mandatory', 'requirement', '14', 'days', 'quarantine']",3,Zambia
2020-04-11 05:38:54+00:00,1248847975524294657,"Join us in sending messages of thanks to health heroes in Zambia and around the world.

 #ThanksHealthHero https://t.co/9kCj2HuYHe https://t.co/0wV0nUAm73",zamvibe,"Lusaka, Zambia",20,2,5,0,Music|Fashion|Entertainment|Lifestyle| Sport|Tourism|Events Blog.,1214,['ThanksHealthHero'],join us in sending messages of thanks to health heroes in zambia and around the world thankshealthhero,"['join', 'us', 'in', 'sending', 'messages', 'of', 'thanks', 'to', 'health', 'heroes', 'in', 'zambia', 'and', 'around', 'the', 'world', 'thankshealthhero']","['join', 'us', 'sending', 'messages', 'thanks', 'health', 'heroes', 'zambia', 'around', 'world', 'thankshealthhero']","['join', 'us', 'send', 'messag', 'thank', 'health', 'hero', 'zambia', 'around', 'world', 'thankshealthhero']","['join', 'us', 'sending', 'messages', 'thanks', 'health', 'heroes', 'zambia', 'around', 'world', 'thankshealthhero']",5,Zambia
2020-04-07 04:46:06+00:00,1247385134438977536,"Join us in sending messages of thanks to health heroes in Zambia and around the world.

 #ThanksHealthHero https://t.co/9kCj2HuYHe",zamvibe,"Lusaka, Zambia",11,1,2,0,Music|Fashion|Entertainment|Lifestyle| Sport|Tourism|Events Blog.,1214,['ThanksHealthHero'],join us in sending messages of thanks to health heroes in zambia and around the world thankshealthhero,"['join', 'us', 'in', 'sending', 'messages', 'of', 'thanks', 'to', 'health', 'heroes', 'in', 'zambia', 'and', 'around', 'the', 'world', 'thankshealthhero']","['join', 'us', 'sending', 'messages', 'thanks', 'health', 'heroes', 'zambia', 'around', 'world', 'thankshealthhero']","['join', 'us', 'send', 'messag', 'thank', 'health', 'hero', 'zambia', 'around', 'world', 'thankshealthhero']","['join', 'us', 'sending', 'messages', 'thanks', 'health', 'heroes', 'zambia', 'around', 'world', 'thankshealthhero']",5,Zambia
2020-04-05 18:57:59+00:00,1246874745532035072,"@BowmanLusambo Please stop undermining the efforts and travel advisory by Health Minister Chilufya. You live in Lusaka and you shouldn't have travelled. Lead by example. Your constituency has capable people to help you, unless you don't trust them.",Space2013M,"Lusaka, Zambia.",1,0,0,0,"🇿🇲Pursuit of: Social Justice, Peace, Equality & Fairness||Anti-Mediocrity||Anti-Corruption|| Lover of: Aesthetics, Pun & Banter|| Y.N.W.A. & AbaYellow.",3052,,please stop undermining the efforts and travel advisory by health minister chilufya you live in lusaka and you shouldnt have travelled lead by example your constituency has capable people to help you unless you dont trust them,"['please', 'stop', 'undermining', 'the', 'efforts', 'and', 'travel', 'advisory', 'by', 'health', 'minister', 'chilufya', 'you', 'live', 'in', 'lusaka', 'and', 'you', 'shouldnt', 'have', 'travelled', 'lead', 'by', 'example', 'your', 'constituency', 'has', 'capable', 'people', 'to', 'help', 'you', 'unless', 'you', 'dont', 'trust', 'them']","['please', 'stop', 'undermining', 'efforts', 'travel', 'advisory', 'health', 'minister', 'chilufya', 'live', 'lusaka', 'shouldnt', 'travelled', 'lead', 'example', 'constituency', 'capable', 'people', 'help', 'unless', 'dont', 'trust']","['pleas', 'stop', 'undermin', 'effort', 'travel', 'advisori', 'health', 'minist', 'chilufya', 'live', 'lusaka', 'shouldnt', 'travel', 'lead', 'exampl', 'constitu', 'capabl', 'peopl', 'help', 'unless', 'dont', 'trust']","['please', 'stop', 'undermining', 'efforts', 'travel', 'advisory', 'health', 'minister', 'chilufya', 'live', 'lusaka', 'shouldnt', 'travelled', 'lead', 'example', 'constituency', 'capable', 'people', 'help', 'unless', 'dont', 'trust']",1,Zambia
2020-04-04 18:43:28+00:00,1246508703085465600,"President Mutharika announces new measures in fight against #COVID19 .
MERA to reduce fuel prices,10percent of
President and cabinet salaries to be directed to prevention measures and Ministry of Health to employ 2000 health workers and hike their risk allowance...among others",mwale_vee,,7,2,3,1,communication:nature: music: oh good food,1141,['COVID19'],president mutharika announces new measures in fight against covid19 mera to reduce fuel prices10percent of president and cabinet salaries to be directed to prevention measures and ministry of health to employ 2000 health workers and hike their risk allowanceamong others,"['president', 'mutharika', 'announces', 'new', 'measures', 'in', 'fight', 'against', 'covid19', 'mera', 'to', 'reduce', 'fuel', 'prices10percent', 'of', 'president', 'and', 'cabinet', 'salaries', 'to', 'be', 'directed', 'to', 'prevention', 'measures', 'and', 'ministry', 'of', 'health', 'to', 'employ', '2000', 'health', 'workers', 'and', 'hike', 'their', 'risk', 'allowanceamong', 'others']","['president', 'mutharika', 'announces', 'new', 'measures', 'fight', 'covid19', 'mera', 'reduce', 'fuel', 'prices10percent', 'president', 'cabinet', 'salaries', 'directed', 'prevention', 'measures', 'ministry', 'health', 'employ', '2000', 'health', 'workers', 'hike', 'risk', 'allowanceamong', 'others']","['presid', 'mutharika', 'announc', 'new', 'measur', 'fight', 'covid19', 'mera', 'reduc', 'fuel', 'prices10perc', 'presid', 'cabinet', 'salari', 'direct', 'prevent', 'measur', 'ministri', 'health', 'employ', '2000', 'health', 'worker', 'hike', 'risk', 'allowanceamong', 'other']","['president', 'mutharika', 'announces', 'new', 'measures', 'fight', 'covid19', 'mera', 'reduce', 'fuel', 'prices10percent', 'president', 'cabinet', 'salaries', 'directed', 'prevention', 'measures', 'ministry', 'health', 'employ', '2000', 'health', 'workers', 'hike', 'risk', 'allowanceamong', 'others']",5,Zambia
2020-04-01 08:51:29+00:00,1245272563858710528,@Zedrocka I have seen a couple of messages concerning mental health such as in the pics attached. https://t.co/cGzkOyuevD,Mulemba_Ndonji,Zambia,1,1,0,0,After God's heart/  Social Scientist/ Communication for development/ Child rights activist,886,,i have seen a couple of messages concerning mental health such as in the pics attached,"['i', 'have', 'seen', 'a', 'couple', 'of', 'messages', 'concerning', 'mental', 'health', 'such', 'as', 'in', 'the', 'pics', 'attached']","['seen', 'couple', 'messages', 'concerning', 'mental', 'health', 'pics', 'attached']","['seen', 'coupl', 'messag', 'concern', 'mental', 'health', 'pic', 'attach']","['seen', 'couple', 'messages', 'concerning', 'mental', 'health', 'pics', 'attached']",3,Zambia
2020-03-31 09:50:59+00:00,1244925147603243011,"#covid19zambia Update

Zambia has in the last 24 hours recorded another confirmed case of COVD-19 bringing the number to 36

Minister of health Minister Chitalu Chilufya says the 46 year old male is part of the group that had travelled to Pakistan.",geshgroove,"ÜT: -26.09355,28.05549",10,2,3,1,"Lawyer,international DJ & MC,Radio & TV Station owner, presenter & producer. Manchester UTD fan!personal views not affiliated to my businesses & associates.",46720,['covid19zambia'],covid19zambia update zambia has in the last 24 hours recorded another confirmed case of covd19 bringing the number to 36 minister of health minister chitalu chilufya says the 46 year old male is part of the group that had travelled to pakistan,"['covid19zambia', 'update', 'zambia', 'has', 'in', 'the', 'last', '24', 'hours', 'recorded', 'another', 'confirmed', 'case', 'of', 'covd19', 'bringing', 'the', 'number', 'to', '36', 'minister', 'of', 'health', 'minister', 'chitalu', 'chilufya', 'says', 'the', '46', 'year', 'old', 'male', 'is', 'part', 'of', 'the', 'group', 'that', 'had', 'travelled', 'to', 'pakistan']","['covid19zambia', 'update', 'zambia', 'last', '24', 'hours', 'recorded', 'another', 'confirmed', 'case', 'covd19', 'bringing', 'number', '36', 'minister', 'health', 'minister', 'chitalu', 'chilufya', 'says', '46', 'year', 'old', 'male', 'part', 'group', 'travelled', 'pakistan']","['covid19zambia', 'updat', 'zambia', 'last', '24', 'hour', 'record', 'anoth', 'confirm', 'case', 'covd19', 'bring', 'number', '36', 'minist', 'health', 'minist', 'chitalu', 'chilufya', 'say', '46', 'year', 'old', 'male', 'part', 'group', 'travel', 'pakistan']","['covid19zambia', 'update', 'zambia', 'last', '24', 'hours', 'recorded', 'another', 'confirmed', 'case', 'covd19', 'bringing', 'number', '36', 'minister', 'health', 'minister', 'chitalu', 'chilufya', 'says', '46', 'year', 'old', 'male', 'part', 'group', 'travelled', 'pakistan']",1,Zambia
2020-03-28 18:11:42+00:00,1243963993326321667,I wonder how #medicalmarijuana sales are doing with #COVID19 #coronavirus lockdowns the world over. Weed must be selling out as must as alcohol and toilet paper. Just to help with the mental health of people as they are stuck indoors for long periods.,RamesesVII,In the Weldi,0,0,1,0,"Kemet by Faith, African by Birth, Believer is Freedom, Blessed by the Ancestors cursed to love the Arsenal",546,"['medicalmarijuana', 'COVID19', 'coronavirus']",i wonder how medicalmarijuana sales are doing with covid19 coronavirus lockdowns the world over weed must be selling out as must as alcohol and toilet paper just to help with the mental health of people as they are stuck indoors for long periods,"['i', 'wonder', 'how', 'medicalmarijuana', 'sales', 'are', 'doing', 'with', 'covid19', 'coronavirus', 'lockdowns', 'the', 'world', 'over', 'weed', 'must', 'be', 'selling', 'out', 'as', 'must', 'as', 'alcohol', 'and', 'toilet', 'paper', 'just', 'to', 'help', 'with', 'the', 'mental', 'health', 'of', 'people', 'as', 'they', 'are', 'stuck', 'indoors', 'for', 'long', 'periods']","['wonder', 'medicalmarijuana', 'sales', 'covid19', 'coronavirus', 'lockdowns', 'world', 'weed', 'must', 'selling', 'must', 'alcohol', 'toilet', 'paper', 'help', 'mental', 'health', 'people', 'stuck', 'indoors', 'long', 'periods']","['wonder', 'medicalmarijuana', 'sale', 'covid19', 'coronaviru', 'lockdown', 'world', 'weed', 'must', 'sell', 'must', 'alcohol', 'toilet', 'paper', 'help', 'mental', 'health', 'peopl', 'stuck', 'indoor', 'long', 'period']","['wonder', 'medicalmarijuana', 'sales', 'covid19', 'coronavirus', 'lockdowns', 'world', 'weed', 'must', 'selling', 'must', 'alcohol', 'toilet', 'paper', 'help', 'mental', 'health', 'people', 'stuck', 'indoors', 'long', 'periods']",3,Zambia
2020-03-28 12:17:40+00:00,1243874898403102720,It's 28 Covid-19 cases now as confirmed by Minister of Health Dr Chilufya. The Minister said 26 patients was a circle of transmission through the people who traveled and returned from Pakistan.,MulundaArchie,"Kitwe,Zambia",6,1,1,1,"Land Governance Expert, Farmer, Development Consultant and founder of the Copperbelt Indigenous Peoples Land Rights Network (CIPLRN).",15526,,its 28 covid19 cases now as confirmed by minister of health dr chilufya the minister said 26 patients was a circle of transmission through the people who traveled and returned from pakistan,"['its', '28', 'covid19', 'cases', 'now', 'as', 'confirmed', 'by', 'minister', 'of', 'health', 'dr', 'chilufya', 'the', 'minister', 'said', '26', 'patients', 'was', 'a', 'circle', 'of', 'transmission', 'through', 'the', 'people', 'who', 'traveled', 'and', 'returned', 'from', 'pakistan']","['28', 'covid19', 'cases', 'confirmed', 'minister', 'health', 'dr', 'chilufya', 'minister', 'said', '26', 'patients', 'circle', 'transmission', 'people', 'traveled', 'returned', 'pakistan']","['28', 'covid19', 'case', 'confirm', 'minist', 'health', 'dr', 'chilufya', 'minist', 'said', '26', 'patient', 'circl', 'transmiss', 'peopl', 'travel', 'return', 'pakistan']","['28', 'covid19', 'cases', 'confirmed', 'minister', 'health', 'dr', 'chilufya', 'minister', 'said', '26', 'patients', 'circle', 'transmission', 'people', 'traveled', 'returned', 'pakistan']",1,Zambia
2020-03-25 10:58:06+00:00,1242767710284546048,"Journalists, 

The most important question you should ask the Health Minister is how that human to human transmission case happened. Was it a family member who was tending to a person who travelled or it's just a random person? If it's a random person then we are screwed...",_Moise_1,Lusaka,5,3,1,0,GRC | Development | Global/Regional/National Politics | Liverpool FC,646,,journalists the most important question you should ask the health minister is how that human to human transmission case happened was it a family member who was tending to a person who travelled or its just a random person if its a random person then we are screwed,"['journalists', 'the', 'most', 'important', 'question', 'you', 'should', 'ask', 'the', 'health', 'minister', 'is', 'how', 'that', 'human', 'to', 'human', 'transmission', 'case', 'happened', 'was', 'it', 'a', 'family', 'member', 'who', 'was', 'tending', 'to', 'a', 'person', 'who', 'travelled', 'or', 'its', 'just', 'a', 'random', 'person', 'if', 'its', 'a', 'random', 'person', 'then', 'we', 'are', 'screwed']","['journalists', 'important', 'question', 'ask', 'health', 'minister', 'human', 'human', 'transmission', 'case', 'happened', 'family', 'member', 'tending', 'person', 'travelled', 'random', 'person', 'random', 'person', 'screwed']","['journalist', 'import', 'question', 'ask', 'health', 'minist', 'human', 'human', 'transmiss', 'case', 'happen', 'famili', 'member', 'tend', 'person', 'travel', 'random', 'person', 'random', 'person', 'screw']","['journalists', 'important', 'question', 'ask', 'health', 'minister', 'human', 'human', 'transmission', 'case', 'happened', 'family', 'member', 'tending', 'person', 'travelled', 'random', 'person', 'random', 'person', 'screwed']",1,Zambia
2020-03-25 10:08:02+00:00,1242755110083624960,"While all other travellers without symptoms will be quanrantined at their own cost.

2. government has suspended non esstential traveller.

3. public gatherings to be restricted to not more than 50 people - subject to complying with Publc health authorty guidelines.",Ze_Mwape,"Lusaka, Zambia",0,1,0,0,"🍫Dark chocolate
🇿🇲Zambia
🎓PHD from the University of Common Sense.",1273,,while all other travellers without symptoms will be quanrantined at their own cost 2 government has suspended non esstential traveller 3 public gatherings to be restricted to not more than 50 people subject to complying with publc health authorty guidelines,"['while', 'all', 'other', 'travellers', 'without', 'symptoms', 'will', 'be', 'quanrantined', 'at', 'their', 'own', 'cost', '2', 'government', 'has', 'suspended', 'non', 'esstential', 'traveller', '3', 'public', 'gatherings', 'to', 'be', 'restricted', 'to', 'not', 'more', 'than', '50', 'people', 'subject', 'to', 'complying', 'with', 'publc', 'health', 'authorty', 'guidelines']","['travellers', 'without', 'symptoms', 'quanrantined', 'cost', '2', 'government', 'suspended', 'non', 'esstential', 'traveller', '3', 'public', 'gatherings', 'restricted', '50', 'people', 'subject', 'complying', 'publc', 'health', 'authorty', 'guidelines']","['travel', 'without', 'symptom', 'quanrantin', 'cost', '2', 'govern', 'suspend', 'non', 'esstenti', 'travel', '3', 'public', 'gather', 'restrict', '50', 'peopl', 'subject', 'compli', 'publc', 'health', 'authorti', 'guidelin']","['travellers', 'without', 'symptoms', 'quanrantined', 'cost', '2', 'government', 'suspended', 'non', 'esstential', 'traveller', '3', 'public', 'gatherings', 'restricted', '50', 'people', 'subject', 'complying', 'publc', 'health', 'authorty', 'guidelines']",1,Zambia
2020-03-22 13:36:22+00:00,1241720377623097350,"@LisaKen53434538 Hey, there is a new case recorded according to the Minister of Health. It brings the total number Covid-19 to 3 in the country. It is equally recorded in Lusaka. Some had traveled to Pakistan and tested positive yesterday after returning.",MulundaArchie,"Kitwe,Zambia",1,0,0,0,"Land Governance Expert, Farmer, Development Consultant and founder of the Copperbelt Indigenous Peoples Land Rights Network (CIPLRN).",15526,,hey there is a new case recorded according to the minister of health it brings the total number covid19 to 3 in the country it is equally recorded in lusaka some had traveled to pakistan and tested positive yesterday after returning,"['hey', 'there', 'is', 'a', 'new', 'case', 'recorded', 'according', 'to', 'the', 'minister', 'of', 'health', 'it', 'brings', 'the', 'total', 'number', 'covid19', 'to', '3', 'in', 'the', 'country', 'it', 'is', 'equally', 'recorded', 'in', 'lusaka', 'some', 'had', 'traveled', 'to', 'pakistan', 'and', 'tested', 'positive', 'yesterday', 'after', 'returning']","['hey', 'new', 'case', 'recorded', 'according', 'minister', 'health', 'brings', 'total', 'number', 'covid19', '3', 'country', 'equally', 'recorded', 'lusaka', 'traveled', 'pakistan', 'tested', 'positive', 'yesterday', 'returning']","['hey', 'new', 'case', 'record', 'accord', 'minist', 'health', 'bring', 'total', 'number', 'covid19', '3', 'countri', 'equal', 'record', 'lusaka', 'travel', 'pakistan', 'test', 'posit', 'yesterday', 'return']","['hey', 'new', 'case', 'recorded', 'according', 'minister', 'health', 'brings', 'total', 'number', 'covid19', '3', 'country', 'equally', 'recorded', 'lusaka', 'traveled', 'pakistan', 'tested', 'positive', 'yesterday', 'returning']",1,Zambia
2020-03-21 08:58:13+00:00,1241287991961812994,I have received countless calls and messages from people in distress due to the outbreak. Is @mohzambia and @ZMPublicHealth doing anything about the mental health of the community and those in mandatory and self quarantine. This has the potential to blow up and get worse.,MsPPChunga,"Lusaka, Zambia",0,1,0,0,Sustainable Development|Innovation & Design Thinking |Mental Health|'19 Mandela Washington Fellow|'19 Unleash Top Talent| AWEC'20| Personal Account,1095,,i have received countless calls and messages from people in distress due to the outbreak is and doing anything about the mental health of the community and those in mandatory and self quarantine this has the potential to blow up and get worse,"['i', 'have', 'received', 'countless', 'calls', 'and', 'messages', 'from', 'people', 'in', 'distress', 'due', 'to', 'the', 'outbreak', 'is', 'and', 'doing', 'anything', 'about', 'the', 'mental', 'health', 'of', 'the', 'community', 'and', 'those', 'in', 'mandatory', 'and', 'self', 'quarantine', 'this', 'has', 'the', 'potential', 'to', 'blow', 'up', 'and', 'get', 'worse']","['received', 'countless', 'calls', 'messages', 'people', 'distress', 'due', 'outbreak', 'anything', 'mental', 'health', 'community', 'mandatory', 'self', 'quarantine', 'potential', 'blow', 'get', 'worse']","['receiv', 'countless', 'call', 'messag', 'peopl', 'distress', 'due', 'outbreak', 'anyth', 'mental', 'health', 'commun', 'mandatori', 'self', 'quarantin', 'potenti', 'blow', 'get', 'wors']","['received', 'countless', 'calls', 'messages', 'people', 'distress', 'due', 'outbreak', 'anything', 'mental', 'health', 'community', 'mandatory', 'self', 'quarantine', 'potential', 'blow', 'get', 'worse']",1,Zambia
