Date,Id,Tweet,Username,Location,likeCount,replyCount,retweetCount,quoteCount,userDescription,userFollowers,hashtags,Cleaned_Tweet,Tweet_tokenized,Tweet_removed_stop_word,Tweet_stemmed,Tweet_lemmatized,sentiment,Country
2022-06-03 18:40:32+00:00,1.5327943770844897e+18,@SharonJ91355229 @Forbes @WorldPeaceBook @KhodSadul @1942SilverChevy @Chewie_Hawk @Erika72813084 @Petra36760903 @armcbride1 @paddyreid5 @SalesTalk360 @Phrontrowalpine @tweetsfordaysss @_wilhelm_walter @hubonst @thisisevelinaok Just FYI. Frauds do not work hard. @elonmusk works his ass off. Keep betting against hard smart working people and you will always lose.,sakiwebo,"Rotterdam, Nederland",1.0,0.0,0.0,0.0,Does not like idealists! Humans should push forward based on science.,222.0,,just fyi frauds do not work hard works his ass off keep betting against hard smart working people and you will always lose,"['just', 'fyi', 'frauds', 'do', 'not', 'work', 'hard', 'works', 'his', 'ass', 'off', 'keep', 'betting', 'against', 'hard', 'smart', 'working', 'people', 'and', 'you', 'will', 'always', 'lose']","['fyi', 'frauds', 'work', 'hard', 'works', 'ass', 'keep', 'betting', 'hard', 'smart', 'working', 'people', 'always', 'lose']","['fyi', 'fraud', 'work', 'hard', 'work', 'ass', 'keep', 'bet', 'hard', 'smart', 'work', 'peopl', 'alway', 'lose']","['fyi', 'frauds', 'work', 'hard', 'works', 'ass', 'keep', 'betting', 'hard', 'smart', 'working', 'people', 'always', 'lose']",1,Netherlands
2022-06-01 14:30:48+00:00,1.5320067565780992e+18,"@garyblack00 @elonmusk This way he increases emissions, support banks exploiting real estate, drive car sales, reduce health of his workers stuck in traffic, waste travel time, express distrust and disdain.  I always asked ""Why am I typing this here?"" Sometimes the trip to the office makes no sense.",climatebabes,"Den Haag, Nederland",1.0,0.0,0.0,0.0,We can create 2500 times more wealth with renewables than with fossil. To cool the planet we need to reflect light back and create shade,2519.0,,this way he increases emissions support banks exploiting real estate drive car sales reduce health of his workers stuck in traffic waste travel time express distrust and disdain i always asked why am i typing this here sometimes the trip to the office makes no sense,"['this', 'way', 'he', 'increases', 'emissions', 'support', 'banks', 'exploiting', 'real', 'estate', 'drive', 'car', 'sales', 'reduce', 'health', 'of', 'his', 'workers', 'stuck', 'in', 'traffic', 'waste', 'travel', 'time', 'express', 'distrust', 'and', 'disdain', 'i', 'always', 'asked', 'why', 'am', 'i', 'typing', 'this', 'here', 'sometimes', 'the', 'trip', 'to', 'the', 'office', 'makes', 'no', 'sense']","['way', 'increases', 'emissions', 'support', 'banks', 'exploiting', 'real', 'estate', 'drive', 'car', 'sales', 'reduce', 'health', 'workers', 'stuck', 'traffic', 'waste', 'travel', 'time', 'express', 'distrust', 'disdain', 'always', 'asked', 'typing', 'sometimes', 'trip', 'office', 'makes', 'sense']","['way', 'increas', 'emiss', 'support', 'bank', 'exploit', 'real', 'estat', 'drive', 'car', 'sale', 'reduc', 'health', 'worker', 'stuck', 'traffic', 'wast', 'travel', 'time', 'express', 'distrust', 'disdain', 'alway', 'ask', 'type', 'sometim', 'trip', 'offic', 'make', 'sens']","['way', 'increases', 'emissions', 'support', 'banks', 'exploiting', 'real', 'estate', 'drive', 'car', 'sales', 'reduce', 'health', 'workers', 'stuck', 'traffic', 'waste', 'travel', 'time', 'express', 'distrust', 'disdain', 'always', 'asked', 'typing', 'sometimes', 'trip', 'office', 'makes', 'sense']",1,Netherlands
2022-06-01 14:17:54+00:00,1.532003508974649e+18,"Read the graphic to see a message from the show founder about the mask wearing policy for #AutoShipTech. The policy is simple: Wearing a mask is ✅. Not wearing a mask is ✅.

Sign up for your FREE Expo pass:  https://t.co/v8rEMlSpXz #AutoShipTech https://t.co/pYH2jL3Wni",AutoShipTech,"Amsterdam, The Netherlands",0.0,0.0,0.0,0.0,Autonomous Ship Expo - dedicated to displaying next-gen solutions + tech to enable varying degrees of automation - across the ship & cargo handling sectors.,56.0,"['AutoShipTech', 'AutoShipTech']",read the graphic to see a message from the show founder about the mask wearing policy for autoshiptech the policy is simple wearing a mask is not wearing a mask is sign up for your free expo pass autoshiptech,"['read', 'the', 'graphic', 'to', 'see', 'a', 'message', 'from', 'the', 'show', 'founder', 'about', 'the', 'mask', 'wearing', 'policy', 'for', 'autoshiptech', 'the', 'policy', 'is', 'simple', 'wearing', 'a', 'mask', 'is', 'not', 'wearing', 'a', 'mask', 'is', 'sign', 'up', 'for', 'your', 'free', 'expo', 'pass', 'autoshiptech']","['read', 'graphic', 'see', 'message', 'show', 'founder', 'mask', 'wearing', 'policy', 'autoshiptech', 'policy', 'simple', 'wearing', 'mask', 'wearing', 'mask', 'sign', 'free', 'expo', 'pass', 'autoshiptech']","['read', 'graphic', 'see', 'messag', 'show', 'founder', 'mask', 'wear', 'polici', 'autoshiptech', 'polici', 'simpl', 'wear', 'mask', 'wear', 'mask', 'sign', 'free', 'expo', 'pass', 'autoshiptech']","['read', 'graphic', 'see', 'message', 'show', 'founder', 'mask', 'wearing', 'policy', 'autoshiptech', 'policy', 'simple', 'wearing', 'mask', 'wearing', 'mask', 'sign', 'free', 'expo', 'pass', 'autoshiptech']",1,Netherlands
2022-05-31 03:19:28+00:00,1.531475420742312e+18,@MateuszWaraksa @elonmusk @TheTeslaBull @BLKMDL3 @S3XYstarship @IWill_Travel @AOC There are contracts and they also have to pay tax. So they can’t lie. But why would they? Health care is top sport as well and sporters have also loved ones whom need care. I believe we could support and encourage each other in this way to do what is important and needed the most,A_flowingvision,"Apeldoorn, Nederland",0.0,1.0,0.0,0.0,,0.0,,there are contracts and they also have to pay tax so they cant lie but why would they health care is top sport as well and sporters have also loved ones whom need care i believe we could support and encourage each other in this way to do what is important and needed the most,"['there', 'are', 'contracts', 'and', 'they', 'also', 'have', 'to', 'pay', 'tax', 'so', 'they', 'cant', 'lie', 'but', 'why', 'would', 'they', 'health', 'care', 'is', 'top', 'sport', 'as', 'well', 'and', 'sporters', 'have', 'also', 'loved', 'ones', 'whom', 'need', 'care', 'i', 'believe', 'we', 'could', 'support', 'and', 'encourage', 'each', 'other', 'in', 'this', 'way', 'to', 'do', 'what', 'is', 'important', 'and', 'needed', 'the', 'most']","['contracts', 'also', 'pay', 'tax', 'cant', 'lie', 'would', 'health', 'care', 'top', 'sport', 'well', 'sporters', 'also', 'loved', 'ones', 'need', 'care', 'believe', 'could', 'support', 'encourage', 'way', 'important', 'needed']","['contract', 'also', 'pay', 'tax', 'cant', 'lie', 'would', 'health', 'care', 'top', 'sport', 'well', 'sporter', 'also', 'love', 'one', 'need', 'care', 'believ', 'could', 'support', 'encourag', 'way', 'import', 'need']","['contracts', 'also', 'pay', 'tax', 'cant', 'lie', 'would', 'health', 'care', 'top', 'sport', 'well', 'sporters', 'also', 'loved', 'ones', 'need', 'care', 'believe', 'could', 'support', 'encourage', 'way', 'important', 'needed']",5,Netherlands
2022-05-30 08:00:12+00:00,1.53118368374664e+18,"😷Packing for #ecsite2022 and travelling by train?
FFP22 or medical grade mask on German trains are mandatory so bring one with you.
And inform yourself of any travel restrictions in Germany, that might be applicable to you 👉https://t.co/jbxreaW0XJ
#TrainToEcsite https://t.co/5VEA3t4ie7",Ecsite,"Brussels, Belgium",5.0,0.0,0.0,0.0,For #scicomm pros in Europe & beyond #sciencecentres #museums #universities #RRI. We publish #SpokesEcsite & organise #ecsite2022 #EcsiteDF2022 #EcsiteWorkrooms,6027.0,"['ecsite2022', 'TrainToEcsite']",packing for ecsite2022 and travelling by train ffp22 or medical grade mask on german trains are mandatory so bring one with you and inform yourself of any travel restrictions in germany that might be applicable to you traintoecsite,"['packing', 'for', 'ecsite2022', 'and', 'travelling', 'by', 'train', 'ffp22', 'or', 'medical', 'grade', 'mask', 'on', 'german', 'trains', 'are', 'mandatory', 'so', 'bring', 'one', 'with', 'you', 'and', 'inform', 'yourself', 'of', 'any', 'travel', 'restrictions', 'in', 'germany', 'that', 'might', 'be', 'applicable', 'to', 'you', 'traintoecsite']","['packing', 'ecsite2022', 'travelling', 'train', 'ffp22', 'medical', 'grade', 'mask', 'german', 'trains', 'mandatory', 'bring', 'one', 'inform', 'travel', 'restrictions', 'germany', 'might', 'applicable', 'traintoecsite']","['pack', 'ecsite2022', 'travel', 'train', 'ffp22', 'medic', 'grade', 'mask', 'german', 'train', 'mandatori', 'bring', 'one', 'inform', 'travel', 'restrict', 'germani', 'might', 'applic', 'traintoecsit']","['packing', 'ecsite2022', 'travelling', 'train', 'ffp22', 'medical', 'grade', 'mask', 'german', 'trains', 'mandatory', 'bring', 'one', 'inform', 'travel', 'restrictions', 'germany', 'might', 'applicable', 'traintoecsite']",5,Netherlands
2022-05-29 21:01:32+00:00,1.531017924886012e+18,"@IgorBeuker @elonmusk I am not an  Us citizen, and like you, I also love to make my money stateside. It is logical for them to think local, why would they bother 75% of the USA citizens have never even left the USA for Holiday etc. They do not care about foreign policies.",Softinc,"Oisterwijk, Netherlands",0.0,1.0,0.0,0.0,"Internet security and fraude detection. Working from Nuland
, Oisterwijk and Austin Tx",134.0,,i am not an us citizen and like you i also love to make my money stateside it is logical for them to think local why would they bother 75 of the usa citizens have never even left the usa for holiday etc they do not care about foreign policies,"['i', 'am', 'not', 'an', 'us', 'citizen', 'and', 'like', 'you', 'i', 'also', 'love', 'to', 'make', 'my', 'money', 'stateside', 'it', 'is', 'logical', 'for', 'them', 'to', 'think', 'local', 'why', 'would', 'they', 'bother', '75', 'of', 'the', 'usa', 'citizens', 'have', 'never', 'even', 'left', 'the', 'usa', 'for', 'holiday', 'etc', 'they', 'do', 'not', 'care', 'about', 'foreign', 'policies']","['us', 'citizen', 'like', 'also', 'love', 'make', 'money', 'stateside', 'logical', 'think', 'local', 'would', 'bother', '75', 'usa', 'citizens', 'never', 'even', 'left', 'usa', 'holiday', 'etc', 'care', 'foreign', 'policies']","['us', 'citizen', 'like', 'also', 'love', 'make', 'money', 'statesid', 'logic', 'think', 'local', 'would', 'bother', '75', 'usa', 'citizen', 'never', 'even', 'left', 'usa', 'holiday', 'etc', 'care', 'foreign', 'polici']","['us', 'citizen', 'like', 'also', 'love', 'make', 'money', 'stateside', 'logical', 'think', 'local', 'would', 'bother', '75', 'usa', 'citizens', 'never', 'even', 'left', 'usa', 'holiday', 'etc', 'care', 'foreign', 'policies']",1,Netherlands
2022-05-29 17:34:08+00:00,1.5309657280603996e+18,"@BlueDotRedStat3 Me (as far as I know) and while I have probably been more careful than most - I have traveled quite a lot since spring last year, visited bars and other crowded places. I wear a mask when I feel like I’m in a higher risk situation but other than that I’m fairly relaxed about it.",ecotist,Amsterdam,0.0,1.0,0.0,0.0,"Digital Manager @350Europe (Previously @Patagonia, @Avaaz & @Greenpeace) British Bermudian, living in NL. Obsessed w/COVID science. Opinions only mine (she/her)",5490.0,,me as far as i know and while i have probably been more careful than most i have traveled quite a lot since spring last year visited bars and other crowded places i wear a mask when i feel like im in a higher risk situation but other than that im fairly relaxed about it,"['me', 'as', 'far', 'as', 'i', 'know', 'and', 'while', 'i', 'have', 'probably', 'been', 'more', 'careful', 'than', 'most', 'i', 'have', 'traveled', 'quite', 'a', 'lot', 'since', 'spring', 'last', 'year', 'visited', 'bars', 'and', 'other', 'crowded', 'places', 'i', 'wear', 'a', 'mask', 'when', 'i', 'feel', 'like', 'im', 'in', 'a', 'higher', 'risk', 'situation', 'but', 'other', 'than', 'that', 'im', 'fairly', 'relaxed', 'about', 'it']","['far', 'know', 'probably', 'careful', 'traveled', 'quite', 'lot', 'since', 'spring', 'last', 'year', 'visited', 'bars', 'crowded', 'places', 'wear', 'mask', 'feel', 'like', 'im', 'higher', 'risk', 'situation', 'im', 'fairly', 'relaxed']","['far', 'know', 'probabl', 'care', 'travel', 'quit', 'lot', 'sinc', 'spring', 'last', 'year', 'visit', 'bar', 'crowd', 'place', 'wear', 'mask', 'feel', 'like', 'im', 'higher', 'risk', 'situat', 'im', 'fairli', 'relax']","['far', 'know', 'probably', 'careful', 'traveled', 'quite', 'lot', 'since', 'spring', 'last', 'year', 'visited', 'bars', 'crowded', 'places', 'wear', 'mask', 'feel', 'like', 'im', 'higher', 'risk', 'situation', 'im', 'fairly', 'relaxed']",4,Netherlands
2022-04-02 18:16:11+00:00,1.5103202033678582e+18,"@travelingbutt @MattWallace888 @elonmusk I care! 
About what are we talking now? 😅",yndzia,Amsterdam,1.0,1.0,0.0,0.0,Accidentally still alive ;),15.0,,i care about what are we talking now,"['i', 'care', 'about', 'what', 'are', 'we', 'talking', 'now']","['care', 'talking']","['care', 'talk']","['care', 'talking']",5,Netherlands
2020-12-27 16:02:13+00:00,1.3432256813926236e+18,"Anybody in Europe with Model 3 manufactured after september 2019, which means including pedestrian speaker and with installed holiday update got Boombox? Hope so, or else regulations issue like summon? @elonmusk",HansNoordsij,"51.580122,5.073237",1.0,0.0,0.0,0.0,Owner iLetsel and happy Model S and 3 driver. Concerned about future and supporting Tesla in transition to sustainability. Unmasking hydrogen as misleading.,1222.0,,anybody in europe with model 3 manufactured after september 2019 which means including pedestrian speaker and with installed holiday update got boombox hope so or else regulations issue like summon,"['anybody', 'in', 'europe', 'with', 'model', '3', 'manufactured', 'after', 'september', '2019', 'which', 'means', 'including', 'pedestrian', 'speaker', 'and', 'with', 'installed', 'holiday', 'update', 'got', 'boombox', 'hope', 'so', 'or', 'else', 'regulations', 'issue', 'like', 'summon']","['anybody', 'europe', 'model', '3', 'manufactured', 'september', '2019', 'means', 'including', 'pedestrian', 'speaker', 'installed', 'holiday', 'update', 'got', 'boombox', 'hope', 'else', 'regulations', 'issue', 'like', 'summon']","['anybodi', 'europ', 'model', '3', 'manufactur', 'septemb', '2019', 'mean', 'includ', 'pedestrian', 'speaker', 'instal', 'holiday', 'updat', 'got', 'boombox', 'hope', 'els', 'regul', 'issu', 'like', 'summon']","['anybody', 'europe', 'model', '3', 'manufactured', 'september', '2019', 'means', 'including', 'pedestrian', 'speaker', 'installed', 'holiday', 'update', 'got', 'boombox', 'hope', 'else', 'regulations', 'issue', 'like', 'summon']",1,Netherlands
2020-12-18 07:20:36+00:00,1.3398329221787935e+18,The argument of ‘freedom of choice’? I do wear a mask and I will definitely get a vaccine. Because freedom for me is definitely travelling to be on stage and making people dance to my live played beats. Not being a spreader is a condition sine qua non.,michaelschack,"Antwerp, Belgium",13.0,0.0,1.0,1.0,Drummer/#DJDrummer/DrumeoCOACH - IG & YT michaelschack // MGMT : nicolas@michaelschackmusic.com // FB page : drummermichaelschack,4703.0,,the argument of freedom of choice i do wear a mask and i will definitely get a vaccine because freedom for me is definitely travelling to be on stage and making people dance to my live played beats not being a spreader is a condition sine qua non,"['the', 'argument', 'of', 'freedom', 'of', 'choice', 'i', 'do', 'wear', 'a', 'mask', 'and', 'i', 'will', 'definitely', 'get', 'a', 'vaccine', 'because', 'freedom', 'for', 'me', 'is', 'definitely', 'travelling', 'to', 'be', 'on', 'stage', 'and', 'making', 'people', 'dance', 'to', 'my', 'live', 'played', 'beats', 'not', 'being', 'a', 'spreader', 'is', 'a', 'condition', 'sine', 'qua', 'non']","['argument', 'freedom', 'choice', 'wear', 'mask', 'definitely', 'get', 'vaccine', 'freedom', 'definitely', 'travelling', 'stage', 'making', 'people', 'dance', 'live', 'played', 'beats', 'spreader', 'condition', 'sine', 'qua', 'non']","['argument', 'freedom', 'choic', 'wear', 'mask', 'definit', 'get', 'vaccin', 'freedom', 'definit', 'travel', 'stage', 'make', 'peopl', 'danc', 'live', 'play', 'beat', 'spreader', 'condit', 'sine', 'qua', 'non']","['argument', 'freedom', 'choice', 'wear', 'mask', 'definitely', 'get', 'vaccine', 'freedom', 'definitely', 'travelling', 'stage', 'making', 'people', 'dance', 'live', 'played', 'beats', 'spreader', 'condition', 'sine', 'qua', 'non']",1,Netherlands
2020-07-30 17:49:44+00:00,1.2888945601821655e+18,"Arriving in Amsterdam after traveling Belgium and France for a week; it’s like entering the party, spotted 1 mask (tourist) people on biking paths that are the most crowded you’ve ever seen, party mood everywhere you look. Not entered a single building without a mask for a week!",electricfelix,Europe,5.0,1.0,0.0,0.0,"EV Travel Hacker. The best finds in electric mobility at electricfelix.com/blog
Sign up for the free newsletter: electricfelix.com/newsletter",3744.0,,arriving in amsterdam after traveling belgium and france for a week its like entering the party spotted 1 mask tourist people on biking paths that are the most crowded youve ever seen party mood everywhere you look not entered a single building without a mask for a week,"['arriving', 'in', 'amsterdam', 'after', 'traveling', 'belgium', 'and', 'france', 'for', 'a', 'week', 'its', 'like', 'entering', 'the', 'party', 'spotted', '1', 'mask', 'tourist', 'people', 'on', 'biking', 'paths', 'that', 'are', 'the', 'most', 'crowded', 'youve', 'ever', 'seen', 'party', 'mood', 'everywhere', 'you', 'look', 'not', 'entered', 'a', 'single', 'building', 'without', 'a', 'mask', 'for', 'a', 'week']","['arriving', 'amsterdam', 'traveling', 'belgium', 'france', 'week', 'like', 'entering', 'party', 'spotted', '1', 'mask', 'tourist', 'people', 'biking', 'paths', 'crowded', 'youve', 'ever', 'seen', 'party', 'mood', 'everywhere', 'look', 'entered', 'single', 'building', 'without', 'mask', 'week']","['arriv', 'amsterdam', 'travel', 'belgium', 'franc', 'week', 'like', 'enter', 'parti', 'spot', '1', 'mask', 'tourist', 'peopl', 'bike', 'path', 'crowd', 'youv', 'ever', 'seen', 'parti', 'mood', 'everywher', 'look', 'enter', 'singl', 'build', 'without', 'mask', 'week']","['arriving', 'amsterdam', 'traveling', 'belgium', 'france', 'week', 'like', 'entering', 'party', 'spotted', '1', 'mask', 'tourist', 'people', 'biking', 'paths', 'crowded', 'youve', 'ever', 'seen', 'party', 'mood', 'everywhere', 'look', 'entered', 'single', 'building', 'without', 'mask', 'week']",1,Netherlands
2020-07-15 13:55:59+00:00,1.283399916384129e+18,"@MarinaSaveTheUS @washingtonpost In Belgium, no one enters a store anymore without a mask. Fines start from 250€. Police are monitoring. I suggest you do that in Spain too, especially during the holiday season.",RudiGeerts,Belgium,1.0,1.0,0.0,0.0,"Democracy, rationality, environment, history, science, real news, minorities & underdogs 🇪🇺",1537.0,,in belgium no one enters a store anymore without a mask fines start from 250 police are monitoring i suggest you do that in spain too especially during the holiday season,"['in', 'belgium', 'no', 'one', 'enters', 'a', 'store', 'anymore', 'without', 'a', 'mask', 'fines', 'start', 'from', '250', 'police', 'are', 'monitoring', 'i', 'suggest', 'you', 'do', 'that', 'in', 'spain', 'too', 'especially', 'during', 'the', 'holiday', 'season']","['belgium', 'one', 'enters', 'store', 'anymore', 'without', 'mask', 'fines', 'start', '250', 'police', 'monitoring', 'suggest', 'spain', 'especially', 'holiday', 'season']","['belgium', 'one', 'enter', 'store', 'anymor', 'without', 'mask', 'fine', 'start', '250', 'polic', 'monitor', 'suggest', 'spain', 'especi', 'holiday', 'season']","['belgium', 'one', 'enters', 'store', 'anymore', 'without', 'mask', 'fines', 'start', '250', 'police', 'monitoring', 'suggest', 'spain', 'especially', 'holiday', 'season']",1,Netherlands
2020-01-01 20:48:23+00:00,1.2124756806063432e+18,@TiceRichard @CatharineHoey believed in the Sovereignty argument but was used by the Tories to underline this argument to mask the real reason for #Brexit which is to change UK in a Singapore like state. She was rewarded with an invitation at a Champagne party at Reed Mogg house. #Brexit,Roelandpaul,Amsterdam,1.0,1.0,0.0,0.0,Psychologist. Dutch. If I lived in the UK I would vote Lib Dem. European. Very sad about Brexit. In my opinion EUref didn't meet the criteria to be valid.,624.0,"['Brexit', 'Brexit']",believed in the sovereignty argument but was used by the tories to underline this argument to mask the real reason for brexit which is to change uk in a singapore like state she was rewarded with an invitation at a champagne party at reed mogg house brexit,"['believed', 'in', 'the', 'sovereignty', 'argument', 'but', 'was', 'used', 'by', 'the', 'tories', 'to', 'underline', 'this', 'argument', 'to', 'mask', 'the', 'real', 'reason', 'for', 'brexit', 'which', 'is', 'to', 'change', 'uk', 'in', 'a', 'singapore', 'like', 'state', 'she', 'was', 'rewarded', 'with', 'an', 'invitation', 'at', 'a', 'champagne', 'party', 'at', 'reed', 'mogg', 'house', 'brexit']","['believed', 'sovereignty', 'argument', 'used', 'tories', 'underline', 'argument', 'mask', 'real', 'reason', 'brexit', 'change', 'uk', 'singapore', 'like', 'state', 'rewarded', 'invitation', 'champagne', 'party', 'reed', 'mogg', 'house', 'brexit']","['believ', 'sovereignti', 'argument', 'use', 'tori', 'underlin', 'argument', 'mask', 'real', 'reason', 'brexit', 'chang', 'uk', 'singapor', 'like', 'state', 'reward', 'invit', 'champagn', 'parti', 'reed', 'mogg', 'hous', 'brexit']","['believed', 'sovereignty', 'argument', 'used', 'tories', 'underline', 'argument', 'mask', 'real', 'reason', 'brexit', 'change', 'uk', 'singapore', 'like', 'state', 'rewarded', 'invitation', 'champagne', 'party', 'reed', 'mogg', 'house', 'brexit']",3,Netherlands
2019-12-27 10:57:41+00:00,1.2105150843568497e+18,@elonmusk @Tesla take care mining pmi services ;-)) enjoy your holidays too ;-)) https://t.co/wPib9Ur4pl,Antonie19031966,"Utrecht, The Netherlands",0.0,0.0,0.0,0.0,"I love colorful open and transparent people. I hope you will find me one of them. My tweets will be short, to remember important life events. I rule a vida loca",4061.0,,take care mining pmi services enjoy your holidays too,"['take', 'care', 'mining', 'pmi', 'services', 'enjoy', 'your', 'holidays', 'too']","['take', 'care', 'mining', 'pmi', 'services', 'enjoy', 'holidays']","['take', 'care', 'mine', 'pmi', 'servic', 'enjoy', 'holiday']","['take', 'care', 'mining', 'pmi', 'services', 'enjoy', 'holidays']",5,Netherlands
2020-05-12 16:18:19+00:00,1.2602429150429553e+18,"Top 5 question from kids during #COVID19
1. Could we buy #sweets?
2. Could I have #icecream in the cafe near pizzeria?
3. When does the #quarantine end?
4. When could we travel to #grandma?
5. When could we go to the swimming pool?
#COVIDlife with 6 and 3 y.o. kids, @stanronzhin",CrazysdiamondN,The Netherlands,4.0,0.0,1.0,1.0,Linked data scientist | Iyengar yoga teacher | PhD in soil science,275.0,"['COVID19', 'sweets', 'icecream', 'quarantine', 'grandma', 'COVIDlife']",top 5 question from kids during covid19 1 could we buy sweets 2 could i have icecream in the cafe near pizzeria 3 when does the quarantine end 4 when could we travel to grandma 5 when could we go to the swimming pool covidlife with 6 and 3 yo kids,"['top', '5', 'question', 'from', 'kids', 'during', 'covid19', '1', 'could', 'we', 'buy', 'sweets', '2', 'could', 'i', 'have', 'icecream', 'in', 'the', 'cafe', 'near', 'pizzeria', '3', 'when', 'does', 'the', 'quarantine', 'end', '4', 'when', 'could', 'we', 'travel', 'to', 'grandma', '5', 'when', 'could', 'we', 'go', 'to', 'the', 'swimming', 'pool', 'covidlife', 'with', '6', 'and', '3', 'yo', 'kids']","['top', '5', 'question', 'kids', 'covid19', '1', 'could', 'buy', 'sweets', '2', 'could', 'icecream', 'cafe', 'near', 'pizzeria', '3', 'quarantine', 'end', '4', 'could', 'travel', 'grandma', '5', 'could', 'go', 'swimming', 'pool', 'covidlife', '6', '3', 'yo', 'kids']","['top', '5', 'question', 'kid', 'covid19', '1', 'could', 'buy', 'sweet', '2', 'could', 'icecream', 'cafe', 'near', 'pizzeria', '3', 'quarantin', 'end', '4', 'could', 'travel', 'grandma', '5', 'could', 'go', 'swim', 'pool', 'covidlif', '6', '3', 'yo', 'kid']","['top', '5', 'question', 'kids', 'covid19', '1', 'could', 'buy', 'sweets', '2', 'could', 'icecream', 'cafe', 'near', 'pizzeria', '3', 'quarantine', 'end', '4', 'could', 'travel', 'grandma', '5', 'could', 'go', 'swimming', 'pool', 'covidlife', '6', '3', 'yo', 'kids']",5,Netherlands
