Date,Id,Tweet,Username,Location,likeCount,replyCount,retweetCount,quoteCount,userDescription,userFollowers,hashtags,Cleaned_Tweet,Tweet_tokenized,Tweet_removed_stop_word,Tweet_stemmed,Tweet_lemmatized,sentiment,Country
2020-02-12 13:16:18+00:00,1227582200003981312,"The hospital has 1000 beds, which means it will soon be filled up. It is managed by the PLA deployed to #Hubei to support medical management.",WilliamYang120,"Taipei, Taiwan",8,1,2,0,"East Asia Correspondent @dwnews and Prez @TaiwanFCC. Words in @BuzzFeedNews, @Guardian, @IrishTimes and @Independent. VIEWS and OPINIONS ARE STRICTLY MY OWN.",53681,['Hubei'],the hospital has 1000 beds which means it will soon be filled up it is managed by the pla deployed to hubei to support medical management,"['the', 'hospital', 'has', '1000', 'beds', 'which', 'means', 'it', 'will', 'soon', 'be', 'filled', 'up', 'it', 'is', 'managed', 'by', 'the', 'pla', 'deployed', 'to', 'hubei', 'to', 'support', 'medical', 'management']","['hospital', '1000', 'beds', 'means', 'soon', 'filled', 'managed', 'pla', 'deployed', 'hubei', 'support', 'medical', 'management']","['hospit', '1000', 'bed', 'mean', 'soon', 'fill', 'manag', 'pla', 'deploy', 'hubei', 'support', 'medic', 'manag']","['hospital', '1000', 'beds', 'means', 'soon', 'filled', 'managed', 'pla', 'deployed', 'hubei', 'support', 'medical', 'management']",4,Taiwan
2020-01-25 03:25:18+00:00,1220910489670041602,"While the government keeps assuring the international community that medical supplies are abundant in #Wuhan, but local hospitals and its staff immediately called for donation and support from the outside world the day after, contradicting the government’s claims.",WilliamYang120,"Taipei, Taiwan",46,2,32,1,"East Asia Correspondent @dwnews and Prez @TaiwanFCC. Words in @BuzzFeedNews, @Guardian, @IrishTimes and @Independent. VIEWS and OPINIONS ARE STRICTLY MY OWN.",53681,['Wuhan'],while the government keeps assuring the international community that medical supplies are abundant in wuhan but local hospitals and its staff immediately called for donation and support from the outside world the day after contradicting the governments claims,"['while', 'the', 'government', 'keeps', 'assuring', 'the', 'international', 'community', 'that', 'medical', 'supplies', 'are', 'abundant', 'in', 'wuhan', 'but', 'local', 'hospitals', 'and', 'its', 'staff', 'immediately', 'called', 'for', 'donation', 'and', 'support', 'from', 'the', 'outside', 'world', 'the', 'day', 'after', 'contradicting', 'the', 'governments', 'claims']","['government', 'keeps', 'assuring', 'international', 'community', 'medical', 'supplies', 'abundant', 'wuhan', 'local', 'hospitals', 'staff', 'immediately', 'called', 'donation', 'support', 'outside', 'world', 'day', 'contradicting', 'governments', 'claims']","['govern', 'keep', 'assur', 'intern', 'commun', 'medic', 'suppli', 'abund', 'wuhan', 'local', 'hospit', 'staff', 'immedi', 'call', 'donat', 'support', 'outsid', 'world', 'day', 'contradict', 'govern', 'claim']","['government', 'keeps', 'assuring', 'international', 'community', 'medical', 'supplies', 'abundant', 'wuhan', 'local', 'hospitals', 'staff', 'immediately', 'called', 'donation', 'support', 'outside', 'world', 'day', 'contradicting', 'governments', 'claims']",3,Taiwan
2020-01-24 13:53:12+00:00,1220706118264950789,"Most people in #Wuhan tried to have a low-key LNY eve gathering with family, hoping not to let the whole #WuhanOutbreak affect their holiday season. And many view the makeshift hospital as a timely solution to the strained medical support on the ground.",WilliamYang120,"Taipei, Taiwan",28,1,9,0,"East Asia Correspondent @dwnews and Prez @TaiwanFCC. Words in @BuzzFeedNews, @Guardian, @IrishTimes and @Independent. VIEWS and OPINIONS ARE STRICTLY MY OWN.",53681,"['Wuhan', 'WuhanOutbreak']",most people in wuhan tried to have a lowkey lny eve gathering with family hoping not to let the whole wuhanoutbreak affect their holiday season and many view the makeshift hospital as a timely solution to the strained medical support on the ground,"['most', 'people', 'in', 'wuhan', 'tried', 'to', 'have', 'a', 'lowkey', 'lny', 'eve', 'gathering', 'with', 'family', 'hoping', 'not', 'to', 'let', 'the', 'whole', 'wuhanoutbreak', 'affect', 'their', 'holiday', 'season', 'and', 'many', 'view', 'the', 'makeshift', 'hospital', 'as', 'a', 'timely', 'solution', 'to', 'the', 'strained', 'medical', 'support', 'on', 'the', 'ground']","['people', 'wuhan', 'tried', 'lowkey', 'lny', 'eve', 'gathering', 'family', 'hoping', 'let', 'whole', 'wuhanoutbreak', 'affect', 'holiday', 'season', 'many', 'view', 'makeshift', 'hospital', 'timely', 'solution', 'strained', 'medical', 'support', 'ground']","['peopl', 'wuhan', 'tri', 'lowkey', 'lni', 'eve', 'gather', 'famili', 'hope', 'let', 'whole', 'wuhanoutbreak', 'affect', 'holiday', 'season', 'mani', 'view', 'makeshift', 'hospit', 'time', 'solut', 'strain', 'medic', 'support', 'ground']","['people', 'wuhan', 'tried', 'lowkey', 'lny', 'eve', 'gathering', 'family', 'hoping', 'let', 'whole', 'wuhanoutbreak', 'affect', 'holiday', 'season', 'many', 'view', 'makeshift', 'hospital', 'timely', 'solution', 'strained', 'medical', 'support', 'ground']",2,Taiwan
2020-12-16 08:54:18+00:00,1339131726530977793,Happy!! Contemporary Music Mentor by @MarinAlsop and @JessicaCottis and big support from @ChoLiangLin and @TheDallasOpera-Mentorship. Love to you all 🎈❤️🎊 #GlobalOdeToJoy @Opus3Artists @HakkaAffairs @CulturalTaiwan #Musician #Conductor #Violinist #Pandemic #Mask https://t.co/5YgWPV1EKW,MadelineCCTsai,,2,0,0,0,Cabrillo Fellow ‘21 | ROH JPYAP WoCo alumna'19’20 The Dallas Opera -conductor residency'19 | Solti International Conducting Competition People's Choice Award'17,30,"['GlobalOdeToJoy', 'Musician', 'Conductor', 'Violinist', 'Pandemic', 'Mask']",happy contemporary music mentor by and and big support from and love to you all globalodetojoy musician conductor violinist pandemic mask,"['happy', 'contemporary', 'music', 'mentor', 'by', 'and', 'and', 'big', 'support', 'from', 'and', 'love', 'to', 'you', 'all', 'globalodetojoy', 'musician', 'conductor', 'violinist', 'pandemic', 'mask']","['happy', 'contemporary', 'music', 'mentor', 'big', 'support', 'love', 'globalodetojoy', 'musician', 'conductor', 'violinist', 'pandemic', 'mask']","['happi', 'contemporari', 'music', 'mentor', 'big', 'support', 'love', 'globalodetojoy', 'musician', 'conductor', 'violinist', 'pandem', 'mask']","['happy', 'contemporary', 'music', 'mentor', 'big', 'support', 'love', 'globalodetojoy', 'musician', 'conductor', 'violinist', 'pandemic', 'mask']",5,Taiwan
2020-12-16 08:54:18+00:00,1339131726530977793,Happy!! Contemporary Music Mentor by @MarinAlsop and @JessicaCottis and big support from @ChoLiangLin and @TheDallasOpera-Mentorship. Love to you all 🎈❤️🎊 #GlobalOdeToJoy @Opus3Artists @HakkaAffairs @CulturalTaiwan #Musician #Conductor #Violinist #Pandemic #Mask https://t.co/5YgWPV1EKW,MadelineCCTsai,,2,0,0,0,Cabrillo Fellow ‘21 | ROH JPYAP WoCo alumna'19’20 The Dallas Opera -conductor residency'19 | Solti International Conducting Competition People's Choice Award'17,30,"['GlobalOdeToJoy', 'Musician', 'Conductor', 'Violinist', 'Pandemic', 'Mask']",happy contemporary music mentor by and and big support from and love to you all globalodetojoy musician conductor violinist pandemic mask,"['happy', 'contemporary', 'music', 'mentor', 'by', 'and', 'and', 'big', 'support', 'from', 'and', 'love', 'to', 'you', 'all', 'globalodetojoy', 'musician', 'conductor', 'violinist', 'pandemic', 'mask']","['happy', 'contemporary', 'music', 'mentor', 'big', 'support', 'love', 'globalodetojoy', 'musician', 'conductor', 'violinist', 'pandemic', 'mask']","['happi', 'contemporari', 'music', 'mentor', 'big', 'support', 'love', 'globalodetojoy', 'musician', 'conductor', 'violinist', 'pandem', 'mask']","['happy', 'contemporary', 'music', 'mentor', 'big', 'support', 'love', 'globalodetojoy', 'musician', 'conductor', 'violinist', 'pandemic', 'mask']",5,Taiwan
2020-12-26 15:21:54+00:00,1342853150064009216,"#Quarantine periods keep entire communities safe- but they’re useless w out enforcement &amp; support. #taiwanquarantine was well organized, well supported, strict- &amp; EFFECTIVE ( 7 total deaths 2020)I’m headed home soon to 🇺🇸 public health nightmare https://t.co/BKeqjyxSjH",HelenHsuPsyD,"Stanford, CA",0,1,0,0,"Clinical Psychologist. Educator. Past President, Asian American Psych Assoc. UCLA Bruin at Stanford. Made in Taiwan. she/her/她 Bibliophile. BLM Hella Nor Cal",4807,"['Quarantine', 'taiwanquarantine']",quarantine periods keep entire communities safe but theyre useless w out enforcement amp support taiwanquarantine was well organized well supported strict amp effective 7 total deaths 2020im headed home soon to public health nightmare,"['quarantine', 'periods', 'keep', 'entire', 'communities', 'safe', 'but', 'theyre', 'useless', 'w', 'out', 'enforcement', 'amp', 'support', 'taiwanquarantine', 'was', 'well', 'organized', 'well', 'supported', 'strict', 'amp', 'effective', '7', 'total', 'deaths', '2020im', 'headed', 'home', 'soon', 'to', 'public', 'health', 'nightmare']","['quarantine', 'periods', 'keep', 'entire', 'communities', 'safe', 'theyre', 'useless', 'w', 'enforcement', 'amp', 'support', 'taiwanquarantine', 'well', 'organized', 'well', 'supported', 'strict', 'amp', 'effective', '7', 'total', 'deaths', '2020im', 'headed', 'home', 'soon', 'public', 'health', 'nightmare']","['quarantin', 'period', 'keep', 'entir', 'commun', 'safe', 'theyr', 'useless', 'w', 'enforc', 'amp', 'support', 'taiwanquarantin', 'well', 'organ', 'well', 'support', 'strict', 'amp', 'effect', '7', 'total', 'death', '2020im', 'head', 'home', 'soon', 'public', 'health', 'nightmar']","['quarantine', 'periods', 'keep', 'entire', 'communities', 'safe', 'theyre', 'useless', 'w', 'enforcement', 'amp', 'support', 'taiwanquarantine', 'well', 'organized', 'well', 'supported', 'strict', 'amp', 'effective', '7', 'total', 'deaths', '2020im', 'headed', 'home', 'soon', 'public', 'health', 'nightmare']",1,Taiwan
2021-05-12 14:52:01+00:00,1392492765263499270,"➡️16 locally transmitted cases today &amp; the govt is already considering the soft lockdown
➡️Daily press briefings by the Health Minister 
➡️President @iingwen demonstrating leadership &amp; accountability, &amp; letting the officials and ministers do their work with full support",sanahashmi1,"Taipei City, Taiwan",6,0,1,0,"Visiting Fellow, @taef_tw | IIR, @NCCU1927| Non-Resident Fellow, @NextGenTaiwan| RIIPA, Japan | Ph.D., JNU | Ex-@MOFA_Taiwan, @MEAIndia |Works on Taiwan & China",13060,,16 locally transmitted cases today amp the govt is already considering the soft lockdown daily press briefings by the health minister president demonstrating leadership amp accountability amp letting the officials and ministers do their work with full support,"['16', 'locally', 'transmitted', 'cases', 'today', 'amp', 'the', 'govt', 'is', 'already', 'considering', 'the', 'soft', 'lockdown', 'daily', 'press', 'briefings', 'by', 'the', 'health', 'minister', 'president', 'demonstrating', 'leadership', 'amp', 'accountability', 'amp', 'letting', 'the', 'officials', 'and', 'ministers', 'do', 'their', 'work', 'with', 'full', 'support']","['16', 'locally', 'transmitted', 'cases', 'today', 'amp', 'govt', 'already', 'considering', 'soft', 'lockdown', 'daily', 'press', 'briefings', 'health', 'minister', 'president', 'demonstrating', 'leadership', 'amp', 'accountability', 'amp', 'letting', 'officials', 'ministers', 'work', 'full', 'support']","['16', 'local', 'transmit', 'case', 'today', 'amp', 'govt', 'alreadi', 'consid', 'soft', 'lockdown', 'daili', 'press', 'brief', 'health', 'minist', 'presid', 'demonstr', 'leadership', 'amp', 'account', 'amp', 'let', 'offici', 'minist', 'work', 'full', 'support']","['16', 'locally', 'transmitted', 'cases', 'today', 'amp', 'govt', 'already', 'considering', 'soft', 'lockdown', 'daily', 'press', 'briefings', 'health', 'minister', 'president', 'demonstrating', 'leadership', 'amp', 'accountability', 'amp', 'letting', 'officials', 'ministers', 'work', 'full', 'support']",4,Taiwan
2022-01-30 08:11:53+00:00,1487700076663566337,"This is my personal story. To be clear: I support TW in all efforts to keep each other safe&amp;healthy but see need for more ability to adjust. Highlight of 🚑 ride: Taipei101 on my way home (back in quarantine) 
So here’s to more blue skies &amp; embracing change in Year of the Tiger🐯 https://t.co/jQhCd7ETYm",zsuzsettte,🇧🇪 / 🇹🇼,24,2,0,0,"Author of ‘Europe, China, and the Limits of Normative Power’. Tweets on China, Taiwan, Korea, India. Head of AssocNet @9dashline, Non-Res. Fellow @nextgentaiwan",5549,,this is my personal story to be clear i support tw in all efforts to keep each other safeamphealthy but see need for more ability to adjust highlight of ride taipei101 on my way home back in quarantine so heres to more blue skies amp embracing change in year of the tiger,"['this', 'is', 'my', 'personal', 'story', 'to', 'be', 'clear', 'i', 'support', 'tw', 'in', 'all', 'efforts', 'to', 'keep', 'each', 'other', 'safeamphealthy', 'but', 'see', 'need', 'for', 'more', 'ability', 'to', 'adjust', 'highlight', 'of', 'ride', 'taipei101', 'on', 'my', 'way', 'home', 'back', 'in', 'quarantine', 'so', 'heres', 'to', 'more', 'blue', 'skies', 'amp', 'embracing', 'change', 'in', 'year', 'of', 'the', 'tiger']","['personal', 'story', 'clear', 'support', 'tw', 'efforts', 'keep', 'safeamphealthy', 'see', 'need', 'ability', 'adjust', 'highlight', 'ride', 'taipei101', 'way', 'home', 'back', 'quarantine', 'heres', 'blue', 'skies', 'amp', 'embracing', 'change', 'year', 'tiger']","['person', 'stori', 'clear', 'support', 'tw', 'effort', 'keep', 'safeamphealthi', 'see', 'need', 'abil', 'adjust', 'highlight', 'ride', 'taipei101', 'way', 'home', 'back', 'quarantin', 'here', 'blue', 'sky', 'amp', 'embrac', 'chang', 'year', 'tiger']","['personal', 'story', 'clear', 'support', 'tw', 'efforts', 'keep', 'safeamphealthy', 'see', 'need', 'ability', 'adjust', 'highlight', 'ride', 'taipei101', 'way', 'home', 'back', 'quarantine', 'heres', 'blue', 'skies', 'amp', 'embracing', 'change', 'year', 'tiger']",4,Taiwan
2020-12-26 15:21:54+00:00,1342853150064009216,"#Quarantine periods keep entire communities safe- but they’re useless w out enforcement &amp; support. #taiwanquarantine was well organized, well supported, strict- &amp; EFFECTIVE ( 7 total deaths 2020)I’m headed home soon to 🇺🇸 public health nightmare https://t.co/BKeqjyxSjH",HelenHsuPsyD,"Stanford, CA",0,1,0,0,"Clinical Psychologist. Educator. Past President, Asian American Psych Assoc. UCLA Bruin at Stanford. Made in Taiwan. she/her/她 Bibliophile. BLM Hella Nor Cal",4807,"['Quarantine', 'taiwanquarantine']",quarantine periods keep entire communities safe but theyre useless w out enforcement amp support taiwanquarantine was well organized well supported strict amp effective 7 total deaths 2020im headed home soon to public health nightmare,"['quarantine', 'periods', 'keep', 'entire', 'communities', 'safe', 'but', 'theyre', 'useless', 'w', 'out', 'enforcement', 'amp', 'support', 'taiwanquarantine', 'was', 'well', 'organized', 'well', 'supported', 'strict', 'amp', 'effective', '7', 'total', 'deaths', '2020im', 'headed', 'home', 'soon', 'to', 'public', 'health', 'nightmare']","['quarantine', 'periods', 'keep', 'entire', 'communities', 'safe', 'theyre', 'useless', 'w', 'enforcement', 'amp', 'support', 'taiwanquarantine', 'well', 'organized', 'well', 'supported', 'strict', 'amp', 'effective', '7', 'total', 'deaths', '2020im', 'headed', 'home', 'soon', 'public', 'health', 'nightmare']","['quarantin', 'period', 'keep', 'entir', 'commun', 'safe', 'theyr', 'useless', 'w', 'enforc', 'amp', 'support', 'taiwanquarantin', 'well', 'organ', 'well', 'support', 'strict', 'amp', 'effect', '7', 'total', 'death', '2020im', 'head', 'home', 'soon', 'public', 'health', 'nightmar']","['quarantine', 'periods', 'keep', 'entire', 'communities', 'safe', 'theyre', 'useless', 'w', 'enforcement', 'amp', 'support', 'taiwanquarantine', 'well', 'organized', 'well', 'supported', 'strict', 'amp', 'effective', '7', 'total', 'deaths', '2020im', 'headed', 'home', 'soon', 'public', 'health', 'nightmare']",1,Taiwan
2020-08-23 11:25:44+00:00,1297495230938136580,"Quarantine day 7, thank God for Uber Eats and support from families. Uber Eats do groceries in Taiwan too. I also got the legendary Taiwan govt care package. https://t.co/Z7zSRARgag",bhuang6,"Minnesota, USA",4,0,0,0,"Taipei = USA = Shanghai = Taipei = USA
I am #B哥B88  #B哥看世界 #bhuang6",53,,quarantine day 7 thank god for uber eats and support from families uber eats do groceries in taiwan too i also got the legendary taiwan govt care package,"['quarantine', 'day', '7', 'thank', 'god', 'for', 'uber', 'eats', 'and', 'support', 'from', 'families', 'uber', 'eats', 'do', 'groceries', 'in', 'taiwan', 'too', 'i', 'also', 'got', 'the', 'legendary', 'taiwan', 'govt', 'care', 'package']","['quarantine', 'day', '7', 'thank', 'god', 'uber', 'eats', 'support', 'families', 'uber', 'eats', 'groceries', 'taiwan', 'also', 'got', 'legendary', 'taiwan', 'govt', 'care', 'package']","['quarantin', 'day', '7', 'thank', 'god', 'uber', 'eat', 'support', 'famili', 'uber', 'eat', 'groceri', 'taiwan', 'also', 'got', 'legendari', 'taiwan', 'govt', 'care', 'packag']","['quarantine', 'day', '7', 'thank', 'god', 'uber', 'eats', 'support', 'families', 'uber', 'eats', 'groceries', 'taiwan', 'also', 'got', 'legendary', 'taiwan', 'govt', 'care', 'package']",5,Taiwan
2020-06-12 10:14:02+00:00,1271385261545369601,"Several Taiwanese organizations hold a rally in Ximen area, Taipei, to support Hong Kong protests in the 1st anniversary of the movement. This is the first time I can go out on the street to shoot footage after two months stay-at-home in AZ and 14-day self quarantine in Taiwan. https://t.co/8QbV15dh9T",peiyulintw,"Bremerton, WA",1,0,0,0,"Journalist. Words: @KitsapSun, @azcentral, part of @USAToday; @radiofreeasia & more. @uajschool alum. Bilingual in Eng. & Mandarin. From TW. peiyulinf@gmail.com",355,,several taiwanese organizations hold a rally in ximen area taipei to support hong kong protests in the 1st anniversary of the movement this is the first time i can go out on the street to shoot footage after two months stayathome in az and 14day self quarantine in taiwan,"['several', 'taiwanese', 'organizations', 'hold', 'a', 'rally', 'in', 'ximen', 'area', 'taipei', 'to', 'support', 'hong', 'kong', 'protests', 'in', 'the', '1st', 'anniversary', 'of', 'the', 'movement', 'this', 'is', 'the', 'first', 'time', 'i', 'can', 'go', 'out', 'on', 'the', 'street', 'to', 'shoot', 'footage', 'after', 'two', 'months', 'stayathome', 'in', 'az', 'and', '14day', 'self', 'quarantine', 'in', 'taiwan']","['several', 'taiwanese', 'organizations', 'hold', 'rally', 'ximen', 'area', 'taipei', 'support', 'hong', 'kong', 'protests', '1st', 'anniversary', 'movement', 'first', 'time', 'go', 'street', 'shoot', 'footage', 'two', 'months', 'stayathome', 'az', '14day', 'self', 'quarantine', 'taiwan']","['sever', 'taiwanes', 'organ', 'hold', 'ralli', 'ximen', 'area', 'taipei', 'support', 'hong', 'kong', 'protest', '1st', 'anniversari', 'movement', 'first', 'time', 'go', 'street', 'shoot', 'footag', 'two', 'month', 'stayathom', 'az', '14day', 'self', 'quarantin', 'taiwan']","['several', 'taiwanese', 'organizations', 'hold', 'rally', 'ximen', 'area', 'taipei', 'support', 'hong', 'kong', 'protests', '1st', 'anniversary', 'movement', 'first', 'time', 'go', 'street', 'shoot', 'footage', 'two', 'months', 'stayathome', 'az', '14day', 'self', 'quarantine', 'taiwan']",1,Taiwan
2020-02-26 09:01:24+00:00,1232591482344722433,"Really grateful for all of our medical and quarantine people, including pharmacists, and gov. officials!!

Hang in there, Taiwan! Keep fighting!!
Please support Taiwan to join WHO.
#COVID19
#TaiwanCanHelp 
#CoronavirusTaiwan https://t.co/ZvoY0sxtEc",kehsinsandy,Taiwan,1,0,0,0,SpongeBob's Friend~Sandy,2,"['COVID19', 'TaiwanCanHelp', 'CoronavirusTaiwan']",really grateful for all of our medical and quarantine people including pharmacists and gov officials hang in there taiwan keep fighting please support taiwan to join who covid19 taiwancanhelp coronavirustaiwan,"['really', 'grateful', 'for', 'all', 'of', 'our', 'medical', 'and', 'quarantine', 'people', 'including', 'pharmacists', 'and', 'gov', 'officials', 'hang', 'in', 'there', 'taiwan', 'keep', 'fighting', 'please', 'support', 'taiwan', 'to', 'join', 'who', 'covid19', 'taiwancanhelp', 'coronavirustaiwan']","['really', 'grateful', 'medical', 'quarantine', 'people', 'including', 'pharmacists', 'gov', 'officials', 'hang', 'taiwan', 'keep', 'fighting', 'please', 'support', 'taiwan', 'join', 'covid19', 'taiwancanhelp', 'coronavirustaiwan']","['realli', 'grate', 'medic', 'quarantin', 'peopl', 'includ', 'pharmacist', 'gov', 'offici', 'hang', 'taiwan', 'keep', 'fight', 'pleas', 'support', 'taiwan', 'join', 'covid19', 'taiwancanhelp', 'coronavirustaiwan']","['really', 'grateful', 'medical', 'quarantine', 'people', 'including', 'pharmacists', 'gov', 'officials', 'hang', 'taiwan', 'keep', 'fighting', 'please', 'support', 'taiwan', 'join', 'covid19', 'taiwancanhelp', 'coronavirustaiwan']",5,Taiwan
2021-05-04 07:28:12+00:00,1389481974566428674,"@niccijsmith The CDC should ""encourage"" crews to get vaccinated by just relaxing the restrictions to those who get the vaccine and keep the 5 day quarantines / enhanced-self-health measures to those who don't want to get vaccinated yet. Simple.",flyingheavy747,"41,000ft and 0.86M",0,1,0,0,#B787 pilot ✈️ (#B747 #E190) #Aviation #Pentaxian #Engineering CostaRica Taiwan 🇨🇷🇹🇼,3682,,the cdc should encourage crews to get vaccinated by just relaxing the restrictions to those who get the vaccine and keep the 5 day quarantines enhancedselfhealth measures to those who dont want to get vaccinated yet simple,"['the', 'cdc', 'should', 'encourage', 'crews', 'to', 'get', 'vaccinated', 'by', 'just', 'relaxing', 'the', 'restrictions', 'to', 'those', 'who', 'get', 'the', 'vaccine', 'and', 'keep', 'the', '5', 'day', 'quarantines', 'enhancedselfhealth', 'measures', 'to', 'those', 'who', 'dont', 'want', 'to', 'get', 'vaccinated', 'yet', 'simple']","['cdc', 'encourage', 'crews', 'get', 'vaccinated', 'relaxing', 'restrictions', 'get', 'vaccine', 'keep', '5', 'day', 'quarantines', 'enhancedselfhealth', 'measures', 'dont', 'want', 'get', 'vaccinated', 'yet', 'simple']","['cdc', 'encourag', 'crew', 'get', 'vaccin', 'relax', 'restrict', 'get', 'vaccin', 'keep', '5', 'day', 'quarantin', 'enhancedselfhealth', 'measur', 'dont', 'want', 'get', 'vaccin', 'yet', 'simpl']","['cdc', 'encourage', 'crews', 'get', 'vaccinated', 'relaxing', 'restrictions', 'get', 'vaccine', 'keep', '5', 'day', 'quarantines', 'enhancedselfhealth', 'measures', 'dont', 'want', 'get', 'vaccinated', 'yet', 'simple']",4,Taiwan
2020-10-24 07:45:34+00:00,1319907871979720704,"The donation to the support fund will be used for infection protection measures in medical settings and the expansion of PCR tests in Tokyo and other cities with the severe outbreak. 

https://t.co/IsR9PE128z",echotpe,"Taipei, Taiwan",24,0,7,0,,1747,,the donation to the support fund will be used for infection protection measures in medical settings and the expansion of pcr tests in tokyo and other cities with the severe outbreak,"['the', 'donation', 'to', 'the', 'support', 'fund', 'will', 'be', 'used', 'for', 'infection', 'protection', 'measures', 'in', 'medical', 'settings', 'and', 'the', 'expansion', 'of', 'pcr', 'tests', 'in', 'tokyo', 'and', 'other', 'cities', 'with', 'the', 'severe', 'outbreak']","['donation', 'support', 'fund', 'used', 'infection', 'protection', 'measures', 'medical', 'settings', 'expansion', 'pcr', 'tests', 'tokyo', 'cities', 'severe', 'outbreak']","['donat', 'support', 'fund', 'use', 'infect', 'protect', 'measur', 'medic', 'set', 'expans', 'pcr', 'test', 'tokyo', 'citi', 'sever', 'outbreak']","['donation', 'support', 'fund', 'used', 'infection', 'protection', 'measures', 'medical', 'settings', 'expansion', 'pcr', 'tests', 'tokyo', 'cities', 'severe', 'outbreak']",4,Taiwan
