Date,Id,Tweet,Username,Location,likeCount,replyCount,retweetCount,quoteCount,userDescription,userFollowers,hashtags,Cleaned_Tweet,Tweet_tokenized,Tweet_removed_stop_word,Tweet_stemmed,Tweet_lemmatized,sentiment,Country
2022-04-28 07:58:15+00:00,1519586777786425345,"Hey @EmmaRaducanu it's great to see your innovation in rejecting a coach at this time... Good luck with all things tennis, and if you need any motivational or mental health support, look at https://t.co/eDlBVhuTOn like you, we do things our way! 
https://t.co/AGF670QyMI",Record_Peddler,"Manchester, England",0,0,0,0,"The Record Peddler was a Manchester Store that specialised in music collectables, memorabilia and good coffee.
Most items posted are for sale, so get in touch!",757,,hey its great to see your innovation in rejecting a coach at this time good luck with all things tennis and if you need any motivational or mental health support look at like you we do things our way,"['hey', 'its', 'great', 'to', 'see', 'your', 'innovation', 'in', 'rejecting', 'a', 'coach', 'at', 'this', 'time', 'good', 'luck', 'with', 'all', 'things', 'tennis', 'and', 'if', 'you', 'need', 'any', 'motivational', 'or', 'mental', 'health', 'support', 'look', 'at', 'like', 'you', 'we', 'do', 'things', 'our', 'way']","['hey', 'great', 'see', 'innovation', 'rejecting', 'coach', 'time', 'good', 'luck', 'things', 'tennis', 'need', 'motivational', 'mental', 'health', 'support', 'look', 'like', 'things', 'way']","['hey', 'great', 'see', 'innov', 'reject', 'coach', 'time', 'good', 'luck', 'thing', 'tenni', 'need', 'motiv', 'mental', 'health', 'support', 'look', 'like', 'thing', 'way']","['hey', 'great', 'see', 'innovation', 'rejecting', 'coach', 'time', 'good', 'luck', 'things', 'tennis', 'need', 'motivational', 'mental', 'health', 'support', 'look', 'like', 'things', 'way']",5,Spain
2022-04-24 17:52:44+00:00,1518286834975088648,"@fadman4real @ColinBellKK Haha! That's really funny mate. I've worked all my life, currently treating people with mental health issues, here in Spain. You? I am a director of a national company, city supporter for 55-years, thick and thin. Hit me with your best shot.... https://t.co/J8aRXtbEDN",Record_Peddler,"Manchester, England",0,1,0,0,"The Record Peddler was a Manchester Store that specialised in music collectables, memorabilia and good coffee.
Most items posted are for sale, so get in touch!",757,,haha thats really funny mate ive worked all my life currently treating people with mental health issues here in spain you i am a director of a national company city supporter for 55years thick and thin hit me with your best shot,"['haha', 'thats', 'really', 'funny', 'mate', 'ive', 'worked', 'all', 'my', 'life', 'currently', 'treating', 'people', 'with', 'mental', 'health', 'issues', 'here', 'in', 'spain', 'you', 'i', 'am', 'a', 'director', 'of', 'a', 'national', 'company', 'city', 'supporter', 'for', '55years', 'thick', 'and', 'thin', 'hit', 'me', 'with', 'your', 'best', 'shot']","['haha', 'thats', 'really', 'funny', 'mate', 'ive', 'worked', 'life', 'currently', 'treating', 'people', 'mental', 'health', 'issues', 'spain', 'director', 'national', 'company', 'city', 'supporter', '55years', 'thick', 'thin', 'hit', 'best', 'shot']","['haha', 'that', 'realli', 'funni', 'mate', 'ive', 'work', 'life', 'current', 'treat', 'peopl', 'mental', 'health', 'issu', 'spain', 'director', 'nation', 'compani', 'citi', 'support', '55year', 'thick', 'thin', 'hit', 'best', 'shot']","['haha', 'thats', 'really', 'funny', 'mate', 'ive', 'worked', 'life', 'currently', 'treating', 'people', 'mental', 'health', 'issues', 'spain', 'director', 'national', 'company', 'city', 'supporter', '55years', 'thick', 'thin', 'hit', 'best', 'shot']",5,Spain
2022-04-18 20:52:23+00:00,1516157717269954561,#collagen gummies for your #beauty and #health! Try #vegetarian complex from Simply8! #vitamins #wellness #healthylifestyle #skin #hair #nails #support https://t.co/L7qE3afTXc,SIMPLY8_gummies,United States,0,0,0,0,"Your everyday vitamin solution! 
FDA & GMP Certified
SIMPLY HEALTHY YUMMY!
Made in Israel / Packed in the US
Open for wholesales",13,"['collagen', 'beauty', 'health', 'vegetarian', 'vitamins', 'wellness', 'healthylifestyle', 'skin', 'hair', 'nails', 'support']",collagen gummies for your beauty and health try vegetarian complex from simply8 vitamins wellness healthylifestyle skin hair nails support,"['collagen', 'gummies', 'for', 'your', 'beauty', 'and', 'health', 'try', 'vegetarian', 'complex', 'from', 'simply8', 'vitamins', 'wellness', 'healthylifestyle', 'skin', 'hair', 'nails', 'support']","['collagen', 'gummies', 'beauty', 'health', 'try', 'vegetarian', 'complex', 'simply8', 'vitamins', 'wellness', 'healthylifestyle', 'skin', 'hair', 'nails', 'support']","['collagen', 'gummi', 'beauti', 'health', 'tri', 'vegetarian', 'complex', 'simply8', 'vitamin', 'well', 'healthylifestyl', 'skin', 'hair', 'nail', 'support']","['collagen', 'gummies', 'beauty', 'health', 'try', 'vegetarian', 'complex', 'simply8', 'vitamins', 'wellness', 'healthylifestyle', 'skin', 'hair', 'nails', 'support']",5,Spain
2022-04-11 21:59:34+00:00,1513637912272850949,"🏆Leading Healthcare Awards 2022 🏆
🏆SME of the Year Winner - Redmoor Health 

""Throughout the COVID-19 pandemic, Redmoor Health supported front line health and care professionals get the best use out of technology through their coaching and training programme"" https://t.co/O5KGHAVEoF",MarcSchmid,Fylde Coast,3,0,0,0,CEO at @redmoorhealth & Redmoor CIC. Husband and proud @kgsrugby @fyldeRUFC parent. Adopted northerner #MUFC #SaleSharks #zwift🏉🚴‍♀️⚽️ 🔰,3529,,leading healthcare awards 2022 sme of the year winner redmoor health throughout the covid19 pandemic redmoor health supported front line health and care professionals get the best use out of technology through their coaching and training programme,"['leading', 'healthcare', 'awards', '2022', 'sme', 'of', 'the', 'year', 'winner', 'redmoor', 'health', 'throughout', 'the', 'covid19', 'pandemic', 'redmoor', 'health', 'supported', 'front', 'line', 'health', 'and', 'care', 'professionals', 'get', 'the', 'best', 'use', 'out', 'of', 'technology', 'through', 'their', 'coaching', 'and', 'training', 'programme']","['leading', 'healthcare', 'awards', '2022', 'sme', 'year', 'winner', 'redmoor', 'health', 'throughout', 'covid19', 'pandemic', 'redmoor', 'health', 'supported', 'front', 'line', 'health', 'care', 'professionals', 'get', 'best', 'use', 'technology', 'coaching', 'training', 'programme']","['lead', 'healthcar', 'award', '2022', 'sme', 'year', 'winner', 'redmoor', 'health', 'throughout', 'covid19', 'pandem', 'redmoor', 'health', 'support', 'front', 'line', 'health', 'care', 'profession', 'get', 'best', 'use', 'technolog', 'coach', 'train', 'programm']","['leading', 'healthcare', 'awards', '2022', 'sme', 'year', 'winner', 'redmoor', 'health', 'throughout', 'covid19', 'pandemic', 'redmoor', 'health', 'supported', 'front', 'line', 'health', 'care', 'professionals', 'get', 'best', 'use', 'technology', 'coaching', 'training', 'programme']",5,Spain
2022-04-08 18:59:12+00:00,1512505354814427137,"What happens if the doctors ,medical and nurses crowd fund with the public to create a new health service with employees diverting their weekly NIC CONTRIBUTIONS TO THE NEW HEALTH SERVICE ?? https://t.co/5k9dMef2V8",COEXIST34948864,,0,1,0,0,Hermit,1785,,what happens if the doctors medical and nurses crowd fund with the public to create a new health service with employees diverting their weekly nic contributions to the new health service,"['what', 'happens', 'if', 'the', 'doctors', 'medical', 'and', 'nurses', 'crowd', 'fund', 'with', 'the', 'public', 'to', 'create', 'a', 'new', 'health', 'service', 'with', 'employees', 'diverting', 'their', 'weekly', 'nic', 'contributions', 'to', 'the', 'new', 'health', 'service']","['happens', 'doctors', 'medical', 'nurses', 'crowd', 'fund', 'public', 'create', 'new', 'health', 'service', 'employees', 'diverting', 'weekly', 'nic', 'contributions', 'new', 'health', 'service']","['happen', 'doctor', 'medic', 'nurs', 'crowd', 'fund', 'public', 'creat', 'new', 'health', 'servic', 'employe', 'divert', 'weekli', 'nic', 'contribut', 'new', 'health', 'servic']","['happens', 'doctors', 'medical', 'nurses', 'crowd', 'fund', 'public', 'create', 'new', 'health', 'service', 'employees', 'diverting', 'weekly', 'nic', 'contributions', 'new', 'health', 'service']",1,Spain
2022-04-07 13:58:28+00:00,1512067284512043028,"Today is #WorldHealthDay . This is your reminder – take a 
moment to review your health and self-care needs! Don’t 
forget to visit our page 
(https://t.co/eFdo2Dn1vh)for more 
resources which support the Psychology of Women. Photo 
by Jonathan Borba on @unsplash #feminist https://t.co/0ldUSJPBu4",APAdiv35,,2,0,1,0,"Society for the Psychology of Women, a division of the American Psychological Association. Feminism+Psych. #WeAreFeminismNOW Retweets are not endorsements.",686,"['WorldHealthDay', 'feminist']",today is worldhealthday this is your reminder take a moment to review your health and selfcare needs dont forget to visit our page more resources which support the psychology of women photo by jonathan borba on feminist,"['today', 'is', 'worldhealthday', 'this', 'is', 'your', 'reminder', 'take', 'a', 'moment', 'to', 'review', 'your', 'health', 'and', 'selfcare', 'needs', 'dont', 'forget', 'to', 'visit', 'our', 'page', 'more', 'resources', 'which', 'support', 'the', 'psychology', 'of', 'women', 'photo', 'by', 'jonathan', 'borba', 'on', 'feminist']","['today', 'worldhealthday', 'reminder', 'take', 'moment', 'review', 'health', 'selfcare', 'needs', 'dont', 'forget', 'visit', 'page', 'resources', 'support', 'psychology', 'women', 'photo', 'jonathan', 'borba', 'feminist']","['today', 'worldhealthday', 'remind', 'take', 'moment', 'review', 'health', 'selfcar', 'need', 'dont', 'forget', 'visit', 'page', 'resourc', 'support', 'psycholog', 'women', 'photo', 'jonathan', 'borba', 'feminist']","['today', 'worldhealthday', 'reminder', 'take', 'moment', 'review', 'health', 'selfcare', 'needs', 'dont', 'forget', 'visit', 'page', 'resources', 'support', 'psychology', 'women', 'photo', 'jonathan', 'borba', 'feminist']",5,Spain
2022-04-05 17:21:55+00:00,1511393712227733504,"According to a study @MHAacrossNYS levels of anxiety &amp; depression rose by 48% in 1st year college students

Many universities have mental health services for students or they can seek help at a local clinic thru their primary care physician 
https://t.co/BlQABC09GN

#REAIM🚸🇺🇸 https://t.co/FwIhXtKBwh",reaim_us,United States,1,0,1,0,RE-AIM at preventable shootings. 100% crowdfunded gun safety PSAs to help trigger life-saving THINKING | Also on Instagram & Facebook 🚸 🇺🇸 😷 bit.ly/2Q4DHJm,1542,['REAIM'],according to a study levels of anxiety amp depression rose by 48 in 1st year college students many universities have mental health services for students or they can seek help at a local clinic thru their primary care physician reaim,"['according', 'to', 'a', 'study', 'levels', 'of', 'anxiety', 'amp', 'depression', 'rose', 'by', '48', 'in', '1st', 'year', 'college', 'students', 'many', 'universities', 'have', 'mental', 'health', 'services', 'for', 'students', 'or', 'they', 'can', 'seek', 'help', 'at', 'a', 'local', 'clinic', 'thru', 'their', 'primary', 'care', 'physician', 'reaim']","['according', 'study', 'levels', 'anxiety', 'amp', 'depression', 'rose', '48', '1st', 'year', 'college', 'students', 'many', 'universities', 'mental', 'health', 'services', 'students', 'seek', 'help', 'local', 'clinic', 'thru', 'primary', 'care', 'physician', 'reaim']","['accord', 'studi', 'level', 'anxieti', 'amp', 'depress', 'rose', '48', '1st', 'year', 'colleg', 'student', 'mani', 'univers', 'mental', 'health', 'servic', 'student', 'seek', 'help', 'local', 'clinic', 'thru', 'primari', 'care', 'physician', 'reaim']","['according', 'study', 'levels', 'anxiety', 'amp', 'depression', 'rose', '48', '1st', 'year', 'college', 'students', 'many', 'universities', 'mental', 'health', 'services', 'students', 'seek', 'help', 'local', 'clinic', 'thru', 'primary', 'care', 'physician', 'reaim']",2,Spain
2022-03-25 17:31:21+00:00,1507409815639052288,"@9Kitty7 @PoliticsJOE_UK Some people don't have a choice in being an addict, no guarantee on treating their health, if more people use/abuse, there are more that are going to need support, for me it's what benefit do current illegal drugs bring, I'm fully aware of cannabis benefits...",jamessmyth17,ashington,0,0,0,0,"enjoys travelling, cooking, time spent with family, I own my comments, expect to be blocked if I find you offensive!!!",52,,some people dont have a choice in being an addict no guarantee on treating their health if more people useabuse there are more that are going to need support for me its what benefit do current illegal drugs bring im fully aware of cannabis benefits,"['some', 'people', 'dont', 'have', 'a', 'choice', 'in', 'being', 'an', 'addict', 'no', 'guarantee', 'on', 'treating', 'their', 'health', 'if', 'more', 'people', 'useabuse', 'there', 'are', 'more', 'that', 'are', 'going', 'to', 'need', 'support', 'for', 'me', 'its', 'what', 'benefit', 'do', 'current', 'illegal', 'drugs', 'bring', 'im', 'fully', 'aware', 'of', 'cannabis', 'benefits']","['people', 'dont', 'choice', 'addict', 'guarantee', 'treating', 'health', 'people', 'useabuse', 'going', 'need', 'support', 'benefit', 'current', 'illegal', 'drugs', 'bring', 'im', 'fully', 'aware', 'cannabis', 'benefits']","['peopl', 'dont', 'choic', 'addict', 'guarante', 'treat', 'health', 'peopl', 'useabus', 'go', 'need', 'support', 'benefit', 'current', 'illeg', 'drug', 'bring', 'im', 'fulli', 'awar', 'cannabi', 'benefit']","['people', 'dont', 'choice', 'addict', 'guarantee', 'treating', 'health', 'people', 'useabuse', 'going', 'need', 'support', 'benefit', 'current', 'illegal', 'drugs', 'bring', 'im', 'fully', 'aware', 'cannabis', 'benefits']",2,Spain
2022-03-25 12:32:21+00:00,1507334569770602508,"@PoliticsJOE_UK Whether you decriminalise drugs or not it won't get rid of dealers, it won't lessen addiction, it will add pressure to mental &amp; physical health services, alcohol and tobacco are 2 legal drugs and look at the issues they cause...",jamessmyth17,ashington,1,3,0,0,"enjoys travelling, cooking, time spent with family, I own my comments, expect to be blocked if I find you offensive!!!",52,,whether you decriminalise drugs or not it wont get rid of dealers it wont lessen addiction it will add pressure to mental amp physical health services alcohol and tobacco are 2 legal drugs and look at the issues they cause,"['whether', 'you', 'decriminalise', 'drugs', 'or', 'not', 'it', 'wont', 'get', 'rid', 'of', 'dealers', 'it', 'wont', 'lessen', 'addiction', 'it', 'will', 'add', 'pressure', 'to', 'mental', 'amp', 'physical', 'health', 'services', 'alcohol', 'and', 'tobacco', 'are', '2', 'legal', 'drugs', 'and', 'look', 'at', 'the', 'issues', 'they', 'cause']","['whether', 'decriminalise', 'drugs', 'wont', 'get', 'rid', 'dealers', 'wont', 'lessen', 'addiction', 'add', 'pressure', 'mental', 'amp', 'physical', 'health', 'services', 'alcohol', 'tobacco', '2', 'legal', 'drugs', 'look', 'issues', 'cause']","['whether', 'decriminalis', 'drug', 'wont', 'get', 'rid', 'dealer', 'wont', 'lessen', 'addict', 'add', 'pressur', 'mental', 'amp', 'physic', 'health', 'servic', 'alcohol', 'tobacco', '2', 'legal', 'drug', 'look', 'issu', 'caus']","['whether', 'decriminalise', 'drugs', 'wont', 'get', 'rid', 'dealers', 'wont', 'lessen', 'addiction', 'add', 'pressure', 'mental', 'amp', 'physical', 'health', 'services', 'alcohol', 'tobacco', '2', 'legal', 'drugs', 'look', 'issues', 'cause']",3,Spain
2022-03-19 20:08:41+00:00,1505275086454018048,"@thedailybeast If @kanyewest a supporter of fellow out-of-control with dangerous malignant public mental health issues #45 weren't wealthy would he be arrested, charged w/multiple violations of Protection From Abuse Orders &amp; 302'd w/an involuntary commitment for emergency evaluation/treatment? https://t.co/uuLEiDp83L",PaulMick,Delaware County PA,1,0,1,0,"Mick Music ~ PhillyEDGE ~ ICON Magazine ~ Rockpile ~ The Record ~ Big Ideas, Images & Distorted Facts ~ Musicians, Artists, Poets & Performers ~ 89.3 WCSD",2583,,if a supporter of fellow outofcontrol with dangerous malignant public mental health issues 45 werent wealthy would he be arrested charged wmultiple violations of protection from abuse orders amp 302d wan involuntary commitment for emergency evaluationtreatment,"['if', 'a', 'supporter', 'of', 'fellow', 'outofcontrol', 'with', 'dangerous', 'malignant', 'public', 'mental', 'health', 'issues', '45', 'werent', 'wealthy', 'would', 'he', 'be', 'arrested', 'charged', 'wmultiple', 'violations', 'of', 'protection', 'from', 'abuse', 'orders', 'amp', '302d', 'wan', 'involuntary', 'commitment', 'for', 'emergency', 'evaluationtreatment']","['supporter', 'fellow', 'outofcontrol', 'dangerous', 'malignant', 'public', 'mental', 'health', 'issues', '45', 'werent', 'wealthy', 'would', 'arrested', 'charged', 'wmultiple', 'violations', 'protection', 'abuse', 'orders', 'amp', '302d', 'wan', 'involuntary', 'commitment', 'emergency', 'evaluationtreatment']","['support', 'fellow', 'outofcontrol', 'danger', 'malign', 'public', 'mental', 'health', 'issu', '45', 'werent', 'wealthi', 'would', 'arrest', 'charg', 'wmultipl', 'violat', 'protect', 'abus', 'order', 'amp', '302d', 'wan', 'involuntari', 'commit', 'emerg', 'evaluationtreat']","['supporter', 'fellow', 'outofcontrol', 'dangerous', 'malignant', 'public', 'mental', 'health', 'issues', '45', 'werent', 'wealthy', 'would', 'arrested', 'charged', 'wmultiple', 'violations', 'protection', 'abuse', 'orders', 'amp', '302d', 'wan', 'involuntary', 'commitment', 'emergency', 'evaluationtreatment']",1,Spain
2022-02-22 09:29:54+00:00,1496054633495683072,@geochurch So this would invalidate the argument saying that somatic would not exasperate social/economic/health inequities/injustice whereas germline would (say the opponents). Church says #Alzheimers drugs for adults (somatic treatment) could be rebranded to enhance intelligence in adults,cathcoste,"Aix-en-Provence, France",0,1,0,0,"My pre-teen students want to be the #JulesVerne of genomics 🚀 writing our own #ScienceFiction Early #MOOC adopter: MITxBio 7.00x, 7.28.1x-2x, 7.QBWx certified",5888,['Alzheimers'],so this would invalidate the argument saying that somatic would not exasperate socialeconomichealth inequitiesinjustice whereas germline would say the opponents church says alzheimers drugs for adults somatic treatment could be rebranded to enhance intelligence in adults,"['so', 'this', 'would', 'invalidate', 'the', 'argument', 'saying', 'that', 'somatic', 'would', 'not', 'exasperate', 'socialeconomichealth', 'inequitiesinjustice', 'whereas', 'germline', 'would', 'say', 'the', 'opponents', 'church', 'says', 'alzheimers', 'drugs', 'for', 'adults', 'somatic', 'treatment', 'could', 'be', 'rebranded', 'to', 'enhance', 'intelligence', 'in', 'adults']","['would', 'invalidate', 'argument', 'saying', 'somatic', 'would', 'exasperate', 'socialeconomichealth', 'inequitiesinjustice', 'whereas', 'germline', 'would', 'say', 'opponents', 'church', 'says', 'alzheimers', 'drugs', 'adults', 'somatic', 'treatment', 'could', 'rebranded', 'enhance', 'intelligence', 'adults']","['would', 'invalid', 'argument', 'say', 'somat', 'would', 'exasper', 'socialeconomichealth', 'inequitiesinjustic', 'wherea', 'germlin', 'would', 'say', 'oppon', 'church', 'say', 'alzheim', 'drug', 'adult', 'somat', 'treatment', 'could', 'rebrand', 'enhanc', 'intellig', 'adult']","['would', 'invalidate', 'argument', 'saying', 'somatic', 'would', 'exasperate', 'socialeconomichealth', 'inequitiesinjustice', 'whereas', 'germline', 'would', 'say', 'opponents', 'church', 'says', 'alzheimers', 'drugs', 'adults', 'somatic', 'treatment', 'could', 'rebranded', 'enhance', 'intelligence', 'adults']",2,Spain
2022-02-20 12:06:11+00:00,1495369186780008449,"@EgNorman @qvh Really struggling to understand what's happening in NHS, clearly we'll understaffed but organisation lacking. Here in Spain the health service has been under pressure also but seems to be coping far better. What's the answer?",objohnny,"Pedreguer, España",0,1,0,0,Professional Photographer. Pretty busy life. (Comments are my own personal views.                 Old Midwhitgiftian RFC,487,,really struggling to understand whats happening in nhs clearly well understaffed but organisation lacking here in spain the health service has been under pressure also but seems to be coping far better whats the answer,"['really', 'struggling', 'to', 'understand', 'whats', 'happening', 'in', 'nhs', 'clearly', 'well', 'understaffed', 'but', 'organisation', 'lacking', 'here', 'in', 'spain', 'the', 'health', 'service', 'has', 'been', 'under', 'pressure', 'also', 'but', 'seems', 'to', 'be', 'coping', 'far', 'better', 'whats', 'the', 'answer']","['really', 'struggling', 'understand', 'whats', 'happening', 'nhs', 'clearly', 'well', 'understaffed', 'organisation', 'lacking', 'spain', 'health', 'service', 'pressure', 'also', 'seems', 'coping', 'far', 'better', 'whats', 'answer']","['realli', 'struggl', 'understand', 'what', 'happen', 'nh', 'clearli', 'well', 'understaf', 'organis', 'lack', 'spain', 'health', 'servic', 'pressur', 'also', 'seem', 'cope', 'far', 'better', 'what', 'answer']","['really', 'struggling', 'understand', 'whats', 'happening', 'nhs', 'clearly', 'well', 'understaffed', 'organisation', 'lacking', 'spain', 'health', 'service', 'pressure', 'also', 'seems', 'coping', 'far', 'better', 'whats', 'answer']",2,Spain
2022-02-17 09:13:12+00:00,1494238491949027328,"“Investments should be made in mental health services (i.e., literacy and universal access in primary care) in order to prevent the cumulative effect of this pandemic from becoming damaging and for lessons to be learned from the experience with COVID-19” https://t.co/vAm3HAK14j",Filipa_SMartins,Porto,2,0,0,0,"MD, Psychiatry Resident at CHUSJ, with a special interest in Public Health, Health Economics and Neurosciences.",230,,investments should be made in mental health services ie literacy and universal access in primary care in order to prevent the cumulative effect of this pandemic from becoming damaging and for lessons to be learned from the experience with covid19,"['investments', 'should', 'be', 'made', 'in', 'mental', 'health', 'services', 'ie', 'literacy', 'and', 'universal', 'access', 'in', 'primary', 'care', 'in', 'order', 'to', 'prevent', 'the', 'cumulative', 'effect', 'of', 'this', 'pandemic', 'from', 'becoming', 'damaging', 'and', 'for', 'lessons', 'to', 'be', 'learned', 'from', 'the', 'experience', 'with', 'covid19']","['investments', 'made', 'mental', 'health', 'services', 'ie', 'literacy', 'universal', 'access', 'primary', 'care', 'order', 'prevent', 'cumulative', 'effect', 'pandemic', 'becoming', 'damaging', 'lessons', 'learned', 'experience', 'covid19']","['invest', 'made', 'mental', 'health', 'servic', 'ie', 'literaci', 'univers', 'access', 'primari', 'care', 'order', 'prevent', 'cumul', 'effect', 'pandem', 'becom', 'damag', 'lesson', 'learn', 'experi', 'covid19']","['investments', 'made', 'mental', 'health', 'services', 'ie', 'literacy', 'universal', 'access', 'primary', 'care', 'order', 'prevent', 'cumulative', 'effect', 'pandemic', 'becoming', 'damaging', 'lessons', 'learned', 'experience', 'covid19']",4,Spain
2022-02-06 08:59:54+00:00,1490248875986374657,@GCraughwell If the two parts of Ireland merged who would decide on a new flag and new National Anthem? Would it be a Constructional Monarchy. Would the health service be based on the North´s or the South´s? Would it be in the EU or out? How would the Armed Forces be merged and called?,TonyAngelUK,,0,0,0,0,"Amateur Astronomer, Ex-Army Bandsman, ex-systems designer and ex-project consultant. Equality not Diversity, Integration not  Multiculturalism.",1205,,if the two parts of ireland merged who would decide on a new flag and new national anthem would it be a constructional monarchy would the health service be based on the norths or the souths would it be in the eu or out how would the armed forces be merged and called,"['if', 'the', 'two', 'parts', 'of', 'ireland', 'merged', 'who', 'would', 'decide', 'on', 'a', 'new', 'flag', 'and', 'new', 'national', 'anthem', 'would', 'it', 'be', 'a', 'constructional', 'monarchy', 'would', 'the', 'health', 'service', 'be', 'based', 'on', 'the', 'norths', 'or', 'the', 'souths', 'would', 'it', 'be', 'in', 'the', 'eu', 'or', 'out', 'how', 'would', 'the', 'armed', 'forces', 'be', 'merged', 'and', 'called']","['two', 'parts', 'ireland', 'merged', 'would', 'decide', 'new', 'flag', 'new', 'national', 'anthem', 'would', 'constructional', 'monarchy', 'would', 'health', 'service', 'based', 'norths', 'souths', 'would', 'eu', 'would', 'armed', 'forces', 'merged', 'called']","['two', 'part', 'ireland', 'merg', 'would', 'decid', 'new', 'flag', 'new', 'nation', 'anthem', 'would', 'construct', 'monarchi', 'would', 'health', 'servic', 'base', 'north', 'south', 'would', 'eu', 'would', 'arm', 'forc', 'merg', 'call']","['two', 'parts', 'ireland', 'merged', 'would', 'decide', 'new', 'flag', 'new', 'national', 'anthem', 'would', 'constructional', 'monarchy', 'would', 'health', 'service', 'based', 'norths', 'souths', 'would', 'eu', 'would', 'armed', 'forces', 'merged', 'called']",1,Spain
