Date,Id,Tweet,Username,Location,likeCount,replyCount,retweetCount,quoteCount,userDescription,userFollowers,hashtags,Cleaned_Tweet,Tweet_tokenized,Tweet_removed_stop_word,Tweet_stemmed,Tweet_lemmatized,sentiment,Country
2020-03-12 16:33:16+00:00,1238141014923186178,We all have an individual responsibility in halting the spread of #COVID19. Our health services will be acutely overstretched and the most vulnerable people in society are at risk. We must make conscious and difficult decisions in how we live our lives over the coming weeks.,PeterjBeer,"Milton Keynes, England",3,0,0,0,"Food, gin and wine lover.
Plenty of political opinion, views are my own. 
Local government manager/chartered surveyor.
Dog Dad to Dudley 🐶 
He/Him 🏳️‍🌈",1278,['COVID19'],we all have an individual responsibility in halting the spread of covid19 our health services will be acutely overstretched and the most vulnerable people in society are at risk we must make conscious and difficult decisions in how we live our lives over the coming weeks,"['we', 'all', 'have', 'an', 'individual', 'responsibility', 'in', 'halting', 'the', 'spread', 'of', 'covid19', 'our', 'health', 'services', 'will', 'be', 'acutely', 'overstretched', 'and', 'the', 'most', 'vulnerable', 'people', 'in', 'society', 'are', 'at', 'risk', 'we', 'must', 'make', 'conscious', 'and', 'difficult', 'decisions', 'in', 'how', 'we', 'live', 'our', 'lives', 'over', 'the', 'coming', 'weeks']","['individual', 'responsibility', 'halting', 'spread', 'covid19', 'health', 'services', 'acutely', 'overstretched', 'vulnerable', 'people', 'society', 'risk', 'must', 'make', 'conscious', 'difficult', 'decisions', 'live', 'lives', 'coming', 'weeks']","['individu', 'respons', 'halt', 'spread', 'covid19', 'health', 'servic', 'acut', 'overstretch', 'vulner', 'peopl', 'societi', 'risk', 'must', 'make', 'consciou', 'difficult', 'decis', 'live', 'live', 'come', 'week']","['individual', 'responsibility', 'halting', 'spread', 'covid19', 'health', 'services', 'acutely', 'overstretched', 'vulnerable', 'people', 'society', 'risk', 'must', 'make', 'conscious', 'difficult', 'decisions', 'live', 'lives', 'coming', 'weeks']",5,Spain
2020-03-12 14:56:05+00:00,1238116561145204736,"Support this wholeheartedly - however action needs to be taken to ensure that good quality, fresh and healthy produce is affordable to all residing in the UK 🇬🇧🚜 #backbritishfarming #quality #Health #affordability #uk #Brexit https://t.co/p5eDd1edDE",BurtonLibby,"Newmarket, England",1,0,0,0,Working in supply chain & logistics in the fresh produce industry 🍊🍆🍉🍍🥒Lover of horse racing 🏇🏼 & rugby. Beer enthusiast🍻Canaries supporter ⚽️🔰#ncfc,845,"['backbritishfarming', 'quality', 'Health', 'affordability', 'uk', 'Brexit']",support this wholeheartedly however action needs to be taken to ensure that good quality fresh and healthy produce is affordable to all residing in the uk backbritishfarming quality health affordability uk brexit,"['support', 'this', 'wholeheartedly', 'however', 'action', 'needs', 'to', 'be', 'taken', 'to', 'ensure', 'that', 'good', 'quality', 'fresh', 'and', 'healthy', 'produce', 'is', 'affordable', 'to', 'all', 'residing', 'in', 'the', 'uk', 'backbritishfarming', 'quality', 'health', 'affordability', 'uk', 'brexit']","['support', 'wholeheartedly', 'however', 'action', 'needs', 'taken', 'ensure', 'good', 'quality', 'fresh', 'healthy', 'produce', 'affordable', 'residing', 'uk', 'backbritishfarming', 'quality', 'health', 'affordability', 'uk', 'brexit']","['support', 'wholeheartedli', 'howev', 'action', 'need', 'taken', 'ensur', 'good', 'qualiti', 'fresh', 'healthi', 'produc', 'afford', 'resid', 'uk', 'backbritishfarm', 'qualiti', 'health', 'afford', 'uk', 'brexit']","['support', 'wholeheartedly', 'however', 'action', 'needs', 'taken', 'ensure', 'good', 'quality', 'fresh', 'healthy', 'produce', 'affordable', 'residing', 'uk', 'backbritishfarming', 'quality', 'health', 'affordability', 'uk', 'brexit']",4,Spain
2020-03-12 07:33:24+00:00,1238005152407314433,"For those that are taking the COVID-19 pandemic lightly, please read. It can affect us in many ways, but seeing our health services getting overwhelmed is scary, especially for those who are weakened or in need of assistance. https://t.co/QwJ9CBcAeC",bemantunes,"Coimbra, Portugal",4,0,2,0,Head of AI @Exclaimer,96,,for those that are taking the covid19 pandemic lightly please read it can affect us in many ways but seeing our health services getting overwhelmed is scary especially for those who are weakened or in need of assistance,"['for', 'those', 'that', 'are', 'taking', 'the', 'covid19', 'pandemic', 'lightly', 'please', 'read', 'it', 'can', 'affect', 'us', 'in', 'many', 'ways', 'but', 'seeing', 'our', 'health', 'services', 'getting', 'overwhelmed', 'is', 'scary', 'especially', 'for', 'those', 'who', 'are', 'weakened', 'or', 'in', 'need', 'of', 'assistance']","['taking', 'covid19', 'pandemic', 'lightly', 'please', 'read', 'affect', 'us', 'many', 'ways', 'seeing', 'health', 'services', 'getting', 'overwhelmed', 'scary', 'especially', 'weakened', 'need', 'assistance']","['take', 'covid19', 'pandem', 'lightli', 'pleas', 'read', 'affect', 'us', 'mani', 'way', 'see', 'health', 'servic', 'get', 'overwhelm', 'scari', 'especi', 'weaken', 'need', 'assist']","['taking', 'covid19', 'pandemic', 'lightly', 'please', 'read', 'affect', 'us', 'many', 'ways', 'seeing', 'health', 'services', 'getting', 'overwhelmed', 'scary', 'especially', 'weakened', 'need', 'assistance']",3,Spain
2020-03-11 02:13:39+00:00,1237562299742695424,Italian health service: average age of deceased from Covid-19 is 81.4 (7 of march),minimaland,"Porto, Portugal",0,1,0,0,"As the free-fall advances
I'm the moron who dances",351,,italian health service average age of deceased from covid19 is 814 7 of march,"['italian', 'health', 'service', 'average', 'age', 'of', 'deceased', 'from', 'covid19', 'is', '814', '7', 'of', 'march']","['italian', 'health', 'service', 'average', 'age', 'deceased', 'covid19', '814', '7', 'march']","['italian', 'health', 'servic', 'averag', 'age', 'deceas', 'covid19', '814', '7', 'march']","['italian', 'health', 'service', 'average', 'age', 'deceased', 'covid19', '814', '7', 'march']",1,Spain
2020-03-10 22:49:10+00:00,1237510838329597954,These are the people doing PIP assessments. Assessing conditions they know fuck all about and can’t be arsed to Google. Fighting rejected claims takes 6m+. That’s a long time without support for a disability. Health takes a nosedive whilst expending extra energy to fight. B*ds 🤬 https://t.co/IrqHOnKni7,tamar_whyte,Birmingham,3,0,0,0,"Over-educated, underpaid #LivedExperienceProfessional. Working towards equality & parity of pay for openly ‘Mad’ people working in MH. BIGSPD Exec. #MadTwitter",3912,,these are the people doing pip assessments assessing conditions they know fuck all about and cant be arsed to google fighting rejected claims takes 6m thats a long time without support for a disability health takes a nosedive whilst expending extra energy to fight bds,"['these', 'are', 'the', 'people', 'doing', 'pip', 'assessments', 'assessing', 'conditions', 'they', 'know', 'fuck', 'all', 'about', 'and', 'cant', 'be', 'arsed', 'to', 'google', 'fighting', 'rejected', 'claims', 'takes', '6m', 'thats', 'a', 'long', 'time', 'without', 'support', 'for', 'a', 'disability', 'health', 'takes', 'a', 'nosedive', 'whilst', 'expending', 'extra', 'energy', 'to', 'fight', 'bds']","['people', 'pip', 'assessments', 'assessing', 'conditions', 'know', 'fuck', 'cant', 'arsed', 'google', 'fighting', 'rejected', 'claims', 'takes', '6m', 'thats', 'long', 'time', 'without', 'support', 'disability', 'health', 'takes', 'nosedive', 'whilst', 'expending', 'extra', 'energy', 'fight', 'bds']","['peopl', 'pip', 'assess', 'assess', 'condit', 'know', 'fuck', 'cant', 'ars', 'googl', 'fight', 'reject', 'claim', 'take', '6m', 'that', 'long', 'time', 'without', 'support', 'disabl', 'health', 'take', 'nosed', 'whilst', 'expend', 'extra', 'energi', 'fight', 'bd']","['people', 'pip', 'assessments', 'assessing', 'conditions', 'know', 'fuck', 'cant', 'arsed', 'google', 'fighting', 'rejected', 'claims', 'takes', '6m', 'thats', 'long', 'time', 'without', 'support', 'disability', 'health', 'takes', 'nosedive', 'whilst', 'expending', 'extra', 'energy', 'fight', 'bds']",1,Spain
2020-03-09 22:55:26+00:00,1237150026654076928,"Oh good, ‘Trump increased tele-health services for seniors so that they can Skype with their doctors.’ Yeah, because those folks in the nursing homes are non-stop Skyping...
#coronavirus",thriftymimi,United States,0,0,0,0,Thrift Store Junkie. Fan of Democracy. Rescuer of vintage bridal gowns. Aspiring Minimalist.,405,['coronavirus'],oh good trump increased telehealth services for seniors so that they can skype with their doctors yeah because those folks in the nursing homes are nonstop skyping coronavirus,"['oh', 'good', 'trump', 'increased', 'telehealth', 'services', 'for', 'seniors', 'so', 'that', 'they', 'can', 'skype', 'with', 'their', 'doctors', 'yeah', 'because', 'those', 'folks', 'in', 'the', 'nursing', 'homes', 'are', 'nonstop', 'skyping', 'coronavirus']","['oh', 'good', 'trump', 'increased', 'telehealth', 'services', 'seniors', 'skype', 'doctors', 'yeah', 'folks', 'nursing', 'homes', 'nonstop', 'skyping', 'coronavirus']","['oh', 'good', 'trump', 'increas', 'telehealth', 'servic', 'senior', 'skype', 'doctor', 'yeah', 'folk', 'nurs', 'home', 'nonstop', 'skype', 'coronaviru']","['oh', 'good', 'trump', 'increased', 'telehealth', 'services', 'seniors', 'skype', 'doctors', 'yeah', 'folks', 'nursing', 'homes', 'nonstop', 'skyping', 'coronavirus']",4,Spain
2020-03-09 05:49:32+00:00,1236891852164542464,SAFE BET: I predict that AG Barr will cite public health concerns in order to cancel his scheduled appearance before @HouseJudiciary later this month. R's on the committee will immediately support Barr. @JerryNadler @RepAdamSchiff @SpeakerPelosi https://t.co/t77SLy5evz,GOP_EthicsGhost,"Washington, USA",1,0,0,0,"From Honest Abe and IKE to Elliot Richardson and John McCain, the GOP used to care about honor and character. America needs them to care again.",2205,,safe bet i predict that ag barr will cite public health concerns in order to cancel his scheduled appearance before later this month rs on the committee will immediately support barr,"['safe', 'bet', 'i', 'predict', 'that', 'ag', 'barr', 'will', 'cite', 'public', 'health', 'concerns', 'in', 'order', 'to', 'cancel', 'his', 'scheduled', 'appearance', 'before', 'later', 'this', 'month', 'rs', 'on', 'the', 'committee', 'will', 'immediately', 'support', 'barr']","['safe', 'bet', 'predict', 'ag', 'barr', 'cite', 'public', 'health', 'concerns', 'order', 'cancel', 'scheduled', 'appearance', 'later', 'month', 'rs', 'committee', 'immediately', 'support', 'barr']","['safe', 'bet', 'predict', 'ag', 'barr', 'cite', 'public', 'health', 'concern', 'order', 'cancel', 'schedul', 'appear', 'later', 'month', 'rs', 'committe', 'immedi', 'support', 'barr']","['safe', 'bet', 'predict', 'ag', 'barr', 'cite', 'public', 'health', 'concerns', 'order', 'cancel', 'scheduled', 'appearance', 'later', 'month', 'rs', 'committee', 'immediately', 'support', 'barr']",3,Spain
2020-03-08 03:44:49+00:00,1236498078326312960,".@realDonaldTrump What about the people who attend your rallies? Do you care about their health and safety? That is the real question, Dummy. Does @TeamTrump care about any of your supporters? If not, let's set up a Kissing Booth at the next one. Good idea? https://t.co/VD6Xz0mPp5",GOP_EthicsGhost,"Washington, USA",1,0,0,0,"From Honest Abe and IKE to Elliot Richardson and John McCain, the GOP used to care about honor and character. America needs them to care again.",2205,,what about the people who attend your rallies do you care about their health and safety that is the real question dummy does care about any of your supporters if not lets set up a kissing booth at the next one good idea,"['what', 'about', 'the', 'people', 'who', 'attend', 'your', 'rallies', 'do', 'you', 'care', 'about', 'their', 'health', 'and', 'safety', 'that', 'is', 'the', 'real', 'question', 'dummy', 'does', 'care', 'about', 'any', 'of', 'your', 'supporters', 'if', 'not', 'lets', 'set', 'up', 'a', 'kissing', 'booth', 'at', 'the', 'next', 'one', 'good', 'idea']","['people', 'attend', 'rallies', 'care', 'health', 'safety', 'real', 'question', 'dummy', 'care', 'supporters', 'lets', 'set', 'kissing', 'booth', 'next', 'one', 'good', 'idea']","['peopl', 'attend', 'ralli', 'care', 'health', 'safeti', 'real', 'question', 'dummi', 'care', 'support', 'let', 'set', 'kiss', 'booth', 'next', 'one', 'good', 'idea']","['people', 'attend', 'rallies', 'care', 'health', 'safety', 'real', 'question', 'dummy', 'care', 'supporters', 'lets', 'set', 'kissing', 'booth', 'next', 'one', 'good', 'idea']",1,Spain
2020-03-07 10:27:27+00:00,1236237015840157701,"Foods like oats,nuts,seeds and bananas can support your heart health. Enjoy our oat cookie recipe and give your heart health a boost at the same time. https://t.co/IaAZa8yKsz #plantbased https://t.co/ahaLgBYhzN",La_Crisalida,"Alicante, Spain",0,0,1,0,"Wellbeing tips and vegan recipes from an all-inclusive #health and #yoga #retreat in Spain, with a passion for health and wellbeing for mind, body and soul.  🌱",442,['plantbased'],foods like oatsnutsseeds and bananas can support your heart health enjoy our oat cookie recipe and give your heart health a boost at the same time plantbased,"['foods', 'like', 'oatsnutsseeds', 'and', 'bananas', 'can', 'support', 'your', 'heart', 'health', 'enjoy', 'our', 'oat', 'cookie', 'recipe', 'and', 'give', 'your', 'heart', 'health', 'a', 'boost', 'at', 'the', 'same', 'time', 'plantbased']","['foods', 'like', 'oatsnutsseeds', 'bananas', 'support', 'heart', 'health', 'enjoy', 'oat', 'cookie', 'recipe', 'give', 'heart', 'health', 'boost', 'time', 'plantbased']","['food', 'like', 'oatsnutsse', 'banana', 'support', 'heart', 'health', 'enjoy', 'oat', 'cooki', 'recip', 'give', 'heart', 'health', 'boost', 'time', 'plantbas']","['foods', 'like', 'oatsnutsseeds', 'bananas', 'support', 'heart', 'health', 'enjoy', 'oat', 'cookie', 'recipe', 'give', 'heart', 'health', 'boost', 'time', 'plantbased']",5,Spain
2020-02-17 18:13:41+00:00,1229468979778985984,"I'm going to start blaming the UK in the same way they blame the EU!

Child poverty!
Fat cat businesses!
Poor health service!
People on benefits dying!
Young people can't afford rent!
Innocent people being kicked out the UK!
Forgotten communities!

All the UK's fault! 🇬🇧🤮🤮🤮🇬🇧",EnglishmanAdam,Portugal,62,5,19,0,"Immigrant, perpetual nomad. Exile. Author. Political recluse. Proud to be part of the 48%.",13163,,im going to start blaming the uk in the same way they blame the eu child poverty fat cat businesses poor health service people on benefits dying young people cant afford rent innocent people being kicked out the uk forgotten communities all the uks fault,"['im', 'going', 'to', 'start', 'blaming', 'the', 'uk', 'in', 'the', 'same', 'way', 'they', 'blame', 'the', 'eu', 'child', 'poverty', 'fat', 'cat', 'businesses', 'poor', 'health', 'service', 'people', 'on', 'benefits', 'dying', 'young', 'people', 'cant', 'afford', 'rent', 'innocent', 'people', 'being', 'kicked', 'out', 'the', 'uk', 'forgotten', 'communities', 'all', 'the', 'uks', 'fault']","['im', 'going', 'start', 'blaming', 'uk', 'way', 'blame', 'eu', 'child', 'poverty', 'fat', 'cat', 'businesses', 'poor', 'health', 'service', 'people', 'benefits', 'dying', 'young', 'people', 'cant', 'afford', 'rent', 'innocent', 'people', 'kicked', 'uk', 'forgotten', 'communities', 'uks', 'fault']","['im', 'go', 'start', 'blame', 'uk', 'way', 'blame', 'eu', 'child', 'poverti', 'fat', 'cat', 'busi', 'poor', 'health', 'servic', 'peopl', 'benefit', 'die', 'young', 'peopl', 'cant', 'afford', 'rent', 'innoc', 'peopl', 'kick', 'uk', 'forgotten', 'commun', 'uk', 'fault']","['im', 'going', 'start', 'blaming', 'uk', 'way', 'blame', 'eu', 'child', 'poverty', 'fat', 'cat', 'businesses', 'poor', 'health', 'service', 'people', 'benefits', 'dying', 'young', 'people', 'cant', 'afford', 'rent', 'innocent', 'people', 'kicked', 'uk', 'forgotten', 'communities', 'uks', 'fault']",1,Spain
2020-02-17 09:36:04+00:00,1229338717460029442,"Cigarettes must be some of the most devious bait-and-switch products. User pays good money to support a habit, and addiction, seeking relief from stress, and gets serious health reduction in return.
A sad case of valuing profit over people.",GeorgFasching,"Oporto, Portugal",2,0,0,0,Guiding leaders/-hip teams to high-performance. || I proudly support @1PercentFTP donating 1% of sales to @feedbackorg,1135,,cigarettes must be some of the most devious baitandswitch products user pays good money to support a habit and addiction seeking relief from stress and gets serious health reduction in return a sad case of valuing profit over people,"['cigarettes', 'must', 'be', 'some', 'of', 'the', 'most', 'devious', 'baitandswitch', 'products', 'user', 'pays', 'good', 'money', 'to', 'support', 'a', 'habit', 'and', 'addiction', 'seeking', 'relief', 'from', 'stress', 'and', 'gets', 'serious', 'health', 'reduction', 'in', 'return', 'a', 'sad', 'case', 'of', 'valuing', 'profit', 'over', 'people']","['cigarettes', 'must', 'devious', 'baitandswitch', 'products', 'user', 'pays', 'good', 'money', 'support', 'habit', 'addiction', 'seeking', 'relief', 'stress', 'gets', 'serious', 'health', 'reduction', 'return', 'sad', 'case', 'valuing', 'profit', 'people']","['cigarett', 'must', 'deviou', 'baitandswitch', 'product', 'user', 'pay', 'good', 'money', 'support', 'habit', 'addict', 'seek', 'relief', 'stress', 'get', 'seriou', 'health', 'reduct', 'return', 'sad', 'case', 'valu', 'profit', 'peopl']","['cigarettes', 'must', 'devious', 'baitandswitch', 'products', 'user', 'pays', 'good', 'money', 'support', 'habit', 'addiction', 'seeking', 'relief', 'stress', 'gets', 'serious', 'health', 'reduction', 'return', 'sad', 'case', 'valuing', 'profit', 'people']",1,Spain
2020-02-10 15:52:30+00:00,1226896733780750336,"@JustEvilKThings @Ella45477777 @orviwan @A_Silent_Child @FitbitSupport @fitbit @FitbitDev @Michael_Fitbit @parkjames @emich @Hexxeh @HiveTheory @benward @davidteodorescu @emilynora Trans women are not female they are men, so should follow male health.",TonyAngelUK,,3,1,0,0,"Amateur Astronomer, Ex-Army Bandsman, ex-systems designer and ex-project consultant. Equality not Diversity, Integration not  Multiculturalism.",1205,,trans women are not female they are men so should follow male health,"['trans', 'women', 'are', 'not', 'female', 'they', 'are', 'men', 'so', 'should', 'follow', 'male', 'health']","['trans', 'women', 'female', 'men', 'follow', 'male', 'health']","['tran', 'women', 'femal', 'men', 'follow', 'male', 'health']","['trans', 'women', 'female', 'men', 'follow', 'male', 'health']",2,Spain
2020-02-03 00:41:45+00:00,1224130821491232769,"@Peter44999173 @nicktolhurst @KenKenph59 Many of them are immigrants in EU countries, taking advantage of better health services. Profiteers!!!",fonteis8,United Kingdom,0,0,0,0,hundred percent in defence of climate emergency. Every small action counts; we do not have Planet B,1052,,many of them are immigrants in eu countries taking advantage of better health services profiteers,"['many', 'of', 'them', 'are', 'immigrants', 'in', 'eu', 'countries', 'taking', 'advantage', 'of', 'better', 'health', 'services', 'profiteers']","['many', 'immigrants', 'eu', 'countries', 'taking', 'advantage', 'better', 'health', 'services', 'profiteers']","['mani', 'immigr', 'eu', 'countri', 'take', 'advantag', 'better', 'health', 'servic', 'profit']","['many', 'immigrants', 'eu', 'countries', 'taking', 'advantage', 'better', 'health', 'services', 'profiteers']",2,Spain
2020-01-16 07:13:36+00:00,1217706450606284800,#OncoAlert A health services research agenda to fully integrate #cancer #rehabilitation into #oncology care #gerionc #geriheme #survonc https://t.co/KWS1t21a22,DrRaulCordoba,"Madrid, España",4,0,1,0,Lymphoma Unit @Hospital_FJD & @UICOquironsalud. Board member @sehh_es & @SIOGorg. Councilor @EHA_Hematology Executive Board. Chairman SWG “Aging and Hematology”,8009,"['OncoAlert', 'cancer', 'rehabilitation', 'oncology', 'gerionc', 'geriheme', 'survonc']",oncoalert a health services research agenda to fully integrate cancer rehabilitation into oncology care gerionc geriheme survonc,"['oncoalert', 'a', 'health', 'services', 'research', 'agenda', 'to', 'fully', 'integrate', 'cancer', 'rehabilitation', 'into', 'oncology', 'care', 'gerionc', 'geriheme', 'survonc']","['oncoalert', 'health', 'services', 'research', 'agenda', 'fully', 'integrate', 'cancer', 'rehabilitation', 'oncology', 'care', 'gerionc', 'geriheme', 'survonc']","['oncoalert', 'health', 'servic', 'research', 'agenda', 'fulli', 'integr', 'cancer', 'rehabilit', 'oncolog', 'care', 'gerionc', 'gerihem', 'survonc']","['oncoalert', 'health', 'services', 'research', 'agenda', 'fully', 'integrate', 'cancer', 'rehabilitation', 'oncology', 'care', 'gerionc', 'geriheme', 'survonc']",4,Spain
2019-12-29 20:07:13+00:00,1211378157468704769,"Good family, friends, fans, coworkers I hope you are enjoying these special dates and I wish you a happy New Year 2020 full of Health, work, money and much love, thank you for all the support and blessings of this… https://t.co/LJlnZzwddF",DjRubenMartinez,Worldwide,0,0,0,0,Promos 👉🏽rmrubenmartinezoficial@gmail.com Dates and Booking 👇,1402,,good family friends fans coworkers i hope you are enjoying these special dates and i wish you a happy new year 2020 full of health work money and much love thank you for all the support and blessings of this,"['good', 'family', 'friends', 'fans', 'coworkers', 'i', 'hope', 'you', 'are', 'enjoying', 'these', 'special', 'dates', 'and', 'i', 'wish', 'you', 'a', 'happy', 'new', 'year', '2020', 'full', 'of', 'health', 'work', 'money', 'and', 'much', 'love', 'thank', 'you', 'for', 'all', 'the', 'support', 'and', 'blessings', 'of', 'this']","['good', 'family', 'friends', 'fans', 'coworkers', 'hope', 'enjoying', 'special', 'dates', 'wish', 'happy', 'new', 'year', '2020', 'full', 'health', 'work', 'money', 'much', 'love', 'thank', 'support', 'blessings']","['good', 'famili', 'friend', 'fan', 'cowork', 'hope', 'enjoy', 'special', 'date', 'wish', 'happi', 'new', 'year', '2020', 'full', 'health', 'work', 'money', 'much', 'love', 'thank', 'support', 'bless']","['good', 'family', 'friends', 'fans', 'coworkers', 'hope', 'enjoying', 'special', 'dates', 'wish', 'happy', 'new', 'year', '2020', 'full', 'health', 'work', 'money', 'much', 'love', 'thank', 'support', 'blessings']",5,Spain
2019-12-14 20:06:43+00:00,1205942213848551424,"@xr_cambridge @dwallacewells @StephenLeahy Hmm... the letter to TM signed by nearly 200 MPs coordinated by a rising Tory star had nothing to do with it? Or the strong civil society campaign, business support, health professionals... all irrelevant I suppose",_richardblack,Berlin,0,1,0,0,"Climate, energy, science, politics, cricket. Sen Assoc @eciu_uk, Hon Fellow @ImperialCollege, ex Env Corr @bbcnews. Share b'day w @GretaThunberg, all own views",30773,,hmm the letter to tm signed by nearly 200 mps coordinated by a rising tory star had nothing to do with it or the strong civil society campaign business support health professionals all irrelevant i suppose,"['hmm', 'the', 'letter', 'to', 'tm', 'signed', 'by', 'nearly', '200', 'mps', 'coordinated', 'by', 'a', 'rising', 'tory', 'star', 'had', 'nothing', 'to', 'do', 'with', 'it', 'or', 'the', 'strong', 'civil', 'society', 'campaign', 'business', 'support', 'health', 'professionals', 'all', 'irrelevant', 'i', 'suppose']","['hmm', 'letter', 'tm', 'signed', 'nearly', '200', 'mps', 'coordinated', 'rising', 'tory', 'star', 'nothing', 'strong', 'civil', 'society', 'campaign', 'business', 'support', 'health', 'professionals', 'irrelevant', 'suppose']","['hmm', 'letter', 'tm', 'sign', 'nearli', '200', 'mp', 'coordin', 'rise', 'tori', 'star', 'noth', 'strong', 'civil', 'societi', 'campaign', 'busi', 'support', 'health', 'profession', 'irrelev', 'suppos']","['hmm', 'letter', 'tm', 'signed', 'nearly', '200', 'mps', 'coordinated', 'rising', 'tory', 'star', 'nothing', 'strong', 'civil', 'society', 'campaign', 'business', 'support', 'health', 'professionals', 'irrelevant', 'suppose']",1,Spain
