Date,Id,Tweet,Username,Location,likeCount,replyCount,retweetCount,quoteCount,userDescription,userFollowers,hashtags,Cleaned_Tweet,Tweet_tokenized,Tweet_removed_stop_word,Tweet_stemmed,Tweet_lemmatized,sentiment,Country
2020-04-04 23:15:43+00:00,1246577215321579525,"“Fear not the want of armor 
For mine is yours to wear ”This is the time we all Chinese community have come together to support our Jamaica brothers and sisters to fight with covid -19 ,

5 million value of medical items handover to Cornwall regional hospital",Bqja09,,0,1,0,0,,1,,fear not the want of armor for mine is yours to wear this is the time we all chinese community have come together to support our jamaica brothers and sisters to fight with covid 19 5 million value of medical items handover to cornwall regional hospital,"['fear', 'not', 'the', 'want', 'of', 'armor', 'for', 'mine', 'is', 'yours', 'to', 'wear', 'this', 'is', 'the', 'time', 'we', 'all', 'chinese', 'community', 'have', 'come', 'together', 'to', 'support', 'our', 'jamaica', 'brothers', 'and', 'sisters', 'to', 'fight', 'with', 'covid', '19', '5', 'million', 'value', 'of', 'medical', 'items', 'handover', 'to', 'cornwall', 'regional', 'hospital']","['fear', 'want', 'armor', 'mine', 'wear', 'time', 'chinese', 'community', 'come', 'together', 'support', 'jamaica', 'brothers', 'sisters', 'fight', 'covid', '19', '5', 'million', 'value', 'medical', 'items', 'handover', 'cornwall', 'regional', 'hospital']","['fear', 'want', 'armor', 'mine', 'wear', 'time', 'chines', 'commun', 'come', 'togeth', 'support', 'jamaica', 'brother', 'sister', 'fight', 'covid', '19', '5', 'million', 'valu', 'medic', 'item', 'handov', 'cornwal', 'region', 'hospit']","['fear', 'want', 'armor', 'mine', 'wear', 'time', 'chinese', 'community', 'come', 'together', 'support', 'jamaica', 'brothers', 'sisters', 'fight', 'covid', '19', '5', 'million', 'value', 'medical', 'items', 'handover', 'cornwall', 'regional', 'hospital']",5,Jamaica
2020-04-04 16:34:39+00:00,1246476285418901504,"That's why we've given our support to the Ministry of Health and Wellness in Jamaica by operating the COVID-19 hotlines. The numbers are:
888-ONE-LOVE (663-5683)
888-754-7792
876-542-5998
876-542-6007
876-542- 6006
876-542-5998",itelCX,Jamaica,1,1,0,0,"itel is an award-winning international CX partner, with a robust service delivery model that combines the best of nearshore, onshore, and work-at-home.",928,,thats why weve given our support to the ministry of health and wellness in jamaica by operating the covid19 hotlines the numbers are 888onelove 6635683 8887547792 8765425998 8765426007 876542 6006 8765425998,"['thats', 'why', 'weve', 'given', 'our', 'support', 'to', 'the', 'ministry', 'of', 'health', 'and', 'wellness', 'in', 'jamaica', 'by', 'operating', 'the', 'covid19', 'hotlines', 'the', 'numbers', 'are', '888onelove', '6635683', '8887547792', '8765425998', '8765426007', '876542', '6006', '8765425998']","['thats', 'weve', 'given', 'support', 'ministry', 'health', 'wellness', 'jamaica', 'operating', 'covid19', 'hotlines', 'numbers', '888onelove', '6635683', '8887547792', '8765425998', '8765426007', '876542', '6006', '8765425998']","['that', 'weve', 'given', 'support', 'ministri', 'health', 'well', 'jamaica', 'oper', 'covid19', 'hotlin', 'number', '888onelov', '6635683', '8887547792', '8765425998', '8765426007', '876542', '6006', '8765425998']","['thats', 'weve', 'given', 'support', 'ministry', 'health', 'wellness', 'jamaica', 'operating', 'covid19', 'hotlines', 'numbers', '888onelove', '6635683', '8887547792', '8765425998', '8765426007', '876542', '6006', '8765425998']",3,Jamaica
2020-03-31 02:56:26+00:00,1244820822457548800,"Save-the-Date: PANCAP in collaboration with the Pan American Health Organisation (PAHO) will host the webinar ""Clinical Management of COVID-19 and Psychosocial support for caregivers"". Register here: https://t.co/nKVUxIlVku",ivancruickshank,Jamaica,0,0,1,0,HIV and Human Rights  Advocate,256,,savethedate pancap in collaboration with the pan american health organisation paho will host the webinar clinical management of covid19 and psychosocial support for caregivers register here,"['savethedate', 'pancap', 'in', 'collaboration', 'with', 'the', 'pan', 'american', 'health', 'organisation', 'paho', 'will', 'host', 'the', 'webinar', 'clinical', 'management', 'of', 'covid19', 'and', 'psychosocial', 'support', 'for', 'caregivers', 'register', 'here']","['savethedate', 'pancap', 'collaboration', 'pan', 'american', 'health', 'organisation', 'paho', 'host', 'webinar', 'clinical', 'management', 'covid19', 'psychosocial', 'support', 'caregivers', 'register']","['savethed', 'pancap', 'collabor', 'pan', 'american', 'health', 'organis', 'paho', 'host', 'webinar', 'clinic', 'manag', 'covid19', 'psychosoci', 'support', 'caregiv', 'regist']","['savethedate', 'pancap', 'collaboration', 'pan', 'american', 'health', 'organisation', 'paho', 'host', 'webinar', 'clinical', 'management', 'covid19', 'psychosocial', 'support', 'caregivers', 'register']",5,Jamaica
2020-03-30 15:38:18+00:00,1244650164742127618,My family &amp; I remain happy to support the fight against COVID - 19 across our region and donating our resorts to house medical support superhero’s. https://t.co/KDF1NVnO6D,AdamStewart,From Jamaica to the World,103,7,24,6,"Jamaican, husband, father & outdoorsman. Official tweets of Adam Stewart, Executive Chairman of @SandalsResorts, @IslandRoutes @atlautomotive @atlunbeatable",343237,,my family amp i remain happy to support the fight against covid 19 across our region and donating our resorts to house medical support superheros,"['my', 'family', 'amp', 'i', 'remain', 'happy', 'to', 'support', 'the', 'fight', 'against', 'covid', '19', 'across', 'our', 'region', 'and', 'donating', 'our', 'resorts', 'to', 'house', 'medical', 'support', 'superheros']","['family', 'amp', 'remain', 'happy', 'support', 'fight', 'covid', '19', 'across', 'region', 'donating', 'resorts', 'house', 'medical', 'support', 'superheros']","['famili', 'amp', 'remain', 'happi', 'support', 'fight', 'covid', '19', 'across', 'region', 'donat', 'resort', 'hous', 'medic', 'support', 'superhero']","['family', 'amp', 'remain', 'happy', 'support', 'fight', 'covid', '19', 'across', 'region', 'donating', 'resorts', 'house', 'medical', 'support', 'superheros']",5,Jamaica
2020-03-18 16:38:17+00:00,1240316604614881283,"In accordance with a restriction now in place on social gatherings requiring permits due to the COVID-19 virus, the Tourism Linkages Network, a division of the Tourism Enhancement Fund (TEF) has made the decision to postpone the 2020 staging of the Jamaica Blue Mountain 1/ https://t.co/7rnJL05vIc",CoffeeFestJa,Jamaica,2,1,1,1,"March 5,2022| Jamaica’s flagship coffee festival - an immersive experience from farm to cup (and plate). #JamaicaCoffeeFestival",162,,in accordance with a restriction now in place on social gatherings requiring permits due to the covid19 virus the tourism linkages network a division of the tourism enhancement fund tef has made the decision to postpone the 2020 staging of the jamaica blue mountain 1,"['in', 'accordance', 'with', 'a', 'restriction', 'now', 'in', 'place', 'on', 'social', 'gatherings', 'requiring', 'permits', 'due', 'to', 'the', 'covid19', 'virus', 'the', 'tourism', 'linkages', 'network', 'a', 'division', 'of', 'the', 'tourism', 'enhancement', 'fund', 'tef', 'has', 'made', 'the', 'decision', 'to', 'postpone', 'the', '2020', 'staging', 'of', 'the', 'jamaica', 'blue', 'mountain', '1']","['accordance', 'restriction', 'place', 'social', 'gatherings', 'requiring', 'permits', 'due', 'covid19', 'virus', 'tourism', 'linkages', 'network', 'division', 'tourism', 'enhancement', 'fund', 'tef', 'made', 'decision', 'postpone', '2020', 'staging', 'jamaica', 'blue', 'mountain', '1']","['accord', 'restrict', 'place', 'social', 'gather', 'requir', 'permit', 'due', 'covid19', 'viru', 'tourism', 'linkag', 'network', 'divis', 'tourism', 'enhanc', 'fund', 'tef', 'made', 'decis', 'postpon', '2020', 'stage', 'jamaica', 'blue', 'mountain', '1']","['accordance', 'restriction', 'place', 'social', 'gatherings', 'requiring', 'permits', 'due', 'covid19', 'virus', 'tourism', 'linkages', 'network', 'division', 'tourism', 'enhancement', 'fund', 'tef', 'made', 'decision', 'postpone', '2020', 'staging', 'jamaica', 'blue', 'mountain', '1']",1,Jamaica
2020-03-18 12:46:38+00:00,1240258310705745926,"@DrNigelClarkeJa Sir, you have mentioned some help for affected businesses in the covid area. How will businesses get support to withstand the hit and stand back on thei legs. How families and school fee will be taken care. Please state how to approach. Thank you.",swasahealthcar1,,0,0,0,0,,0,,sir you have mentioned some help for affected businesses in the covid area how will businesses get support to withstand the hit and stand back on thei legs how families and school fee will be taken care please state how to approach thank you,"['sir', 'you', 'have', 'mentioned', 'some', 'help', 'for', 'affected', 'businesses', 'in', 'the', 'covid', 'area', 'how', 'will', 'businesses', 'get', 'support', 'to', 'withstand', 'the', 'hit', 'and', 'stand', 'back', 'on', 'thei', 'legs', 'how', 'families', 'and', 'school', 'fee', 'will', 'be', 'taken', 'care', 'please', 'state', 'how', 'to', 'approach', 'thank', 'you']","['sir', 'mentioned', 'help', 'affected', 'businesses', 'covid', 'area', 'businesses', 'get', 'support', 'withstand', 'hit', 'stand', 'back', 'thei', 'legs', 'families', 'school', 'fee', 'taken', 'care', 'please', 'state', 'approach', 'thank']","['sir', 'mention', 'help', 'affect', 'busi', 'covid', 'area', 'busi', 'get', 'support', 'withstand', 'hit', 'stand', 'back', 'thei', 'leg', 'famili', 'school', 'fee', 'taken', 'care', 'pleas', 'state', 'approach', 'thank']","['sir', 'mentioned', 'help', 'affected', 'businesses', 'covid', 'area', 'businesses', 'get', 'support', 'withstand', 'hit', 'stand', 'back', 'thei', 'legs', 'families', 'school', 'fee', 'taken', 'care', 'please', 'state', 'approach', 'thank']",4,Jamaica
2020-03-17 20:51:58+00:00,1240018060666458114,"As the threat of COVID-19 intensifies we are taking every precaution to safeguard the health and safety of our employee family through our “6-Point Action Plan,” as well as simply being here for them in a collaborative and emotionally-supportive manner. https://t.co/DVgFKsbmar",itelCX,Jamaica,3,0,1,0,"itel is an award-winning international CX partner, with a robust service delivery model that combines the best of nearshore, onshore, and work-at-home.",928,,as the threat of covid19 intensifies we are taking every precaution to safeguard the health and safety of our employee family through our 6point action plan as well as simply being here for them in a collaborative and emotionallysupportive manner,"['as', 'the', 'threat', 'of', 'covid19', 'intensifies', 'we', 'are', 'taking', 'every', 'precaution', 'to', 'safeguard', 'the', 'health', 'and', 'safety', 'of', 'our', 'employee', 'family', 'through', 'our', '6point', 'action', 'plan', 'as', 'well', 'as', 'simply', 'being', 'here', 'for', 'them', 'in', 'a', 'collaborative', 'and', 'emotionallysupportive', 'manner']","['threat', 'covid19', 'intensifies', 'taking', 'every', 'precaution', 'safeguard', 'health', 'safety', 'employee', 'family', '6point', 'action', 'plan', 'well', 'simply', 'collaborative', 'emotionallysupportive', 'manner']","['threat', 'covid19', 'intensifi', 'take', 'everi', 'precaut', 'safeguard', 'health', 'safeti', 'employe', 'famili', '6point', 'action', 'plan', 'well', 'simpli', 'collabor', 'emotionallysupport', 'manner']","['threat', 'covid19', 'intensifies', 'taking', 'every', 'precaution', 'safeguard', 'health', 'safety', 'employee', 'family', '6point', 'action', 'plan', 'well', 'simply', 'collaborative', 'emotionallysupportive', 'manner']",5,Jamaica
2020-03-14 15:52:49+00:00,1238855611904901120,"Super proud of our @UWIMonaGuild President @CSW_JA and the team. 

With the support of the Hall Managers, the Guild has provided free transportation to over 200 students returning home due to COVID-19. 

I am happy to be a part of this team. https://t.co/29uyGpJGSS",SujaeBoswell,"Montego Bay, Jamaica",178,1,38,9,Jamaican 🇯🇲 | 🐶 dad | Get it done 💪,4978,,super proud of our president and the team with the support of the hall managers the guild has provided free transportation to over 200 students returning home due to covid19 i am happy to be a part of this team,"['super', 'proud', 'of', 'our', 'president', 'and', 'the', 'team', 'with', 'the', 'support', 'of', 'the', 'hall', 'managers', 'the', 'guild', 'has', 'provided', 'free', 'transportation', 'to', 'over', '200', 'students', 'returning', 'home', 'due', 'to', 'covid19', 'i', 'am', 'happy', 'to', 'be', 'a', 'part', 'of', 'this', 'team']","['super', 'proud', 'president', 'team', 'support', 'hall', 'managers', 'guild', 'provided', 'free', 'transportation', '200', 'students', 'returning', 'home', 'due', 'covid19', 'happy', 'part', 'team']","['super', 'proud', 'presid', 'team', 'support', 'hall', 'manag', 'guild', 'provid', 'free', 'transport', '200', 'student', 'return', 'home', 'due', 'covid19', 'happi', 'part', 'team']","['super', 'proud', 'president', 'team', 'support', 'hall', 'managers', 'guild', 'provided', 'free', 'transportation', '200', 'students', 'returning', 'home', 'due', 'covid19', 'happy', 'part', 'team']",5,Jamaica
2020-03-13 20:38:20+00:00,1238565076178743298,"In accordance with a restriction now in place on social gatherings requiring permits due to the COVID-19 virus, the Tourism Linkages Network, a division of the Tourism Enhancement Fund (TEF) has made the decision to postpone the 2020 staging of the Jamaica Blue Mountain (1/2) https://t.co/IGwknbrb40",CoffeeFestJa,Jamaica,8,1,10,2,"March 5,2022| Jamaica’s flagship coffee festival - an immersive experience from farm to cup (and plate). #JamaicaCoffeeFestival",162,,in accordance with a restriction now in place on social gatherings requiring permits due to the covid19 virus the tourism linkages network a division of the tourism enhancement fund tef has made the decision to postpone the 2020 staging of the jamaica blue mountain 12,"['in', 'accordance', 'with', 'a', 'restriction', 'now', 'in', 'place', 'on', 'social', 'gatherings', 'requiring', 'permits', 'due', 'to', 'the', 'covid19', 'virus', 'the', 'tourism', 'linkages', 'network', 'a', 'division', 'of', 'the', 'tourism', 'enhancement', 'fund', 'tef', 'has', 'made', 'the', 'decision', 'to', 'postpone', 'the', '2020', 'staging', 'of', 'the', 'jamaica', 'blue', 'mountain', '12']","['accordance', 'restriction', 'place', 'social', 'gatherings', 'requiring', 'permits', 'due', 'covid19', 'virus', 'tourism', 'linkages', 'network', 'division', 'tourism', 'enhancement', 'fund', 'tef', 'made', 'decision', 'postpone', '2020', 'staging', 'jamaica', 'blue', 'mountain', '12']","['accord', 'restrict', 'place', 'social', 'gather', 'requir', 'permit', 'due', 'covid19', 'viru', 'tourism', 'linkag', 'network', 'divis', 'tourism', 'enhanc', 'fund', 'tef', 'made', 'decis', 'postpon', '2020', 'stage', 'jamaica', 'blue', 'mountain', '12']","['accordance', 'restriction', 'place', 'social', 'gatherings', 'requiring', 'permits', 'due', 'covid19', 'virus', 'tourism', 'linkages', 'network', 'division', 'tourism', 'enhancement', 'fund', 'tef', 'made', 'decision', 'postpone', '2020', 'staging', 'jamaica', 'blue', 'mountain', '12']",1,Jamaica
2021-10-24 16:01:52+00:00,1452304343684747271,"Way to go @nepajamaica 

As our frontline workers traverse the corridors of our country we hope they feel the immense support of a grateful people. We are grateful beyond measure 👩‍⚕️👨‍⚕️👩🏿‍🌾👷‍♂️👨‍🔬🚔🚨👮‍♂️ https://t.co/MoTOxzxjlJ",UNJamaica,"Kingston, Jamaica",4,2,1,0,"The voice of the collective UN presence in Jamaica, Bahamas, Bermuda, Cayman & Turks & Caicos. Dr. @ConilleGarry is UN Resident Coordinator.",3812,,way to go as our frontline workers traverse the corridors of our country we hope they feel the immense support of a grateful people we are grateful beyond measure,"['way', 'to', 'go', 'as', 'our', 'frontline', 'workers', 'traverse', 'the', 'corridors', 'of', 'our', 'country', 'we', 'hope', 'they', 'feel', 'the', 'immense', 'support', 'of', 'a', 'grateful', 'people', 'we', 'are', 'grateful', 'beyond', 'measure']","['way', 'go', 'frontline', 'workers', 'traverse', 'corridors', 'country', 'hope', 'feel', 'immense', 'support', 'grateful', 'people', 'grateful', 'beyond', 'measure']","['way', 'go', 'frontlin', 'worker', 'travers', 'corridor', 'countri', 'hope', 'feel', 'immens', 'support', 'grate', 'peopl', 'grate', 'beyond', 'measur']","['way', 'go', 'frontline', 'workers', 'traverse', 'corridors', 'country', 'hope', 'feel', 'immense', 'support', 'grateful', 'people', 'grateful', 'beyond', 'measure']",5,Jamaica
2021-10-18 14:19:45+00:00,1450104317562822658,"Jamaica’s frontline heroes are in health, education, sanitation, shipping, security, farming &amp; MORE. Learn how @UN @FAOCaribbean programmes have supported female farmers to brave the pandemic &amp; keep the Jamaican economy beating. #onthefrontline #Thankyou #LightJamaicaBLue 🇯🇲🇺🇳 https://t.co/qMhQTW9WGT",UNJamaica,"Kingston, Jamaica",4,0,1,1,"The voice of the collective UN presence in Jamaica, Bahamas, Bermuda, Cayman & Turks & Caicos. Dr. @ConilleGarry is UN Resident Coordinator.",3812,"['onthefrontline', 'Thankyou', 'LightJamaicaBLue']",jamaicas frontline heroes are in health education sanitation shipping security farming amp more learn how programmes have supported female farmers to brave the pandemic amp keep the jamaican economy beating onthefrontline thankyou lightjamaicablue,"['jamaicas', 'frontline', 'heroes', 'are', 'in', 'health', 'education', 'sanitation', 'shipping', 'security', 'farming', 'amp', 'more', 'learn', 'how', 'programmes', 'have', 'supported', 'female', 'farmers', 'to', 'brave', 'the', 'pandemic', 'amp', 'keep', 'the', 'jamaican', 'economy', 'beating', 'onthefrontline', 'thankyou', 'lightjamaicablue']","['jamaicas', 'frontline', 'heroes', 'health', 'education', 'sanitation', 'shipping', 'security', 'farming', 'amp', 'learn', 'programmes', 'supported', 'female', 'farmers', 'brave', 'pandemic', 'amp', 'keep', 'jamaican', 'economy', 'beating', 'onthefrontline', 'thankyou', 'lightjamaicablue']","['jamaica', 'frontlin', 'hero', 'health', 'educ', 'sanit', 'ship', 'secur', 'farm', 'amp', 'learn', 'programm', 'support', 'femal', 'farmer', 'brave', 'pandem', 'amp', 'keep', 'jamaican', 'economi', 'beat', 'onthefrontlin', 'thankyou', 'lightjamaicablu']","['jamaicas', 'frontline', 'heroes', 'health', 'education', 'sanitation', 'shipping', 'security', 'farming', 'amp', 'learn', 'programmes', 'supported', 'female', 'farmers', 'brave', 'pandemic', 'amp', 'keep', 'jamaican', 'economy', 'beating', 'onthefrontline', 'thankyou', 'lightjamaicablue']",5,Jamaica
2021-04-21 23:04:31+00:00,1385006563430125570,Ignorance is a disease 🦠 Hope @themohwgovjm provides some support and security for her. Grateful to all our frontline workers 💕🙏🏾 https://t.co/RGTNEHJoCh,garveygirl,"Kingston, Jamaica ",2,0,0,0,Read 📚 Write 👩🏾‍💻 Serve 🇯🇲#BlackBooksMatter #WeCreateJA,1970,,ignorance is a disease hope provides some support and security for her grateful to all our frontline workers,"['ignorance', 'is', 'a', 'disease', 'hope', 'provides', 'some', 'support', 'and', 'security', 'for', 'her', 'grateful', 'to', 'all', 'our', 'frontline', 'workers']","['ignorance', 'disease', 'hope', 'provides', 'support', 'security', 'grateful', 'frontline', 'workers']","['ignor', 'diseas', 'hope', 'provid', 'support', 'secur', 'grate', 'frontlin', 'worker']","['ignorance', 'disease', 'hope', 'provides', 'support', 'security', 'grateful', 'frontline', 'workers']",4,Jamaica
2021-02-26 22:59:56+00:00,1365436466206244873,@hcikingston @christufton @MEAIndia As the Peak of Pandemic is going in #Jamaica it will not only Boost the Moral of Frontline Workers but also the People of this Great Nation. Thank you @hcikingston for your support to make it happen in this short span of time.🇮🇳🇯🇲,CEOMUKESHSINGH,"Kingston,Jamaica",0,0,0,0,"Chief Executive Office, All Views are Personal",24,['Jamaica'],as the peak of pandemic is going in jamaica it will not only boost the moral of frontline workers but also the people of this great nation thank you for your support to make it happen in this short span of time,"['as', 'the', 'peak', 'of', 'pandemic', 'is', 'going', 'in', 'jamaica', 'it', 'will', 'not', 'only', 'boost', 'the', 'moral', 'of', 'frontline', 'workers', 'but', 'also', 'the', 'people', 'of', 'this', 'great', 'nation', 'thank', 'you', 'for', 'your', 'support', 'to', 'make', 'it', 'happen', 'in', 'this', 'short', 'span', 'of', 'time']","['peak', 'pandemic', 'going', 'jamaica', 'boost', 'moral', 'frontline', 'workers', 'also', 'people', 'great', 'nation', 'thank', 'support', 'make', 'happen', 'short', 'span', 'time']","['peak', 'pandem', 'go', 'jamaica', 'boost', 'moral', 'frontlin', 'worker', 'also', 'peopl', 'great', 'nation', 'thank', 'support', 'make', 'happen', 'short', 'span', 'time']","['peak', 'pandemic', 'going', 'jamaica', 'boost', 'moral', 'frontline', 'workers', 'also', 'people', 'great', 'nation', 'thank', 'support', 'make', 'happen', 'short', 'span', 'time']",5,Jamaica
2020-12-11 00:37:59+00:00,1337194887284928512,We'll also continue to celebrate &amp; support our frontline workers through our partnership with the Jamaica Chamber of Commerce  (@jamaicacommerce) &amp; All Island Chamber of Commerce to bring Christmas cheer by decorating select hospitals across the island.🎄🎄🎁🎁,thePSOJ,"39 Hope Road, Kingston 10, Jam",0,0,0,0,"The Private Sector Organisation of Jamaica (PSOJ), is a national organisation of private sector entities promoting a competitive and productive private sector.",4060,,well also continue to celebrate amp support our frontline workers through our partnership with the jamaica chamber of commerce amp all island chamber of commerce to bring christmas cheer by decorating select hospitals across the island,"['well', 'also', 'continue', 'to', 'celebrate', 'amp', 'support', 'our', 'frontline', 'workers', 'through', 'our', 'partnership', 'with', 'the', 'jamaica', 'chamber', 'of', 'commerce', 'amp', 'all', 'island', 'chamber', 'of', 'commerce', 'to', 'bring', 'christmas', 'cheer', 'by', 'decorating', 'select', 'hospitals', 'across', 'the', 'island']","['well', 'also', 'continue', 'celebrate', 'amp', 'support', 'frontline', 'workers', 'partnership', 'jamaica', 'chamber', 'commerce', 'amp', 'island', 'chamber', 'commerce', 'bring', 'christmas', 'cheer', 'decorating', 'select', 'hospitals', 'across', 'island']","['well', 'also', 'continu', 'celebr', 'amp', 'support', 'frontlin', 'worker', 'partnership', 'jamaica', 'chamber', 'commerc', 'amp', 'island', 'chamber', 'commerc', 'bring', 'christma', 'cheer', 'decor', 'select', 'hospit', 'across', 'island']","['well', 'also', 'continue', 'celebrate', 'amp', 'support', 'frontline', 'workers', 'partnership', 'jamaica', 'chamber', 'commerce', 'amp', 'island', 'chamber', 'commerce', 'bring', 'christmas', 'cheer', 'decorating', 'select', 'hospitals', 'across', 'island']",5,Jamaica
2020-04-30 22:04:25+00:00,1255981357836242946,"#Throwback
Dr. Tomlin Paul, highlights the importance of creating and ensuring that resources are being put in place to support all frontline caregivers/healthworkers. He also enouraged them to seek counseling as it's likely to be a stressful time amid the #COVID19 outbreak. https://t.co/5El50QDuzF",SALISESMona,"Mona Kingston Jamaica
The Univ",6,0,0,0,Sir Arthur Lewis Institute of Social and Economic Studies | Influencing development through high quality graduate teaching and research,567,"['Throwback', 'COVID19']",throwback dr tomlin paul highlights the importance of creating and ensuring that resources are being put in place to support all frontline caregivershealthworkers he also enouraged them to seek counseling as its likely to be a stressful time amid the covid19 outbreak,"['throwback', 'dr', 'tomlin', 'paul', 'highlights', 'the', 'importance', 'of', 'creating', 'and', 'ensuring', 'that', 'resources', 'are', 'being', 'put', 'in', 'place', 'to', 'support', 'all', 'frontline', 'caregivershealthworkers', 'he', 'also', 'enouraged', 'them', 'to', 'seek', 'counseling', 'as', 'its', 'likely', 'to', 'be', 'a', 'stressful', 'time', 'amid', 'the', 'covid19', 'outbreak']","['throwback', 'dr', 'tomlin', 'paul', 'highlights', 'importance', 'creating', 'ensuring', 'resources', 'put', 'place', 'support', 'frontline', 'caregivershealthworkers', 'also', 'enouraged', 'seek', 'counseling', 'likely', 'stressful', 'time', 'amid', 'covid19', 'outbreak']","['throwback', 'dr', 'tomlin', 'paul', 'highlight', 'import', 'creat', 'ensur', 'resourc', 'put', 'place', 'support', 'frontlin', 'caregivershealthwork', 'also', 'enourag', 'seek', 'counsel', 'like', 'stress', 'time', 'amid', 'covid19', 'outbreak']","['throwback', 'dr', 'tomlin', 'paul', 'highlights', 'importance', 'creating', 'ensuring', 'resources', 'put', 'place', 'support', 'frontline', 'caregivershealthworkers', 'also', 'enouraged', 'seek', 'counseling', 'likely', 'stressful', 'time', 'amid', 'covid19', 'outbreak']",4,Jamaica
