Date,Id,Tweet,Username,Location,likeCount,replyCount,retweetCount,quoteCount,userDescription,userFollowers,hashtags,Cleaned_Tweet,Tweet_tokenized,Tweet_removed_stop_word,Tweet_stemmed,Tweet_lemmatized,sentiment,Country
2022-05-30 06:40:33+00:00,1531163636785348609,"Let’s look for growing organic content in our agricultural soil 🙏💚💙 min. 3% #SaveSoil #ConsciousPlanet #SadhguruJV the benefits are not only going to ensure our lives , but tremendously enhance life quality and healthcare #LetsMakeItHappen https://t.co/t7LbayNAV5",ClaudiaCiorba,"Salzburg, Österreich",0,0,0,0,interested on this my piece of life • add value to other people •I am definitely a wonderful possibility in making use of this our planet in more conscious way,12,"['SaveSoil', 'ConsciousPlanet', 'SadhguruJV', 'LetsMakeItHappen']",lets look for growing organic content in our agricultural soil min 3 savesoil consciousplanet sadhgurujv the benefits are not only going to ensure our lives but tremendously enhance life quality and healthcare letsmakeithappen,"['lets', 'look', 'for', 'growing', 'organic', 'content', 'in', 'our', 'agricultural', 'soil', 'min', '3', 'savesoil', 'consciousplanet', 'sadhgurujv', 'the', 'benefits', 'are', 'not', 'only', 'going', 'to', 'ensure', 'our', 'lives', 'but', 'tremendously', 'enhance', 'life', 'quality', 'and', 'healthcare', 'letsmakeithappen']","['lets', 'look', 'growing', 'organic', 'content', 'agricultural', 'soil', 'min', '3', 'savesoil', 'consciousplanet', 'sadhgurujv', 'benefits', 'going', 'ensure', 'lives', 'tremendously', 'enhance', 'life', 'quality', 'healthcare', 'letsmakeithappen']","['let', 'look', 'grow', 'organ', 'content', 'agricultur', 'soil', 'min', '3', 'savesoil', 'consciousplanet', 'sadhgurujv', 'benefit', 'go', 'ensur', 'live', 'tremend', 'enhanc', 'life', 'qualiti', 'healthcar', 'letsmakeithappen']","['lets', 'look', 'growing', 'organic', 'content', 'agricultural', 'soil', 'min', '3', 'savesoil', 'consciousplanet', 'sadhgurujv', 'benefits', 'going', 'ensure', 'lives', 'tremendously', 'enhance', 'life', 'quality', 'healthcare', 'letsmakeithappen']",5,Austria
2020-04-03 08:05:38+00:00,1245985799356715009,"When this all improves, it’ll be the mental health professionals that get overwhelmed by new patients while trying to manage their own traumas. First, we survive and support the physical healthcare professionals, then we need to be prepared to support mental health professionals.",DrLMRobinson,"Ann Arbor, MI",38,2,6,0,"Psychologist & #AnimalWelfare scientist, studier of apes/monkeys, knower of personality💜🐒 Views my own; everyone else refused to plagiarise them. She/her",13042,,when this all improves itll be the mental health professionals that get overwhelmed by new patients while trying to manage their own traumas first we survive and support the physical healthcare professionals then we need to be prepared to support mental health professionals,"['when', 'this', 'all', 'improves', 'itll', 'be', 'the', 'mental', 'health', 'professionals', 'that', 'get', 'overwhelmed', 'by', 'new', 'patients', 'while', 'trying', 'to', 'manage', 'their', 'own', 'traumas', 'first', 'we', 'survive', 'and', 'support', 'the', 'physical', 'healthcare', 'professionals', 'then', 'we', 'need', 'to', 'be', 'prepared', 'to', 'support', 'mental', 'health', 'professionals']","['improves', 'itll', 'mental', 'health', 'professionals', 'get', 'overwhelmed', 'new', 'patients', 'trying', 'manage', 'traumas', 'first', 'survive', 'support', 'physical', 'healthcare', 'professionals', 'need', 'prepared', 'support', 'mental', 'health', 'professionals']","['improv', 'itll', 'mental', 'health', 'profession', 'get', 'overwhelm', 'new', 'patient', 'tri', 'manag', 'trauma', 'first', 'surviv', 'support', 'physic', 'healthcar', 'profession', 'need', 'prepar', 'support', 'mental', 'health', 'profession']","['improves', 'itll', 'mental', 'health', 'professionals', 'get', 'overwhelmed', 'new', 'patients', 'trying', 'manage', 'traumas', 'first', 'survive', 'support', 'physical', 'healthcare', 'professionals', 'need', 'prepared', 'support', 'mental', 'health', 'professionals']",3,Austria
2022-06-05 09:32:22+00:00,1533381204606590976,"I have happy messages.  everything is fine.  I was able to sleep!  put on a drip!  waiting for the doctor.  I’ll answer all the guys, we still don’t have anything clear, Katarina is in the hospital, I drive and dangle.  thanks for your support.  love you all! https://t.co/Mh8s9kWXez",NikoShev,Украина,7,1,0,0,NFT and cryptocurrency. Former entrepreneur. I'm trying to avoid war for the second time. I speak openly about love and mental disorders! Looking for a job Mod!,1183,,i have happy messages everything is fine i was able to sleep put on a drip waiting for the doctor ill answer all the guys we still dont have anything clear katarina is in the hospital i drive and dangle thanks for your support love you all,"['i', 'have', 'happy', 'messages', 'everything', 'is', 'fine', 'i', 'was', 'able', 'to', 'sleep', 'put', 'on', 'a', 'drip', 'waiting', 'for', 'the', 'doctor', 'ill', 'answer', 'all', 'the', 'guys', 'we', 'still', 'dont', 'have', 'anything', 'clear', 'katarina', 'is', 'in', 'the', 'hospital', 'i', 'drive', 'and', 'dangle', 'thanks', 'for', 'your', 'support', 'love', 'you', 'all']","['happy', 'messages', 'everything', 'fine', 'able', 'sleep', 'put', 'drip', 'waiting', 'doctor', 'ill', 'answer', 'guys', 'still', 'dont', 'anything', 'clear', 'katarina', 'hospital', 'drive', 'dangle', 'thanks', 'support', 'love']","['happi', 'messag', 'everyth', 'fine', 'abl', 'sleep', 'put', 'drip', 'wait', 'doctor', 'ill', 'answer', 'guy', 'still', 'dont', 'anyth', 'clear', 'katarina', 'hospit', 'drive', 'dangl', 'thank', 'support', 'love']","['happy', 'messages', 'everything', 'fine', 'able', 'sleep', 'put', 'drip', 'waiting', 'doctor', 'ill', 'answer', 'guys', 'still', 'dont', 'anything', 'clear', 'katarina', 'hospital', 'drive', 'dangle', 'thanks', 'support', 'love']",5,Austria
2021-12-03 12:17:03+00:00,1466743281744846857,"@DiverHannah Sweet, now just go down to the your local hospital, go to the intensive care ward and let the doctors know they they should give people on life support machines paracetamol and fluids instead 👍 x",DannyBoyMiller,Peterborough UK,0,1,0,0,long suffering PUFC fan | Cave-dweller |🌱 | 🇬🇧 | 🇦🇹,741,,sweet now just go down to the your local hospital go to the intensive care ward and let the doctors know they they should give people on life support machines paracetamol and fluids instead x,"['sweet', 'now', 'just', 'go', 'down', 'to', 'the', 'your', 'local', 'hospital', 'go', 'to', 'the', 'intensive', 'care', 'ward', 'and', 'let', 'the', 'doctors', 'know', 'they', 'they', 'should', 'give', 'people', 'on', 'life', 'support', 'machines', 'paracetamol', 'and', 'fluids', 'instead', 'x']","['sweet', 'go', 'local', 'hospital', 'go', 'intensive', 'care', 'ward', 'let', 'doctors', 'know', 'give', 'people', 'life', 'support', 'machines', 'paracetamol', 'fluids', 'instead', 'x']","['sweet', 'go', 'local', 'hospit', 'go', 'intens', 'care', 'ward', 'let', 'doctor', 'know', 'give', 'peopl', 'life', 'support', 'machin', 'paracetamol', 'fluid', 'instead', 'x']","['sweet', 'go', 'local', 'hospital', 'go', 'intensive', 'care', 'ward', 'let', 'doctors', 'know', 'give', 'people', 'life', 'support', 'machines', 'paracetamol', 'fluids', 'instead', 'x']",4,Austria
2020-11-19 12:07:39+00:00,1329395914000261122,"@awkward_duck This is late and maybe repetitive: water wipes because you may not get a shower, chapstick, water cup with straw, SNACKS for you &amp; support. I did bone broth &amp; coconut water, nursing tops, cozy robe, slippers, and take all the things from the hospital. All of them.",maryelizrobbins,"Vienna, Austria",0,1,0,0,"Parent to Sidney & Theo. Feminist social scientist. Recovering academic.
Likes: cats, public schools, gender and racial justice, and science.",685,,this is late and maybe repetitive water wipes because you may not get a shower chapstick water cup with straw snacks for you amp support i did bone broth amp coconut water nursing tops cozy robe slippers and take all the things from the hospital all of them,"['this', 'is', 'late', 'and', 'maybe', 'repetitive', 'water', 'wipes', 'because', 'you', 'may', 'not', 'get', 'a', 'shower', 'chapstick', 'water', 'cup', 'with', 'straw', 'snacks', 'for', 'you', 'amp', 'support', 'i', 'did', 'bone', 'broth', 'amp', 'coconut', 'water', 'nursing', 'tops', 'cozy', 'robe', 'slippers', 'and', 'take', 'all', 'the', 'things', 'from', 'the', 'hospital', 'all', 'of', 'them']","['late', 'maybe', 'repetitive', 'water', 'wipes', 'may', 'get', 'shower', 'chapstick', 'water', 'cup', 'straw', 'snacks', 'amp', 'support', 'bone', 'broth', 'amp', 'coconut', 'water', 'nursing', 'tops', 'cozy', 'robe', 'slippers', 'take', 'things', 'hospital']","['late', 'mayb', 'repetit', 'water', 'wipe', 'may', 'get', 'shower', 'chapstick', 'water', 'cup', 'straw', 'snack', 'amp', 'support', 'bone', 'broth', 'amp', 'coconut', 'water', 'nurs', 'top', 'cozi', 'robe', 'slipper', 'take', 'thing', 'hospit']","['late', 'maybe', 'repetitive', 'water', 'wipes', 'may', 'get', 'shower', 'chapstick', 'water', 'cup', 'straw', 'snacks', 'amp', 'support', 'bone', 'broth', 'amp', 'coconut', 'water', 'nursing', 'tops', 'cozy', 'robe', 'slippers', 'take', 'things', 'hospital']",3,Austria
2022-05-30 14:02:18+00:00,1531274807676895235,"Managing Employee Mental Health enables employees to maintain balance with work-life stressors and enhance employee engagement. Moreover, it promotes a safe and friendly job environment. Also, it discourages the stigma related with mental health issues of employees https://t.co/9IE6wbgdtq",ForSlovenia,"Maribor, Slovenia",0,0,0,0,,1,,managing employee mental health enables employees to maintain balance with worklife stressors and enhance employee engagement moreover it promotes a safe and friendly job environment also it discourages the stigma related with mental health issues of employees,"['managing', 'employee', 'mental', 'health', 'enables', 'employees', 'to', 'maintain', 'balance', 'with', 'worklife', 'stressors', 'and', 'enhance', 'employee', 'engagement', 'moreover', 'it', 'promotes', 'a', 'safe', 'and', 'friendly', 'job', 'environment', 'also', 'it', 'discourages', 'the', 'stigma', 'related', 'with', 'mental', 'health', 'issues', 'of', 'employees']","['managing', 'employee', 'mental', 'health', 'enables', 'employees', 'maintain', 'balance', 'worklife', 'stressors', 'enhance', 'employee', 'engagement', 'moreover', 'promotes', 'safe', 'friendly', 'job', 'environment', 'also', 'discourages', 'stigma', 'related', 'mental', 'health', 'issues', 'employees']","['manag', 'employe', 'mental', 'health', 'enabl', 'employe', 'maintain', 'balanc', 'worklif', 'stressor', 'enhanc', 'employe', 'engag', 'moreov', 'promot', 'safe', 'friendli', 'job', 'environ', 'also', 'discourag', 'stigma', 'relat', 'mental', 'health', 'issu', 'employe']","['managing', 'employee', 'mental', 'health', 'enables', 'employees', 'maintain', 'balance', 'worklife', 'stressors', 'enhance', 'employee', 'engagement', 'moreover', 'promotes', 'safe', 'friendly', 'job', 'environment', 'also', 'discourages', 'stigma', 'related', 'mental', 'health', 'issues', 'employees']",4,Austria
2020-06-03 14:06:46+00:00,1268182343094861824,"Going to the gym feels a bit inappropriate with a pandemic in the wild and important protests to support. Staying healthy is still important, even when there are extra safety measures to be taken. @ Kieser Training https://t.co/wR4hYwDzBI",widhalmt,"iPhone: 47.785831,13.064665",1,0,0,0,"(He/Him)
Consultant, Sysadmin, Knife enthusiast",901,,going to the gym feels a bit inappropriate with a pandemic in the wild and important protests to support staying healthy is still important even when there are extra safety measures to be taken kieser training,"['going', 'to', 'the', 'gym', 'feels', 'a', 'bit', 'inappropriate', 'with', 'a', 'pandemic', 'in', 'the', 'wild', 'and', 'important', 'protests', 'to', 'support', 'staying', 'healthy', 'is', 'still', 'important', 'even', 'when', 'there', 'are', 'extra', 'safety', 'measures', 'to', 'be', 'taken', 'kieser', 'training']","['going', 'gym', 'feels', 'bit', 'inappropriate', 'pandemic', 'wild', 'important', 'protests', 'support', 'staying', 'healthy', 'still', 'important', 'even', 'extra', 'safety', 'measures', 'taken', 'kieser', 'training']","['go', 'gym', 'feel', 'bit', 'inappropri', 'pandem', 'wild', 'import', 'protest', 'support', 'stay', 'healthi', 'still', 'import', 'even', 'extra', 'safeti', 'measur', 'taken', 'kieser', 'train']","['going', 'gym', 'feels', 'bit', 'inappropriate', 'pandemic', 'wild', 'important', 'protests', 'support', 'staying', 'healthy', 'still', 'important', 'even', 'extra', 'safety', 'measures', 'taken', 'kieser', 'training']",3,Austria
2021-08-05 12:04:23+00:00,1423253549614567432,"Angela Merkel, 2.6m people are calling on you to share the covid vaccine recipes with the world. Stand with @potus at #G7 and support the suspension of #patents, so that more countries can produce the life-saving vaccines. #PeoplesVaccine https://t.co/zhb97N9fUa @RegSprecher",mkraml2908,"Graz, Österreich",0,0,0,0,,92,"['G7', 'patents', 'PeoplesVaccine']",angela merkel 26m people are calling on you to share the covid vaccine recipes with the world stand with at g7 and support the suspension of patents so that more countries can produce the lifesaving vaccines peoplesvaccine,"['angela', 'merkel', '26m', 'people', 'are', 'calling', 'on', 'you', 'to', 'share', 'the', 'covid', 'vaccine', 'recipes', 'with', 'the', 'world', 'stand', 'with', 'at', 'g7', 'and', 'support', 'the', 'suspension', 'of', 'patents', 'so', 'that', 'more', 'countries', 'can', 'produce', 'the', 'lifesaving', 'vaccines', 'peoplesvaccine']","['angela', 'merkel', '26m', 'people', 'calling', 'share', 'covid', 'vaccine', 'recipes', 'world', 'stand', 'g7', 'support', 'suspension', 'patents', 'countries', 'produce', 'lifesaving', 'vaccines', 'peoplesvaccine']","['angela', 'merkel', '26m', 'peopl', 'call', 'share', 'covid', 'vaccin', 'recip', 'world', 'stand', 'g7', 'support', 'suspens', 'patent', 'countri', 'produc', 'lifesav', 'vaccin', 'peoplesvaccin']","['angela', 'merkel', '26m', 'people', 'calling', 'share', 'covid', 'vaccine', 'recipes', 'world', 'stand', 'g7', 'support', 'suspension', 'patents', 'countries', 'produce', 'lifesaving', 'vaccines', 'peoplesvaccine']",1,Austria
