Date,Id,Tweet,Username,Location,likeCount,replyCount,retweetCount,quoteCount,userDescription,userFollowers,hashtags,Cleaned_Tweet,Tweet_tokenized,Tweet_removed_stop_word,Tweet_stemmed,Tweet_lemmatized,sentiment,Country
2020-02-28 02:14:28+00:00,1233213851673427970,"Today, I visited Primary Health Facilities in Kingston as part of the Primary Health Care Renewal Initiative. 
My first stop for the day was at the Harbour View Health Centre which is a Type 3 Facility which offers Maternal &amp; Childcare Services, Mental Health Services ... https://t.co/QyIWFGvTUS",christufton,Jamaica,17,1,1,0,Author || Minister of Health and Wellness @themohwgovjm || Member of Parliament West Central St Catherine,114353,,today i visited primary health facilities in kingston as part of the primary health care renewal initiative my first stop for the day was at the harbour view health centre which is a type 3 facility which offers maternal amp childcare services mental health services,"['today', 'i', 'visited', 'primary', 'health', 'facilities', 'in', 'kingston', 'as', 'part', 'of', 'the', 'primary', 'health', 'care', 'renewal', 'initiative', 'my', 'first', 'stop', 'for', 'the', 'day', 'was', 'at', 'the', 'harbour', 'view', 'health', 'centre', 'which', 'is', 'a', 'type', '3', 'facility', 'which', 'offers', 'maternal', 'amp', 'childcare', 'services', 'mental', 'health', 'services']","['today', 'visited', 'primary', 'health', 'facilities', 'kingston', 'part', 'primary', 'health', 'care', 'renewal', 'initiative', 'first', 'stop', 'day', 'harbour', 'view', 'health', 'centre', 'type', '3', 'facility', 'offers', 'maternal', 'amp', 'childcare', 'services', 'mental', 'health', 'services']","['today', 'visit', 'primari', 'health', 'facil', 'kingston', 'part', 'primari', 'health', 'care', 'renew', 'initi', 'first', 'stop', 'day', 'harbour', 'view', 'health', 'centr', 'type', '3', 'facil', 'offer', 'matern', 'amp', 'childcar', 'servic', 'mental', 'health', 'servic']","['today', 'visited', 'primary', 'health', 'facilities', 'kingston', 'part', 'primary', 'health', 'care', 'renewal', 'initiative', 'first', 'stop', 'day', 'harbour', 'view', 'health', 'centre', 'type', '3', 'facility', 'offers', 'maternal', 'amp', 'childcare', 'services', 'mental', 'health', 'services']",4,Jamaica
2020-02-21 00:58:44+00:00,1230658075490750464,"My day:
1. Guest speaker at Real Man Talk at Trench Town Polytechnic
2. Facilitated Supporting Volunteer Resiliency TOT session for staff at Peace Corps Jamaica
3. Managing Conflict session at St. Thomas Health Department
Mi tiyad...and so grateful!!
#transformationaltrainer https://t.co/Xoq6xrzNZk",Fabian_M_Thomas,"Kingston, Jamaica",0,0,1,0,"Fabian has more than twenty years’ experience as a trainer/facilitator, performing arts specialist,  life/corporate coach and motivational speaker",270,['transformationaltrainer'],my day 1 guest speaker at real man talk at trench town polytechnic 2 facilitated supporting volunteer resiliency tot session for staff at peace corps jamaica 3 managing conflict session at st thomas health department mi tiyadand so grateful transformationaltrainer,"['my', 'day', '1', 'guest', 'speaker', 'at', 'real', 'man', 'talk', 'at', 'trench', 'town', 'polytechnic', '2', 'facilitated', 'supporting', 'volunteer', 'resiliency', 'tot', 'session', 'for', 'staff', 'at', 'peace', 'corps', 'jamaica', '3', 'managing', 'conflict', 'session', 'at', 'st', 'thomas', 'health', 'department', 'mi', 'tiyadand', 'so', 'grateful', 'transformationaltrainer']","['day', '1', 'guest', 'speaker', 'real', 'man', 'talk', 'trench', 'town', 'polytechnic', '2', 'facilitated', 'supporting', 'volunteer', 'resiliency', 'tot', 'session', 'staff', 'peace', 'corps', 'jamaica', '3', 'managing', 'conflict', 'session', 'st', 'thomas', 'health', 'department', 'mi', 'tiyadand', 'grateful', 'transformationaltrainer']","['day', '1', 'guest', 'speaker', 'real', 'man', 'talk', 'trench', 'town', 'polytechn', '2', 'facilit', 'support', 'volunt', 'resili', 'tot', 'session', 'staff', 'peac', 'corp', 'jamaica', '3', 'manag', 'conflict', 'session', 'st', 'thoma', 'health', 'depart', 'mi', 'tiyadand', 'grate', 'transformationaltrain']","['day', '1', 'guest', 'speaker', 'real', 'man', 'talk', 'trench', 'town', 'polytechnic', '2', 'facilitated', 'supporting', 'volunteer', 'resiliency', 'tot', 'session', 'staff', 'peace', 'corps', 'jamaica', '3', 'managing', 'conflict', 'session', 'st', 'thomas', 'health', 'department', 'mi', 'tiyadand', 'grateful', 'transformationaltrainer']",5,Jamaica
2020-02-20 10:46:26+00:00,1230443588644937733,"Over 800 in two days:  Bright Smiles, Bright Futures at 5 schools of The Links Incorporated’s Service mission to Jamaica in partnership with members of the National Dental Associations ad Link volunteers with support of the Health Ministry https://t.co/aN6DRAX6AY",ColgateBSBF,,12,0,1,1,"Colgate Bright Smiles, Bright Futures® Bringing free dental screenings, oral health education & smiles to children in need worldwide. #ColgateBrightSmiles",821,,over 800 in two days bright smiles bright futures at 5 schools of the links incorporateds service mission to jamaica in partnership with members of the national dental associations ad link volunteers with support of the health ministry,"['over', '800', 'in', 'two', 'days', 'bright', 'smiles', 'bright', 'futures', 'at', '5', 'schools', 'of', 'the', 'links', 'incorporateds', 'service', 'mission', 'to', 'jamaica', 'in', 'partnership', 'with', 'members', 'of', 'the', 'national', 'dental', 'associations', 'ad', 'link', 'volunteers', 'with', 'support', 'of', 'the', 'health', 'ministry']","['800', 'two', 'days', 'bright', 'smiles', 'bright', 'futures', '5', 'schools', 'links', 'incorporateds', 'service', 'mission', 'jamaica', 'partnership', 'members', 'national', 'dental', 'associations', 'ad', 'link', 'volunteers', 'support', 'health', 'ministry']","['800', 'two', 'day', 'bright', 'smile', 'bright', 'futur', '5', 'school', 'link', 'incorpor', 'servic', 'mission', 'jamaica', 'partnership', 'member', 'nation', 'dental', 'associ', 'ad', 'link', 'volunt', 'support', 'health', 'ministri']","['800', 'two', 'days', 'bright', 'smiles', 'bright', 'futures', '5', 'schools', 'links', 'incorporateds', 'service', 'mission', 'jamaica', 'partnership', 'members', 'national', 'dental', 'associations', 'ad', 'link', 'volunteers', 'support', 'health', 'ministry']",5,Jamaica
2020-02-12 20:53:56+00:00,1227697367123714055,"We will be at @spartanhealthclub tomorrow for World Condom Day providing free health screening from 3-6pm. Be sure to stop by for testing, vital checks, prizes and surprises. 

Made possible by the kind support of USAID. 

#safersexweek #gettested #wholesomehealth https://t.co/lwWwbaloDV",JASLtweets,Jamaica,8,0,9,1,"Official Twitter page of Jamaica AIDS Support for Life, oldest and largest human rights NGO in Jamaica. Located in: Kingston (HQ), Montego Bay & Ocho Rios",2621,"['safersexweek', 'gettested', 'wholesomehealth']",we will be at tomorrow for world condom day providing free health screening from 36pm be sure to stop by for testing vital checks prizes and surprises made possible by the kind support of usaid safersexweek gettested wholesomehealth,"['we', 'will', 'be', 'at', 'tomorrow', 'for', 'world', 'condom', 'day', 'providing', 'free', 'health', 'screening', 'from', '36pm', 'be', 'sure', 'to', 'stop', 'by', 'for', 'testing', 'vital', 'checks', 'prizes', 'and', 'surprises', 'made', 'possible', 'by', 'the', 'kind', 'support', 'of', 'usaid', 'safersexweek', 'gettested', 'wholesomehealth']","['tomorrow', 'world', 'condom', 'day', 'providing', 'free', 'health', 'screening', '36pm', 'sure', 'stop', 'testing', 'vital', 'checks', 'prizes', 'surprises', 'made', 'possible', 'kind', 'support', 'usaid', 'safersexweek', 'gettested', 'wholesomehealth']","['tomorrow', 'world', 'condom', 'day', 'provid', 'free', 'health', 'screen', '36pm', 'sure', 'stop', 'test', 'vital', 'check', 'prize', 'surpris', 'made', 'possibl', 'kind', 'support', 'usaid', 'safersexweek', 'gettest', 'wholesomehealth']","['tomorrow', 'world', 'condom', 'day', 'providing', 'free', 'health', 'screening', '36pm', 'sure', 'stop', 'testing', 'vital', 'checks', 'prizes', 'surprises', 'made', 'possible', 'kind', 'support', 'usaid', 'safersexweek', 'gettested', 'wholesomehealth']",5,Jamaica
2020-02-07 13:35:51+00:00,1225775180766642181,"The enhancement of these health centres will include Dental Facilities &amp; provision for a pharmacy. The completion of this project will be of great benefit to the staff, as well as residents in the targeted and surrounding areas.",christufton,Jamaica,2,0,0,0,Author || Minister of Health and Wellness @themohwgovjm || Member of Parliament West Central St Catherine,114353,,the enhancement of these health centres will include dental facilities amp provision for a pharmacy the completion of this project will be of great benefit to the staff as well as residents in the targeted and surrounding areas,"['the', 'enhancement', 'of', 'these', 'health', 'centres', 'will', 'include', 'dental', 'facilities', 'amp', 'provision', 'for', 'a', 'pharmacy', 'the', 'completion', 'of', 'this', 'project', 'will', 'be', 'of', 'great', 'benefit', 'to', 'the', 'staff', 'as', 'well', 'as', 'residents', 'in', 'the', 'targeted', 'and', 'surrounding', 'areas']","['enhancement', 'health', 'centres', 'include', 'dental', 'facilities', 'amp', 'provision', 'pharmacy', 'completion', 'project', 'great', 'benefit', 'staff', 'well', 'residents', 'targeted', 'surrounding', 'areas']","['enhanc', 'health', 'centr', 'includ', 'dental', 'facil', 'amp', 'provis', 'pharmaci', 'complet', 'project', 'great', 'benefit', 'staff', 'well', 'resid', 'target', 'surround', 'area']","['enhancement', 'health', 'centres', 'include', 'dental', 'facilities', 'amp', 'provision', 'pharmacy', 'completion', 'project', 'great', 'benefit', 'staff', 'well', 'residents', 'targeted', 'surrounding', 'areas']",5,Jamaica
2020-01-22 16:54:48+00:00,1220027040142893056,"春节快乐

I thank China and the Chinese people for your support for the United Nations and multilateralism.

I wish you all good health, happiness and success in this New Year. @un @antonioguterres 

谢谢 🇺🇳 https://t.co/1fDmyO785r",UNJamaica,"Kingston, Jamaica",0,0,0,0,"The voice of the collective UN presence in Jamaica, Bahamas, Bermuda, Cayman & Turks & Caicos. Dr. @ConilleGarry is UN Resident Coordinator.",3812,,i thank china and the chinese people for your support for the united nations and multilateralism i wish you all good health happiness and success in this new year,"['i', 'thank', 'china', 'and', 'the', 'chinese', 'people', 'for', 'your', 'support', 'for', 'the', 'united', 'nations', 'and', 'multilateralism', 'i', 'wish', 'you', 'all', 'good', 'health', 'happiness', 'and', 'success', 'in', 'this', 'new', 'year']","['thank', 'china', 'chinese', 'people', 'support', 'united', 'nations', 'multilateralism', 'wish', 'good', 'health', 'happiness', 'success', 'new', 'year']","['thank', 'china', 'chines', 'peopl', 'support', 'unit', 'nation', 'multilater', 'wish', 'good', 'health', 'happi', 'success', 'new', 'year']","['thank', 'china', 'chinese', 'people', 'support', 'united', 'nations', 'multilateralism', 'wish', 'good', 'health', 'happiness', 'success', 'new', 'year']",5,Jamaica
2020-01-17 23:58:19+00:00,1218321682940731393,"Good job guys! We'll be supporting you guys every step of your journey to GREAT health! 💪🏾⁣

#JamaicaMoves #BeatNCDs #JaMovesInSchools #GetMoving #EatWellLiveWell https://t.co/V4yKuM9jyW",jamaica_moves,Jamaica,3,0,1,0,"Join us as we get Jamaicans to lead a healthier lifestyle so that they can enjoy more moments, more memories and more life!",2655,"['JamaicaMoves', 'BeatNCDs', 'JaMovesInSchools', 'GetMoving', 'EatWellLiveWell']",good job guys well be supporting you guys every step of your journey to great health jamaicamoves beatncds jamovesinschools getmoving eatwelllivewell,"['good', 'job', 'guys', 'well', 'be', 'supporting', 'you', 'guys', 'every', 'step', 'of', 'your', 'journey', 'to', 'great', 'health', 'jamaicamoves', 'beatncds', 'jamovesinschools', 'getmoving', 'eatwelllivewell']","['good', 'job', 'guys', 'well', 'supporting', 'guys', 'every', 'step', 'journey', 'great', 'health', 'jamaicamoves', 'beatncds', 'jamovesinschools', 'getmoving', 'eatwelllivewell']","['good', 'job', 'guy', 'well', 'support', 'guy', 'everi', 'step', 'journey', 'great', 'health', 'jamaicamov', 'beatncd', 'jamovesinschool', 'getmov', 'eatwelllivewel']","['good', 'job', 'guys', 'well', 'supporting', 'guys', 'every', 'step', 'journey', 'great', 'health', 'jamaicamoves', 'beatncds', 'jamovesinschools', 'getmoving', 'eatwelllivewell']",5,Jamaica
2020-01-16 11:11:26+00:00,1217766303026630656,"Happy you did it!What he said,supports the women's  health survey done on gender based violence in Ja. Young men are beating women from a very young age. Yes,we are angry but we need to understand the ""why"" to really fix this frail masculinity of our Jamaican men. https://t.co/62GO8Cj7gz",TamiTude,"St.Andrew,Jamaica",0,0,0,0,"Nomad, Foodie, Cat Lover, Afrocentric Caribbean Crusader for  Justice and Rural Jamaica &appreciates every feminist,cultural,and off the beaten path experience.",565,,happy you did itwhat he saidsupports the womens health survey done on gender based violence in ja young men are beating women from a very young age yeswe are angry but we need to understand the why to really fix this frail masculinity of our jamaican men,"['happy', 'you', 'did', 'itwhat', 'he', 'saidsupports', 'the', 'womens', 'health', 'survey', 'done', 'on', 'gender', 'based', 'violence', 'in', 'ja', 'young', 'men', 'are', 'beating', 'women', 'from', 'a', 'very', 'young', 'age', 'yeswe', 'are', 'angry', 'but', 'we', 'need', 'to', 'understand', 'the', 'why', 'to', 'really', 'fix', 'this', 'frail', 'masculinity', 'of', 'our', 'jamaican', 'men']","['happy', 'itwhat', 'saidsupports', 'womens', 'health', 'survey', 'done', 'gender', 'based', 'violence', 'ja', 'young', 'men', 'beating', 'women', 'young', 'age', 'yeswe', 'angry', 'need', 'understand', 'really', 'fix', 'frail', 'masculinity', 'jamaican', 'men']","['happi', 'itwhat', 'saidsupport', 'women', 'health', 'survey', 'done', 'gender', 'base', 'violenc', 'ja', 'young', 'men', 'beat', 'women', 'young', 'age', 'yesw', 'angri', 'need', 'understand', 'realli', 'fix', 'frail', 'masculin', 'jamaican', 'men']","['happy', 'itwhat', 'saidsupports', 'womens', 'health', 'survey', 'done', 'gender', 'based', 'violence', 'ja', 'young', 'men', 'beating', 'women', 'young', 'age', 'yeswe', 'angry', 'need', 'understand', 'really', 'fix', 'frail', 'masculinity', 'jamaican', 'men']",5,Jamaica
2020-01-01 01:32:38+00:00,1212184828097028096,"@saymantix 1. Medical Technology
2. Health Services Administration
3. Certified Lead Assessor  (PECB Canada)
4. Certified Technical Assessor  (Medical Laboratories)
Profession: Clinical Laboratory Scientist &amp; Quality Assurance Manager  (Public Sector Laboratories)",Andi_O,"Kingston, Jamaica",8,0,0,0,"Lover of science, dancehall, and chocolate. Works in healthcare. Funny yet serious. Follow to learn more. 🇯🇲",5071,,1 medical technology 2 health services administration 3 certified lead assessor pecb canada 4 certified technical assessor medical laboratories profession clinical laboratory scientist amp quality assurance manager public sector laboratories,"['1', 'medical', 'technology', '2', 'health', 'services', 'administration', '3', 'certified', 'lead', 'assessor', 'pecb', 'canada', '4', 'certified', 'technical', 'assessor', 'medical', 'laboratories', 'profession', 'clinical', 'laboratory', 'scientist', 'amp', 'quality', 'assurance', 'manager', 'public', 'sector', 'laboratories']","['1', 'medical', 'technology', '2', 'health', 'services', 'administration', '3', 'certified', 'lead', 'assessor', 'pecb', 'canada', '4', 'certified', 'technical', 'assessor', 'medical', 'laboratories', 'profession', 'clinical', 'laboratory', 'scientist', 'amp', 'quality', 'assurance', 'manager', 'public', 'sector', 'laboratories']","['1', 'medic', 'technolog', '2', 'health', 'servic', 'administr', '3', 'certifi', 'lead', 'assessor', 'pecb', 'canada', '4', 'certifi', 'technic', 'assessor', 'medic', 'laboratori', 'profess', 'clinic', 'laboratori', 'scientist', 'amp', 'qualiti', 'assur', 'manag', 'public', 'sector', 'laboratori']","['1', 'medical', 'technology', '2', 'health', 'services', 'administration', '3', 'certified', 'lead', 'assessor', 'pecb', 'canada', '4', 'certified', 'technical', 'assessor', 'medical', 'laboratories', 'profession', 'clinical', 'laboratory', 'scientist', 'amp', 'quality', 'assurance', 'manager', 'public', 'sector', 'laboratories']",5,Jamaica
2019-12-29 16:02:50+00:00,1211316654333976583,Supporting arsenal cannot be good for ones health lol,diaveragejoe,,0,0,1,0,Part time gimmick full time bloodclaat ediat ...Tru u deven know half the story better u follow and find out! #MUFC #AgeQuodAgis 🇯🇲,463,,supporting arsenal cannot be good for ones health lol,"['supporting', 'arsenal', 'cannot', 'be', 'good', 'for', 'ones', 'health', 'lol']","['supporting', 'arsenal', 'cannot', 'good', 'ones', 'health', 'lol']","['support', 'arsen', 'cannot', 'good', 'one', 'health', 'lol']","['supporting', 'arsenal', 'cannot', 'good', 'ones', 'health', 'lol']",2,Jamaica
2019-12-13 19:15:06+00:00,1205566834340237314,"Jamaica Gleaner article: Ageing population increasing demand for health services 
@themohgovjm @jamaicaobserver @jamaicagleaner @cvmatsunrise #stannsbayhospital https://t.co/ZLJjiRoN8Z",mohnerha,Jamaica,1,0,0,0,"The North-East Regional Health Authority (NERHA) comprise the parishes of St. Ann, St. Mary and Portland.",1810,['stannsbayhospital'],jamaica gleaner article ageing population increasing demand for health services stannsbayhospital,"['jamaica', 'gleaner', 'article', 'ageing', 'population', 'increasing', 'demand', 'for', 'health', 'services', 'stannsbayhospital']","['jamaica', 'gleaner', 'article', 'ageing', 'population', 'increasing', 'demand', 'health', 'services', 'stannsbayhospital']","['jamaica', 'gleaner', 'articl', 'age', 'popul', 'increas', 'demand', 'health', 'servic', 'stannsbayhospit']","['jamaica', 'gleaner', 'article', 'ageing', 'population', 'increasing', 'demand', 'health', 'services', 'stannsbayhospital']",3,Jamaica
2019-12-12 19:18:51+00:00,1205205390885081098,Scenes from today's mental health stakeholders meeting in MoBay with Minister @christufton on the challenges &amp; opportunities to improve the provision of mental health services in western Jamaica. #SpeakUpSpeakNow #EndTheStigma https://t.co/AdybS22Bbj,themohwgovjm,"Kingston, Jamaica",1,0,1,0,"The official page of the Ministry of Health & Wellness, Jamaica.",49911,"['SpeakUpSpeakNow', 'EndTheStigma']",scenes from todays mental health stakeholders meeting in mobay with minister on the challenges amp opportunities to improve the provision of mental health services in western jamaica speakupspeaknow endthestigma,"['scenes', 'from', 'todays', 'mental', 'health', 'stakeholders', 'meeting', 'in', 'mobay', 'with', 'minister', 'on', 'the', 'challenges', 'amp', 'opportunities', 'to', 'improve', 'the', 'provision', 'of', 'mental', 'health', 'services', 'in', 'western', 'jamaica', 'speakupspeaknow', 'endthestigma']","['scenes', 'todays', 'mental', 'health', 'stakeholders', 'meeting', 'mobay', 'minister', 'challenges', 'amp', 'opportunities', 'improve', 'provision', 'mental', 'health', 'services', 'western', 'jamaica', 'speakupspeaknow', 'endthestigma']","['scene', 'today', 'mental', 'health', 'stakehold', 'meet', 'mobay', 'minist', 'challeng', 'amp', 'opportun', 'improv', 'provis', 'mental', 'health', 'servic', 'western', 'jamaica', 'speakupspeaknow', 'endthestigma']","['scenes', 'todays', 'mental', 'health', 'stakeholders', 'meeting', 'mobay', 'minister', 'challenges', 'amp', 'opportunities', 'improve', 'provision', 'mental', 'health', 'services', 'western', 'jamaica', 'speakupspeaknow', 'endthestigma']",4,Jamaica
2019-12-05 14:37:01+00:00,1202597751567060993,"Today, we have taken leadership in the struggle to rid this world of discrimination based on health status and to beat the virus.  The three of us standing together is symbolic of how @jasltweets has managed to bring people together to offer  Love. Support.  Action!",DMarcAnthony,"Kingston, Jamaica",0,1,0,0,I'm not always right but I ALWAYS speak MY truth. Caribbean lover. diasporan African! #socialdevelopment #Author #DevelopmentConsultant #Entrepreneur #Speaker,1865,,today we have taken leadership in the struggle to rid this world of discrimination based on health status and to beat the virus the three of us standing together is symbolic of how has managed to bring people together to offer love support action,"['today', 'we', 'have', 'taken', 'leadership', 'in', 'the', 'struggle', 'to', 'rid', 'this', 'world', 'of', 'discrimination', 'based', 'on', 'health', 'status', 'and', 'to', 'beat', 'the', 'virus', 'the', 'three', 'of', 'us', 'standing', 'together', 'is', 'symbolic', 'of', 'how', 'has', 'managed', 'to', 'bring', 'people', 'together', 'to', 'offer', 'love', 'support', 'action']","['today', 'taken', 'leadership', 'struggle', 'rid', 'world', 'discrimination', 'based', 'health', 'status', 'beat', 'virus', 'three', 'us', 'standing', 'together', 'symbolic', 'managed', 'bring', 'people', 'together', 'offer', 'love', 'support', 'action']","['today', 'taken', 'leadership', 'struggl', 'rid', 'world', 'discrimin', 'base', 'health', 'statu', 'beat', 'viru', 'three', 'us', 'stand', 'togeth', 'symbol', 'manag', 'bring', 'peopl', 'togeth', 'offer', 'love', 'support', 'action']","['today', 'taken', 'leadership', 'struggle', 'rid', 'world', 'discrimination', 'based', 'health', 'status', 'beat', 'virus', 'three', 'us', 'standing', 'together', 'symbolic', 'managed', 'bring', 'people', 'together', 'offer', 'love', 'support', 'action']",5,Jamaica
2019-12-03 14:54:32+00:00,1201877380782075906,"""There is need for a greater effort at the community level, and so we are also pleased to support the @themohgovjm’s work to equip health care workers to offer that critical support to parents through the National Infant and Young Child Feeding Network."" #BabyFriendly 🤱🏿",UNICEFJamaica,"Kingston, Jamaica",0,1,0,0,We support government & non-governmental partners to promote & fulfill the rights of children. #foreverychild,17583,['BabyFriendly'],there is need for a greater effort at the community level and so we are also pleased to support the work to equip health care workers to offer that critical support to parents through the national infant and young child feeding network babyfriendly,"['there', 'is', 'need', 'for', 'a', 'greater', 'effort', 'at', 'the', 'community', 'level', 'and', 'so', 'we', 'are', 'also', 'pleased', 'to', 'support', 'the', 'work', 'to', 'equip', 'health', 'care', 'workers', 'to', 'offer', 'that', 'critical', 'support', 'to', 'parents', 'through', 'the', 'national', 'infant', 'and', 'young', 'child', 'feeding', 'network', 'babyfriendly']","['need', 'greater', 'effort', 'community', 'level', 'also', 'pleased', 'support', 'work', 'equip', 'health', 'care', 'workers', 'offer', 'critical', 'support', 'parents', 'national', 'infant', 'young', 'child', 'feeding', 'network', 'babyfriendly']","['need', 'greater', 'effort', 'commun', 'level', 'also', 'pleas', 'support', 'work', 'equip', 'health', 'care', 'worker', 'offer', 'critic', 'support', 'parent', 'nation', 'infant', 'young', 'child', 'feed', 'network', 'babyfriendli']","['need', 'greater', 'effort', 'community', 'level', 'also', 'pleased', 'support', 'work', 'equip', 'health', 'care', 'workers', 'offer', 'critical', 'support', 'parents', 'national', 'infant', 'young', 'child', 'feeding', 'network', 'babyfriendly']",4,Jamaica
2019-12-02 23:04:18+00:00,1201638248361201667,"@kingofkgn Because many people work hard all their 20s and still cannot save because they're paying back student loans. Thus, they CAN'T live the life they want at 41. Worse if you add kids, supporting other family members, health emergencies etc into all of that.",Minxlareina,Jamaica,1,1,0,0,music nerd. consistently contradictory. wikkid inna dance but sleep in ma bed.,716,,because many people work hard all their 20s and still cannot save because theyre paying back student loans thus they cant live the life they want at 41 worse if you add kids supporting other family members health emergencies etc into all of that,"['because', 'many', 'people', 'work', 'hard', 'all', 'their', '20s', 'and', 'still', 'cannot', 'save', 'because', 'theyre', 'paying', 'back', 'student', 'loans', 'thus', 'they', 'cant', 'live', 'the', 'life', 'they', 'want', 'at', '41', 'worse', 'if', 'you', 'add', 'kids', 'supporting', 'other', 'family', 'members', 'health', 'emergencies', 'etc', 'into', 'all', 'of', 'that']","['many', 'people', 'work', 'hard', '20s', 'still', 'cannot', 'save', 'theyre', 'paying', 'back', 'student', 'loans', 'thus', 'cant', 'live', 'life', 'want', '41', 'worse', 'add', 'kids', 'supporting', 'family', 'members', 'health', 'emergencies', 'etc']","['mani', 'peopl', 'work', 'hard', '20', 'still', 'cannot', 'save', 'theyr', 'pay', 'back', 'student', 'loan', 'thu', 'cant', 'live', 'life', 'want', '41', 'wors', 'add', 'kid', 'support', 'famili', 'member', 'health', 'emerg', 'etc']","['many', 'people', 'work', 'hard', '20s', 'still', 'cannot', 'save', 'theyre', 'paying', 'back', 'student', 'loans', 'thus', 'cant', 'live', 'life', 'want', '41', 'worse', 'add', 'kids', 'supporting', 'family', 'members', 'health', 'emergencies', 'etc']",1,Jamaica
