Date,Id,Tweet,Username,Location,likeCount,replyCount,retweetCount,quoteCount,userDescription,userFollowers,hashtags,Cleaned_Tweet,Tweet_tokenized,Tweet_removed_stop_word,Tweet_stemmed,Tweet_lemmatized,sentiment,Country
2021-08-13 06:35:47+00:00,1426069955582193676,"When people praised joker for its depiction of declining mental health and the lack of support of society it’s this film that came to mind,Hall’s performance deserves so much more recognition https://t.co/yShAW6kTDN",jerryasleep,"Yilan County, Taiwan",23,4,0,0,"He/Him,26, Bi,cinephile📝📖🎬🎥 📺 🏳️‍🌈🔥",1443,,when people praised joker for its depiction of declining mental health and the lack of support of society its this film that came to mindhalls performance deserves so much more recognition,"['when', 'people', 'praised', 'joker', 'for', 'its', 'depiction', 'of', 'declining', 'mental', 'health', 'and', 'the', 'lack', 'of', 'support', 'of', 'society', 'its', 'this', 'film', 'that', 'came', 'to', 'mindhalls', 'performance', 'deserves', 'so', 'much', 'more', 'recognition']","['people', 'praised', 'joker', 'depiction', 'declining', 'mental', 'health', 'lack', 'support', 'society', 'film', 'came', 'mindhalls', 'performance', 'deserves', 'much', 'recognition']","['peopl', 'prais', 'joker', 'depict', 'declin', 'mental', 'health', 'lack', 'support', 'societi', 'film', 'came', 'mindhal', 'perform', 'deserv', 'much', 'recognit']","['people', 'praised', 'joker', 'depiction', 'declining', 'mental', 'health', 'lack', 'support', 'society', 'film', 'came', 'mindhalls', 'performance', 'deserves', 'much', 'recognition']",2,Taiwan
2021-08-06 23:19:01+00:00,1423785712583806977,"Not sure this is endorsement I’d want for #AZGov, but @aaron4az seems to have no problem w/ accepting support from legislators who want to restrict access to birth control 🤷🏼‍♂️ Why does Rep. Shah believe women can’t make their own health decisions? Does Rep. Lieberman agree w/ him? https://t.co/x7VfewPdH4",JChaseWilliams,"Taipei City, Taiwan",0,1,0,0,"Seattle born. AZ raised. #TeamPete. Speech & Debate Dir. @TASNewsFeed. Founder of @ispeechdebate. Fan of @united, @marriott, @seahawks, and @asufootball.",2015,['AZGov'],not sure this is endorsement id want for azgov but seems to have no problem w accepting support from legislators who want to restrict access to birth control why does rep shah believe women cant make their own health decisions does rep lieberman agree w him,"['not', 'sure', 'this', 'is', 'endorsement', 'id', 'want', 'for', 'azgov', 'but', 'seems', 'to', 'have', 'no', 'problem', 'w', 'accepting', 'support', 'from', 'legislators', 'who', 'want', 'to', 'restrict', 'access', 'to', 'birth', 'control', 'why', 'does', 'rep', 'shah', 'believe', 'women', 'cant', 'make', 'their', 'own', 'health', 'decisions', 'does', 'rep', 'lieberman', 'agree', 'w', 'him']","['sure', 'endorsement', 'id', 'want', 'azgov', 'seems', 'problem', 'w', 'accepting', 'support', 'legislators', 'want', 'restrict', 'access', 'birth', 'control', 'rep', 'shah', 'believe', 'women', 'cant', 'make', 'health', 'decisions', 'rep', 'lieberman', 'agree', 'w']","['sure', 'endors', 'id', 'want', 'azgov', 'seem', 'problem', 'w', 'accept', 'support', 'legisl', 'want', 'restrict', 'access', 'birth', 'control', 'rep', 'shah', 'believ', 'women', 'cant', 'make', 'health', 'decis', 'rep', 'lieberman', 'agre', 'w']","['sure', 'endorsement', 'id', 'want', 'azgov', 'seems', 'problem', 'w', 'accepting', 'support', 'legislators', 'want', 'restrict', 'access', 'birth', 'control', 'rep', 'shah', 'believe', 'women', 'cant', 'make', 'health', 'decisions', 'rep', 'lieberman', 'agree', 'w']",3,Taiwan
2021-05-29 14:21:22+00:00,1398645646987456520,"@pamee_devkota Well said! Free health service shld be for poor, marginalised community living in remote part of the country , elderly etc!  health insurance shld be promoted! Should not be free Just  because someone in particular  profession and  what about remaining professions\populations!!",mp_gautam,Pretoria     Kathmandu ,1,0,1,0,"Human rights Lawyer! Formerly worked in Nepal,Philippines,Bangladesh,South Sudan,Namibia on human rights, refugees,and humanitarian assistance . Views my own.",666,,well said free health service shld be for poor marginalised community living in remote part of the country elderly etc health insurance shld be promoted should not be free just because someone in particular profession and what about remaining professionspopulations,"['well', 'said', 'free', 'health', 'service', 'shld', 'be', 'for', 'poor', 'marginalised', 'community', 'living', 'in', 'remote', 'part', 'of', 'the', 'country', 'elderly', 'etc', 'health', 'insurance', 'shld', 'be', 'promoted', 'should', 'not', 'be', 'free', 'just', 'because', 'someone', 'in', 'particular', 'profession', 'and', 'what', 'about', 'remaining', 'professionspopulations']","['well', 'said', 'free', 'health', 'service', 'shld', 'poor', 'marginalised', 'community', 'living', 'remote', 'part', 'country', 'elderly', 'etc', 'health', 'insurance', 'shld', 'promoted', 'free', 'someone', 'particular', 'profession', 'remaining', 'professionspopulations']","['well', 'said', 'free', 'health', 'servic', 'shld', 'poor', 'marginalis', 'commun', 'live', 'remot', 'part', 'countri', 'elderli', 'etc', 'health', 'insur', 'shld', 'promot', 'free', 'someon', 'particular', 'profess', 'remain', 'professionspopul']","['well', 'said', 'free', 'health', 'service', 'shld', 'poor', 'marginalised', 'community', 'living', 'remote', 'part', 'country', 'elderly', 'etc', 'health', 'insurance', 'shld', 'promoted', 'free', 'someone', 'particular', 'profession', 'remaining', 'professionspopulations']",1,Taiwan
2021-05-12 14:52:01+00:00,1392492765263499270,"➡️16 locally transmitted cases today &amp; the govt is already considering the soft lockdown
➡️Daily press briefings by the Health Minister 
➡️President @iingwen demonstrating leadership &amp; accountability, &amp; letting the officials and ministers do their work with full support",sanahashmi1,"Taipei City, Taiwan",6,0,1,0,"Visiting Fellow, @taef_tw | IIR, @NCCU1927| Non-Resident Fellow, @NextGenTaiwan| RIIPA, Japan | Ph.D., JNU | Ex-@MOFA_Taiwan, @MEAIndia |Works on Taiwan & China",13060,,16 locally transmitted cases today amp the govt is already considering the soft lockdown daily press briefings by the health minister president demonstrating leadership amp accountability amp letting the officials and ministers do their work with full support,"['16', 'locally', 'transmitted', 'cases', 'today', 'amp', 'the', 'govt', 'is', 'already', 'considering', 'the', 'soft', 'lockdown', 'daily', 'press', 'briefings', 'by', 'the', 'health', 'minister', 'president', 'demonstrating', 'leadership', 'amp', 'accountability', 'amp', 'letting', 'the', 'officials', 'and', 'ministers', 'do', 'their', 'work', 'with', 'full', 'support']","['16', 'locally', 'transmitted', 'cases', 'today', 'amp', 'govt', 'already', 'considering', 'soft', 'lockdown', 'daily', 'press', 'briefings', 'health', 'minister', 'president', 'demonstrating', 'leadership', 'amp', 'accountability', 'amp', 'letting', 'officials', 'ministers', 'work', 'full', 'support']","['16', 'local', 'transmit', 'case', 'today', 'amp', 'govt', 'alreadi', 'consid', 'soft', 'lockdown', 'daili', 'press', 'brief', 'health', 'minist', 'presid', 'demonstr', 'leadership', 'amp', 'account', 'amp', 'let', 'offici', 'minist', 'work', 'full', 'support']","['16', 'locally', 'transmitted', 'cases', 'today', 'amp', 'govt', 'already', 'considering', 'soft', 'lockdown', 'daily', 'press', 'briefings', 'health', 'minister', 'president', 'demonstrating', 'leadership', 'amp', 'accountability', 'amp', 'letting', 'officials', 'ministers', 'work', 'full', 'support']",4,Taiwan
2021-05-06 00:43:14+00:00,1390104836696203267,"G7 on #Taiwan
“We support Taiwan’s meaningful participation in WHO forums &amp; the World Health Assembly. The international community should be able to benefit from the experience of all partners, including Taiwan’s successful contribution to the tackling of the COVID-19 pandemic.” https://t.co/3wo1MvZlvW",zsuzsettte,🇧🇪 / 🇹🇼,36,4,12,0,"Author of ‘Europe, China, and the Limits of Normative Power’. Tweets on China, Taiwan, Korea, India. Head of AssocNet @9dashline, Non-Res. Fellow @nextgentaiwan",5549,['Taiwan'],g7 on taiwan we support taiwans meaningful participation in who forums amp the world health assembly the international community should be able to benefit from the experience of all partners including taiwans successful contribution to the tackling of the covid19 pandemic,"['g7', 'on', 'taiwan', 'we', 'support', 'taiwans', 'meaningful', 'participation', 'in', 'who', 'forums', 'amp', 'the', 'world', 'health', 'assembly', 'the', 'international', 'community', 'should', 'be', 'able', 'to', 'benefit', 'from', 'the', 'experience', 'of', 'all', 'partners', 'including', 'taiwans', 'successful', 'contribution', 'to', 'the', 'tackling', 'of', 'the', 'covid19', 'pandemic']","['g7', 'taiwan', 'support', 'taiwans', 'meaningful', 'participation', 'forums', 'amp', 'world', 'health', 'assembly', 'international', 'community', 'able', 'benefit', 'experience', 'partners', 'including', 'taiwans', 'successful', 'contribution', 'tackling', 'covid19', 'pandemic']","['g7', 'taiwan', 'support', 'taiwan', 'meaning', 'particip', 'forum', 'amp', 'world', 'health', 'assembl', 'intern', 'commun', 'abl', 'benefit', 'experi', 'partner', 'includ', 'taiwan', 'success', 'contribut', 'tackl', 'covid19', 'pandem']","['g7', 'taiwan', 'support', 'taiwans', 'meaningful', 'participation', 'forums', 'amp', 'world', 'health', 'assembly', 'international', 'community', 'able', 'benefit', 'experience', 'partners', 'including', 'taiwans', 'successful', 'contribution', 'tackling', 'covid19', 'pandemic']",5,Taiwan
2021-05-04 07:28:12+00:00,1389481974566428674,"@niccijsmith The CDC should ""encourage"" crews to get vaccinated by just relaxing the restrictions to those who get the vaccine and keep the 5 day quarantines / enhanced-self-health measures to those who don't want to get vaccinated yet. Simple.",flyingheavy747,"41,000ft and 0.86M",0,1,0,0,#B787 pilot ✈️ (#B747 #E190) #Aviation #Pentaxian #Engineering CostaRica Taiwan 🇨🇷🇹🇼,3682,,the cdc should encourage crews to get vaccinated by just relaxing the restrictions to those who get the vaccine and keep the 5 day quarantines enhancedselfhealth measures to those who dont want to get vaccinated yet simple,"['the', 'cdc', 'should', 'encourage', 'crews', 'to', 'get', 'vaccinated', 'by', 'just', 'relaxing', 'the', 'restrictions', 'to', 'those', 'who', 'get', 'the', 'vaccine', 'and', 'keep', 'the', '5', 'day', 'quarantines', 'enhancedselfhealth', 'measures', 'to', 'those', 'who', 'dont', 'want', 'to', 'get', 'vaccinated', 'yet', 'simple']","['cdc', 'encourage', 'crews', 'get', 'vaccinated', 'relaxing', 'restrictions', 'get', 'vaccine', 'keep', '5', 'day', 'quarantines', 'enhancedselfhealth', 'measures', 'dont', 'want', 'get', 'vaccinated', 'yet', 'simple']","['cdc', 'encourag', 'crew', 'get', 'vaccin', 'relax', 'restrict', 'get', 'vaccin', 'keep', '5', 'day', 'quarantin', 'enhancedselfhealth', 'measur', 'dont', 'want', 'get', 'vaccin', 'yet', 'simpl']","['cdc', 'encourage', 'crews', 'get', 'vaccinated', 'relaxing', 'restrictions', 'get', 'vaccine', 'keep', '5', 'day', 'quarantines', 'enhancedselfhealth', 'measures', 'dont', 'want', 'get', 'vaccinated', 'yet', 'simple']",4,Taiwan
2021-05-03 04:26:38+00:00,1389073894867279872,"@UddhavRBhetuwal @RabindraMishra Well said! This is the reality,unfortunately no single government has worked to enhance proper health facility and system!!",mp_gautam,Pretoria     Kathmandu ,1,0,0,0,"Human rights Lawyer! Formerly worked in Nepal,Philippines,Bangladesh,South Sudan,Namibia on human rights, refugees,and humanitarian assistance . Views my own.",666,,well said this is the realityunfortunately no single government has worked to enhance proper health facility and system,"['well', 'said', 'this', 'is', 'the', 'realityunfortunately', 'no', 'single', 'government', 'has', 'worked', 'to', 'enhance', 'proper', 'health', 'facility', 'and', 'system']","['well', 'said', 'realityunfortunately', 'single', 'government', 'worked', 'enhance', 'proper', 'health', 'facility', 'system']","['well', 'said', 'realityunfortun', 'singl', 'govern', 'work', 'enhanc', 'proper', 'health', 'facil', 'system']","['well', 'said', 'realityunfortunately', 'single', 'government', 'worked', 'enhance', 'proper', 'health', 'facility', 'system']",5,Taiwan
2021-04-24 06:39:11+00:00,1385845758750982149,"At 2021 India Spring Festival, Gourangalal Das, DG, India-Taipei Assn, appreciated Taiwan’s support for India in the time of health crisis in 2020 &amp; hoped the situation in India gets better soon. Also great to see @MOFA_Taiwan @CulturalTaiwan @NewTaipeiGov support Indian culture! https://t.co/49zbNNalYX",sanahashmi1,"Taipei City, Taiwan",30,3,5,0,"Visiting Fellow, @taef_tw | IIR, @NCCU1927| Non-Resident Fellow, @NextGenTaiwan| RIIPA, Japan | Ph.D., JNU | Ex-@MOFA_Taiwan, @MEAIndia |Works on Taiwan & China",13060,,at 2021 india spring festival gourangalal das dg indiataipei assn appreciated taiwans support for india in the time of health crisis in 2020 amp hoped the situation in india gets better soon also great to see support indian culture,"['at', '2021', 'india', 'spring', 'festival', 'gourangalal', 'das', 'dg', 'indiataipei', 'assn', 'appreciated', 'taiwans', 'support', 'for', 'india', 'in', 'the', 'time', 'of', 'health', 'crisis', 'in', '2020', 'amp', 'hoped', 'the', 'situation', 'in', 'india', 'gets', 'better', 'soon', 'also', 'great', 'to', 'see', 'support', 'indian', 'culture']","['2021', 'india', 'spring', 'festival', 'gourangalal', 'das', 'dg', 'indiataipei', 'assn', 'appreciated', 'taiwans', 'support', 'india', 'time', 'health', 'crisis', '2020', 'amp', 'hoped', 'situation', 'india', 'gets', 'better', 'soon', 'also', 'great', 'see', 'support', 'indian', 'culture']","['2021', 'india', 'spring', 'festiv', 'gourangal', 'da', 'dg', 'indiataipei', 'assn', 'appreci', 'taiwan', 'support', 'india', 'time', 'health', 'crisi', '2020', 'amp', 'hope', 'situat', 'india', 'get', 'better', 'soon', 'also', 'great', 'see', 'support', 'indian', 'cultur']","['2021', 'india', 'spring', 'festival', 'gourangalal', 'das', 'dg', 'indiataipei', 'assn', 'appreciated', 'taiwans', 'support', 'india', 'time', 'health', 'crisis', '2020', 'amp', 'hoped', 'situation', 'india', 'gets', 'better', 'soon', 'also', 'great', 'see', 'support', 'indian', 'culture']",4,Taiwan
2021-03-09 01:28:33+00:00,1369097746104283139,"@MohamedBinZayed Great 👍🏻 let’s make the world 🌎 be health and peaceful with love ❤️🌈

We have pharmaceutical manufactures in Taiwan,PIC/S GMP and we also do trading in the world  

we support fine chemicals,Intermediates,APIs and finished products,if you are interested,just contact with Wendy https://t.co/cTF8vMhvrW",Wendy45631560,Taiwan,1,0,0,0,Everyone is very important in a strong team 💪🏻Keep going and thanks everyone 💃🏻💝,42,,great lets make the world be health and peaceful with love we have pharmaceutical manufactures in taiwanpics gmp and we also do trading in the world we support fine chemicalsintermediatesapis and finished productsif you are interestedjust contact with wendy,"['great', 'lets', 'make', 'the', 'world', 'be', 'health', 'and', 'peaceful', 'with', 'love', 'we', 'have', 'pharmaceutical', 'manufactures', 'in', 'taiwanpics', 'gmp', 'and', 'we', 'also', 'do', 'trading', 'in', 'the', 'world', 'we', 'support', 'fine', 'chemicalsintermediatesapis', 'and', 'finished', 'productsif', 'you', 'are', 'interestedjust', 'contact', 'with', 'wendy']","['great', 'lets', 'make', 'world', 'health', 'peaceful', 'love', 'pharmaceutical', 'manufactures', 'taiwanpics', 'gmp', 'also', 'trading', 'world', 'support', 'fine', 'chemicalsintermediatesapis', 'finished', 'productsif', 'interestedjust', 'contact', 'wendy']","['great', 'let', 'make', 'world', 'health', 'peac', 'love', 'pharmaceut', 'manufactur', 'taiwanp', 'gmp', 'also', 'trade', 'world', 'support', 'fine', 'chemicalsintermediatesapi', 'finish', 'productsif', 'interestedjust', 'contact', 'wendi']","['great', 'lets', 'make', 'world', 'health', 'peaceful', 'love', 'pharmaceutical', 'manufactures', 'taiwanpics', 'gmp', 'also', 'trading', 'world', 'support', 'fine', 'chemicalsintermediatesapis', 'finished', 'productsif', 'interestedjust', 'contact', 'wendy']",5,Taiwan
2021-03-09 01:27:57+00:00,1369097594954125313,"@HamdanMohammed @TECofDubai Great 👍🏻 let’s make the world 🌎 be health and peaceful with love ❤️🌈

We have pharmaceutical manufactures in Taiwan,PIC/S GMP and we also do trading in the world  

we support fine chemicals,Intermediates,APIs and finished products,if you are interested,just contact with Wendy https://t.co/aVIVn7WMsM",Wendy45631560,Taiwan,0,0,0,0,Everyone is very important in a strong team 💪🏻Keep going and thanks everyone 💃🏻💝,42,,great lets make the world be health and peaceful with love we have pharmaceutical manufactures in taiwanpics gmp and we also do trading in the world we support fine chemicalsintermediatesapis and finished productsif you are interestedjust contact with wendy,"['great', 'lets', 'make', 'the', 'world', 'be', 'health', 'and', 'peaceful', 'with', 'love', 'we', 'have', 'pharmaceutical', 'manufactures', 'in', 'taiwanpics', 'gmp', 'and', 'we', 'also', 'do', 'trading', 'in', 'the', 'world', 'we', 'support', 'fine', 'chemicalsintermediatesapis', 'and', 'finished', 'productsif', 'you', 'are', 'interestedjust', 'contact', 'with', 'wendy']","['great', 'lets', 'make', 'world', 'health', 'peaceful', 'love', 'pharmaceutical', 'manufactures', 'taiwanpics', 'gmp', 'also', 'trading', 'world', 'support', 'fine', 'chemicalsintermediatesapis', 'finished', 'productsif', 'interestedjust', 'contact', 'wendy']","['great', 'let', 'make', 'world', 'health', 'peac', 'love', 'pharmaceut', 'manufactur', 'taiwanp', 'gmp', 'also', 'trade', 'world', 'support', 'fine', 'chemicalsintermediatesapi', 'finish', 'productsif', 'interestedjust', 'contact', 'wendi']","['great', 'lets', 'make', 'world', 'health', 'peaceful', 'love', 'pharmaceutical', 'manufactures', 'taiwanpics', 'gmp', 'also', 'trading', 'world', 'support', 'fine', 'chemicalsintermediatesapis', 'finished', 'productsif', 'interestedjust', 'contact', 'wendy']",5,Taiwan
2021-03-09 01:27:32+00:00,1369097488162902018,"@HamdanMohammed @HHShkMohd Great 👍🏻 let’s make the world 🌎 be health and peaceful with love ❤️🌈

We have pharmaceutical manufactures in Taiwan,PIC/S GMP and we also do trading in the world  

we support fine chemicals,Intermediates,APIs and finished products,if you are interested,just contact with Wendy https://t.co/ADBKNodlEs",Wendy45631560,Taiwan,0,0,0,0,Everyone is very important in a strong team 💪🏻Keep going and thanks everyone 💃🏻💝,42,,great lets make the world be health and peaceful with love we have pharmaceutical manufactures in taiwanpics gmp and we also do trading in the world we support fine chemicalsintermediatesapis and finished productsif you are interestedjust contact with wendy,"['great', 'lets', 'make', 'the', 'world', 'be', 'health', 'and', 'peaceful', 'with', 'love', 'we', 'have', 'pharmaceutical', 'manufactures', 'in', 'taiwanpics', 'gmp', 'and', 'we', 'also', 'do', 'trading', 'in', 'the', 'world', 'we', 'support', 'fine', 'chemicalsintermediatesapis', 'and', 'finished', 'productsif', 'you', 'are', 'interestedjust', 'contact', 'with', 'wendy']","['great', 'lets', 'make', 'world', 'health', 'peaceful', 'love', 'pharmaceutical', 'manufactures', 'taiwanpics', 'gmp', 'also', 'trading', 'world', 'support', 'fine', 'chemicalsintermediatesapis', 'finished', 'productsif', 'interestedjust', 'contact', 'wendy']","['great', 'let', 'make', 'world', 'health', 'peac', 'love', 'pharmaceut', 'manufactur', 'taiwanp', 'gmp', 'also', 'trade', 'world', 'support', 'fine', 'chemicalsintermediatesapi', 'finish', 'productsif', 'interestedjust', 'contact', 'wendi']","['great', 'lets', 'make', 'world', 'health', 'peaceful', 'love', 'pharmaceutical', 'manufactures', 'taiwanpics', 'gmp', 'also', 'trading', 'world', 'support', 'fine', 'chemicalsintermediatesapis', 'finished', 'productsif', 'interestedjust', 'contact', 'wendy']",5,Taiwan
2021-02-23 01:19:29+00:00,1364022031063216128,"@HamdanMohammed Great 👍🏻 let’s make the world 🌎 be health and peaceful with love ❤️🌈

We have pharmaceutical manufactures in Taiwan,PIC/S GMP and we also do trading in the world  

we support fine chemicals,Intermediates,APIs and finished products,if you are interested,just contact with Wendy",Wendy45631560,Taiwan,2,0,0,0,Everyone is very important in a strong team 💪🏻Keep going and thanks everyone 💃🏻💝,42,,great lets make the world be health and peaceful with love we have pharmaceutical manufactures in taiwanpics gmp and we also do trading in the world we support fine chemicalsintermediatesapis and finished productsif you are interestedjust contact with wendy,"['great', 'lets', 'make', 'the', 'world', 'be', 'health', 'and', 'peaceful', 'with', 'love', 'we', 'have', 'pharmaceutical', 'manufactures', 'in', 'taiwanpics', 'gmp', 'and', 'we', 'also', 'do', 'trading', 'in', 'the', 'world', 'we', 'support', 'fine', 'chemicalsintermediatesapis', 'and', 'finished', 'productsif', 'you', 'are', 'interestedjust', 'contact', 'with', 'wendy']","['great', 'lets', 'make', 'world', 'health', 'peaceful', 'love', 'pharmaceutical', 'manufactures', 'taiwanpics', 'gmp', 'also', 'trading', 'world', 'support', 'fine', 'chemicalsintermediatesapis', 'finished', 'productsif', 'interestedjust', 'contact', 'wendy']","['great', 'let', 'make', 'world', 'health', 'peac', 'love', 'pharmaceut', 'manufactur', 'taiwanp', 'gmp', 'also', 'trade', 'world', 'support', 'fine', 'chemicalsintermediatesapi', 'finish', 'productsif', 'interestedjust', 'contact', 'wendi']","['great', 'lets', 'make', 'world', 'health', 'peaceful', 'love', 'pharmaceutical', 'manufactures', 'taiwanpics', 'gmp', 'also', 'trading', 'world', 'support', 'fine', 'chemicalsintermediatesapis', 'finished', 'productsif', 'interestedjust', 'contact', 'wendy']",5,Taiwan
2021-02-08 14:05:20+00:00,1358778946796482562,"@HamdanMohammed Good luck 🍀let’s make the world 🌎 be health and peaceful with love ❤️🌈

We have pharmaceutical manufactures in Taiwan,PIC/S GMP and we also do trading in the world ,we support fine chemicals,Intermediates,APIs and finished products,if you are interested,just contact with Wendy",Wendy45631560,Taiwan,0,0,0,0,Everyone is very important in a strong team 💪🏻Keep going and thanks everyone 💃🏻💝,42,,good luck lets make the world be health and peaceful with love we have pharmaceutical manufactures in taiwanpics gmp and we also do trading in the world we support fine chemicalsintermediatesapis and finished productsif you are interestedjust contact with wendy,"['good', 'luck', 'lets', 'make', 'the', 'world', 'be', 'health', 'and', 'peaceful', 'with', 'love', 'we', 'have', 'pharmaceutical', 'manufactures', 'in', 'taiwanpics', 'gmp', 'and', 'we', 'also', 'do', 'trading', 'in', 'the', 'world', 'we', 'support', 'fine', 'chemicalsintermediatesapis', 'and', 'finished', 'productsif', 'you', 'are', 'interestedjust', 'contact', 'with', 'wendy']","['good', 'luck', 'lets', 'make', 'world', 'health', 'peaceful', 'love', 'pharmaceutical', 'manufactures', 'taiwanpics', 'gmp', 'also', 'trading', 'world', 'support', 'fine', 'chemicalsintermediatesapis', 'finished', 'productsif', 'interestedjust', 'contact', 'wendy']","['good', 'luck', 'let', 'make', 'world', 'health', 'peac', 'love', 'pharmaceut', 'manufactur', 'taiwanp', 'gmp', 'also', 'trade', 'world', 'support', 'fine', 'chemicalsintermediatesapi', 'finish', 'productsif', 'interestedjust', 'contact', 'wendi']","['good', 'luck', 'lets', 'make', 'world', 'health', 'peaceful', 'love', 'pharmaceutical', 'manufactures', 'taiwanpics', 'gmp', 'also', 'trading', 'world', 'support', 'fine', 'chemicalsintermediatesapis', 'finished', 'productsif', 'interestedjust', 'contact', 'wendy']",5,Taiwan
